id,source,title,link,published,summary,collected_date
ac442897d6ee2929b80d8e555619e262,Business_Insider,スーツ不況で明暗。快活クラブ好調なAOKI、変われなかった王者・青山,https://www.businessinsider.jp/article/2512-suit-aoki-vs-aoyama/,"Mon, 01 Dec 2025 21:50:00 GMT",スーツ量販店の双璧、青山商事とAOKI。オフィスカジュアル化で市場が縮小するなか、2019年以降、利益や時価総額ではAOKIが逆転しました。同じ逆風下で、なぜここまで差が開いたのか。両社の戦略の違いを追います。,2025-12-01
63e6dbfebe2c1abb3c1e8b13f8d9d87d,Business_Insider,「AI分野への参入に、博士号はもう必要ない」元メタのシニアディレクターが語る成功のための4つのアドバイス,https://www.businessinsider.jp/article/ai-meta-generativeai-phd/,"Mon, 01 Dec 2025 21:35:00 GMT",AI分野で成功するにはどのようなことが必要なのでしょうか。元メタのジェネレーティブAIのシニアディレクターだった女性が、4つのアドバイスを紹介します,2025-12-01
46e75e4914c378a1d12de131047449b3,Business_Insider,対日“文化制裁”は誰の得になるのか──浜崎あゆみ、大槻マキ騒動が示した中国国内の違和感,https://www.businessinsider.jp/article/2512-insidechina-who-benefits/,"Mon, 01 Dec 2025 21:30:00 GMT",中国での日本人アーティストの上映や公演が次々と中止されています。タレント側にとっての損失はもちろん、チケットを購入した中国人のファンは「これが日本にどういう打撃を与えるというのか」とやるせなさをSNSに投稿しています。,2025-12-01
0bd2e306a579336dae9bf0488dbd52a6,Business_Insider,「ハードワーク＝長時間労働」ではない。幸福度も競争力も高いデンマーク、鍵は「残された時間」にある,https://www.businessinsider.jp/article/2512-found-third-time-in-denmark/,"Mon, 01 Dec 2025 21:10:00 GMT",かつて新聞記者として長時間労働に明け暮れていた筆者。幸福度も、競争力も高い北欧・デンマークで過ごすうちに、「働くこと」に対する価値観が広がりました。,2025-12-01
d9b0bb274c5fe425422e24c54e1fff38,Business_Insider,テスラ出身者10人以上が集結して生み出した家庭用ロボット「Memo」脱ステルスで判明したこと,https://www.businessinsider.jp/article/tesla-loses-ai-staff-startup-sunday-robotics-2025-11/,"Mon, 01 Dec 2025 21:05:00 GMT","サンデー・ロボティクス（Sunday Robotics）はテスラ（Tesla）の元従業員を多数採用して家庭用ロボット「Memo」の開発を進めています。
テスラの人型ロボット「Optimus」や先進運転支援システム「Autopilot」の開発担当者も含まれるようです。",2025-12-01
a7b1072c189a648c9c33cfc894c751c6,Business_Insider,iPhone17の売上が好調…アップルに10年以上ぶりのタイトルをもたらす,https://www.businessinsider.jp/article/2511-apple-beats-samsung-iphone-17-success-smartphone-manufatcuring-market/,"Mon, 01 Dec 2025 21:00:00 GMT",アップルのティム・クックCEOは、同社の最新の決算発表で、今四半期が会社史上最高になると予想していると述べた。,2025-12-01
22e2ed1a9b76242c84f1b8ad3622579f,Business_Insider,「おかしな動物たち」写真コンテスト 2024年の受賞作を振り返ってみよう,https://www.businessinsider.jp/article/2512-funny-animal-photos-nikon-comedy-wildlife-photography-awards-finalists-2024/,"Mon, 01 Dec 2025 10:00:00 GMT",野生動物の面白おかしい写真を表彰する、ニコンの写真コンテストの季節がやってきました。2025年の授賞式を前に、昨年の受賞作を振り返ります。,2025-12-01
54ba62cdbb8673681daafbf412472155,Business_Insider,週4日労働制はどこへ行った？…雇用市場の冷え込みで棚上げに,https://www.businessinsider.jp/article/2511-what-ever-happened-to-the-four-day-workweek/,"Mon, 01 Dec 2025 10:00:00 GMT",週4日労働の夢は雇用市場と同じように冷めてきたかもしれませんが、支持者たちは今でも、より多くの人々が恒久的に長い週末を過ごせるようになることを望んでいます。,2025-12-01
5a513811b2e6990a31618cde818ccf31,Business_Insider,「最強」の巨大SaaS企業2社のAI戦略：Salesforceの“最大の脅威”がマイクロソフトである理由,https://www.businessinsider.jp/article/2511-ai-kill-saas-ep02-a/,"Mon, 01 Dec 2025 08:30:00 GMT",SaaSはどの「コンテキスト」を核に再結晶化するのか。セールスフォースやアドビに見るように、SaaS企業はもはやUIに頼らず、AIエージェントによるワークフローで競争しており、その先にテック業界の未来像が見えてきます。,2025-12-01
25eb8e60791041f584bfacb28e97ef7e,Business_Insider,不動産業者を見限って、私は&quot;家&quot;を買うのに「AI」に契約書を作らせた。おかげで手数料の約120万円を節約できた,https://www.businessinsider.jp/article/2512-homebuyer-used-ai-tool-to-buy-home/,"Mon, 01 Dec 2025 08:30:00 GMT",,2025-12-01
8e3a5c4a50ad66059fe8162711249ef6,Business_Insider,私はテック業界を辞めてブルーカラーへ転身した29歳です。“切り株処理”の仕事は「自分の予定で動けて、10万ドル以上の収入」になりました,https://www.businessinsider.jp/article/2511-quit-tech-job-grind-tree-stumps-make-6-figures-happier-a/,"Mon, 01 Dec 2025 08:00:00 GMT",テイラー・マムフォード氏は2024年にテック企業でのセールス職を辞め、切り株処理の会社を始めました。 セールススキルとテクノロジーを活用して、すぐにクライアントと売上を確保。 初年度の売上高は20万ドルを超え、いずれビジネスを拡大する計画です。,2025-12-01
00e5e53da051ea5d76c6142d79656440,Business_Insider,高市首相「働いて働いて働いて働いて働いて参ります」宣言から考える、「組織を動かすリーダー」に求められること,https://www.businessinsider.jp/article/2512-what-is-leadership/,"Mon, 01 Dec 2025 05:30:00 GMT",事業を成功に導くには、強いリーダーシップが必要です。一方で、リーダーと同じ熱量でビジネスに向き合える組織を作るのはそう簡単ではありません。「新しいリーダー」の着任時に組織を成長軌道に乗せるために使える、定石とも言える技術を紹介します。,2025-12-01
4ea6710f3f96b86f3c89fda5cece729c,Business_Insider,一人分のお茶を最小限の手間で淹れたい。正解は「茶漉しも取っ手もない急須」だった,https://www.businessinsider.jp/article/297973-edf/,"Mon, 01 Dec 2025 03:00:00 GMT",一人分の温かい飲み物を、最小限の労力で作れないものかと思っていたときに見つけたのが、アオラボの「ちゃpod 2」。茶漉しなしでお茶を淹れられるポットなんです。パーツ数も少なく手入れも簡単で、お茶を淹れるハードルを下げてくれました。,2025-12-01
063644ba3dd56493dab74127ae25a307,Business_Insider,AIや信用市場のバブル崩壊から身を守るための投資先…元モルガン・スタンレーのリサーチ責任者が選択したのは？,https://www.businessinsider.jp/article/2511-stock-market-bubble-ai-investing-tips-credit-gold-metals-bonds/,"Mon, 01 Dec 2025 01:30:00 GMT",デイビッド・ロッシュは、AIバブルと信用バブルの崩壊が2008年に見られたものと同様の経済的損害をもたらす可能性があると述べています。,2025-12-01
c4dbd29d4f4ef4620fc6382ff4e51504,Business_Insider,「世紀の空売り王」バーリ氏、エヌビディアとパランティアに弱気の賭け…AI企業の減価償却会計に懸念を表明,https://www.businessinsider.jp/article/2511-big-short-michael-burry-substack-nvidia-memo-depreciation-ai-bubble/,"Sun, 30 Nov 2025 21:35:00 GMT",マイケル・バーリ氏は、自身の批判に対するエヌビディアの反論が「藁人形論法ばかりだ」と述べています。さらに彼は、エヌビディアとパランティアのプットオプションを保有していると付け加えました。,2025-12-01
cf8a140778d5bb0dd452c510fa3e4515,Business_Insider,Slack CEOが語る「AI時代の人間不要論」への反論。セールスフォース社内ではAIが業務質問の96％を回答,https://www.businessinsider.jp/article/2512-slack-ceo-interview-ai-agents/,"Sun, 30 Nov 2025 21:30:00 GMT",Slackのデニース・ドレッサーCEOが来日し、Tech Insiderのインタビューに応じました。同氏は「AIは人間を置き換えるのではなく強化する」と強調しています。,2025-12-01
1a6b7819a4816db4e439ef59030dd64b,Business_Insider,OpenAI、急成長でサイバー攻撃の標的に。同社の分析パートナーからデータ漏えい——ChatGPTユーザーには影響なし,https://www.businessinsider.jp/article/2511-openai-mixpanel-hackers-stole-data-analytics-partner-chatgpt/,"Sun, 30 Nov 2025 21:15:00 GMT",OpenAIは、ハッカーが同社の分析パートナーからデータを盗んだことを受け、フィッシング攻撃に警戒するよう開発者に呼びかけています。,2025-12-01
e1e03b26abd5e52804f23fd9a34e0616,Business_Insider,「みんなで大家さん」投資トラブル、成田空港の運営会社が用地の契約を終了した背景…「遂行能力を確認できず」,https://www.businessinsider.jp/article/2511-narita-airport-minna-de-ohyasan/,"Sun, 30 Nov 2025 21:00:00 GMT",成田空港周辺の開発に関する投資商品「みんなで大家さん」で配当トラブルが相次いでいる問題を巡り、成田国際空港の運営会社は賃貸借契約を11月末で終了し、更新しない方針を示しました。,2025-12-01
035b0604e4bb81fd1058022fe79b3a2a,Business_Insider,テクノロジー関連の仕事に関する恐ろしいデータ…最新の調査結果で明らかに,https://www.businessinsider.jp/article/2511-gruesome-tech-jobs-data-scientists-analytics-indeed/,"Sun, 30 Nov 2025 21:00:00 GMT",インディードの新たな報告書によると、技術職、特にデータ分析の求人は近年劇的に減少しています。,2025-12-01
937644427d883e8d6bb6f71d4dfc201c,Business_Insider,花王、台湾で半導体「洗浄センター」稼働。先端パッケージの開発サイクル高速化へ,https://www.businessinsider.jp/article/2512-kao-semiconductor-cleaning-center-taiwan/,"Sun, 30 Nov 2025 20:30:00 GMT",花王が台湾に海外初となる半導体の「精密洗浄センター」を設立しました。現地の半導体企業と密接に連携し、先端パッケージの開発サイクルを高速化していく考えです。,2025-12-01
3941a245ab60b9b384b6e3878b30aac1,ITmedia_AI_Plus,DeepSeek-R1に潜む“トリガーワード問題”　コード品質を揺らす思わぬリスク,https://www.itmedia.co.jp/enterprise/articles/2512/02/news036.html,"Tue, 02 Dec 2025 07:30:00 +0900",AIが生成するコードの品質は、入力するプロンプト次第で大きく揺らぐ──CrowdStrikeが明らかにしたのは、大規模言語モデル「DeepSeek-R1」に特定の語句を与えるだけで脆弱性の発生率が跳ね上がるという、予想外の“偏り”だった。,2025-12-01
f71180d5be86e1bc6bf9616c5676b042,ITmedia_AI_Plus,800のポリシーは本当に必要か？　メルカリとOktaが出した“シンプル最強”の答え,https://www.itmedia.co.jp/enterprise/articles/2512/02/news024.html,"Tue, 02 Dec 2025 07:30:00 +0900",複雑化し続けたアクセス制御が、逆にセキュリティの抜け穴を広げてしまう──そんな“ポリシー過多”の問題に、メルカリは真正面からメスを入れた。同社は800近い認証ポリシーをわずか6種類へと大胆に整理した。その事例を紹介しよう。,2025-12-01
cd0af8e8546ccb2ded28729946bbc9bf,ITmedia_AI_Plus,【1カ月使って分かった】AIブラウザ「ChatGPT Atlas」、乗り換え前にやっておきたい4つの設定,https://www.itmedia.co.jp/business/articles/2512/02/news026.html,"Tue, 02 Dec 2025 07:00:00 +0900",米OpenAIが2025年10月に提供を開始した「ChatGPT Atlas」は、ChatGPTを中核に据えて作られたAIブラウザだ。約1カ月メインブラウザとして使ってきた筆者の経験を踏まえ、AIブラウザの恩恵を受けるためにやっておきたい4つの設定について解説する。,2025-12-01
eececb4a19e8f7bf1777dea880c1334e,ITmedia_AI_Plus,AIとの対話によって設計業務が行える「SOLIDWORKS」の未来を提示,https://monoist.itmedia.co.jp/mn/articles/2512/02/news020.html,"Tue, 02 Dec 2025 07:00:00 +0900",ダッソー・システムズの年次ユーザーイベント「3DEXPERIENCE WORLD JAPAN 2025」の基調講演に登壇したDassault Systemes Mainstream Innovation & CRE担当 シニア・バイスプレジデントのジャン・パオロ・バッシ氏と、同社 SOLIDWORKS CEO 兼 R&amp;D担当 バイスプレジデントのマニッシュ・クマー氏の講演内容を紹介する。,2025-12-01
6a7d41bcc4b8e09fff570e85c0a6481a,ITmedia_AI_Plus,OpenAI、Thrive Holdingsと株式取得で提携　企業向けAI導入を加速,https://www.itmedia.co.jp/news/articles/2512/02/news058.html,"Tue, 02 Dec 2025 06:41:00 +0900",OpenAIは、主要投資家であるThrive Capitalが設立したThrive Holdingsの株式を取得したと発表した。企業によるAI導入を加速するための提携だと説明する。同日、コンサル企業のAccentureとも提携し、次世代AI活用サービスの主要パートナーとなることを明らかにした。,2025-12-01
00869d1fabb1c8310ee649f171066ffb,ITmedia_AI_Plus,NECが次世代ベクトル処理ユニットを開発へ、RISC-VやAIエンジンと融合,https://monoist.itmedia.co.jp/mn/articles/2512/02/news025.html,"Tue, 02 Dec 2025 06:00:00 +0900",NECがHPC（高性能コンピューティング）技術のイベント「NEC HPC Forum」を開催。同社がスペインのOpenchipと共同で開発を進めている次世代ベクトル処理ユニットについて紹介した。,2025-12-01
e0ec801a5a74e7713f2edd01dc436f84,ITmedia_AI_Plus,［Pythonクイズ］文字列の要素を数え上げる方法を数え上げよう　何個あるかな？,https://atmarkit.itmedia.co.jp/ait/articles/2512/02/news009.html,"Tue, 02 Dec 2025 05:00:00 +0900",文字列の要素を数え上げる方法はいろいろとあります。シンプルなコードからそうじゃないものまで。皆さんは何個のやり方を思い付きますか？,2025-12-01
1a6149aab19c8df35f4d1171e5b529d6,ITmedia_AI_Plus,Claude Opus 4.5登場　プロ開発者向けにコーディング性能を再強化、API価格は1/3に,https://atmarkit.itmedia.co.jp/ait/articles/2512/02/news005.html,"Tue, 02 Dec 2025 05:00:00 +0900",Anthropicの最上位モデル「Claude Opus」をリニューアルした。開発タスクでの実力を再び押し上げつつ、大幅な値下げも実施。今回のアップデートが“今のAI開発”に何をもたらすのか、一言コメントを添えて見ていく。,2025-12-01
71e88f24c3f2820697f84ea8da19a877,ITmedia_AI_Plus,実際に成果を出すCAIOの特徴は？　PwC Japan調査から探る「なぜ企業にCAIOが必要なのか」,https://www.itmedia.co.jp/enterprise/articles/2512/01/news099.html,"Mon, 01 Dec 2025 16:00:00 +0900",企業においてAIを推進する「CAIO」がなぜ必要なのか。成果を出しているCAIOの共通点とは。PwC Japanグループの4つの調査結果から探る。,2025-12-01
8efb426b221148852632f1a95cbc58ec,ITmedia_AI_Plus,共同・毎日・産経、AI検索「Perplexity」に抗議　記事の無断利用停止など求める,https://www.itmedia.co.jp/aiplus/articles/2512/01/news100.html,"Mon, 01 Dec 2025 15:29:00 +0900",共同通信社は、AI検索サービス「Perplexity」を運営する米Perplexity AIに対し、著作権侵害に抗議する書類を送付したと発表した。毎日新聞社と産業経済新聞社もそれぞれ同様の対応を取ったという。,2025-12-01
1393f838a07b6c954194c8b840fcac8b,ITmedia_AI_Plus,ソフトバンク、産業用ロボット大手の安川電機と協業　「フィジカルAI」実装へ,https://www.itmedia.co.jp/aiplus/articles/2512/01/news084.html,"Mon, 01 Dec 2025 14:33:00 +0900",ソフトバンクは、物理法則を理解するロボット向けのAIモデル「フィジカルAI」の社会実装に向け、産業用ロボット大手の安川電機と協業を始めたと発表した。,2025-12-01
c438c07ea2e91ba6d72d252561c027cf,ITmedia_AI_Plus,新卒採用の全工程で「AI活用」、書類選考から最終面接まで　博報堂子会社　27卒から,https://www.itmedia.co.jp/aiplus/articles/2512/01/news069.html,"Mon, 01 Dec 2025 12:57:00 +0900",博報堂DYグループ傘下のHakuhodo DY ONEは、2027年卒の新卒採用から、選考の全プロセスにAIを導入すると発表した。,2025-12-01
359370fc6970344770f9a127d9d38564,ITmedia_AI_Plus,「AI俳句ロボ」爆誕　風景を理解し生成、575？　ロボット展でデモ展示,https://www.itmedia.co.jp/aiplus/articles/2512/01/news065.html,"Mon, 01 Dec 2025 11:57:00 +0900",眼前の風景をカメラで撮影。その景色でAIに読み込ませ、俳句として表現し、その講評まで行う──AI・ロボット技術の研究開発を手掛けるForcesteed Roboticsが、こんな機能を持ったロボットをロボット展示会「2025国際ロボット展で展示する。,2025-12-01
634f4eac6679ff8049ab600ef3881c86,ITmedia_AI_Plus,SnowflakeとNVIDIAの提携強化が何が変わるか　GPU統合ML基盤の威力,https://www.itmedia.co.jp/enterprise/articles/2512/01/news027.html,"Mon, 01 Dec 2025 08:00:00 +0900",SnowflakeはNVIDIAとの協業を拡大し、自社のAI Data CloudにGPU処理をネイティブ統合した。CUDA-X系ライブラリを実装し、既存のPythonワークフローでGPUアクセラレーションを活用できる環境を提供する。,2025-12-01
6558201efd17d7c35823495792d90b43,ITmedia_AI_Plus,AIによるサイバー攻撃の民主化をUnit 42が警告　無料の「KawaiiGPT」巡り,https://www.itmedia.co.jp/news/articles/2512/01/news051.html,"Mon, 01 Dec 2025 07:32:00 +0900",Palo Alto NetworksのUnit 42は、悪意あるLLM「WormGPT 4」や「KawaiiGPT」の分析結果を公開し、AIの「デュアルユースのジレンマ」がサイバーセキュリティの中心課題だと警告した。これらのLLMの出現により、攻撃のライフサイクルが数日からわずか数分にまで圧縮されたとしている。,2025-12-01
29ef64c3d701f494ad9c002ee1f2e086,ITmedia_AI_Plus,アクセンチュアが10年ぶりに社長交代、AI変革で具体的な成果を創出する組織へ,https://monoist.itmedia.co.jp/mn/articles/2512/02/news022.html,"Mon, 01 Dec 2025 07:30:00 +0900",アクセンチュアは、10年の成長をけん引した江川昌史氏から濱岡大氏へ社長を交代した。新体制はAI時代を見据えた「変革のプラットフォーマー」として、企業の具体的な成果創出にコミットする方針だ。,2025-12-01
bcdbb64ec511b651d57d19fd2d482b29,ITmedia_AI_Plus,公務員として働く幸せとは？　那覇市のエースDX人材、幼少期の苦労を糧に切り拓いた“今”,https://www.itmedia.co.jp/business/articles/2512/01/news024.html,"Mon, 01 Dec 2025 07:00:00 +0900",民間企業に比べて、その導入プロセスの多さなどから、一般的に業務でのAI活用が進みにくい行政組織。そんな中で、沖縄県の那覇市役所で市民生活安全課に所属する宮城駿雅さん（32）は、少し異彩を放つ存在だ。,2025-12-01
8430690c7d30633cab4e6830fde42592,ITmedia_AI_Plus,「AU 2025」で何が語られた？　オートデスク日本法人が解説,https://monoist.itmedia.co.jp/mn/articles/2512/01/news009.html,"Mon, 01 Dec 2025 07:00:00 +0900",オートデスクは、米国テネシー州ナッシュビルで開催された年次イベント「Autodesk University 2025（AU 2025）」の発表内容を、日本のメディア向けに紹介する記者説明会を実施した。本稿では、基調講演、AIキーノート、製造領域の発表内容を中心に、AU 2025の主要トピックスを整理した。,2025-12-01
e7af0debf760fa1fe786c42ee1808594,ITmedia_AI_Plus,Google Antigravityでアプリ開発はどう変わるのか　エディタとエージェントマネジャーがもたらす新たな世界,https://atmarkit.itmedia.co.jp/ait/articles/2512/01/news014.html,"Mon, 01 Dec 2025 05:00:00 +0900",Googleが発表したAntigravityはAIエージェントを開発の中心に置いた新たな開発体験を提供しようとしている。その体験がどんなものか、どんな要素が組み合わさっているのかについて紹介します。,2025-12-01
421574b181f1302e72411081e27e3978,ITmedia_AI_Plus,「誤解を招いた」――国交省・薗原ダム管理支所、投稿した“AI加工”写真を削除　代わりに元写真を掲載,https://www.itmedia.co.jp/aiplus/articles/2511/28/news126.html,"Fri, 28 Nov 2025 18:13:00 +0900",国土交通省の薗原ダム（群馬県沼田市）管理支所の公式Xは11月28日、27日に投稿した同ダムのAI加工写真を削除すると発表した。「誤解を与えない分かりやすく簡潔な情報発信とする」という公式Xの運用ポリシーにそぐわないと判断したという。,2025-12-01
85d49de768454c4383e85f35bb89c999,Hatena_IT,M365 Copilotで「自社スタイルPPT」を自動生成する方法,https://zenn.dev/acntechjp/articles/411bbb4fe65022,,アクセンチュア株式会社に所属する社員有志による運営です。アクセンチュアの社員による様々な発信をまとめています。なお、投稿内容は社員個人の見解であり、所属する組織を代表するものではありません。,2025-12-01
bc960928971ccb7bce12051b81f3a8ad,Hatena_IT,パスキー(FIDO)の安全性と脆弱性と破滅的欠陥 - falsandtruのメモ帳,https://falsandtru.hatenablog.com/entry/passkey-fido-security-and-vulnerability-and-catastrophic-defect,,これはパスキー(FIDO/FIDO2)の安全性と脆弱性と破滅的欠陥そして正しい認証設計の最も包括的かつ総合的な解説である。パスキーの破滅的欠陥の公開はこれが世界初である。次に列挙する事項を読めば欠陥の原理を掴める。全体の文量が多ければ最初はハイライト部分だけ流し読んで要点を掴むのもいいだろう。証拠となる公式...,2025-12-01
98d8017133d6e8a6b256e7d5067baf9b,Hatena_IT,OCR技術の変遷と日本語対応モデルの性能検証 - LayerX エンジニアブログ,https://tech.layerx.co.jp/entry/2025/12/01/161913,,こんにちは、バクラク事業部AI・機械学習部の飯田 (@frkake) です。 こちらはLayerXアドベントカレンダー1日目の記事です。初日は @izumin5210 さんの記事との二本立てです。 最近、DeepSeek-OCRの登場など、OCR界隈がにわかに活気づいていますね。LLMやVLMの進化に伴い、OCRも単なる「文字起こし」から「構造の読み取り...,2025-12-01
4f1bb1ab9e379c1ffd529272d21a9c50,Hatena_IT,客先のDBを間違えて削除した話 - Qiita,https://qiita.com/lif_yumumu/items/eec7a352f32cc59f39ac,,この記事は「 本番環境などでやらかしちゃった人 Advent Calendar 2025」の1日目です。 はじめに 「慣れてきた頃が一番危ない」 あれ、ほんとです。 当時の私は作業にも環境にも慣れてきて、油断が出始めていました。 「いつもの作業だし、サクッと終わらせよう」 完全にそんな気持ちでした。 何が起きたのか ECサイトの...,2025-12-01
0fb476c77de445d874be5f36ff25f481,Hatena_IT,京大理系がPythonで「最強の株AI」を作ろうとしたら、結論が「ニュースを見て寝なさい」になった話｜もんげー,https://note.com/mongee0792/n/n1006007b1cb4,,初めに忠告するが、私は国語が苦手だ。なのでもし読むときはchatgpt使って、要約をかけさせることをお勧めする。 ーこの記事の要約ー ・テクニカル分析が嘘であることを検証した話 ・一番結果を出した戦略について ー次回書くことー ・ＡＩによる取り組み①～強化学習編～ ・ＡＩによる取り組み②～教師あり学習編～ まず...,2025-12-01
931a896e925ce41849f05f0b6cf8a9ea,Hatena_IT,AIコーディング実践環境の構築方法【2025年12月】,https://zenn.dev/mkj/articles/bf59c4c86d98a8,,松尾研究所テックブログPublication ProLLMSDDClaude Codetech松尾研究所テックブログPublication Pro株式会社松尾研究所のテックブログです。 Discussion,2025-12-01
