id,source,title,link,published,summary,collected_date
c72c0a4243845c5bba07cf8b4d08a5f2,Business_Insider,AmazonプライムビデオがYouTubeを追い抜いて王座に就く、その理由とは,https://www.businessinsider.jp/article/2508-amazon-prime-video-youtube-connected-tv-ad-market-cord-cutting/,"Sat, 16 Aug 2025 23:00:00 GMT",テック大手企業が、急成長するコネクテッドTV広告市場を席巻していますが、アナリストたちはAmazonプライムビデオが優位にあると分析しています。,2025-08-16
fc577aa648e7a91c01b623d47628b126,Business_Insider,男性がスカートを履くのは“変”じゃない──専門家と考える、ファッションと社会の偏見,https://www.businessinsider.jp/article/what-the-fear-of-being-judged-in-mens-fashion-reveals-about-social-bias/,"Sat, 16 Aug 2025 22:30:00 GMT",「変に思われたくない」──男性ファッションに潜む心理から、ジェンダーの固定観念と社会の変化を探ります。,2025-08-16
c7daad291f65e0a06459e2ac590789ca,Business_Insider,【佐藤優】仕事力に格差を生む「学力欠損」とは？ 社会人なら知っておくべき「使える知識」の学習方法,https://www.businessinsider.jp/article/250368d/,"Sat, 16 Aug 2025 22:15:00 GMT",佐藤優さんが悩めるミレニアル世代のシマオに教える連載「はたらく哲学」。変化の激しい時代、若い時の自己投資が将来の武器になります。佐藤さんが考える、「社会人が20代ですべき勉強」とは？,2025-08-16
04b7acbd34a2d24a907f6573b1cddf39,Business_Insider,年収10万ドルを超えたことがない小規模事業者の44歳女性が、あと6年以内にFIREを目指す,https://www.businessinsider.jp/article/2508-fire-early-retirement-gen-x-small-business-saving-strategy/,"Sat, 16 Aug 2025 08:30:00 GMT",サラ・レッセルバウム氏は2018年、FIREを目指し始めました。同氏は昨年、7万ドル（約1050万円）の年収を獲得。計画的に貯蓄と投資をすることで、本当に好きなことや大切な人のためにお金を使う心の余裕ができたと言います。,2025-08-16
7400ccd5dac010cb46db2e6e93fbc041,Business_Insider,ジャシーCEOも書いていた…アマゾンの会議で欠かせない「6ページのメモ」,https://www.businessinsider.jp/article/2508-amazon-engineer-6-page-memos-reading-culture-jeff-bezos/,"Sat, 16 Aug 2025 06:00:00 GMT",アマゾンの主席エンジニアだった彼は、ジェフ・ベゾスの下で始まった6ページのメモを書いたり読んだりするアマゾンの文化を称賛しています。,2025-08-16
305ddb4dc85bbe81c88210e400b9201f,Business_Insider,アマチュア投資家にとって、最強の戦略は「敗者のゲーム」である。名著から学んだ5つの教訓,https://www.businessinsider.jp/article/2508-for-amateur-investors-the-best-strategy-is-a-losers-game/,"Sat, 16 Aug 2025 02:30:00 GMT",そのタイトルの響きに誘われて筆者は、チャールズ・エリスの著書『敗者のゲーム』を書店で手にとったと言います。そこには、個人投資家が「負けない」ための投資法、「敗者のゲーム」こそが長期投資において重要だと書かれていました。,2025-08-16
483cf8c75c791b0708b9891ab5da1639,Business_Insider,行ってみたらガッカリ…大型クルーズ船による豪華旅行の実際の様子,https://www.businessinsider.jp/article/2508-cruise-photos-show-expectation-vs-reality/,"Fri, 15 Aug 2025 23:30:00 GMT",初めてのクルーズはリラックスできるだろうと期待していましたが、船は混雑しすぎ、行列は長すぎ、オプショナルツアーのバスは暑すぎました。,2025-08-16
be67ef5ffe3aea5f3806e9c2f38fe12c,Business_Insider,超富裕層にとって生活費の高い都市ランキング・トップ10 [2025年版],https://www.businessinsider.jp/article/2508-the-10-most-expensive-cities-for-ultra-rich-in/,"Fri, 15 Aug 2025 23:00:00 GMT",ジュリアス・ベア社の最新の報告書によると、ドバイ、バンコク、東京が新たな高級品の中心地として急速に成長していることがわかりました。,2025-08-16
9b78ad2edc0d191d58f3246da0fd2958,Business_Insider,製薬会社の治験担当→心理カウンセラー。「同僚の言動が理解できない」という自分のモヤモヤを晴らしたかった,https://www.businessinsider.jp/article/life-shifter-nakazawarie/,"Fri, 15 Aug 2025 12:00:00 GMT",「自分らしい選択｣をしてキャリアを大きくシフトさせた中澤理恵さんにインタビュー。製薬会社勤務から心理カウンセラーになるまでの道程を聞きました。,2025-08-16
ea3470a42747d054c499d80a1066c7f9,Business_Insider,米著名アーティストのオークションハウスでロレックスやリシャール・ミルなどが競売に…落札価格は合計100万ドル以上,https://www.businessinsider.jp/article/2508-pharrell-williams-auction-house-watch-collection-fetches-over-1-million/,"Fri, 15 Aug 2025 10:00:00 GMT",ファレル・ウィリアムスが設立したオークションハウス「Joopiter」は、コレクター向け腕時計のラインナップを企画し、7月に総額100万ドル超で販売した。,2025-08-16
af7a2761944f7be61d0ec0756d4e2d94,Business_Insider,ファーウェイのスマートウォッチ「HUAWEI WATCH FIT 4 Pro」レビュー：4万円弱で心電図機能に対応,https://www.businessinsider.jp/article/2508-huawei-watch-fit-4-pro-review/,"Fri, 15 Aug 2025 09:00:00 GMT",ファーウェイのスマートウォッチ「HUAWEI WATCH FIT 4 Pro」のレビューをお届けします。サファイアガラスのディスプレイ等を採用したフラグシップモデルで、心電図測定機能も備えています。,2025-08-16
c13cdb01be9360f3d0d2c50fc5dfea2d,Business_Insider,茨城の空き家を300万円で購入した豪日夫婦、2年をかけて夢のマイホームに改修する,https://www.businessinsider.jp/article/2508-abandoned-house-renovation-japan-diy-before-after-photos/,"Fri, 15 Aug 2025 08:30:00 GMT",オーストラリア人と日本人の夫妻が2019年に日本の空き家を3万ドル（約450万円）で購入。約15万ドル（約2250円）を費やし、2年間をかけて改修しました。キッチンとバスルームを全面改装し、床材、電気配線、配管をすべて交換したそうです。,2025-08-16
617376afaba60c2f09ff004a6534d8d3,Business_Insider,TikTokに宿泊予約できる新機能が登場。旅行関連で「稼げる」サービスもスタート,https://www.businessinsider.jp/article/2508-tiktok-now-lets-users-book-hotels-adds-creator-commission-program/,"Fri, 15 Aug 2025 02:30:00 GMT",TikTokが、旅行関連の機能拡大に力を入れています。ホテルをTikTok上で予約できる機能、クリエイターの副収入に役立つ機能について紹介します。,2025-08-16
5b488d6a7e1af548ef54e0038b33d74e,Business_Insider,企業はすべての社内文書をAIが読みやすい形式で作成すべき,https://www.businessinsider.jp/article/2508-dx-cto-internal-documentation-written-for-ai-humans-efficiency-gain/,"Fri, 15 Aug 2025 01:30:00 GMT",DXのタチョCTOは、ドキュメントは企業にとって「大きな摩擦」であり、LLMにとって読みやすいものにする価値があると語った。,2025-08-16
0cfa8d3f29eafbd7a94b7fab3c01c6a0,Business_Insider,「賢明なる」企業はAIの発展に伴ってエンジニアを減らすのではなく、逆に増やすだろう,https://www.businessinsider.jp/article/2508-github-ceo-smartest-companies-hire-more-software-engineers/,"Thu, 14 Aug 2025 22:30:00 GMT",「生産性の高い開発者が1人いるとして、なぜもう1人、さらにもう1人と、雇わないのでしょうか」と GitHub ドムケCEOは話しています。,2025-08-16
764cd3d70c1a07410d363c54bb43305a,Business_Insider,AIが日テレ「ZIP!」の企画会議に参加。Google Cloudと挑む“暗黙知“の可視化,https://www.businessinsider.jp/article/2508-ntv-zip-agentic-ai/,"Thu, 14 Aug 2025 22:15:00 GMT",日本テレビは、情報番組「ZIP!」の「？よミトく！」コーナーの制作において、番組の企画業務を支援するAIエージェントを試験的に活用しています。グーグルの法人向け年次イベントで、開発背景などが紹介されました。,2025-08-16
0e6b2518adad512f07cd19c876965cf0,Business_Insider,AI人材に「契約金145億円」メタで既存社員の不満爆発。「超知能」担当との待遇格差がヒドすぎる,https://www.businessinsider.jp/article/meta-ai-talent-war-superintelligence-push-tension-desertion-2025-8/,"Thu, 14 Aug 2025 21:40:00 GMT",メタ・プラットフォームズは「スーパーインテリジェンス（超知能）」部門の新設に際して、AI人材確保のために巨額の報酬を提示していますが、既存の従業員からは不当な待遇格差と不満の声が上がっているようです。,2025-08-16
123d16f07310ffeb4582627fa03b3e45,Business_Insider,株価が1年で600%上昇した驚きの企業、Palantirの「異色の企業文化」…従業員インタビューを分析、ビッグテックとは全く違う,https://www.businessinsider.jp/article/2508-palantir-company-culture-employee-videos/,"Thu, 14 Aug 2025 21:35:00 GMT",パランティアのCEO、アレックス・カープ氏は、同社には「断固として特別な」文化があると述べた。筆者はその文化を理解するために、パランティアのYouTube動画を174分視聴しました。,2025-08-16
a3b3b96fb3bd84633ab035179170c9be,Business_Insider,戦争の記憶、生成AIで動画化。「まるで本物」東大教授が感じた「恐怖」と「可能性」【戦後80年】,https://www.businessinsider.jp/article/2508-ww2-photo-colorization-generative-ai-short-movie/,"Thu, 14 Aug 2025 20:25:00 GMT",戦後80年を迎え、戦時中の経験の継承が課題となる中、東京大学の学者が生成AIを使い、動画を作り出す研究に取り組んでいます。AIと人力で戦時中の白黒写真をカラー化するプロジェクト「記憶の解凍」のその後を取材しました。,2025-08-16
43ddf7855ad4b1c3411bfbdd7d31a13c,Business_Insider,東映の知られざる収益源「ショービジネス」——映画が当たらない時代の勝ち筋,https://www.businessinsider.jp/article/2508-toei-show-business/,"Thu, 14 Aug 2025 12:00:00 GMT","アニメを見て、日本に憧れた——。そんな声を聞くことも多い。今やコンテンツ産業は日本の主要な輸出産業の一つであり、世界中でその存在感を示している。その一角を担うのが、日本を代表するアニメ製作会社の一つ、東映だ。
昭和100年にあたる2025年。日本アニメのビジネスモデルと東映の戦略について、ノンフィクション作家の野地秩嘉氏が独自取材を重ね、書籍『東映の仁義なき戦い』を上梓した。前回の記事に続き、著書...",2025-08-16
bcaa47fb477bca388465236fdd6d9add,ITmedia_AI_Plus,AnthropicのClaude、有害な会話を自ら終了する機能を試験導入　“AIの福祉”研究の一環,https://www.itmedia.co.jp/aiplus/articles/2508/17/news021.html,"Sun, 17 Aug 2025 07:33:00 +0900",Anthropicは、「Claude Opus 4/4.1」が有害または虐待的な会話を最後の手段として自ら終了する実験的機能を発表した。「AI welfare」に関する研究の一環で、事前テストではAIが“苦痛”のパターンを示すことが観察されたという。,2025-08-16
666b469461bbb0da35d211215aeea20e,ITmedia_AI_Plus,Anthropic、「Claude」の使用ポリシーを更新　エージェント機能の悪用規制を明示,https://www.itmedia.co.jp/aiplus/articles/2508/16/news034.html,"Sat, 16 Aug 2025 07:23:00 +0900",Anthropicは、AI「Claude」の使用ポリシーを9月15日付で更新すると発表した。エージェント機能の進化を受け、マルウェア作成やサイバー攻撃などの悪用を具体的に禁止。一方、政治的コンテンツに関する制限は一部緩和する。,2025-08-16
f307e53f57a0410b80060146c094f419,ITmedia_AI_Plus,Google、“超小型”AIモデル「Gemma 3 270M」公開　スマホで動き、省電力性能に優れる,https://www.itmedia.co.jp/aiplus/articles/2508/15/news090.html,"Fri, 15 Aug 2025 19:10:00 +0900",米Googleは、2億7000万パラメータの小型AIモデル「Gemma 3 270M」を公開した。エッジデバイス向けで、マルチモーダルに対応。省電力性能に優れるという。,2025-08-16
03fd38f740b8880997e080fa614201ac,ITmedia_AI_Plus,エージェント型AIを各業界に導入へ、NTTデータとGoogle Cloudがグローバルで協業,https://www.itmedia.co.jp/aiplus/articles/2508/15/news086.html,"Fri, 15 Aug 2025 17:04:00 +0900",NTTデータグループは、米Google Cloudと8月13日までにグローバルパートナーシップを結び、業界に特化したエージェント型AIの導入などを加速させると発表した。,2025-08-16
a6b703f6e85fcf4d4903e6fc538a19a7,ITmedia_AI_Plus,お腹から“顔が生えた”人が身につける「小型扇風機」の商品画像がXで注目　生成AI利用か,https://www.itmedia.co.jp/aiplus/articles/2508/15/news081.html,"Fri, 15 Aug 2025 16:25:00 +0900",腹部から顔が生えているように見える人が写った、小型扇風機の商品画像が、Xで注目を集めている。X上では「怖すぎる」「AI生成？」「なぜこの画像を掲載しようと思った」など、さまざまな声が上がっている。,2025-08-16
822cdc402e4374bd13777f2673031382,ITmedia_AI_Plus,Oktaが年次調査「AI at Work 2025」を発表　日本では期待と慎重姿勢が共存,https://www.itmedia.co.jp/enterprise/articles/2508/15/news037.html,"Fri, 15 Aug 2025 08:00:00 +0900",Okta Japanは年次調査「AI at Work 2025」を発表した。世界の経営幹部の66％がAIを戦略上不可欠と認識し、特に業務効率化とセキュリティ強化に重点を置いている。日本の経営層は期待と慎重姿勢が共存しているようだ。,2025-08-16
d70002ed8979d890575a82af8d093826,ITmedia_AI_Plus,戦後80年、カラーでよみがえる“戦時中の動物たち”の姿とは？　AIと人力で戦争写真を着彩、第一人者が語る思い,https://www.itmedia.co.jp/aiplus/articles/2508/15/news021.html,"Fri, 15 Aug 2025 08:00:00 +0900",馬や犬、鳩などさまざまな動物が写る戦時中のモノクロ写真を、AIと手作業でカラー化して掲載した写真集「動物たちがみた戦争」。共著者の1人で、カラー化を手掛けた東京大学の渡邉英徳教授に、同書に関する取り組みについて聞いた。,2025-08-16
2a4e7dadf4c61cee494e7362bfd4a41b,ITmedia_AI_Plus,アクセンチュア、AI人材育成のアイデミー買収へ　リスキリングサービス強化,https://www.itmedia.co.jp/aiplus/articles/2508/14/news101.html,"Thu, 14 Aug 2025 18:49:00 +0900",アクセンチュアは、AI人材育成支援などを手掛けるアイデミー（東京都千代田区）に対し、買収を目的とした公開買い付け（TOB）を行うと発表した。生成AIに関するリスキリングサービスなどを強化する狙い。,2025-08-16
1399d015dd51dd32402570f4803e9d71,ITmedia_AI_Plus,生成AI活用は「データの壁」に阻まれる　経営層が知るべき、デジタル庁の「データガバナンスガイドライン」とは,https://atmarkit.itmedia.co.jp/ait/articles/2508/14/news076.html,"Thu, 14 Aug 2025 17:00:00 +0900",多くの企業が生成AI活用に意欲を示す一方、「データの品質」が成果を妨げる最大の要因となっている。では、生成AIに注目する企業の経営層は何に取り組むべきなのか。そこで役立つのが、デジタル庁が2024年6月に公開した「データガバナンスガイドライン」だ。,2025-08-16
e31c049e64c9da8cfef3e491b89cf848,ITmedia_AI_Plus,「AIいらすとや」「AIピカソ」、“ひっそり”サービス終了していた　公式Xなどで告知なく,https://www.itmedia.co.jp/aiplus/articles/2508/14/news079.html,"Thu, 14 Aug 2025 13:20:00 +0900",AIベンチャー・AI Picassoが提供するAI画像生成サービス「AI素材.com」や、AI画像生成アプリ「AIピカソ」（iOS／Android）が8月4日にサービス終了していたことが分かった。,2025-08-16
2596577f5cf09311eadca62f14bc2e39,ITmedia_AI_Plus,米当局、AI半導体に極秘の追跡装置　中国への不正輸出を監視か,https://www.itmedia.co.jp/news/articles/2508/14/news077.html,"Thu, 14 Aug 2025 12:45:00 +0900",中国へ不正輸出される恐れがある一部の先端半導体チップの出荷品に、米当局が極秘に位置追跡装置を設置していることが関係者の話で明らかになった。,2025-08-16
28ed1e8d3b85be58dad713b77a8ce094,ITmedia_AI_Plus,AIは「大きい」より「小さい」方がいい──AIエージェントの開発手法、米NVIDIAが主張　LLMをSLMに移行する技術も掲載,https://www.itmedia.co.jp/aiplus/articles/2508/14/news033.html,"Thu, 14 Aug 2025 12:00:00 +0900",米NVIDIA Researchに所属する研究者らは、大規模言語モデル（LLM）を中心に構築されている現在のエージェントAIシステムが、実際の運用では小規模言語モデル（SLM）の方が適しているという主張をした研究報告を発表した。,2025-08-16
5e80172046580a32d8204a7af9207c91,ITmedia_AI_Plus,Googleの「Gemini」、好みを記憶する機能をデフォルトに　「一時チャット」も可能,https://www.itmedia.co.jp/aiplus/articles/2508/14/news051.html,"Thu, 14 Aug 2025 09:17:00 +0900",Googleは、「Gemini」アプリが過去の対話からユーザーの好みを記憶する機能をデフォルトで有効にすると発表した。よりパーソナライズされた回答が可能になる。一方、履歴を残さずAIの学習にも使われない「一時チャット」機能も追加した。,2025-08-16
4cb45b5a641f91fc82d2b209fbd948ac,ITmedia_AI_Plus,粒子法による解析技術の高度化と製造業への応用展開を目的に技術提携を発表,https://monoist.itmedia.co.jp/mn/articles/2508/14/news016.html,"Thu, 14 Aug 2025 09:00:00 +0900",JDSCはゴーデルブロックの田中昭雄氏と、粒子法（Particle Method）による解析技術の高度化と製造業への応用展開を目的とする技術提携を開始した。,2025-08-16
e260274b6b3039fa56f154ac7fc7d2cb,ITmedia_AI_Plus,“AIエージェント一色”のGoogle Cloud年次イベントで語られた最新動向と導入事例,https://www.itmedia.co.jp/enterprise/articles/2508/14/news046.html,"Thu, 14 Aug 2025 08:00:00 +0900",グーグル・クラウド・ジャパンは年次イベントで、生成AIとAIエージェントがビジネス価値を高める未来像を示した。本稿では「Gemini」の進化や企業の導入事例が紹介された初日の基調講演の内容を伝える（編集：村田知己）。,2025-08-16
7c596e4e87ad1057d5c837ce9bae94e4,ITmedia_AI_Plus,リコー、オープンウェイトモデル「gpt-oss-120B」をオンプレ環境で提供開始,https://www.itmedia.co.jp/enterprise/articles/2508/14/news024.html,"Thu, 14 Aug 2025 08:00:00 +0900",リコーはOpenAIのオープンウェイトLLM「gpt-oss-120B」をオンプレ環境で検証し提供を開始した。今秋、同社のスターターキットにも搭載予定で、生成AIの業務活用を高度化し企業の選択肢を拡大させる。,2025-08-16
4b56e1653345a1e39e46eb58f8853773,ITmedia_AI_Plus,組織にデータ＆AI活用を浸透させるには？　ムラタの研修プログラムに学ぶ,https://www.itmedia.co.jp/enterprise/articles/2508/10/news001.html,"Thu, 14 Aug 2025 08:00:00 +0900",「課題を見つけ、その解決にデータを生かす」は、スローガンとしては分かりやすいが実践するのは難しい。特にデータに慣れ親しむ技術者以外の部門に、業務データ活用やAI活用の思考を定着させるには組織的な活動が重要だ。ムラタの実践例とカリキュラムの実例から手法を学ぶ。,2025-08-16
b237c6a4d78a182e5dbcd09ab8806817,ITmedia_AI_Plus,【ヒット記事】Canva、NotebookLM、ChatGPT　業務で今すぐ実践できる生成AI活用法3選,https://www.itmedia.co.jp/business/articles/2508/14/news026.html,"Thu, 14 Aug 2025 07:00:00 +0900",ITジャーナリスト酒井麻里子氏の人気連載「その悩み、生成AIが解決」から、2025年上半期によく読まれたヒット記事3本を紹介します。,2025-08-16
fbe3eff42f09e35315a5d8d8150ffda8,ITmedia_AI_Plus,GPT-5の“性格”変更へ　「温かみがありつつ、GPT-4oほど煩わしくないものに」,https://www.itmedia.co.jp/aiplus/articles/2508/13/news099.html,"Wed, 13 Aug 2025 17:00:00 +0900",OpenAIのサム・アルトマンCEOは、ChatGPTの最新モデル「GPT-5」の“性格”のアップデートに取り組んでいると、Xに投稿した。,2025-08-16
1afc2a5df5189f0d03a653d090ddb96d,ITmedia_AI_Plus,人型ロボ、次々と洗濯物を畳む　タオルの山を整理整頓　米ロボット企業が動画公開,https://www.itmedia.co.jp/aiplus/articles/2508/13/news075.html,"Wed, 13 Aug 2025 16:01:00 +0900",ロボット開発企業の米Figureは、同社の人型ロボット「Figure 02」が洗濯物を畳む動画を公開した。タオルの山から1枚ずつタオルを取り出して畳み、バスケットに収納する姿が確認できる。,2025-08-16
6b47a1df30b4caea0bde4d4cf9467f04,Hatena_IT,"【神回】Googleスライドが一瞬で完成する""奇跡""のプロンプト教えます｜まじん",https://note.com/majin_108/n/n39235bcacbfc,,こんにちは､まじんです｡ この記事は､私の2025年上半期の集大成だと思ってます！ ずっとスライド生成を研究してたんでね…。 有料記事にしようか本気で悩みましたが、この感動をより多くの人に届けたいと思い、無料で公開することに決めました。 まずは、このプロンプトで「何ができるのか」をサクッとお見せします。 1️⃣Go...,2025-08-16
bb1e283969fa0814a9a0ee2071f93b20,Hatena_IT,娘「ねぇどうして空は青いの？」父「それはね、大気中の気体分子が…」母「ちょっとあなたそんな説明でわかるわけ…」→「ゆっくり父よ」「ゆっくり母だぜ」,https://posfie.com/@mumimushunyu/p/cLLCC9y,,島田耕介@大湊鯖 @1304122Tomoaki @Air____Air 娘「じ、じゃあ海が青いのも同じ理由って事だよね？」 父「それはね、海水が太陽光に含まれる青色の光以外を吸収するからだよ」 母「それじゃダメよ。まずミー散乱とは…」 2025-08-16 07:38:01 Asuto Furuhashi @AsutoF @Air____Air SCP-8900-EXの影響のせいでこんな気色の....,2025-08-16
2a1a1d4c6196bd1d1046f8bd77143a7d,Hatena_IT,「Dockerはわかるけど…」から卒業！AWSでコンテナを動かすための30日集中講座 - Qiita,https://qiita.com/555hamano/items/bf47c8adc1eddcfb3841,,Deleted articles cannot be recovered. Draft of this article would be also deleted. Are you sure you want to delete this article? はじめに この30日間の記事では、無理なくスキルを習得し、最終的に自律的にコンテナをAWS上で運用できることを目指して、技術を整理していこうと...,2025-08-16
8924227ede8b55cc799bad6090c4c154,Hatena_IT,LLM へのプロンプトを構造化された文書で管理する POML,https://azukiazusa.dev/blog/poml-prompt-structured-document/,,POML (Prompt Orchestration Markup Language) は、Microsoft によって提案されたプロンプトを構造化された文書として管理するためのマークアップ言語です。プロンプト開発における構造の欠如や複雑なデータとの統合の困難さ、特定のフォーマットへの依存性といった課題を解決することを目指しています。 高度な AI エー...,2025-08-16
814de69df4e0ccbc1435739819e5178a,Hatena_IT,AWS EC2接続：SSH踏み台 vs SSM性能比較 - AI活用で効率的に検証してみた,https://zenn.dev/primenumber/articles/8b39511fbade43,,through-bastion /tmp/10mb_test_file Running iteration 1... Iteration 1: Latency = 1663 ms Running iteration 2... Iteration 2: Latency = 914 ms Running iteration 3... Iteration 3: Latency = 967 ms Runn...,2025-08-16
1c07726b6418fa74dcf08c2df21decbd,Hatena_IT,裁判所が満を持して投入する民事裁判書面オンラインシステムのUIがこれだっ！→「CSS完全に理解してて草」「スマホ表示は対象外だから…」「どこに頼んだらこうなるんだ」,https://posfie.com/@petaritape/p/kdLD4Ow,,たぬ(B) @tanubenben B | JGC/SFC | Marriott Lifetime Pt | DVC/MVC | R1300GSA | Brompton | Baystars,2025-08-16
