id,source,title,link,published,summary,collected_date
1df854f6b18b5b6f6a30763a9414cff4,Business_Insider,OpenAIに採用されるには、博士号よりも好奇心と主体性の方が重要,https://www.businessinsider.jp/article/2507-want-work-at-openai-curiosity-grit-matter-more-than-phd/,"Sun, 13 Jul 2025 22:30:00 GMT",OpenAIのリーダーたちは、採用においてはAIに関する資格や博士号よりも、好奇心、自発性、適応性を重視すると述べました。,2025-07-13
9d6d5f2a23e6ce20d4982c035c2538ee,Business_Insider,グーグルの株価低迷は買い時でしかない、検索広告以外の成長に注目せよ。エバーコア最新分析,https://www.businessinsider.jp/article/alphabet-stock-outlook-big-tech-google-search-ai-chatgpt-goldman-2025-7/,"Sun, 13 Jul 2025 21:40:00 GMT",AIの台頭を受け検索広告事業の見通しに懸念の広がるグーグル（親会社アルファベット）の株価がパッとしません。しかし、ウォール街の一部のアナリストは、年初来の株価低迷を買い時と見ているようです。,2025-07-13
7c76a90d72eb760dae90a4f54cc06109,Business_Insider,モルガン・スタンレー、自社開発のAIツールで28万時間以上を節約…銀行業界最大の懸念であるレガシーコードの解読に活用,https://www.businessinsider.jp/article/2507-devgen-ai-tool-saved-morgan-stanley-280-000-hours-jobs/,"Sun, 13 Jul 2025 21:35:00 GMT",モルガン・スタンレーは新しいAIツールによって、「面倒な」機械的な作業が置き換えられ、今年だけで 1万1000日分以上の労力が節約されたとしています。,2025-07-13
0793803d17b69fe9cdf59b370bdabc29,Business_Insider,JR東・東京メトロなど首都圏鉄道9社、国内初「日傘」シェア導入。“日傘男子”ニーズねらう,https://www.businessinsider.jp/article/2507parasol-sharing-launches-at-jr-stations-and-more/,"Sun, 13 Jul 2025 21:15:00 GMT",夏の暑さが本格化する中、JR東日本や東京メトロなど首都圏の鉄道事業者9社が、「日傘」のシェアリングサービス「アイカサ mini」（24時間140円）の導入が始まりました。事業を担う企業NIGは、国内初の試みだとしています。,2025-07-13
9cc50f13ec3548541b030127e954c651,Business_Insider,史上最長開催のプライムデーセールを支えるAmazonの倉庫に行ってみた,https://www.businessinsider.jp/article/2507-amazon-fc-in-prime-sale/,"Sun, 13 Jul 2025 09:00:00 GMT",Amazonのプライムデーセールが始まる直前、日本最大級のアマゾンの倉庫「千葉みなとフルフィルメントセンター」を訪れ、先進的な技術や働く人々の姿を取材しました。,2025-07-13
4635673fb8f210c395fbef826ceb8eae,Business_Insider,たった1社への投資で、約3億円のポートフォリオを築く。ある個人投資家の&quot;単一銘柄&quot;戦略,https://www.businessinsider.jp/article/2507-palantir-millionaire-single-stock-bet-investing-options-strategy-retail-trader/,"Sun, 13 Jul 2025 08:30:00 GMT",エティエンヌ・ブルトン氏はパランティア（Palantir）株への投資のみで7桁（数億円）の純資産を達成しました。同氏は2020年にこの銘柄への投資を始めました。いまはパランティア株でオプション戦略を使って収入を得て、リスクを管理しています。,2025-07-13
caa05c4eeb6fc849b8f3da68a89105f8,Business_Insider,AIによって一部の雇用は消滅するが、2つの分野では増える…アマゾンは1カ月で500件以上の求人を掲載,https://www.businessinsider.jp/article/2507-andy-jassy-ai-eliminate-jobs-create-more-robotics/,"Sun, 13 Jul 2025 06:00:00 GMT",ジャシー氏は「我々はAIとロボティクスの分野でさらに多くの人材を採用する予定です」とCNBCで語りました。,2025-07-13
429993405eeb69832cdfc836bd081b24,Business_Insider,私の家、抽選でプレゼントすることにしたら――1口約1000円で、30万枚の応募チケットが捌けた,https://www.businessinsider.jp/article/2507-i-decided-to-give-away-my-house-by-lottery/,"Sun, 13 Jul 2025 02:30:00 GMT",アイルランドで医療に従事するイメルダ・コリンズ氏（52歳）は、10月に2ベッドルームの自宅を賞品とした抽選をはじめた。コリンズ氏は、このやり方は双方にとってメリットがあると考えている。,2025-07-13
a1ca2d071cd4bb8addf8d37cb8dafa0f,Business_Insider,中国が発表した極小のスパイドローン、軍事専門家の見解は？,https://www.businessinsider.jp/article/2507-military-experts-china-mosquito-like-spy-drones-uav-defense/,"Sat, 12 Jul 2025 23:30:00 GMT",このマイクロドローンは、人間の指の爪ほどの大きさで、小さな羽根と細いワイヤーの脚を備えています。,2025-07-13
322752443262255e883e0ca61f1f4d68,Business_Insider,専門家に聞いた、職場で話さないほうがいい8つのこと,https://www.businessinsider.jp/article/2507-things-you-should-never-talk-about-at-work-etiquette-experts/,"Sat, 12 Jul 2025 23:00:00 GMT",職場で同僚同士が世間話をするのは普通のことですが、エチケットの専門家は、特定の話題は絶対にタブーであるべきだと言います。,2025-07-13
9067166b12eaf85b1df37b2ac40975cd,Business_Insider,【佐藤優】がんを経た死生観の変化。「人生のターニングポイントは45歳にある」,https://www.businessinsider.jp/article/275324d/,"Sat, 12 Jul 2025 22:20:00 GMT",前立腺がんの手術が成功した佐藤優さん。読者からの「考え方の変化は」という質問に、「仕事にプライオリティをつけていかざるを得なくなった」と答えます。佐藤さんの選択とは。,2025-07-13
910c237438ff78ab30ab59f02180a48c,Business_Insider,スコットランド人男性、石造りの「廃屋」を11カ月かけて&quot;タイニーホーム&quot;に改築。予想以上に時間も費用も要するとアドバイス,https://www.businessinsider.jp/article/2507-tiny-home-renovation-old-abandoned-cottage-scotland-before-after-photos/,"Sat, 12 Jul 2025 08:30:00 GMT",廃屋だったコテージを購入し、11カ月をかけてタイニーホームに改築したダネット氏。改築におよそ10万2500ポンド（約2050万円）を費やしたと見積もっています。同氏は、改築には予想したよりもはるかに多くの費用が必要になったと語ります。,2025-07-13
5b7f6dc37764928777c454b8ce58faee,Business_Insider,アメリカ軍は約30年前のステルス爆撃機「B-2」をいかにして高性能に維持しているのか,https://www.businessinsider.jp/article/2507-how-us-air-force-is-keeping-b2-spirit-bombers-lethal/,"Sat, 12 Jul 2025 06:00:00 GMT",イランの核施設を攻撃するために使用されたB-2爆撃機は、ステルス性と破壊力を維持するために、継続的に大規模なアップグレードが行われています。,2025-07-13
c429f6088a44b31b3125134947057ec4,Business_Insider,子どもに財産を残す気がない、12人のものすごい富豪たち,https://www.businessinsider.jp/article/2507-12-incredible-billionaires-who-dont-plan-to-leave-wealth-to-their-children/,"Sat, 12 Jul 2025 02:30:00 GMT",ジョブズの妻、ローレンは相続した240億ドルを子供たちに譲るつもりがありません。ビル・ゲイツの子供たちも、父親の総資産の1％さえ受け取れないそうです。子どもに財産を残さない、12人の大富豪を紹介します。,2025-07-13
ea085cb720608071c338bcf55b2f16b1,Business_Insider,ジブリ『海がきこえる』がリバイバル上映中。言語化の時代に光る「語らない」新鮮さ,https://www.businessinsider.jp/article/studio-ghiblis-ocean-waves/,"Sat, 12 Jul 2025 00:00:00 GMT",スタジオジブリの異色作『海がきこえる』が、7月末までの3週間限定で全国リバイバル上映を実施しています。同作はSNSなどを通じてZ世代の間で「エモい」「ファッションがおしゃれ」として人気を高め、韓国でも若者に高い人気を誇ります。改めて人気の理由や作品の魅力を紐解くと、「語らない魅力」が見えてきます。,2025-07-13
462dfc959e72194ef4c02b3f3d1772dc,Business_Insider,AIモデルは必ずしも知的ではない…その事実を表す新しい用語とは？,https://www.businessinsider.jp/article/2507-aji-artificial-jagged-intelligence-google-ceo-sundar-pichai/,"Fri, 11 Jul 2025 23:30:00 GMT",グーグルのスンダー・ピチャイCEOは、AIの現在の段階を表す新しい用語として「AJI（人工的なギザギザの知能）」を提唱しています。これは、良い面と悪い面があるということです。,2025-07-13
f307785b9187b45d626c043395f1b191,Business_Insider,大学時代の友人から、「元気？」と久々のメッセージ。羽振りの良さに、マルチ勧誘かと思ったら――,https://www.businessinsider.jp/article/2507-a-long-awaited-message-from-a-college-friend-are-you-doing-well/,"Fri, 11 Jul 2025 23:30:00 GMT",筆者の大学時代の親しい友人がFacebook経由で会わないかと連絡してきました。彼女は筆者を夕食に誘い、すべて支払い、ギフトカードもくれたのだそうです。彼女は宝くじに当たり、親切にしてくれた人々に恩返しをしたいと考えたのだとか。,2025-07-13
e5822351515daba57d51d774402bf07a,Business_Insider,スタイリストに聞いた、この夏のスニーカーのトレンド4つと流行遅れ4つ,https://www.businessinsider.jp/article/2507-sneakers-whats-popular-and-out-of-style-right-now-photos/,"Fri, 11 Jul 2025 23:00:00 GMT",スタイリストによると、この夏はバックレスのスニーカーやカラフルなスニーカーが流行るそうです。ただし、オールホワイトやチャンキースニーカーはそれほど流行らないでしょう。,2025-07-13
849434e13cd193713e51f57c9c7899d0,Business_Insider,【佐藤優】20代でSNSを捨てるべき理由とは？ 時間を奪うものはすべて“敵”と見よ,https://www.businessinsider.jp/article/279632d/,"Fri, 11 Jul 2025 22:00:00 GMT",#佐藤優 が悩めるミレニアル世代のシマオに教える #はたらく哲学。SNSに時間を費やし、なかなか自己投資に集中できないシマオに、佐藤優さんがする提言とは？,2025-07-13
cb6f0287106477cb753d2b873b13a0dd,Business_Insider,工夫の詰まった「KINTOのアクティブボトル」で水分補給を習慣にできた理由,https://www.businessinsider.jp/article/kintos-active-bottle-the-clever-design-that-made-hydration-a-habit/,"Fri, 11 Jul 2025 11:00:00 GMT",水分量が目標に届かない日が続いていることに気づき、意識的に改善する必要があると感じていました。そんなタイミングで取り入れたのが、KINTOの「アクティブボトル 950ml」。1日の水分摂取量を把握しやすくなり、習慣にすることができたんです。,2025-07-13
6029a42bb2c904c7f22ce1bd1be8128f,ITmedia_AI_Plus,誰もやらないのである！　漫画「15日間、生成AIでやらかし続ける中小企業」【残り9日】,https://www.itmedia.co.jp/aiplus/articles/2506/09/news015.html,"Mon, 14 Jul 2025 07:00:00 +0900",生成AIに関する“失敗あるある”を繰り返す架空の中小企業を舞台に、生成AI活用の基礎的な注意点を漫画形式で紹介します。更新は毎営業日。,2025-07-13
376d363b896ca57a2d4fda418102e1f7,ITmedia_AI_Plus,xAI、Grokの“恐ろしい行動”について謝罪し、原因と対策を説明,https://www.itmedia.co.jp/news/articles/2507/14/news050.html,"Mon, 14 Jul 2025 06:52:00 +0900",xAIは、AIチャットボット「Grok」がヒトラーを称賛するなど不適切な投稿を繰り返した件で謝罪した。原因は「Xユーザーを密接に模倣しすぎた」ことだと説明。問題のコードを削除しシステムを再構築したと報告した。,2025-07-13
7dbdc623ac71106798c270ba9254cfad,ITmedia_AI_Plus,MR対応とサロゲートモデル連携でデザインレビューの常識が変わる!?,https://monoist.itmedia.co.jp/mn/articles/2507/14/news033.html,"Mon, 14 Jul 2025 06:15:00 +0900",サイバネットシステムは「第37回 ものづくり ワールド［東京］」の構成展の1つである「第37回 設計・製造ソリューション展」に出展し、VR設計レビュー支援システムの最新版「バーチャルデザインレビュー V8.0」の「AI連携オプション」に関するデモを披露した。,2025-07-13
4f9a991c2a2ac5e555ff24826ba62e1d,ITmedia_AI_Plus,OpenAIが買収しようとしていたWindsurfの幹部をGoogleが引き抜き,https://www.itmedia.co.jp/news/articles/2507/13/news023.html,"Sun, 13 Jul 2025 07:50:00 +0900",GoogleがAIコーディングツールを手掛けるWindsurfのCEOらを引き抜いた。同社はOpenAIが買収交渉中と報じられていたが、Microsoftとの契約が障害となり難航。WindsurfのチームはGoogle DeepMindに参加する。,2025-07-13
a625a3390d9c0d61c9913614d46b9c0b,ITmedia_AI_Plus,3駅の駅案内ロボットを1カ所から遠隔操作　JR東日本が実証実験,https://www.itmedia.co.jp/news/articles/2507/11/news104.html,"Fri, 11 Jul 2025 16:46:00 +0900",JR東日本は7月13日から、アバターロボット「newme」（ニューミー）を活用した駅案内業務の実証試験を行う。今後の本格運用に向けた課題を抽出し、指定席券売機の利用に不慣れな利用者の不安解消を目指すとともに、労働人口減少を見据えた新たな案内サービスのあり方を検討する。,2025-07-13
97b4c78afb35a849e2cc44cfea7affce,ITmedia_AI_Plus,テスラ車にAIモデル「Grok」搭載へ　「遅くとも来週中」とイーロン・マスク氏,https://www.itmedia.co.jp/aiplus/articles/2507/11/news100.html,"Fri, 11 Jul 2025 16:39:00 +0900",米Teslaのイーロン・マスクCEOは、同じくCEOを務める米xAIのAIモデル「Grok」を、Teslaの自動車に搭載すると発表した。時期は「遅くとも来週中」としている。,2025-07-13
1af4f0fa540e32a8a20300e98d015b8e,ITmedia_AI_Plus,“AIでジブリ化”の次は“ポケモン風ドット絵化”？　「ChatGPTで被写体をピクセルアート化」がインスタ・TikTokで流行中,https://www.itmedia.co.jp/news/articles/2507/11/news094.html,"Fri, 11 Jul 2025 15:23:00 +0900",自分の写真をChatGPTの画像生成機能で“ドット絵化”し、オリジナルの写真に添えて投稿する──そんな写真加工の方法がInstagramやTikTokで流行している。若者がかわいさやおしゃれさを感じて投稿しているとみられ、中には数万～100万規模でいいねを集めたり、再生されたりするものも。,2025-07-13
092776bd1e0f1931e39241fc5daf4157,ITmedia_AI_Plus,Yahoo!きっず、生成AIで“オリジナルゲーム”が作れる「AIでゲームつくりエイター」提供開始,https://www.itmedia.co.jp/aiplus/articles/2507/11/news085.html,"Fri, 11 Jul 2025 13:45:00 +0900",LINEヤフーは、子ども向けポータルサイト「Yahoo!きっず」上で、生成AIを活用したゲーム制作ができる「AIでゲームつくりエイター」の提供を始めた。,2025-07-13
d4a600d8d97b2cd24aa059b98a67ed7e,ITmedia_AI_Plus,ソフトバンク、大学・高専生向け「生成AI活用アイデアコンテスト」開催へ　最優秀賞には賞金1000万円,https://www.itmedia.co.jp/aiplus/articles/2507/11/news072.html,"Fri, 11 Jul 2025 11:18:00 +0900",ソフトバンクグループは、大学生・大学院生・高等専門学校生向けに「ソフトバンク生成AI活用アイデアコンテスト」を開催すると発表した。生成AIを活用し、企業のイノベーションなどにつながるアイデアを募集する。最優秀賞には、賞金1000万円を授与する。,2025-07-13
4d90349445febd7f8b56da5f5bc35632,ITmedia_AI_Plus,長過ぎる「治験薬承認」どう短期化？　SBI出資「慶大発医療ベンチャー」の挑戦,https://www.itmedia.co.jp/business/articles/2507/11/news053.html,"Fri, 11 Jul 2025 08:30:00 +0900",先端医療の実用化に不可欠な創薬と再生治療の二刀流で、医療イノベーションを目指すのがスタートアップのケイファーマ（東京都港区）だ。医療イノベーションの最先端について、福島弘明社長に聞いた。,2025-07-13
7fdeefab97c5f5a6b9c5761002c16423,ITmedia_AI_Plus,三菱電機「Serendie」の生成AI活用　「DX人材2万人体制」の狙いは？,https://www.itmedia.co.jp/business/articles/2507/11/news052.html,"Fri, 11 Jul 2025 08:30:00 +0900",三菱電機は独自のデジタル基盤「Serendie」（セレンディ）を軸に、2030年度までにDX人材2万人体制を目指している。三菱電機がDX人材とAI活用を強化する狙いは？　同社執行役員で、DXイノベーションセンターの朝日宣雄センター長に聞いた。,2025-07-13
42451caff0d9670726c64f2a7d0ad078,ITmedia_AI_Plus,手描きスケッチから3Dモデルが!?　オートデスクが「Project Bernini」を初披露,https://monoist.itmedia.co.jp/mn/articles/2507/11/news039.html,"Fri, 11 Jul 2025 08:00:00 +0900",オートデスクは「第37回 ものづくり ワールド［東京］」の構成展の1つである「第37回 設計・製造ソリューション展」に出展し、同社のAI Labが研究開発を進めている「Project Bernini」のデモンストレーションを国内展示会で初めて披露した。,2025-07-13
a3f77bc5839e2d9991b8625313793a78,ITmedia_AI_Plus,Google、「Gemini」アプリに写真から音声付き動画を生成する機能追加,https://www.itmedia.co.jp/aiplus/articles/2507/11/news063.html,"Fri, 11 Jul 2025 07:14:00 +0900",Googleの「Gemini」アプリに、写真1枚から音声付きの8秒動画を生成する新機能が追加された。動画生成モデル「Veo 3」を活用したもので、有料プランユーザー向けに提供。生成された動画にはAI製を示す透かしが入る。,2025-07-13
7ce2593a1d24fea1d5589a8627a787b2,ITmedia_AI_Plus,ネットワーク分離環境でもクラウド版Office製品を使うには？　自治体CIO補佐官が自作した、おすすめツール2選,https://www.itmedia.co.jp/business/articles/2507/11/news023.html,"Fri, 11 Jul 2025 07:00:00 +0900",今回は、自治体CIO補佐官である著者が自作した、ネットワーク分離環境でもMicrosoft 365の認証をスムーズに行うための「エンドポイントトラッカー」と、職員のデジタルスキルを“見える化”する「自治体デジタル人材アセスメント」の2つのツールを紹介する。,2025-07-13
db5bc15b8f5672ded98f069a74a36bfc,ITmedia_AI_Plus,AIに言っていいこと、悪いこと　漫画「15日間、生成AIでやらかし続ける中小企業」【残り10日】,https://www.itmedia.co.jp/aiplus/articles/2506/08/news004.html,"Fri, 11 Jul 2025 07:00:00 +0900",本連載では、生成AIに関する“失敗あるある”を繰り返す架空の中小企業を舞台に、生成AI活用の基礎的な注意点を漫画形式で紹介します。更新は毎営業日。,2025-07-13
febc942bdaebdd7e21cf034c29c83ef6,ITmedia_AI_Plus,AIデータセンターは2029年にサーバ1台の電力が1MW超へ、システム構成はどうなる,https://monoist.itmedia.co.jp/mn/articles/2507/11/news062.html,"Fri, 11 Jul 2025 06:30:00 +0900",インフィニオンテクノロジーズ ジャパンは、生成AIの登場により高性能化への要求が大幅に高まっているAIデータセンター向け電力供給システムの市場動向と同社の取り組みについて説明した。,2025-07-13
e7552ce94ce953c261826e27630e488f,ITmedia_AI_Plus,生成AI「翻訳」が引き起こす「コンテンツ大航海時代」　日本の漫画が世界で戦う際の“勝ち筋”は？,https://www.itmedia.co.jp/business/articles/2507/11/news006.html,"Fri, 11 Jul 2025 06:00:00 +0900",生成AIの登場は、漫画業界の常識を大きく変えるかもしれない──。日本の漫画を世界に輸出するには「翻訳」が欠かせない。,2025-07-13
92128bb0a8f1b87176bb63f8238ba0b0,ITmedia_AI_Plus,Pythonでファイルパスってどう扱えばいいの？　そんなときにはos.path／pathlibモジュールを使いましょう！　無料の電子書籍『解決！Python ファイルパス操作編』,https://atmarkit.itmedia.co.jp/ait/articles/2507/11/news019.html,"Fri, 11 Jul 2025 05:00:00 +0900",人気過去連載を電子書籍化して無料ダウンロード提供する＠IT eBookシリーズ。第141弾はPythonのos.pathモジュールとpathlibモジュールが提供する各種関数／メソッドの使い方をまとめました。これ1冊でファイルパス操作が自由自在にできるようになるかも？,2025-07-13
8392d21cc2b307f4e6b4c0044d9206ec,ITmedia_AI_Plus,YouTubeでAI動画の収益化停止？　話題のポリシー変更に「生成AIコンテンツを対象としたものではない」とGoogle日本法人,https://www.itmedia.co.jp/aiplus/articles/2507/10/news128.html,"Thu, 10 Jul 2025 19:52:00 +0900",米Googleの日本法人は、YouTubeの収益化ポリシーで「大量生産された、繰り返しの多いコンテンツ」の制限を強化するとの予告に関して、「これは生成AIコンテンツを対象としたポリシーではない」と、ITmedia AI＋の取材に対して明かした。,2025-07-13
f2bd1b2d5eca7cc09cd188390b8e1fbf,ITmedia_AI_Plus,藤井聡太棋聖が幻の沼津対局の地でトークショー　テーマは「人工知能と将棋」,https://www.itmedia.co.jp/news/articles/2507/10/news125.html,"Thu, 10 Jul 2025 18:52:00 +0900",将棋のヒューリック杯第96期棋聖戦五番勝負を3連勝で制し、6連覇を達成した藤井聡太棋聖（22、竜王・名人・王位・王座・棋王・王将）のトークショーが、第4局が予定されていた静岡県沼津市で行われた。,2025-07-13
7de875fc2d1b0ddc6480fbe001f31734,Hatena_IT,モバイルSuicaでやってはいけないこと　トラブルを防ぐ7つの心得,https://www.itmedia.co.jp/mobile/articles/2507/13/news003.html,,スマートフォン1台で電車に乗れて、コンビニや自販機での支払いもできる。モバイルSuicaは日常生活に欠かせない存在として、すっかり定着した。だが、その利便性の裏には「思わぬ落とし穴」も潜んでいる。ちょっとした不注意が、通勤中や旅行先でのトラブルにつながるケースもある。 この記事では、6月15日に掲載したカ...,2025-07-13
d0478a0404a09db907596b174c1b0c65,Hatena_IT,『開発者とアーキテクトのためのコミュニケーションガイド』 - Don't Repeat Yourself,https://blog-dry.com/entry/2025/07/13/083540,,本書はドキュメントについてはもちろんのこと、たとえば人に伝える際にどうすればよいかやリモートワークで働く際に何を気をつけたらよいかといった、開発現場で遭遇する「コミュニケーション」つまり情報伝達の方法論をいろいろと教えてくれる一冊です。今回は私が印象に残った内容を思考の整理がてら紹介したいと思い...,2025-07-13
d0367f95a8749087b07ed09490e1dce1,Hatena_IT,Dockerイメージの選び方ガイド | SIOS Tech. Lab,https://tech-lab.sios.jp/archives/48204,,PSSLの佐々木です。 Dockerを使っていると、同じアプリケーションでも様々なイメージタグが用意されています。node:18、node:18-slim、node:18-alpineなど、どれを選べばいいのか迷ってしまうことはありませんか？ 例えばPythonのDocker Imageはversion 3.13.5系だけでもこんなにあります。とほほ。。 この記事では、各D...,2025-07-13
b488e4e64b0f13e31ca9ebc14215f562,Hatena_IT,生成AI 国内の個人利用26％にとどまる 米中などと比べ低水準 | NHK,https://www3.nhk.or.jp/news/html/20250714/k10014862251000.html,,世界で利用が拡大する生成AIについて、国内で利用経験のある個人は26％にとどまり、アメリカや中国などと比べて低い水準であることが総務省のまとめでわかりました。 総務省が7月8日に発表したことしの情報通信白書によりますと、国内で、過去も含めて生成AIを使ったことがあると回答した人の割合は2024年度に26.7％と、...,2025-07-13
7e54b8e5d32125f30963800a31a7d709,Hatena_IT,インフラエンジニアが作った『hawk』- なぜawkを再発明したのか？,https://zenn.dev/kyonaka/articles/1905716e1514f0,,TL;DR AWSインフラエンジニアが、日常業務での「JSONやYAMLの構造把握」の課題を解決するために開発したCLIツールhawkの開発背景をお話しします。 💡 課題: AWS CLI出力やK8sマニフェストの構造把握に時間がかかる 🎯 解決: info機能による一発構造把握 + pandas風の統一クエリ言語 🚀 結果: 学習コストを下げながら、日...,2025-07-13
