id,source,title,link,published,summary,collected_date
ecee6f0bb7de7d7aad2584ce53aaf2a9,Business_Insider,債券は株価下落から投資家を守らない…ゴールドマン・サックスは2つの資産への投資を提案,https://www.businessinsider.jp/article/2506-bond-yields-treasury-stock-market-goldman-gold-oil-fed-deficit/,"Sun, 01 Jun 2025 22:30:00 GMT",ゴールドマン・サックスのアナリストらは、2025年は債券と株式が同時に売られることが多いが、ポートフォリオをボラティリティから守る代替手段があると考えていると述べました。,2025-06-01
90dc0baa3cea6759beac938ecd3111f5,Business_Insider,AI議事録のNottaが録音デバイス「Notta Memo」を発表。累計9.9億円調達、法人ニーズを狙う,https://www.businessinsider.jp/article/2506-notta-new-product-notta-memo/,"Sun, 01 Jun 2025 22:05:00 GMT",AI議事録サービスのNottaが、AIボイスレコーダー「Notta Memo」を発表しました。また、シリーズA＋で総額9億9000万円の資金調達を完了したことも発表。同社の戦略を解説します。,2025-06-01
421d02fe9a4642b5f282af858c675101,Business_Insider,ウォルマートのMicrosoft Azureクラウド利用実態示す内部文書が流出。2024年は「800億円超」,https://www.businessinsider.jp/article/internal-microsoft-document-how-much-walmart-has-spent-on-azure-2025-5/,"Sun, 01 Jun 2025 21:45:00 GMT",マイクロソフトが5月中旬に開催した年次開発者会議「Build」で、AIセキュリティ責任者が同社の顧客であるウォルマートのAI関連サービス利用の情報を誤って公開しました。,2025-06-01
21d3157369add0fc75f5ce7032af4b7b,Business_Insider,アメリカの原子力産業はAIブームに期待…ビッグテックなどの資金で「停滞」からの脱却へ,https://www.businessinsider.jp/article/2506-big-tech-investments-nuclear-energy-could-help-industry/,"Sun, 01 Jun 2025 21:40:00 GMT",原子力エンジニアたちは、ビッグテックの投資が原子力が不況から脱却するのを後押しする可能性があると述べました。一方、話題になっている「小型モジュール炉」については懐疑的な見方も出ています,2025-06-01
48b3391aa18d8bc2610b2e708c3597b6,Business_Insider,職場を激変させた“感謝”の力──リクルートで実践したポジティブ心理学,https://www.businessinsider.jp/article/2505-positive-psychology/,"Sun, 01 Jun 2025 21:30:00 GMT",職場がなんだかうまくいっていない…そんな時に実践するべきなのが「ポジティブ心理学」です。日常的な感謝とコミュニケーションをがもたらす好影響について実体験から紹介します。,2025-06-01
3ba41c859a62e104dabf29d586e65c25,Business_Insider,住宅ローン返済のため、寝室をエアビーで貸し出しはじめた夫婦。そして今、ふたりのキャビン村が毎月約450万円以上の収入を生んでいる,https://www.businessinsider.jp/article/2506-couple-turned-airbnb-side-hustle-into-six-figure-hospitality-business/,"Sun, 01 Jun 2025 08:30:00 GMT",2015年、ダレルとパトリスのマクサム夫妻はアトランタにある自宅の寝室をエアビー（Airbnb）で貸し出し始めました。最新のプロジェクトとしてニューヨーク州北部に木造のキャビン群を建て、収益が月3万ドル（約450万円）を超えました。,2025-06-01
604b4da0a2a2b3ad445c0f81831885a6,Business_Insider,トップアスリートが午後4時以降は水分を控える理由…水分補給の基本を確認しよう,https://www.businessinsider.jp/article/2506-why-elite-athletes-curb-water-intake-after-4pm-top-dietitian-2025-5/,"Sat, 31 May 2025 23:30:00 GMT",NBAチャンピオンチームのスポーツ栄養士が、集中力とパフォーマンスを向上させるための水分補給の方法を説明します。,2025-06-01
885cb6c2202c06ca823062ea9c6fc9e4,Business_Insider,もう一つの大統領専用機、E-4B ナイトウォッチの内部を見てみよう,https://www.businessinsider.jp/article/2506-doomsday-plane-nuclear-war-us-air-force-presidents-military/,"Sat, 31 May 2025 23:00:00 GMT",エアフォースワンは「空飛ぶ大統領執務室」として知られています。また、あまり知られていませんが「空飛ぶ作戦室」として機能する大統領専用機があります。,2025-06-01
618bcfbc69b1060aa32a006d39305887,Business_Insider,30歳でFIREしたミレニアル世代が語る、5年間で1億6000万円の資産を築き上げた投資法,https://www.businessinsider.jp/article/276663f/,"Sat, 31 May 2025 22:20:00 GMT",グラント・サバティエは24歳のとき、できるだけ早いうちに100万ドル（約1.3億円）を貯めてFIREしようと決意しました。そして5年後となる2015年に目標を達成。125万ドル（約1.6億円）を手に30歳でリタイアを実現しました。その投資法に迫ります。,2025-06-01
e6d6148df433edeb42da89fcd989e4a0,Business_Insider,ヘラルボニーが手掛ける新感覚の「謎解きゲーム」。ヤマハ、上智大学でも導入「マイノリティの疑似体験」から見えたこと,https://www.businessinsider.jp/article/2505-a-new-kind-of-puzzle-game-by-heralbony/,"Sat, 31 May 2025 09:30:00 GMT",ヘラルボニーが提供する、組織のDE&amp;Iを促進する企業向け体験型プログラム「DIVERSESSION PROGRAM（ダイバーセッション・プログラム）」。その内容に迫ります。,2025-06-01
b33bb86303d78b2928bcaf838f4487ae,Business_Insider,49歳でFIREしたシングルマザーが語る、約2億円の資産を築くまでの6つのシンプルな行動,https://www.businessinsider.jp/article/2505-single-mom-retired-early-steps-reach-goal/,"Sat, 31 May 2025 08:30:00 GMT",シングルマザーのジャッキー・カミングズ・コスキ氏は、49歳までに純資産額が130万ドル（約1億9400万円）に達しました。彼女は、生活費を抑え、収入を増やし、投資を学ぶことで、この目標を達成したと言います。,2025-06-01
bd7705abbbe03ebcc70d1596cc3d932a,Business_Insider,違いにびっくり！ わたしたち一家がフロリダからコネチカットに移り住む決断をした理由,https://www.businessinsider.jp/article/2505-moving-my-family-from-florida-to-connecticut/,"Sat, 31 May 2025 06:00:00 GMT",わたしはフロリダ州マイアミで生まれ育ちましたが…。,2025-06-01
2556137485969af5c9cbbd255dfd6ae8,Business_Insider,生成AIの普及で、&quot;オレオレ詐欺&quot;も進化する!? 「ハルシネーション（幻覚）」を覚えておこう,https://www.businessinsider.jp/article/2505-remembering-generative-ais-hallucinations/,"Sat, 31 May 2025 00:00:00 GMT",こちらはBusiness Insiderの無料メルマガに掲載されたコラムです。無料メルマガでは、日替わりで編集部員がコラムを執筆しています。Money Insiderのマネーコラムは、毎週水曜日17時以降に配信しています。,2025-06-01
3b415ba260c5fbbe1d570f6a948c59aa,Business_Insider,夏に向けた筋肉増強と脂肪燃焼のためのトレーニング…4つの間違いに注意しよう,https://www.businessinsider.jp/article/2505-avoid-mistakes-get-in-shape-for-summer-personal-trainer-tips/,"Fri, 30 May 2025 23:30:00 GMT",よくある失敗を避けて、夏に向けて健康になりましょう。パーソナルトレーナーが、筋肉増強と脂肪燃焼を最適化するための、効果的な全身ワークアウトと現実的な目標設定を教えます。,2025-06-01
670a3960109b81d7b4b260c50c9cada9,Business_Insider,スタイリストに聞いた、2025年夏のサンダルのトレンド…流行るもの4つと廃れるもの4つ,https://www.businessinsider.jp/article/2505-popular-sandals-trends-shoes-going-out-of-style-summer/,"Fri, 30 May 2025 23:00:00 GMT",スタイリストやデザイナーが、フィッシャーマンスタイルなど今お気に入りのサンダルのトレンドや、この夏人気が落ちているスタイルについて語りました。,2025-06-01
6b42233593dd1cc245ec39e1747d890e,Business_Insider,36歳のシングルマザーが月650万円の｢不労所得｣を得るために行った3つのステップ…「受動的な収入」の作り方,https://www.businessinsider.jp/article/289508c/,"Fri, 30 May 2025 22:30:00 GMT",「5週間、電話もノートパソコンも持たず、外界との接触は一切ありませんでした」と、起業家で元「サバイバー」出場者のリズ・ウィルコックスは語っています。,2025-06-01
dce937030ad2ae360f46597f0364c0da,Business_Insider,「角度に秘密がある板」で積読が解消。読書習慣を取り戻せた,https://www.businessinsider.jp/article/the-angled-shelf-that-conquered-my-to-read-pile-and-restored-my-reading-habit/,"Fri, 30 May 2025 11:00:00 GMT",デスクの片隅に、つい積み重ねてしまう本たち。「積読」がデスクの面積を占有してしまい、読書の心理的なハードルも高くなってしまっていました。そんな積読状態を改善してくれたのが、SOGUの「ソグ 9°ブックストッパー」だったんです。このアイテムの最大の特徴は、その名のとおり本体に9度の傾きがあること。,2025-06-01
2ef5496ea885d4f71a7838f103cd52f8,Business_Insider,「iPad（A16）」の実力を試す。「Apple Intelligence」なしでも十分使える11インチタブレット,https://www.businessinsider.jp/article/2505-apple-ipad-a16-review/,"Fri, 30 May 2025 10:38:00 GMT",アップルの「iPad（A16）」のレビューをお届けします。「Apple Intelligence」には非対応ですが、「iPhone 15」と同じチップセットを搭載し、軽快に動く11インチタブレットです。,2025-06-01
34deb8647e37800251556da6fb5ce367,Business_Insider,日本最大級のGXカンファレンス「ASUENE SUSTAINABILITY SUMMIT 2025」7/16（水）に開催,https://www.businessinsider.jp/article/2505-asuene-esg-summit-2025-held/,"Fri, 30 May 2025 10:00:00 GMT",グローバル企業が取るべきGX（グリーントランスフォーメーション）の次の一手を探るカンファレンス「アスエネESGサミット 2025」が、7月16日（水）に開かれます。,2025-06-01
5824912142e643002ca48a84b69dbd92,Business_Insider,新キャストも続々決定！ 『ハリー・ポッター』の新たなテレビシリーズについて分かっていること,https://www.businessinsider.jp/article/2505-harry-potter-tv-series-info/,"Fri, 30 May 2025 10:00:00 GMT",ついにハリー・ポッターがテレビドラマとして帰ってきます。,2025-06-01
e25c197077a0a03ad07ce93b62a3ed1c,ITmedia_AI_Plus,Googleの動画生成AI「Veo 3」、Geminiアプリでも利用可能に（ただし「Pro」以上）,https://www.itmedia.co.jp/news/articles/2505/31/news041.html,"Sat, 31 May 2025 06:40:00 +0900",Googleの動画生成AI「Veo 3」が、Geminiアプリでも利用可能になった（「AI Pro」プラン以上対象）。また、Veoで生成した動画には、SynthIDに加え目視可能なウォーターマークも追加される（「Flow」のUltraプランを除く）。,2025-06-01
80a55e67129b8e9b041813405aa31cc7,ITmedia_AI_Plus,AIでCAE業務が爆速に!?　サロゲートモデルが熱い,https://monoist.itmedia.co.jp/mn/articles/2505/30/news136.html,"Fri, 30 May 2025 19:00:00 +0900",製品開発のスピードと精度の両立を目指し、AI（人工知能）によるCAEの高速化技術が注目されている。,2025-06-01
f37fa29cdb527c8c63a9ffb98637fc7e,ITmedia_AI_Plus,自身のコードを書き換え“成長するAI”――Sakana AI、新たなAIエージェント「DGM」発表,https://www.itmedia.co.jp/aiplus/articles/2505/30/news130.html,"Fri, 30 May 2025 17:36:00 +0900",Sakana AIは、自身のコードを書き換えて性能を高めるコーディング向けAIエージェント「ダーウィン・ゲーデル・マシン」を発表した。自身のコードを読み取り、修正することで、コーディング性能を高められるという。,2025-06-01
9a0d675443c3526e682da752508e7d36,ITmedia_AI_Plus,東南アジア有数の旅行予約プラットフォーム「トラベロカ」、日本市場に本格参入,https://www.itmedia.co.jp/business/articles/2505/30/news076.html,"Fri, 30 May 2025 14:42:00 +0900",旅行予約プラットフォーム「トラベロカ」（Traveloka）を展開するTraveloka Japanは、日本でのサービスを開始した。ホテル、航空券、アクティビティ、空港送迎、レンタカーなどの予約をワンストップで提供。快適な旅行体験の提供を目指す。,2025-06-01
ed8cde7207f7be44cfd4dd6e9275b4ab,ITmedia_AI_Plus,人型ロボが“殴り合い”――ロボット同士の格闘技大会が中国で開催　簡単に倒れない“打たれ強さ”披露,https://www.itmedia.co.jp/aiplus/articles/2505/30/news106.html,"Fri, 30 May 2025 13:32:00 +0900",ロボット開発企業の中国Unitree Roboticsは、人型ロボット同士が戦う格闘技大会の様子を動画で公開した。同社の人型ロボ「G1」とみられるロボットが、相手を倒そうと、パンチやキックなどを繰り出している。,2025-06-01
f78785a29456ca5acb631de3ae181b61,ITmedia_AI_Plus,これがWeb 4.0？　Microsoftが提唱する「Open Agentic Web」を解説　今までのWebサイトは“司書のいない図書館”,https://www.itmedia.co.jp/aiplus/articles/2505/29/news042.html,"Fri, 30 May 2025 12:00:00 +0900",Microsoftの開発者向けイベント「Build 2025」のキーノートスピーチにおいて、サティア・ナデラCEO兼会長は「Open Agentic Web」という概念を打ち出した。Microsoftは、いったいAIエージェントに関してどのようなビジョンを描いたのか。,2025-06-01
096966108637aa635fc28c0cf702d3cb,ITmedia_AI_Plus,「IT導入補助金」は中小企業を救うか、それとも？　問われる不正対策,https://www.itmedia.co.jp/business/articles/2505/30/news073.html,"Fri, 30 May 2025 08:30:00 +0900",IT導入補助金は、中小企業の生産性向上に結び付いているのか。中小企業庁経営支援部の村山裕紀生産性向上支援室長補佐に、本音を聞いた。,2025-06-01
6fb051bd64fd1bf11afaedc98ceac823,ITmedia_AI_Plus,“爆速”開発チームの原動力は「否定しない文化」　エンジニアが生き生きした秘密,https://www.itmedia.co.jp/business/articles/2505/30/news064.html,"Fri, 30 May 2025 08:00:00 +0900",サイオステクノロジーの喜多伸夫社長に、AI活用の要点やエンジニアが生き生きと働ける組織づくりの秘密を聞いた。,2025-06-01
e94adec483caab6d1df881ee9dc94c9c,ITmedia_AI_Plus,「フードの変更20mm以内でデザインを修正して」、ホンダが設計検討にAI活用,https://monoist.itmedia.co.jp/mn/articles/2505/30/news041.html,"Fri, 30 May 2025 06:00:00 +0900",ホンダは「人とくるまのテクノロジー展 2025 YOKOHAMA」において、自然言語駆動型3Dモデル生成技術による車両デザイン検討の取り組みについて発表した。PoCは完了し、量産車の開発に適用し始めている。,2025-06-01
50ee640e45212c32b598f77fa04839fa,ITmedia_AI_Plus,AIが24時間365日休まず大量架電、「AIテレアポくん」登場　「AIピカソ」の親会社から,https://www.itmedia.co.jp/aiplus/articles/2505/29/news152.html,"Thu, 29 May 2025 18:34:00 +0900",AIdeaLabは、AIが自動で電話をかけて相手と会話し、アポイントの獲得を目指すサービス「AIテレアポくん」の提供を始めた。,2025-06-01
27cfa1c639838651adcaa66108a0e37e,ITmedia_AI_Plus,AI時代に求められるのは？　国内1000人調査で見えた実態,https://www.itmedia.co.jp/business/articles/2505/29/news048.html,"Thu, 29 May 2025 18:17:00 +0900",80％以上の人が「誤情報」や「フェイク画像・映像」に懸念を示している。「AIの信頼性に関する実態調査」で明らかになった。,2025-06-01
78a649c97808ca8e152c7c0806db86c3,ITmedia_AI_Plus,中学生の2人に1人が「画像・動画生成AI」を使ったことがある　ニフティ調査,https://www.itmedia.co.jp/aiplus/articles/2505/29/news136.html,"Thu, 29 May 2025 15:53:00 +0900",中学生の2人に1人が画像や動画を生成するAIを使ったことがある――ニフティは5月29日、こんな調査結果を発表した。,2025-06-01
deb4dd850f27ea8f1eac5c3470eac06a,ITmedia_AI_Plus,CAEの結果を1分で予測　トヨタシステムズが汎用PCで動くサロゲートモデルを提案,https://monoist.itmedia.co.jp/mn/articles/2505/29/news038.html,"Thu, 29 May 2025 13:30:00 +0900",トヨタシステムズは「人とくるまのテクノロジー展 2025 YOKOHAMA」に出展し、3D形状を認識して製品性能をAIで素早く予測するシステム「3D-OWL」を訴求していた。,2025-06-01
cba0e21a7b2a721d8e9b776fcb627ee5,ITmedia_AI_Plus,中国発AI「DeepSeek-R1」がアップデート　長考での推論やコーディング性能向上か,https://www.itmedia.co.jp/aiplus/articles/2505/29/news105.html,"Thu, 29 May 2025 12:25:00 +0900",AI開発企業の中国DeepSeekは、大規模言語モデル「DeepSeek-R1」のアップデート版を公開した。パラメータ数は6850億で、商用利用もできるMITライセンスの下で提供する。,2025-06-01
ace646d44696edda28926c59fdfead7d,ITmedia_AI_Plus,Anthropic、Netflix共同創業者のヘイスティングス氏を取締役に,https://www.itmedia.co.jp/news/articles/2505/29/news095.html,"Thu, 29 May 2025 09:53:00 +0900",Anthropicは、Netflix共同創業者のリード・ヘイスティングス氏を取締役に任命した。ヘイスティングス氏の豊富な経営経験とAIの社会貢献への理解に期待するとしている。これで同社の取締役会は5人体制となる。,2025-06-01
7ca287477959e1ad9c982091d01f8460,ITmedia_AI_Plus,Opera、“AIエージェントブラウザ”「Opera Neon」発表　ウェイティングリスト公開,https://www.itmedia.co.jp/news/articles/2505/29/news092.html,"Thu, 29 May 2025 09:13:00 +0900",Operaが“AIエージェントブラウザ”と銘打つ「Opera Neon」を発表した。AIエージェント「Browser Operator」と会話し、Web操作や情報取得が可能。クラウドで動作し、オフライン作業も継続する。具体的なリリース日程は不明だ。,2025-06-01
50147ff6a7b91db3398fc22079b738b7,ITmedia_AI_Plus,“ワンピースっぽい”と注目のゲーム、任天堂のオンラインストアから消える,https://www.itmedia.co.jp/aiplus/articles/2505/28/news136.html,"Wed, 28 May 2025 21:31:00 +0900",マンガ「ワンピース」に似ていると注目を集めていたゲーム「パイレーツアニメクエスト」。5月28日午後8時時点で、任天堂の公式オンラインストア「マイニンテンドーストア」上の商品ページが閲覧できない状態だ。,2025-06-01
8f9566bd172b8722dccca64999154a6c,ITmedia_AI_Plus,AIが建設現場の熱中症を予防　1日3回、体重測定→Googleの「Gemini」が必要な水分量をアドバイス,https://www.itmedia.co.jp/aiplus/articles/2505/28/news131.html,"Wed, 28 May 2025 18:38:00 +0900",ユーフォリアは、米Googleの生成AI「Gemini」を活用し、建設現場での熱中症を予防するシステムを開発したと発表した。測定した作業者の体重データなどをもとに、Geminiが熱中症を予防するためのアドバイスをするという。,2025-06-01
b66a7ad6c9d8fe68759d074e3e75741a,ITmedia_AI_Plus,中国の“車輪付き”四足歩行ロボ、日本で販売へ　山岳地帯・沼地を走れ、80cmの段差も乗り越える,https://www.itmedia.co.jp/aiplus/articles/2505/28/news122.html,"Wed, 28 May 2025 18:18:00 +0900",エルザジャパンは、中国DEEP Roboticsの車輪付き四足歩行ロボット「LYNX M20」の取り扱いを始めた。7月以降に出荷予定。,2025-06-01
4af154c9bbeeab4851f25f1ddebc0002,ITmedia_AI_Plus,メニュー写真をAIでテキスト化→ワンクリックで公開　Googleの店舗情報に新機能,https://www.itmedia.co.jp/aiplus/articles/2505/28/news114.html,"Wed, 28 May 2025 15:20:00 +0900",,2025-06-01
2f3b1de8f11834706b2b532f9062c720,Hatena_IT,コーディングエージェントの現状の整理とエンジニアの仕事の変化について,https://azukiazusa.dev/blog/coding-agents-and-developers-work/,,"When the GitHub Copilot Technical Preview launched just over one year ago, we wanted to know one thing: Is this tool helping developers? The GitHub Next team conducted research using a combination of ...",2025-06-01
bb359354e23ae64c14613bb4c3a76898,Hatena_IT,ソフトウェアエンジニアから AI エンジニアへスキルチェンジ - As a Futurist...,https://blog.riywo.com/2025/06/from-software-engineer-to-ai-engineer/,,AI 始めました！というと、ミーハーな感じがありますが、15年ほどやってきたソフトウェアエンジニアとしてのキャリアは終わりにして、 2カ月程前から AI エンジニアになりました。ここ5年程は、過去の経験の切り売りしかしていない感じがずっとあったのですが、 全く新しいことを始めて1から勉強し直しているところでと...,2025-06-01
f94835e75b39271a6fbdba5a5da6f0f1,Hatena_IT,エンジニアの目標設定と評価を考える｜saitoryc,https://note.com/saitoryc/n/n1e757ef48df7,,こんばんは。SmartHR VP of Engineeringの@saitorycです。 あっという間に5月が終わろうとしていますね。毎回「時間が経つのが早い」で始めている気がしてきたので、次回こそは違う切り口でスタートしようと思います。 ところで今年、雨が降ると急激に気温が下がりませんか？いつもこんなだったか？ 超余談ですが、毎回...,2025-06-01
eb815946cd42e7fa80b77753e5b985c8,Hatena_IT,Claude Code Actionで5000円溶かして学んだ、AIエージェント並列開発,https://zenn.dev/ryryo/articles/b38b6a8430aa61,,どうも、こんにちは。私です。 今月、AI開発界隈がまた騒がしくなってますね。Claude Codeに加えて、Claude Code Actionという新しい選択肢が登場しました。 なので、5000円ほど溶かしながら実際に触ってみました。これまでのAI開発とはまた全く違う体験で、今後の開発環境の変化の可能性が感じられてとても良かったです...,2025-06-01
f78bb054d0f593bc322e651a940b7166,Hatena_IT,Windowsのメモ帳（Notepad）がMarkdown形式をサポートへ。Windows Insider向けに配布開始,https://www.publickey1.jp/blog/25/windowsnotepadmarkdownwindows_insider.html,,Windowsのメモ帳（Notepad）がMarkdown形式をサポートへ。Windows Insider向けに配布開始 マイクロソフトは、Markdown形式をサポートしたメモ帳（Notepad）がWindows Insider向けに配布開始されたことを、5月30日付のWindows Insider Blogの記事「Text Formatting in Notepad begin rolling...,2025-06-01
d88e2b0f263822bca8a3ed9e3ee81f4c,Hatena_IT,AWS、事実上無制限にスケールするPostgreSQL互換の大規模分散DB「Amazon Aurora DSQL」正式版を提供開始,https://www.publickey1.jp/blog/25/awspostgresqldbamazon_aurora_dsql.html,,Amazon Web Services（AWS）は、事実上無制限にスケールするPostgreSQL互換の大規模分散データベース「Amazon Aurora DSQL」の正式版を提供開始したと発表しました。 Amazon Aurora DSQLは昨年（2024年）12月のイベント「AWS re:Invent 2024」で発表された、サーバレスな大規模分散データベースです。 1つのリージョン内...,2025-06-01
1f709cbf9897442075ceba5b63f1b7bd,Hatena_IT,カスタムキーボードThinkPadの作り方｜saoto28,https://note.com/saoto28/n/n716b7ca2e1f9,,How to make a ThinkPad with a custom keyboard. 2025-06-01 初版 ThinkPad にカスタムキーボードを搭載する方法について記す。今回ThinkPad X13 Gen2に換装した（Gen3も同等のはず）。以前T470sにも同様に換装したことあり（T460sも同等のはず）。 希望者がいればX13G2用Alice配列PCB（マイコン搭載）を販売...,2025-06-01
b72969f013456a5a2085a630c5f4da7f,Hatena_IT,povo2.0、“0円で使い放題”になる裏技が発覚　KDDI「意図しない形で使われている」,https://www.itmedia.co.jp/mobile/articles/2506/01/news026.html,,KDDIは、オンライン専用プラン「povo2.0」の契約者向けに、一部内容を改定すると案内している。povo2.0は基本料金0円で、必要な時にデータ容量や音声通話定額オプションを追加できる「トッピング形式」が大きな特徴だ。契約手続きや料金プランの相談は店頭では受け付けておらず、オンライン専用の料金プランとなっている...,2025-06-01
1b95918ff429e8cbb8b0ec86b5c0749d,Hatena_IT,2025年度人工知能学会全国大会チュートリアル講演「深層基盤モデルの数理」,https://speakerdeck.com/taiji_suzuki/2025nian-du-ren-gong-zhi-neng-xue-hui-quan-guo-da-hui-tiyutoriarujiang-yan-shen-ceng-ji-pan-moderunoshu-li,,2025年度人工知能学会全国大会 (JSAI2025) にて行ったチュートリアル講演の資料です．,2025-06-01
