id,source,title,link,published,summary,collected_date
7849e6473480b1a37e91a4afb65535c3,Business_Insider,【COMPUTEX】マッキンゼーが警告した「AIデータセンター拡大における4つの懸念」…ある問題が年間8億ドルの「推論機会ロス」に,https://www.businessinsider.jp/article/2606-mckinsey-4-concerns-ai-datacenter-expansion/,"Sun, 31 May 2026 22:45:00 GMT",マッキンゼーのグローバル・マネージング・パートナーは、AIデータセンターの拡大と実装を左右する真の要因には、電力、放熱、ネットワーク、コンピューティング能力という4つの主要なインフラ要素があり、それぞれ懸念があると警告している。,2026-05-31
38e04931506822554a130b7856a3ce8f,Business_Insider,ChatGPT広告にソフトウェア企業が殺到している,https://www.businessinsider.jp/article/2606openai-chatgpt-ad-tests-reveal-new-advertising-trends/,"Sun, 31 May 2026 21:50:00 GMT",OpenAIの広告導入でデータ分析が進み、ChatGPTがソフトウェア広告の有力な掲載先になっていることが分かりました。,2026-05-31
ba8d5878fdc1f6a983d2aea2160d982f,Business_Insider,三菱商事を3カ月で辞め、米アグリテックから女川町へ。なぜ彼は「養殖困難な高級貝」に賭けるのか,https://www.businessinsider.jp/article/2605-onagawa-challenging-rare-shellfish-farming/,"Sun, 31 May 2026 21:30:00 GMT",宮城県女川町で地域おこし協力隊の長谷川翔亮さん（31）。元三菱商事や海外スタートアップで活躍した異色の経歴を持ち、現在は高級貝「トリガイ」の養殖実験に挑んでいます。,2026-05-31
dacaacd61c9fa8d60f82d7f64dff9ec0,Business_Insider,ブルーオリジンのロケット爆発で「宇宙関連株」が一時急落,https://www.businessinsider.jp/article/2606-blue-origin-explosion-asts-rklb-lunr-space-stocks-spacex-bezos/,"Sun, 31 May 2026 21:30:00 GMT",アマゾン創業者ジェフ・ベゾス氏率いるブルーオリジンのロケットが5月28日の打ち上げ前試験中に爆発。これを受け、宇宙関連株は翌金曜日の取引で大幅に下落しました。,2026-05-31
e05f4fb552b3297f6b3d9d7cd3d171a1,Business_Insider,AIは本当に「人類の敵」なのか…ローマ教皇、サム・アルトマン、ジェンスン・フアンが語る「現実的な未来」,https://www.businessinsider.jp/article/2605-nvidia-jensen-huang-pope-sam-altman-ai-jobs-companies-future/,"Sun, 31 May 2026 21:00:00 GMT",AIは人類を完全に変えてしまう存在ではなく、案外「普通の技術」に落ち着くのかもしれません。サム・アルトマン、ジェンスン・フアン、ローマ教皇レオ14世の発言に希望が見えてきています。,2026-05-31
d6517a9e4f9448a095ca6a7232e88cc9,Business_Insider,スマホ成長鈍化の穴を半導体「AI ASIC」が埋めるか。メディアテックの26年データセンター出荷目標は20億ドル,https://www.businessinsider.jp/article/2605-mediatek-2026-datacenter-ai-asic/,"Sun, 31 May 2026 20:55:00 GMT",AI需要の高まりにより、半導体成長の焦点は携帯電話からデータセンターへと移りつつある。台湾の半導体大手MediaTekは株主総会で、今年のAI ASIC出荷額目標を20億ドルに設定し、来年には数十億ドル規模に成長するとの見通しを示した。,2026-05-31
9b6e9ea212f59044b5c50b6bb8dedf9a,Business_Insider,「早く仕上げるほど売上は減る」。富士通・時田社長が語るSIerが「人月の通用しない時代」で稼ぐ方法,https://www.businessinsider.jp/article/2606-fujitsu-ceo-tokita-sier-business-model-in-ai-agent-era/,"Sun, 31 May 2026 20:30:00 GMT",富士通の時田隆仁社長は、AIエージェントの進化により従来の人月モデルは持たなくなるとの見方を示しました。開発自動化や海外AI企業との提携を通じ、収益モデル転換を急ぎます。,2026-05-31
46d731eae4bfe96235294d67ca33a2d0,Business_Insider,100万ドル以上を稼いだ、23歳のオプショントレーダー。投資家にアドバイスを送る,https://www.businessinsider.jp/article/2605-options-trader-lander-schlessinger-retail-investors-tsla-nvda-0dte-trading/,"Sun, 31 May 2026 08:30:00 GMT",ランダー・シュレッシンジャーは10代の頃からトレーディングをしています。どのトレーダーも成功には、計画を立て、それを続けることが必要だと彼は考えています。,2026-05-31
ba95a3144715106b64f2f7fad70790e7,Business_Insider,アメリカ軍、特殊部隊への物資輸送に「グライダー型ドローン」をテスト,https://www.businessinsider.jp/article/2605-green-berets-testing-drones-that-can-slip-past-enemy-sensors/,"Sun, 31 May 2026 06:00:00 GMT",アメリカ陸軍特殊部隊「グリーンベレー」は、敵のセンサーを回避し、部隊へ隠密に物資を補給するために設計された「探知困難なグライダー型ドローン」の試験を行っています。,2026-05-31
5c0c61bb33c0223bfd9c27c94e0c96ca,Business_Insider,コストコのエグゼクティブ会員になって良かった！ 4人家族の筆者が買う、お気に入りの商品 11,https://www.businessinsider.jp/article/2503-what-i-buy-to-make-costco-executive-jll/,"Sun, 31 May 2026 03:00:00 GMT",エグゼクティブ会員であることを最大限に活かす、我が家のお気に入りの商品を紹介します。【アーカイブ記事】,2026-05-31
c93a22aaf58b872bfd110037819c10f6,Business_Insider,息子の病気を機に家を売り、一家6人でキャンピングカー生活を始めた…「後悔のない人生」を求めて一緒に旅する道を選択,https://www.businessinsider.jp/article/2605-rv-living-full-time-family-parenting-expenses-freedom-no-regrets/,"Sat, 30 May 2026 23:30:00 GMT",ベイリーさん夫妻は、幼い子どもの病気をきっかけに仕事中心の生活だったことに気づき、家を売却して一家6人でキャンピングカー生活を始めました。,2026-05-31
de4ccc5226c2920a435895c667444db9,Business_Insider,ボート、防空壕、銀行金庫室…世界で最もユニークな14の書店を見てみよう,https://www.businessinsider.jp/article/2605-bookstores-built-strange-places-around-world/,"Sat, 30 May 2026 23:00:00 GMT",世界には個性的な書店があります。その歴史や建築、そして驚きの立地で名を馳せる、世界で最もユニークな書店を紹介します。,2026-05-31
d70541af299e831318802056591d3579,Business_Insider,【佐藤優】Z世代部下の｢正しくないからやりたくない｣に悩む管理職。私たちは「日本の大企業おじさん」なのか？,https://www.businessinsider.jp/article/276665g/,"Sat, 30 May 2026 22:25:00 GMT",Z世代の部下から「この仕事は正しくないと思うからやりたくない」と言われ、ストレスを抱える40代の管理職。佐藤優さんは、上司は「いい人」ではいられない、現実とビジョンを伝えることが必要と説きます。,2026-05-31
1654abf0afbb6802e0375568422c42dd,Business_Insider,約600万円のボートで暮らす、25歳のイギリス人女性。毎月15万円以上を節約する,https://www.businessinsider.jp/article/2604-uk-woman-lives-in-narrowboat-saves-money/,"Sat, 30 May 2026 08:30:00 GMT",ドッティ・ターンブル氏は、1ベッドルームのコテージを退去し、約4万ドルでナローボートを購入しました。5年が経った今、彼女は毎月節約できているといいます。,2026-05-31
069da461f9f3c4e87293b492a10905dd,Business_Insider,アメリカで収入の高い職業トップ13 [2026年版],https://www.businessinsider.jp/article/2605-highest-paying-jobs-in-us/,"Sat, 30 May 2026 06:00:00 GMT",新たなデータで、アメリカで平均的に高収入な職種が明らかになった。さまざまな分野の外科医など、多くの医療関連職種が高収入です。,2026-05-31
d0eccabe2cf7577edbb4560a56c16982,Business_Insider,世界最高の国ランキング・トップ20 [2026年版],https://www.businessinsider.jp/article/2605-20-best-countries-in-the-world-ranked-2026-20-south-korea-1/,"Fri, 29 May 2026 23:30:00 GMT",U.S.ニュース＆ワールド・レポートが選ぶ世界の「最高の国」ランキングが発表されました。2026年度は多くのヨーロッパ諸国が上位を占める一方、アメリカはトップ10入りを逃す結果となりました。,2026-05-31
18972c3ac03d68867ce4cd6b536ae64b,Business_Insider,70代で夫婦揃ってタイの高齢者施設へ…残された側にとっての保険のようなもの,https://www.businessinsider.jp/article/2605-retiree-couple-moved-to-senior-care-resort-thailand-chiang-mai/,"Fri, 29 May 2026 23:00:00 GMT",タイのチェンマイで暮らすピーター・ミラード氏は、妻のリタさんとともに自立した生活を維持したいと考えており、食事の準備や家事の大部分を自分たち自身でこなしているそうです。,2026-05-31
e11ec5bd1f06db56124c4cac5bd90e7a,Business_Insider,【佐藤優】盛り上がっている会議で反対意見を言いづらい。微妙な結果に終わるモヤモヤどうすれば？,https://www.businessinsider.jp/article/282355f/,"Fri, 29 May 2026 22:25:00 GMT",「盛り上がっている会議で反対意見を出しにくい」。読者からのお悩みに佐藤優さんが回答。日本の特徴的な組織文化、反対意見を言っても孤立しないために気をつけるべきこととは？,2026-05-31
95e5dcbe898972ef3ea4bf8245fa5889,Business_Insider,テック業界の次の主役は「プロダクトエンジニア」という新たな職種かもしれない,https://www.businessinsider.jp/article/2605-ai-jobs-product-engineers-managers/,"Fri, 29 May 2026 10:00:00 GMT",AIやバイブコーディングの普及によって、プロダクトマネージャーの業務量が急増。その改善策として、Anthropicはエンジニアの採用を増やし、新たな職種の試験導入も始めました。,2026-05-31
b22a4dfd6db5df8c9aabb8bed24b07d9,Business_Insider,約310万円の借金を抱えたのは、私が25歳になる前だった。それを打ち明けたとき、婚約者の反応に驚いた,https://www.businessinsider.jp/article/2605-hid-credit-card-debt-told-fiance-money-shame/,"Fri, 29 May 2026 08:30:00 GMT",クレジットカードで2万ドルの借金を抱えていることを婚約者に隠していました。ついに隠しきれなくなり真実を打ち明けたことで、私の人生もキャリアも変わりました。,2026-05-31
ba0d9d5874fa1e5994d40abeb3f50fb9,ITmedia_AI_Plus,富士通が認めた「人月モデル」の限界　時田社長「労働集約型SIモデルからの転換を」,https://www.itmedia.co.jp/business/articles/2606/01/news040.html,"Mon, 01 Jun 2026 07:00:00 +0900",富士通が「中長期経営ビジョン2035」を発表した。AI時代に突入した今、同社の時田隆仁社長CEOは、従来型の「人月モデル」には限界があると認めた。その真意とは。,2026-05-31
b2d5e45c60b8104c074ad06779b5b134,ITmedia_AI_Plus,「ハーネス」って結局、何？　みんな使い方が違うAIエージェント用語をHugging Faceが整理,https://atmarkit.itmedia.co.jp/ait/articles/2606/01/news016.html,"Mon, 01 Jun 2026 05:00:00 +0900",AIエージェント分野で人によって意味が揺れる「ハーネス」「スキャフォールド」などの用語を、Hugging Faceが整理した。AIエージェントを正しく理解し議論するために押さえておきたい基本用語を初心者向けに解説する。,2026-05-31
084562b98feefe6fcafa31ef809d18c4,ITmedia_AI_Plus,「FDE」って結局、客先常駐SEのリブランディングじゃないの？　アクセンチュアに聞いてみた,https://www.itmedia.co.jp/aiplus/article/2606/01/2000000039/,"Sun, 31 May 2026 23:00:00 +0900",AIプラットフォーム企業が掲げる新職業「FDE」（フォワード・デプロイド・エンジニア）は、客先常駐SEの焼き直しなのか。Microsoftと共同でFDE組織を立ち上げ、独自の「RDE」も打ち出すアクセンチュアの保科学世氏と片岡俊行氏に疑問をぶつけてみた。,2026-05-31
07714245e5c7494c2d29f404e679c48a,ITmedia_AI_Plus,日立はAnthropicと組んで何を狙うのか　従業員29万人へのClaude導入で目指す姿,https://www.itmedia.co.jp/enterprise/articles/2605/30/news010.html,"Sun, 31 May 2026 08:00:00 +0900",ミッションクリティカル領域でのAI活用に向け、日立はAnthropicと戦略的パートナーシップを締結した。同社は今回の提携で何を実現しようとしているのか。,2026-05-31
39c876b3488b39afc376d25d1b062edd,ITmedia_AI_Plus,OpenAIが生命科学推論AI「GPT-Rosalind」をバイオディフェンスに開放　デュアルユースリスクに懸念も,https://www.itmedia.co.jp/news/articles/2605/30/news031.html,"Sat, 30 May 2026 06:48:00 +0900",OpenAIは、生命科学研究に特化したフロンティア推論モデル「GPT-Rosalind」を活用した「Rosalind Biodefense」プログラムを発表した。生物脅威の検知など防衛目的に限定し、審査済みの開発者や米政府機関および同盟国のパートナー組織にAPIを無償提供する。,2026-05-31
473f78dc5eeaaa88260b257ff2e90b9e,ITmedia_AI_Plus,「Nano Banana 2」「Nano Banana Pro」が一般提供開始　「2」は動画からの画像生成もサポート,https://www.itmedia.co.jp/news/articles/2605/29/news146.html,"Fri, 29 May 2026 20:30:00 +0900",米Googleは5月29日、「Nano Banana 2」（Gemini 3.1 Flash Image）と「Nano Banana Pro」（Gemini 3 Pro Image）の一般提供を開始すると発表した。加えて、動画入力に対応する新機能をNano Banana 2でプレビュー公開する。,2026-05-31
fbf27c23fd12fd3020421808165ff75a,ITmedia_AI_Plus,日本政府と主要金融機関、OpenAI新モデルのアクセス権を取得　サイバー対策強化へ,https://www.itmedia.co.jp/news/articles/2605/29/news144.html,"Fri, 29 May 2026 19:14:00 +0900",片山さつき金融担当相が、米OpenAIが開発した新型AIのアクセス権を政府と主要金融機関が取得したと明らかにした。高性能AIがサイバー攻撃に悪用される懸念が高まる中、AIを防御に活用した対策が急務となっている。片山氏は「わが国金融機関のサイバーセキュリティー強化の観点から歓迎するべきものだ」と述べた。,2026-05-31
3a37c45ad4ec8e1cd0079c5aa1d5428f,ITmedia_AI_Plus,JR西日本は“熟練者が手書きするしかなかった車両作業計画”をAIでどう自動化するのか？,https://atmarkit.itmedia.co.jp/ait/articles/2605/29/news103.html,"Fri, 29 May 2026 17:00:00 +0900",JR西日本は、熟練担当者が手書きで作成していた鉄道車両基地の構内作業計画を、AIで自動作成するシステムを開発している。なぜ開発し、どのような効果を見込むのか。,2026-05-31
22437a450a8927a6a46e6dcf574be3f4,ITmedia_AI_Plus,OpenAI、日本政府とサイバーセキュリティで協力　最新AI「GPT-5.5-Cyber」を金融機関に提供,https://www.itmedia.co.jp/aiplus/article/2605/29/2000000037/,"Fri, 29 May 2026 13:12:36 +0900",米OpenAIは、日本政府とサイバーセキュリティで協力する取り組み「日本サイバー・アクションプラン」を発表した。まずは、金融機関にサイバーセキュリティに特化した最新AIモデル「GPT-5.5-Cyber」を提供する。,2026-05-31
dc89a47b04a6f6e69e15a40e929c9871,ITmedia_AI_Plus,クラウド依存、コストの課題を解消？　MicrosoftのローカルAI基盤「Foundry Local」,https://atmarkit.itmedia.co.jp/ait/articles/2605/29/news075.html,"Fri, 29 May 2026 11:30:00 +0900",Microsoftは、開発者がアプリケーションにAI機能を組み込めるローカルAI実行基盤「Foundry Local」の一般提供を開始した。ユーザーの端末上でAI処理を完結させる仕組みにより、クラウドへの依存やネットワーク遅延、トークン課金が発生しないAI実装が可能になるという。,2026-05-31
7066c2131c178fc43257ca525ab6c0c6,ITmedia_AI_Plus,それで、メモリ不足はいつまで続くの？　なかなか終わらない狂騒のウラ側,https://www.itmedia.co.jp/news/articles/2605/29/news041.html,"Fri, 29 May 2026 10:00:00 +0900",長引くメモリ不足。いつ安く購入できるようになるのか……。,2026-05-31
9aef7ff2ccd69ff878b64d2d0257e02d,ITmedia_AI_Plus,「Mythos級モデル」一般提供、数週間以内に　米Anthropic「Opus 4.8」リリース,https://www.itmedia.co.jp/news/articles/2605/29/news084.html,"Fri, 29 May 2026 09:55:00 +0900",より強力な安全策を講じた上で、数週間以内に全顧客に提供するとの見通しだという。,2026-05-31
a77b70245ef859a4a6c4f50298bdf933,ITmedia_AI_Plus,AI-CAEで風荷重評価を効率化、大林組がRICOS製ソリューションで検証,https://monoist.itmedia.co.jp/mn/articles/2605/29/news025.html,"Fri, 29 May 2026 09:00:00 +0900",RICOSは、大林組が建物の風荷重予測に向けたAI-CAEソリューションの検証を開始したと発表した。AIが風向や建物形状などの条件を踏まえて予測し、設計工程の効率化を図る。,2026-05-31
5a6705922ac6f6ee5042b27456bd2f68,ITmedia_AI_Plus,富士通がOpenAI、Anthropicと相次ぎ提携　AIベンダーと組む狙いは？,https://www.itmedia.co.jp/enterprise/articles/2605/29/news067.html,"Fri, 29 May 2026 08:00:00 +0900",富士通はOpenAIとAnthropicとの提携を同じ日に発表した。自社独自のAI技術を持つ同社は、AIベンダーとの提携によって何を狙うのか。,2026-05-31
136069acf035222c8f364010e2d695fa,ITmedia_AI_Plus,データ分析の「分からない」「準備が面倒」を解消　ソニーの「初心者」特化ツール、記者が使ってみた【レポート】,https://www.itmedia.co.jp/business/articles/2605/29/news039.html,"Fri, 29 May 2026 08:00:00 +0900",自業務の成果を高めるために、データを分析したいけれど、何から始めればいいのか分からない──と悩むビジネスパーソンは少なくない。ソニーネットワークコミュニケーションズは、こうした初心者向けのニーズに着目した。データ分析業務の初心者である筆者が体験してみたところ……。,2026-05-31
734a2e613aef1166ff0f50254e57747e,ITmedia_AI_Plus,「日本は製造業のパワーハウス」、IFSが産業AI投資を急拡大する理由,https://monoist.itmedia.co.jp/mn/articles/2605/29/news054.html,"Fri, 29 May 2026 07:30:00 +0900",IFSジャパンは記者会見を開催し、日本市場への投資継続とパートナーシップ強化の方針を説明した。日本IBMらとの戦略的協業を通じ、製造業などアセット集約型産業のAI実装とDXを支援する。,2026-05-31
ef613eb603a714668432e394431ec588,ITmedia_AI_Plus,「Google Antigravity 2.0と戯れながら感じたこと」と「LLM Wikiを実践して『ロケスマペディア』を作ってみた」,https://atmarkit.itmedia.co.jp/ait/articles/2605/29/news012.html,"Fri, 29 May 2026 05:00:00 +0900",かわさきからは「Google Antigravity 2.0と戯れながら感じたこと」というタイトルで生成AI時代における教科書的コンテンツの存在意義と、AIにコードを書かせる時代の学び方について、一色からは「LLM Wikiを実践して『ロケスマペディア』を作ってみた」というタイトルで、自身で執筆した記事のコンセプトを実務に落とし込んだ社内知識ベースの実践と運用課題について書きました。,2026-05-31
20bcad2cb7444640209192ba76c0a037,ITmedia_AI_Plus,「国産人型ロボ」量産化へ　東大発スタートアップ　三菱自動車も出資,https://www.itmedia.co.jp/aiplus/article/2605/29/2000000035/,"Fri, 29 May 2026 03:22:50 +0900",東京大学発のロボット開発スタートアップHighlandersは、国産人型ロボットの量産化を目指す取り組みを始めると発表した。,2026-05-31
73abb1b054a0ab026959eae32a1aa57e,ITmedia_AI_Plus,デジタル庁、AI「源内」向け国産LLM再公募　有償の政府調達へ　評価テストは50問→300問に,https://www.itmedia.co.jp/aiplus/article/2605/29/2000000036/,"Fri, 29 May 2026 02:54:00 +0900",初回公募は無償試用を前提に募集したが、27年度向け公募では政府調達（有償）に移行する。,2026-05-31
e00c41556a17110275ffa7730263f285,ITmedia_AI_Plus,Anthropic、Claude Opus 4.8を一般提供　誠実さが飛躍的に向上、Mythosに並ぶアライメント性能を実現,https://www.itmedia.co.jp/aiplus/article/2605/29/2000000034/,"Fri, 29 May 2026 01:16:01 +0900",Anthropicは、AIモデルの最新版「Claude Opus 4.8」の一般提供を開始した。前世代から推論やコーディング能力を向上させ、自らの作業の不確実性に対する「誠実さ」が劇的に改善した。また、数百のサブエージェントを並行して走らせる新機能「dynamic workflows」も追加されている。,2026-05-31
ece5e5cc9f377607c921c95e7b8ce64f,Hatena_IT,若い女の子の漫画を全ておじさんに変換するAIがほしい,https://anond.hatelabo.jp/20260531120158,,若い女の子におじさんの趣味をやらせてる漫画、あるじゃないですか！？ あれ、現実逃避だと思うんです！ ちゃんとおじさんがわちゃわちゃしてる漫画にするべきなんです！ ガワを女の子にすればいいって思ってる人、多すぎ！ そんなことでこっちが騙されると思うなよっ！ 舐めんな！ 酒好きの女の子たちなんていねーよ！ ...,2026-05-31
b97ff427034b58614f4437c99295a772,Hatena_IT,VR上でも“触感”を再現　光で硬さを自在に変えられる新素材、「NHK技研公開」で展示中,https://www.itmedia.co.jp/news/articles/2605/30/news029.html,,NHK放送技術研究所（以下、NHK技研）は、技術展示イベント「技研公開2026」（5月28日～31日）で、光を当てると硬さが変わる材料を使った触感提示デバイスの研究成果を展示している。VRなどの没入型メディアで、物体の質感や手触りをよりリアルに伝えることを狙う。 展示の中心は、NHK技研が開発した「光応答性ポリマー」...,2026-05-31
8e9a1eeca7f0d388329a32dfeaf4393f,Hatena_IT,Wi-Fiが遅くなる問題、Windowsの「ある標準機能」をオフにしたら一発解決した（ライフハッカー・ジャパン） - Yahoo!ニュース,https://news.yahoo.co.jp/articles/d56df223c66951380eed2c1fadf5fb75b82d8287,,2週間ほど前から、特に仕事が立て込んでいるタイミングに限って、インターネットの速度が落ちる現象に悩まされていました。 1週間ほど調査を続けた結果、私のPCに搭載されている「配信の最適化」という機能がこのトラブルを引き起こしていることが分かりました。 今回は、なぜこの機能が問題だったのか、そしてどのよう...,2026-05-31
034c483400d8c774a247c8d38b41f13f,Hatena_IT,Zero Trust for AI agents | Claude,https://claude.com/blog/zero-trust-for-ai-agents,,"Frontier AI models are compressing the timeline between vulnerability and exploit from months to hours. Defenders who adopt these tools find and fix bugs faster; attackers who adopt them, or who simpl...",2026-05-31
a8b81968a5e1c18cb92d753b9fee9446,Hatena_IT,Claude Codeをはじめて触るエンジニアのためのざっくり入門,https://zenn.dev/stafes_blog/articles/nano72mkn-claude-code-intro,,どうも、nano72mknです。 Claude Code使ってますか？ 一年ぶりに復帰した同僚に向けてClaude Codeとは何ぞやというのを簡単にまとめてみたいと思います。 ちょうど一年前くらいから一気に盛り上がってきてましたよね...AIの進化は早いもので、少し休んでたら浦島太郎になっちゃいますね。 自分もまだまだ使いこなせてい...,2026-05-31
120292db7db13f02197462f0cc44170d,Hatena_IT,マジで便利な折りたたみキーボード、安い、軽い、なのにタッチパッド搭載？本当に？ (1/5),https://ascii.jp/elem/000/004/404/4404595/,,『私的My推しガジェット』 はアスキーの各編集者が個人的に推しなガジェットを紹介していくレビュー企画です。 スマホで長文を打ったり、複雑なパスワードを入力したりする、あのわずらわしさ。いっそのことキーボードで入力しちゃえばいいのでは？と、常々思っていました。 そんな時に見つけましたよ、そんな悩みを解決...,2026-05-31
09693f50ff2122f7566e6238831c9cc9,Hatena_IT,私の最強のMac開発環境 2026: Nixとmiseで育てる🐱 - Qiita,https://qiita.com/tyPhoon/items/f1855ff508f4268df5b5,,要約 2026年5月時点で運用している、Mac向けの開発環境をスナップショットとして紹介します 環境の土台はNix、GUIアプリはHomebrew、プロジェクトごとの開発者ツールはmiseで分担しています ツール単体の良さだけでなく、どう組み合わせて日々の開発効率を上げているかまでまとめます はじめに 開発環境は、気が付くと少...,2026-05-31
