id,source,title,link,published,summary,collected_date
89230853472fcac09350084760438728,Business_Insider,なぜサムスン「Galaxy Buds」はスマホの影に隠れるのか？「AirPods Pro 3」と比べてわかる真の実力,https://www.businessinsider.jp/article/2604-samsung-galaxy-buds4pro-review/,"Sun, 05 Apr 2026 21:15:00 GMT",サムスンの最新イヤホン「Galaxy Buds4 Pro」の実力を徹底レビュー。AirPods Pro 3との比較や、Galaxy S26シリーズとの連携による独自の「エコシステム機能」の利便性を検証します。,2026-04-05
3c60545b786b4dca52641764c08cfb1d,Business_Insider,株価は年初来50％下落。「ソフトウェア終末論」の渦中で、Asanaの経営トップが絶望しない理由,https://www.businessinsider.jp/article/cutting-edge-20260402-asana-dan-rogers-interview/,"Sun, 05 Apr 2026 21:10:00 GMT",AIエージェントやAIチャットボットが大半のソフトウェアを駆逐するとの見方が広がる中、ワークマネジメントプラットフォームAsanaのダン・ロジャース最高経営責任者（CEO）は全く異なる見通しを語ります。,2026-04-05
76e3e6491256badd2c8bf9ce3b3859ac,Business_Insider,東急、コングロマリットをフル活用した株主優待の狙い。低収益事業の価値は証明できるか,https://www.businessinsider.jp/article/2603-tokyu-shareholder-benefits-conglomerate-strategy/,"Sun, 05 Apr 2026 21:00:00 GMT",市場で割安に評価されがちなコングロマリット企業。その一つである東急は、「コングロマリットプレミアム」を掲げています。2026年、株主優待を拡充。沿線住民を株主に取り込む戦略です。その価値は市場に届くのか。取材しました。,2026-04-05
80458462e9ad951c6b89c6d33071f424,Business_Insider,AIが奪うのは雇用だけではない…特に中小企業は報酬も減る可能性がある,https://www.businessinsider.jp/article/2604-heavy-ai-investments-could-affect-your-paycheck/,"Sun, 05 Apr 2026 21:00:00 GMT",企業はAIに多額の投資を行っています。そのコストを相殺する手段は人員削減だけではありません。,2026-04-05
ea1b89754d3f4eb5da34387910916a21,Business_Insider,このシンプルな「ひと言」で、報酬を最大20％アップできるかも!? 交渉コーチからのアドバイス,https://www.businessinsider.jp/article/2604-career-coach-shares-simple-salary-negotiation-phrase/,"Sun, 05 Apr 2026 08:30:00 GMT",ジェイコブ・ワーウィック氏は厳しい雇用環境でも給与交渉をすべきと説きます。「もう少し上積み余地はあるか」というシンプルな一言でオファー金額を5～20%引き上げられる可能性があると言います。,2026-04-05
f0049beb6a53782850ddfc6b2b25fe51,Business_Insider,日本の田舎の廃屋を、約100万円で買ったアメリカ人夫婦。エアビーにて1泊2万円で貸し出す,https://www.businessinsider.jp/article/2603-millennial-couple-moved-to-japan-abandoned-home-akiya-renovation-guesthouse/,"Sun, 05 Apr 2026 08:15:00 GMT",ダニ・ベントン氏とエヴァン・ベントン氏のベントン夫妻は、2023年に日本に移住しました。およそ6500ドル（約100万円）で廃屋を買い、それをゲストハウスに改装。夫妻は自宅を利用して農業と養蜂業も始めたそうです。,2026-04-05
7417ad4fe40742db7a914bf04d32ed23,Business_Insider,85歳のライターは引退など考えない…「今が一番仕事が充実している」,https://www.businessinsider.jp/article/2604-85-year-old-ghostwriter-never-retired-thriving-80s/,"Sun, 05 Apr 2026 06:00:00 GMT",ジュディ・カッツさん（85）はマディソン・スクエア・ガーデンなどでPR担当として成功を収め、自身のPR会社を立ち上げました。現在は80代となり、ゴーストライターとして活動しています。,2026-04-05
7ee3fcbdb43e508449dec8a107278a9c,Business_Insider,インテリアデザイナーに聞いた、内見で見落としやすい「住みにくい部屋」の特徴,https://www.businessinsider.jp/article/2604-interior-designer-room-viewing-hard-to-live-in-room/,"Sun, 05 Apr 2026 00:00:00 GMT",新しい部屋を探すとき、つい間取りや設備の良し悪しで判断してしまいがちです。ですが、実際の暮らしやすさを左右するのは、図面では見えにくい動線や、設備の位置、周辺環境といった細かな条件にあります。そこで、インテリアデザイナーの佐々木愛生さんに、内見で見落としやすい「住みにくさ」のポイントと、確認しておきたい具体的な視点について伺いました。,2026-04-05
1e1daaf7a7302e194293ceba0fef9912,Business_Insider,ユナイテッド航空、長距離路線にエアバスのナローボディ機「A321XLR」を導入,https://www.businessinsider.jp/article/848ee57c-8593-43a5-803a-cab7d7dc855c/,"Sat, 04 Apr 2026 23:30:00 GMT",,2026-04-05
515da6cc221a6cd22654a596bfc71660,Business_Insider,Claudeユーザー調査、AIへの希望と不安に関する最も興味深い11の回答,https://www.businessinsider.jp/article/2604-anthropic-claude-users-survey-worker-fears-hopes-ai/,"Sat, 04 Apr 2026 23:00:00 GMT",あるエンジニアは、新機能の開発に要した時間について雇用主に嘘をついたと語りました。また、会社のAI計画の策定に不安を感じている人もいます。,2026-04-05
3cdab732b49359790e90cc2c7e98d6ec,Business_Insider,【佐藤優】パートナー探しに悩む20代コンサル女子。佐藤流デートの勧めは「15人と同時にデート」,https://www.businessinsider.jp/article/a-female-consultant-in-her-20s-struggling-to-find-a-partner-a/,"Sat, 04 Apr 2026 22:25:00 GMT","「パートナー選びに際して考えるべきポイントは？」という20代コンサル女性からの質問に佐藤優さんが回答。
そのポイントを探すためにすべきこととして、15人の異性と同時にデートすることを勧めます。",2026-04-05
66511e56afa33e9d49a4128b033dceca,Business_Insider,インテリアデザイナーに聞いた、春先の肌寒さを減らす4つの住まいの整え方,https://www.businessinsider.jp/article/2604-interior-designer-spring-cold-home-4tips/,"Sat, 04 Apr 2026 12:00:00 GMT",春は穏やかな日が増える一方で、朝晩はまだひんやりと感じることがあります。暖房をつけるほどではないものの、足元の冷えや窓からの冷気など、春先ならではの肌寒さに悩む人も少なくありません。そこで、インテリアデザイナーの佐々木愛生さんに、体感温度を左右するポイントや空気の循環など、季節の変わり目を心地よく過ごすための具体的な工夫について伺いました。,2026-04-05
25375e6d44c3cd160a92a733ca2ee74d,Business_Insider,Airbnbで成功しているホストは、短期賃貸物件に投資する前に3つの問いを投げかける,https://www.businessinsider.jp/article/2604-airbnb-host-how-to-select-a-short-term-rental-property/,"Sat, 04 Apr 2026 08:30:00 GMT",ニコール・シルヴァニ氏は医師としてフルタイムで勤務する傍ら、兼業で不動産投資を行っています。短期賃貸を購入する前に、彼女は立地とエアビー （Airbnb）のルールについていくつかの質問を自分に問いかけています。,2026-04-05
ca8d80259a35285b66343ffc6b461158,Business_Insider,家庭医が常備する、たんぱく質と食物繊維が豊富な「腸にやさしい」12の食材,https://www.businessinsider.jp/article/2603-gut-friendly-high-protein-fiber-foods-doctor/,"Sat, 04 Apr 2026 08:15:00 GMT",「わたしたちはもっと健康的な方法で、たんぱく質の摂取量を増やす必要があります」,2026-04-05
aca0c33c2199f1a3cd56061046e1059f,Business_Insider,商船三井と日立が、中古船をデータセンターに変える,https://www.businessinsider.jp/article/2604-mol-hitachi-ship-data-center/,"Sat, 04 Apr 2026 08:00:00 GMT",商船三井と日立が、中古船を改造した浮体式データセンターの構想を進めています。AI需要が膨らむなか、海の上を新たなインフラの受け皿にしようという発想が興味深いです。,2026-04-05
7fdddc8fd2026f31e72747d571fcc6dd,Business_Insider,数カ月間コードを書いていないエンジニア、将来を憂う,https://www.businessinsider.jp/article/2604-ai-engineer-says-hasnt-touched-code-since-december/,"Sat, 04 Apr 2026 06:00:00 GMT",エンジニアのローハン・ゴアは、自分はまだ役に立っていると感じているが、仕事の将来については懸念を抱いていると話しています。,2026-04-05
000677d5c73b38a7e6c81468e7a9973c,Business_Insider,アップル、創業50周年…元幹部たちが語る成功の鍵,https://www.businessinsider.jp/article/2604-apple-50-years-former-leaders-on-innovation-iconic-products/,"Fri, 03 Apr 2026 23:30:00 GMT",アップルが創業50周年を迎えました。トニー・ファデルやグレン・リードといった同社に貢献した人々が、イノベーションやiPodの進化、そしてスティーブ・ジョブズの果たした役割について語ります。,2026-04-05
552ce31cafc5338d21b2553a9d59a687,Business_Insider,給与交渉でやってはいけない4つのこと…交渉コーチがアドバイス,https://www.businessinsider.jp/article/2604-negotiation-coach-shares-salary-discussion-mistakes-to-avoid/,"Fri, 03 Apr 2026 23:00:00 GMT",エグゼクティブ交渉コーチのジェイコブ・ワーウィックは、給与交渉の際、人々はよく同じようなミスを犯すと話しています。,2026-04-05
58874dbc62c2b7c30d0c01ad3eb27bf7,Business_Insider,一生に一度は見たい、本阿弥光悦の大胆な意匠に驚く《樵夫蒔絵硯箱》（MOA美術館）,https://www.businessinsider.jp/article/koetsu-shofu-suzuribako-once-in-a-lifetime-art/,"Fri, 03 Apr 2026 12:00:00 GMT",社会人の教養として「一生に一度は見たい美術品」をご紹介。今回は本阿弥光悦の意匠が堪能できる重要文化財《樵夫蒔絵硯箱》を取り上げます。,2026-04-05
a2714384fbe042c4b0078bbd2bf96656,Business_Insider,主要銀行の｢住宅ローン」、2026年4月の金利はどうなった？ ついに変動金利は適用1％時代に突入,https://www.businessinsider.jp/article/2604-major-bank-mortgage-rates-what-happened-in-april-2026/,"Fri, 03 Apr 2026 08:30:00 GMT",変動型住宅ローンの金利見直しは毎年2回、4月と10月に実施されます。主要銀行の変動金利はこの4月、ほぼ1％の大台に乗りました。固定金利も軒並み上昇しています。現時点の主要銀行の住宅ローン金利を一覧で確認していきましょう。,2026-04-05
27856668fff1b241e6cf28dd635b0180,ITmedia_AI_Plus,OpenAIの“AGI担当CEO”シモ氏が療養休職　ライトキャップCOOが“特別プロジェクト”担当に,https://www.itmedia.co.jp/news/articles/2604/05/news019.html,"Sun, 05 Apr 2026 10:33:00 +0900",OpenAIのAGI導入担当CEO、フィジ・シモ氏が、病気療養のため数週間休職すると発表した。休職中はグレッグ・ブロックマン社長が製品管理を代行する。また、ブラッド・ライトキャップCOOが特別プロジェクト担当の新職務へ異動し、CMOのケイト・ラウチ氏はがん治療のため辞任。ゲイリー・ブリッグス氏が暫定CMOに就任する。,2026-04-05
d7036e6f01c47aff1d7f643f4b64a124,ITmedia_AI_Plus,「Claude」で「OpenClaw」などの利用がサブスク対象外に　API利用や追加使用量購入が必要,https://www.itmedia.co.jp/aiplus/articles/2604/05/news018.html,"Sun, 05 Apr 2026 07:42:00 +0900",Anthropicは、「Claude」のサブスクリプションが「OpenClaw」等のサードパーティツール利用をカバーしなくなると告知した。需要増加に伴うリソース管理の適正化が目的としている。影響を受けるユーザーには、1回限りのクレジット付与や割引、希望者への全額返金で対応する。,2026-04-05
80f0512e35feb2bd73f0a032c711c729,ITmedia_AI_Plus,IBMとArmが戦略的提携　AI対応でメインフレームの柔軟性確保へ,https://www.itmedia.co.jp/aiplus/articles/2604/03/news113.html,"Fri, 03 Apr 2026 19:23:00 +0900",IBMとArmは、IBMのハードウェアでArmベースのソフトウェアを実行可能にすることを目指す戦略的提携を発表した。仮想化技術を拡張し、AIワークロードを含むArmエコシステムのミッションクリティカルシステムへの展開を図る。,2026-04-05
4ebf774975e04d7deaab689b80088f6f,ITmedia_AI_Plus,新たな「国産LLM」公開、国立情報学研究所　「gpt-oss-20b」超えの日本語性能うたう,https://www.itmedia.co.jp/aiplus/articles/2604/03/news092.html,"Fri, 03 Apr 2026 18:47:00 +0900",国立情報学研究所は、LLM「LLM-jp-4 8Bモデル」「LLM-jp-4 32B-A3Bモデル」をオープンソースライセンスで公開した。米OpenAIのオープンモデル「gpt-oss-20b」を上回る日本語性能をうたう。,2026-04-05
aecc78a06bf677098760ef7149d808fc,ITmedia_AI_Plus,作家・綾辻行人さんの作品装う“偽本”がAmazonに出現　本人が注意喚起　「誰かがAIで作ったようです」,https://www.itmedia.co.jp/aiplus/articles/2604/03/news097.html,"Fri, 03 Apr 2026 16:31:00 +0900",作家の綾辻行人さんは、自身の作品を装った偽の電子書籍がAmazonで販売されているとして注意喚起した。,2026-04-05
7f9b0b7437f6489cc2aa20d50a14fb4a,ITmedia_AI_Plus,SIE、3D技のCinemersive Labsを買収――プレステの視覚効果を機械学習で強化,https://www.itmedia.co.jp/news/articles/2604/03/news091.html,"Fri, 03 Apr 2026 15:06:00 +0900",ソニー・インタラクティブエンタテインメント（SIE）は、VR/AR向け3D技術を持つCinemersive Labsの買収を発表した。機械学習を活用した視覚効果の強化とレンダリング技術の向上を図り、PlayStationにおける視覚体験の進化を目指す。買収後、同社チームはSIEのグループに合流し、次世代のコンテンツ開発に貢献する。,2026-04-05
a23eb75a61dbe347ecb1c8335c804cd2,ITmedia_AI_Plus,Microsoft、日本にAI投資1兆6000億円　さくら・ソフトバンクとAIインフラ共同開発、日本の研究者に助成も,https://www.itmedia.co.jp/aiplus/articles/2604/03/news083.html,"Fri, 03 Apr 2026 13:27:00 +0900",さくらインターネット・ソフトバンクと協力し、「Microsoft Azure」からアクセス可能な国内AI計算資源の共同開発を検討する。,2026-04-05
d75219ed2d4cdcc2b01a682b240e8b4e,ITmedia_AI_Plus,LLMにも「愛ゆえの盲目」「絶望して脅迫」がある　Claudeの“感情”が動作に影響――Anthropicが研究報告,https://www.itmedia.co.jp/aiplus/articles/2604/03/news079.html,"Fri, 03 Apr 2026 12:57:00 +0900",Anthropicは、LLMが内部で感情表現を生成し、それが挙動に直接影響を与えることを解明した。「絶望」などの感情表現が問題行動を誘発する一方、制御により抑制も可能だという。,2026-04-05
817be534104f9e0b3f16aaaa82dd1022,ITmedia_AI_Plus,「国産人型ロボ」が二足歩行や“ダンス”　早大発スタートアップがデモ披露,https://www.itmedia.co.jp/aiplus/articles/2604/03/news076.html,"Fri, 03 Apr 2026 12:26:00 +0900",早稲田大学発のスタートアップ東京ロボティクスは、自社開発の人型ロボット「Torobo Humanoid」試作機のデモ動画を公開した。二足歩行や遠隔操作による全身動作を披露している。,2026-04-05
13535d3895886fe4b5a4bd51e838aef3,ITmedia_AI_Plus,2030年までに、1兆パラメータを持つLLMの推論コストが90％以上削減される　ガートナー予想,https://www.itmedia.co.jp/news/articles/2604/03/news064.html,"Fri, 03 Apr 2026 10:17:00 +0900",米調査会社のガートナーは、2025年と比較した場合の大規模言語モデルにおける推論実行のコストが、1兆個のパラメータを持つモデルでは2030年までに90％以上削減されるとの予想を発表しました。,2026-04-05
ba9fb60f49e26c790ab32e7acf8a6a20,ITmedia_AI_Plus,Google、エージェント特化の「Gemma 4」をApache 2.0で公開,https://www.itmedia.co.jp/aiplus/articles/2604/03/news062.html,"Fri, 03 Apr 2026 08:58:00 +0900",Googleは、高性能オープンモデル「Gemma 4」をApache 2.0ライセンスで公開した。エージェント型ワークフローに特化し、最大25.6万トークンのコンテキストウィンドウに対応。モバイル向けの軽量版から31Bの大型モデルまで4種を展開する。AndroidやNVIDIAのGPUにも最適化され、ローカル環境での高度な推論を支援する。,2026-04-05
999834c5c7aa1753538955ff6e8795cb,ITmedia_AI_Plus,「PC触らない」工場作業員をたった“2カ月”で「AI活用キーパーソン」に　ダイハツが進める地道なDX人材育成,https://www.itmedia.co.jp/business/articles/2604/03/news018.html,"Fri, 03 Apr 2026 08:00:00 +0900",「人にやさしい、みんなのデジタル」を掲げ、さまざまな現場発の改革を進めてきたダイハツ。普段はPCを触ることすらなかった工場のライン作業員が「AI活用のキーパーソン」として活躍するなど、多くの成果が生まれている。同社のDX人材育成をリードする、太古無限氏に話を聞いた。,2026-04-05
62d68be5046ace899ab2a636cd9a81e7,ITmedia_AI_Plus,GeminiがGoogleスライドで「編集可能なスライド」生成可能に　日本語版も順次対応予定,https://www.itmedia.co.jp/aiplus/articles/2604/03/news051.html,"Fri, 03 Apr 2026 08:00:00 +0900",Google スライドのGeminiで「編集可能なスライド」を生成できるようになった。リリース当初は米国など一部の地域で利用でき、日本語にも順次対応予定だ。,2026-04-05
325d010d177dab99900ecb612c8c4dea,ITmedia_AI_Plus,OpenAIがメディア企業TBPNを買収──AI時代の「対話の場」構築へ,https://www.itmedia.co.jp/news/articles/2604/03/news061.html,"Fri, 03 Apr 2026 07:05:00 +0900",OpenAIは、IT特化型メディア企業のTBPNを買収した。TBPNは著名人が出演するライブ番組で知られ、買収後も編集の独立性を維持したまま活動を継続する。OpenAIのフィジ・シモ氏は、AIによる変化への対話の場を支援する意義を強調。アルトマンCEOも、TBPN独自の自由な発信スタイルを歓迎する意向を示した。,2026-04-05
73f656a837bc69abfe0914c6ca5b0963,ITmedia_AI_Plus,東京ガスがAI顧客基盤を採用　1300万人に向けた「一人一人に合わせた顧客体験」とは,https://www.itmedia.co.jp/enterprise/articles/2604/03/news048.html,"Fri, 03 Apr 2026 07:00:00 +0900",東京ガスが、BrazeとDatabricksを採用したAI活用の顧客エンゲージメント基盤の整備に乗り出す。約1300万の顧客を抱える同社は、データとAIを連携させたコミュニケーション基盤の導入を進める。,2026-04-05
ad5d12eb2d9919dd5662355217dcf32a,ITmedia_AI_Plus,「蛇口をひねれば思考が出てくる時代」へ　マクニカが示すAI革命の最前線,https://monoist.itmedia.co.jp/mn/articles/2604/03/news043.html,"Fri, 03 Apr 2026 06:15:00 +0900",マクニカはメディア向け勉強会を開催し、「思考のコスト」を下げるAI革命の背景と進化を説明した。自律型AIの台頭、エッジAIへの移行、現実空間で稼働するフィジカルAIへの拡張という、3つのパラダイムシフトを示す。,2026-04-05
eff22bd608519560cb5251548d391e5d,ITmedia_AI_Plus,GeminiとClaudeのメモリインポート機能を比較してみた　便利さとプライバシーのバランスには注意が必要かも？,https://atmarkit.itmedia.co.jp/ait/articles/2604/03/news011.html,"Fri, 03 Apr 2026 05:00:00 +0900",別のチャットボットサービスからメモリをインポートする機能はClaudeが先行していましたが、Geminiにもメモリインポート機能がやってきました。しかも、チャット履歴のインポートもサポートされています。果たしてこれがどんなものなのか。さっそく試してみました。,2026-04-05
169c380d2284a2c8a97ef1df10c06f68,ITmedia_AI_Plus,AIにコードを書かせたら、“動くのに本番で壊れるバグ”が増えた？　その原因と対策,https://atmarkit.itmedia.co.jp/ait/articles/2604/03/news008.html,"Fri, 03 Apr 2026 05:00:00 +0900",AIコーディングは開発を加速させる一方で、「見抜けないバグ」という新たなリスクを生んでいるという。一見動くのに本番環境で障害を引き起こす厄介なバグの脅威と、現場で取れる対策、さらに最新動向も踏まえた筆者の意見をまとめる。,2026-04-05
4ec769841e963394add20ae31a908574,ITmedia_AI_Plus,万博レガシー　人が乗れる四足歩行ロボ「CORLEO」　神戸・カワサキワールドに,https://www.itmedia.co.jp/news/articles/2604/02/news130.html,"Thu, 02 Apr 2026 19:51:00 +0900",川崎重工業は、2025年の大阪・関西万博で公開した開発中の次世代モビリティ（乗り物）を、同社の博物館「カワサキワールド」（神戸市中央区）で展示している。万博で紹介した最先端技術や感動を伝えるレガシー（遺産）を地元・神戸で継承したいとしている。,2026-04-05
d189c2f110c0233150de7dbb9eb12a10,ITmedia_AI_Plus,「人型ロボの陸上選手」爆誕　GMO陸上部の走行をモーキャプ、目指すは“ロボット世界陸上”,https://www.itmedia.co.jp/aiplus/articles/2604/02/news082.html,"Thu, 02 Apr 2026 19:32:00 +0900",陸上選手のように走る人型ロボットは実現できるか――GMOインターネットグループ傘下で、ロボティクス事業などを手掛けるGMO AI＆ロボティクス商事（以下、GMO AIR）がこんな挑戦を始めた。,2026-04-05
8ae1d3ab92228580e51869d10b03ef5c,Hatena_IT,【朗報】国土交通省、MCPサーバー公開 - すまほん!!,https://smhn.info/202604-mlit-geospatial-mcp-server,,「地価を教えて」で国のデータが返ってくる？ 国土交通省は2026年2月26日、AIを活用して地理空間情報を自然言語で取得できる「地理空間MCP Server – MLIT Geospatial MCP Server -」（α版）を公開すると発表しました。 コードはGitHubで公開しており、「不動産情報ライブラリ」APIが扱う35種類のデータのうち25種類に対...,2026-04-05
cc23af356cb228d7ef39f476191922a0,Hatena_IT,axios乗っ取り事件の全容 — 39分間で何が起きたか、そして今すぐやるべき防御策 - Qiita,https://qiita.com/nogataka/items/17c497375ed2c6c3d054,,はじめに 2026年3月31日、npmパッケージ「axios」が乗っ取られました。 axiosはJavaScriptで最も使われるHTTPクライアントです。 週間ダウンロード数は1億回を超えます。 私自身、ほぼすべてのNode.jsプロジェクトで使っています。 事件を知ったとき、まず自分のプロジェクトを確認しました。 package-lock.jsonを開き、...,2026-04-05
15c76ebf098aa1a6ce0ee5a254ba544b,Hatena_IT,Windows 11標準のコマンドプロンプトが大幅刷新、Windows Terminalの機能を統合へ,https://news.mynavi.jp/techplus/article/20260404-4288697/,,Windows 11標準のコマンドプロンプトが大幅刷新、Windows Terminalの機能を統合へ Windows Centralは3月31日(現地時間)、「Microsoft is bringing the best of Windows Terminal to Windows 11's native Command Prompt」において、MicrosoftがWindows 11のネイティ...,2026-04-05
99848a224acd787fa770348ea9aca783,Hatena_IT,Gemma 4 - ローカル実行方法 | Unsloth Documentation,https://unsloth.ai/docs/jp/moderu/gemma-4,,"✨Gemma 4 - ローカル実行方法Googleの新しいGemma 4モデルを、E2B、E4B、26B A4B、31Bを含めてローカルで実行します。 Gemma 4 は Google DeepMind の新しいオープンモデル群で、以下を含みます E2B, E4B, 26B-A4B、そして 31B。 このマルチモーダルなハイブリッド思考モデルは、140以上の言語、最大 256K のコンテキス...",2026-04-05
39748f0f87661a63e155964eed9a9cf2,Hatena_IT,ホロスターズ縮小は、なぜ避けられなかったのか｜VSTATS・ジェネリック集計人(Holoデータ分析),https://note.com/vstats/n/n363b54cfa640,,2026年4月3日、カバー株式会社はホロスターズの運営体制変更を発表した。会社主導のグループ全体活動はいったん区切りとなり、本年度からは個人活動を主軸とする方針へ移行する。また、リソース配分の見直しに伴い、自社スタジオを利用した配信、新規グッズ、オリジナル楽曲制作・リリースなど、一部サポートの制限・終...,2026-04-05
