id,source,title,link,published,summary,collected_date
11ae4f13d28317743a9915de4a548317,GCP_Blog,Guidance from the Frontlines: Proactive Defense Against ShinyHunters-Branded Data Theft Targeting SaaS,https://cloud.google.com/blog/topics/threat-intelligence/defense-against-shinyhunters-cybercrime-saas/,"Fri, 30 Jan 2026 14:00:00 +0000","Introduction
Mandiant is tracking a significant expansion and escalation in the operations of threat clusters associated with ShinyHunters-branded extortion. As detailed in our companion report, 'Vish...",2026-02-03
f3eb6c8517579b8b8f63932c448bf908,GCP_Blog,Vishing for Access: Tracking the Expansion of ShinyHunters-Branded SaaS Data Theft,https://cloud.google.com/blog/topics/threat-intelligence/expansion-shinyhunters-saas-data-theft/,"Fri, 30 Jan 2026 14:00:00 +0000","Introduction 
Mandiant has identified an expansion in threat activity that uses tactics, techniques, and procedures (TTPs) consistent with prior ShinyHunters-branded extortion operations. These operat...",2026-02-03
1eafc7f6211c300c075230ea48aca667,GCP_Blog,Introducing Conversational Analytics in BigQuery,https://cloud.google.com/blog/products/data-analytics/introducing-conversational-analytics-in-bigquery/,"Thu, 29 Jan 2026 17:00:00 +0000","Businesses want to move quickly and make informed decisions, but the explosion of data in today’s organizations often can leave knowledge teams buried and business users waiting in lengthy queues for ...",2026-02-03
40437abe16e2e0716424f7b8773e9509,GCP_Blog,What’s new with Google Data Cloud,https://cloud.google.com/blog/products/data-analytics/whats-new-with-google-data-cloud/,"Thu, 29 Jan 2026 17:00:00 +0000","January 26 - January 30

We introduced Conversational Analytics in BigQuery, which allows users to analyze data using natural language. Conversational Analytics in BigQuery is an intelligent agent tha...",2026-02-03
fd5aecc90ffd957c0dae09481e18b11e,GCP_Blog,Introducing Google Cloud Vertex AI Extensions for .NET,https://cloud.google.com/blog/topics/developers-practitioners/introducing-google-cloud-vertex-ai-extensions-for-net/,"Thu, 29 Jan 2026 15:38:00 +0000","In October 2024, Microsoft announced the Microsoft.Extensions.AI.Abstractions and Microsoft.Extensions.AI libraries for .NET. These libraries provide the .NET ecosystem with essential abstractions for...",2026-02-03
d1eed5e21f35658d58063867a30fc4b4,GCP_Blog,BigQuery AI Hackathon: Celebrating Innovation and a Look at What's New,https://cloud.google.com/blog/topics/developers-practitioners/bigquery-ai-hackathon-celebrating-innovation-and-a-look-at-whats-new/,"Thu, 29 Jan 2026 09:12:00 +0000","
    aside_block
    &lt;ListValue: [StructValue([(&#x27;title&#x27;, &#x27;DISCLAIMER&#x27;), (&#x27;body&#x27;, &lt;wagtail.rich_text.RichText object at 0x7f5fe0556940&gt;), (&#x27;btn_text&#x27;, &...",2026-02-03
6afcc158cccb9e24f9fabaa8366ef2fb,GCP_Blog,Accelerate GKE cluster autoscaling with faster concurrent node pool auto-creation,https://cloud.google.com/blog/products/containers-kubernetes/faster-gke-node-pool-auto-creation/,"Wed, 28 Jan 2026 17:00:00 +0000","We're excited to announce concurrency in Google Kubernetes Engine (GKE) node pool auto-creation, to significantly reduce provisioning latency and autoscaling performance. Internal benchmarks show up t...",2026-02-03
7e61870c9a5fbc506f7149e733fa76d4,GCP_Blog,"Spanner in 2025: Innovations powering intelligent, multi-model AI applications",https://cloud.google.com/blog/products/databases/spanner-in-2025/,"Wed, 28 Jan 2026 17:00:00 +0000","For over a decade now, Google has relied on Spanner, an always-on, virtually unlimited database to power global-scale applications like Gmail, YouTube, and Google Photos. Today, Spanner handles over 6...",2026-02-03
d907b1585a3daebc3d8f720fef03768a,GCP_Blog,No Place Like Home Network: Disrupting the World's Largest Residential Proxy Network,https://cloud.google.com/blog/topics/threat-intelligence/disrupting-largest-residential-proxy-network/,"Wed, 28 Jan 2026 14:00:00 +0000","Introduction 
This week Google and partners took action to disrupt what we believe is one of the largest residential proxy networks in the world, the IPIDEA proxy network. IPIDEA’s proxy infrastructur...",2026-02-03
253b3b8fd339631bdabbbb19e08af35a,GCP_Blog,Future Mode Part 1: The intelligent and secure browser for enterprises,https://cloud.google.com/blog/products/chrome-enterprise/future-mode-part-1-the-intelligent-and-secure-browser-for-enterprises/,"Wed, 28 Jan 2026 07:49:00 +0000","Editor's Note: Our Future Mode series will give businesses insight into how Chrome Enterprise is approaching AI in the browser. Stay tuned for more blogs in this series.
For the modern enterprise, the...",2026-02-03
16b2f8d30608fdfa856e58d3f35371bb,GCP_Blog,"Unlock 2x better price-performance with Axion-based N4A VMs, now generally available",https://cloud.google.com/blog/products/compute/axion-based-n4a-vms-now-in-preview/,"Tue, 27 Jan 2026 17:00:00 +0000","January 27, 2026: The N4A is now generally available. You can get started by deploying N4A from the Google Cloud console.
Decision makers and builders today face a constant challenge: managing rising ...",2026-02-03
2b90c77dd02c50ef70676e51e66967d0,GCP_Blog,What's new with ML infrastructure for Dataflow,https://cloud.google.com/blog/products/data-analytics/new-dataflow-features-to-enable-streaming-and-ml-workloads/,"Tue, 27 Jan 2026 17:00:00 +0000","The world of artificial intelligence is moving at lightning speed. At Google Cloud, we’re committed to providing best-in-class infrastructure to power your AI and ML workloads. Dataflow is a critical ...",2026-02-03
3077bd964819931473ba0a5a108a9483,GCP_Blog,Diverse Threat Actors Exploiting Critical WinRAR Vulnerability CVE-2025-8088,https://cloud.google.com/blog/topics/threat-intelligence/exploiting-critical-winrar-vulnerability/,"Tue, 27 Jan 2026 14:00:00 +0000","Introduction 
The Google Threat Intelligence Group (GTIG) has identified widespread, active exploitation of the critical vulnerability CVE-2025-8088 in WinRAR, a popular file archiver tool for Windows...",2026-02-03
a4ed5bc4f0ecb531332124ae13a82743,GCP_Blog,Flutter on Cloud Run: Full Stack Dart Architecture,https://cloud.google.com/blog/topics/developers-practitioners/flutter-on-cloud-run-full-stack-dart-architecture/,"Tue, 27 Jan 2026 08:49:00 +0000","Flutter is a framework for building mobile, web, and desktop applications from a single codebase.  The language that powers Flutter, Dart, is a compiled language well-suited for backend development as...",2026-02-03
527417873be9b715e7e8f371095fb76a,GCP_Japan,Community Mobility: Google Maps Platform を活用したサービスで、交通空白解消へ,https://cloud.google.com/blog/ja/products/maps-platform/community-mobility-solving-the-transit-desert-problem-through-google-maps-platform/,"Tue, 03 Feb 2026 01:00:00 +0000",少子高齢化社会の到来は、生活のあらゆる部分に影響を及ぼしています。中でも喫緊の課題とされているのが、地方における交通です。公共性の高い交通サービスの需要が高まる中、逆にドライバー不足が深刻化し、社会生活の維持に支障をきたしつつあります。乗合型オンデマンド交通サービスの運営事業とコンサルティングを手掛ける Community Mobility株式会社（以下、Community Mobility）は、...,2026-02-03
dd874c26fd9b65b3f96c526d77cddc68,GCP_Japan,Google の ADK を使ったエージェント アプリケーションを Datadog LLM Observability でモニタリングする,https://cloud.google.com/blog/ja/products/management-tools/datadog-integrates-agent-development-kit-or-adk/,"Mon, 02 Feb 2026 03:00:00 +0000","※この投稿は米国時間 2026 年 1 月 24 日に、Google Cloud blog に投稿されたものの抄訳です。
Google の Agent Development Kit（ADK）は、強力なエージェント システムを構築するための基盤を提供します。こうした複数ステップのエージェントは、計画を立て、ループ処理を行い、協調し、必要に応じてツールを動的に呼び出しながら、自律的に問題を解決できま...",2026-02-03
303e4ad174feafcf29084a2c66c9ff6b,GCP_Japan,ノードプールの高速な同時自動作成により GKE クラスタの自動スケーリングを加速,https://cloud.google.com/blog/ja/products/containers-kubernetes/faster-gke-node-pool-auto-creation/,"Mon, 02 Feb 2026 02:30:00 +0000","※この投稿は米国時間 2026 年 1 月 29 日に、Google Cloud blog に投稿されたものの抄訳です。
このたび、Google Kubernetes Engine（GKE）におけるノードプールの同時自動作成機能をリリースしました。これにより、プロビジョニングのレイテンシが大幅に減少し、自動スケーリングのパフォーマンスが向上します。社内ベンチマークでは、プロビジョニング速度が最大 ...",2026-02-03
09ac9b88ce6b646f33856c0dfdfcfebf,GCP_Japan,Gemini for Government: 公共部門の次世代のイノベーションを実現,https://cloud.google.com/blog/ja/topics/public-sector/gemini-for-government-unlocking-the-next-wave-of-public-sector-innovation/,"Mon, 02 Feb 2026 02:00:00 +0000",※この投稿は米国時間 2026 年 1 月 27 日に、Google Cloud blog に投稿されたものの抄訳です。インテリジェント エージェントの台頭により、公共部門のイノベーションは新時代を迎えました。この変革期において、AI 搭載エージェントは人間の能力を増幅させ、管理業務に費やされていた時間を解放することで、あらゆる従業員の力を増強します。この新時代に求められるのは、従業員やチームが持...,2026-02-03
222cc7444290b382e743cab1b6e11d8e,GCP_Japan,AuraInspector: Salesforce Aura の監査によるデータ漏洩の検出,https://cloud.google.com/blog/ja/topics/threat-intelligence/auditing-salesforce-aura-data-exposure/,"Mon, 02 Feb 2026 02:00:00 +0000","※この投稿は米国時間 2026 年 1 月 13 日に、Google Cloud blog に投稿されたものの抄訳です。
執筆者: Amine Ismail、Anirudha Kanodia

はじめに
Mandiant が、新たなオープンソース ツールである AuraInspector をリリースします。Salesforce Aura フレームワーク内のアクセス制御の構成ミスの特定と監査において...",2026-02-03
a6ac6657d0e4c089d2159cdf21e59723,GCP_Japan,Cloud Composer で Apache Airflow 3.1 を活用し、ワークフロー オーケストレーションを強化,https://cloud.google.com/blog/ja/products/data-analytics/cloud-composer-supports-apache-airflow-31/,"Fri, 30 Jan 2026 03:00:00 +0000","※この投稿は米国時間 2026 年 1 月 24 日に、Google Cloud blog に投稿されたものの抄訳です。
データスタックが分断された世界では、革新的で、移植性と拡張性を備えたワークフロー オーケストレーションが求められます。フルマネージドのデータおよび AI / ML 向けワークフロー オーケストレーション サービスである Cloud Composer は、Apache Airfl...",2026-02-03
1ce364b9a12c4c53fb4955e4bbc7f110,GCP_Japan,Google Cloud A4X（GB200）と NVIDIA Dynamo を使用した WideEP Mixture-of-Experts 推論のスケーリング,https://cloud.google.com/blog/ja/products/compute/scaling-moe-inference-with-nvidia-dynamo-on-google-cloud-a4x/,"Fri, 30 Jan 2026 02:00:00 +0000","※この投稿は米国時間 2026 年 1 月 23 日に、Google Cloud blog に投稿されたものの抄訳です。
組織が標準的な LLM から DeepSeek-R1 のような大規模な Mixture-of-Experts（MoE）アーキテクチャに移行するにつれて、主な制約は、物理的な計算密度から通信レイテンシとメモリ帯域幅へと変化しました。Google はこのたび、エージェント型 AI ...",2026-02-03
d48143f0b6114c1e27be343af5cabdf9,GCP_Japan,AlloyDB のマネージド接続プーリングのご紹介 - 規模の拡大と接続の高速化,https://cloud.google.com/blog/ja/products/databases/alloydb-managed-connection-pooling/,"Thu, 29 Jan 2026 03:00:00 +0000","※この投稿は米国時間 2026 年 1 月 23 日に、Google Cloud blog に投稿されたものの抄訳です。
AlloyDB for PostgreSQL は、要求の厳しいエンタープライズ ワークロード向けに設計されたフルマネージド データベース サービスです。PostgreSQL の使いやすさと堅牢性を Google Cloud の高度なテクノロジーと組み合わせることで、卓越したパフ...",2026-02-03
2e7dca1eecca2f3a72982630b8ac0137,GCP_Japan,Google SRE が Gemini CLI を使用して実際の障害を解決している方法,https://cloud.google.com/blog/ja/topics/developers-practitioners/how-google-sres-use-gemini-cli-to-solve-real-world-outages/,"Thu, 29 Jan 2026 02:00:00 +0000","※この投稿は米国時間 2026 年 1 月 23 日に、Google Cloud blog に投稿されたものの抄訳です。
Google のサイト信頼性エンジニアリング（SRE）において私たちがよく使うモットーの一つに、「トイルを排除する」があります。
チューリッヒのミニキッチンやマウンテンビューの廊下でも耳にすることがあるこのモットーには、反復的な手作業をエンジニアリングされたシステムに置き換える...",2026-02-03
e29cfd8cf345be77e04e6d37d73913e7,GCP_Japan,Agent Factory のハイライト: Remik と学ぶ Antigravity と Nano Banana Pro,https://cloud.google.com/blog/ja/topics/developers-practitioners/agent-factory-recap-antigravity-and-nano-banana-pro-with-remik/,"Thu, 29 Jan 2026 01:00:00 +0000","※この投稿は米国時間 2026 年 1 月 23 日に、Google Cloud blog に投稿されたものの抄訳です。
The Agent Factory ポッドキャストのエピソード 17 では、純粋な理論的な領域から離れて、Google の最新のデベロッパー ツールを実際に使用します。Vlad とともに、Antigravity と Nano Banana Pro を詳しく見ていき、コード生成と...",2026-02-03
e376effe1b700048fa287307983afa52,GCP_Japan,Fastweb + Vodafone: Spanner と BigQuery でデータ ワークフローを再定義,https://cloud.google.com/blog/ja/products/databases/how-fastweb-vodafone-reimagined-data-workflows-with-spanner-bigquery/,"Wed, 28 Jan 2026 03:00:00 +0000","※この投稿は米国時間 2026 年 1 月 23 日に、Google Cloud blog に投稿されたものの抄訳です。
編集者注: イタリアの大手通信プロバイダである Fastweb + Vodafone は、チャネル全体でより迅速かつパーソナライズされたカスタマー エクスペリエンスをサポートする Customer 360 プラットフォームを構築しました。また、Spanner、BigQuery、...",2026-02-03
ab05edeea27657d521ce45b5179a32d0,GCP_Japan,Gemini 3 のはじめ方: 最初の Gemini 3 アプリを Google Cloud Run にデプロイする,https://cloud.google.com/blog/ja/topics/developers-practitioners/getting-started-with-gemini-3-deploy-your-first-gemini-3-app-to-google-cloud-run/,"Wed, 28 Jan 2026 03:00:00 +0000","※この投稿は米国時間 2026 年 1 月 23 日に、Google Cloud blog に投稿されたものの抄訳です。
前回のブログ記事では、Gemini 3 の利用を簡単に始める方法をご紹介しました。Google AI Studio を使用すると、API キーを取得してすぐに使用できるコードを入手できるため、簡単に次のステップに進むことができます。これにより、コードをすばやく実行してカスタマイ...",2026-02-03
7f50394bd3eead7f1a1d2612156287d6,GCP_Japan,Gemini CLI の習得: インストールから高度なユースケースまでの完全ガイド,https://cloud.google.com/blog/ja/topics/developers-practitioners/mastering-gemini-cli-your-complete-guide-from-installation-to-advanced-use-cases/,"Wed, 28 Jan 2026 02:00:00 +0000","※この投稿は米国時間 2026 年 1 月 22 日に、Google Cloud blog に投稿されたものの抄訳です。
このたび、Google と DeepLearning.ai が提携し、無料コース Gemini CLI: Code &amp; Create with an Open-Source Agent をリリースいたしました。この包括的なコースは、Gemini CLI とその優れた機能...",2026-02-03
9bedfca051d1a4de46f1721d411c186a,GCP_Japan,サワディー（こんにちは）タイ！Google Cloud がバンコクに新しいリージョンを開設,https://cloud.google.com/blog/ja/products/infrastructure/google-cloud-launches-new-region-in-bangkok-thailand/,"Tue, 27 Jan 2026 02:00:00 +0000","※この投稿は米国時間 2026 年 1 月 21 日に、Google Cloud blog に投稿されたものの抄訳です。
ยินดีต้อนรับสู่ Google Cloud, Thailand!（タイの Google Cloud へようこそ！）
タイの企業や公共機関は共通の目標を掲げています。それは、低レイテンシで高性能なアプリケーションを提供しながら、貴重なデータが国内に安全にとどまるよう...",2026-02-03
79f6ce5cd676b298e87b22e63f696ab6,GCP_Japan,Agent Factory のハイライト: TPU での強化学習とファインチューニング,https://cloud.google.com/blog/ja/topics/developers-practitioners/agent-factory-recap-reinforcement-learning-and-fine-tuning-on-tpus/,"Tue, 27 Jan 2026 01:30:00 +0000","※この投稿は米国時間 2026 年 1 月 17 日に、Google Cloud blog に投稿されたものの抄訳です。
Agent Factory のホリデー スペシャルでは、Google の TPU トレーニング チームのシニア プロダクト マネージャーである Kyle Meggs をゲストに迎え、Don McCasland と私の 3 人で、モデルのファインチューニングの世界を深く掘り下げま...",2026-02-03
6b105d9345021b26843a2bd5a5343359,GCP_Japan,Rapid Migration and Modernization Program（RaMP）の新しいインセンティブで移行を加速させましょう,https://cloud.google.com/blog/ja/products/infrastructure-modernization/new-ramp-incentives-for-cloud-migration/,"Mon, 26 Jan 2026 02:00:00 +0000","※この投稿は米国時間 2026 年 1 月 22 日に、Google Cloud blog に投稿されたものの抄訳です。
2026 年に主導的な立場を確立するには、あらゆるワークロードにわたり、AI 対応、スリム化、最適化が必要となります。多くの組織にとって、それは SAP、Oracle、NetApp、VMware などのアプリケーションをクラウドに移行してモダナイズすることを意味します。Goog...",2026-02-03
9d4827a38178f4ad1cc67acff3bdf409,GCP_Japan,Firestore の新しい高度なクエリエンジンでアプリケーションを強化,https://cloud.google.com/blog/ja/products/data-analytics/new-firestore-query-engine-enables-pipelines/,"Mon, 26 Jan 2026 02:00:00 +0000","※この投稿は米国時間 2026 年 1 月 21 日に、Google Cloud blog に投稿されたものの抄訳です。
価値あるデータベースの特徴は、格納されているデータを簡単にクエリできることです。これにより、デベロッパーはカスタマイズされた複雑なユーザー エクスペリエンスをアプリケーション内で構築できます。先週、Google Cloud のエンタープライズ クラスのスケーラブルなドキュメント...",2026-02-03
4720b097f3a0cbd0dbc8c196c8579d0d,GCP_Japan,Gemini 3 を使ってみる: Gemini 3 Flash での Hello World,https://cloud.google.com/blog/ja/topics/developers-practitioners/getting-started-with-gemini-3-hello-world-with-gemini-3-flash/,"Fri, 23 Jan 2026 03:00:00 +0000","※この投稿は米国時間 2026 年 1 月 21 日に、Google Cloud blog に投稿されたものの抄訳です。
Gemini 3 は、Google 史上最もインテリジェントなモデル ファミリーであり、最先端の推論機能によって、あらゆる学習、創造、計画を支援します。このファミリーのなかでも、Gemini 3 Flash はスピードと効率性を重視して設計されており、複雑な推論、マルチモーダル...",2026-02-03
0617eb1d0bbc9547a0078efaccd82f84,GCP_Japan,VoC（ Voice of Customer ）起点のバーチャルリサーチで顧客理解を高速化 - Google Cloud 活用,https://cloud.google.com/blog/ja/topics/customers/panasonic-accelerates-customer-understanding-with-virtual-research/,"Fri, 23 Jan 2026 02:00:00 +0000",日本国内におけるパナソニック家電製品のマーケティングを一手に担う、パナソニック株式会社（以下、パナソニック） コンシューマーマーケティング ジャパン本部。同本部は、製造事業部と販売現場をつなぐ結節点として、販売戦略の策定やDX推進を通じ、お客様へ継続的な価値を届ける仕組みづくりを主導しています。その中核となるのが、「顧客理解」の深化です。今回は同本部の若松氏をお迎えし、コンタクトセンターに寄せられ...,2026-02-03
2c9d0259e90d69307bf0fb1d27314144,GCP_Japan,Palo Alto Networks がマルチテナントのスケーラブルな統合データ プラットフォームを構築した方法,https://cloud.google.com/blog/ja/topics/partners/palo-alto-networks-builds-a-multi-tenant-unified-data-platform/,"Fri, 23 Jan 2026 01:00:00 +0000","※この投稿は米国時間 2026 年 1 月 17 日に、Google Cloud blog に投稿されたものの抄訳です。
世界中の企業が大量のデータを処理しています。Palo Alto Networks は、同社の製品ポートフォリオ全体で、毎秒数千件のファイアウォール ログ、テレメトリー シグナル、脅威イベントを処理しています。この規模に対応するため、Palo Alto Networks は 30...",2026-02-03
e0fc400948ff3f6be0092049ca33a637,Ggen_Blog,2026年1月のイチオシGoogle Cloud・Google Workspaceアップデート,https://blog.g-gen.co.jp/entry/update-in-this-month-2026-01,2026-02-03T09:00:00+09:00,G-gen の杉村です。2026年1月に発表された、Google Cloud や Google Workspace のイチオシアップデートをまとめてご紹介します。記載は全て、記事公開当時のものですのでご留意ください。 はじめに Google Cloud のアップデート LOAD DATA/CREATE EXTERNAL TABLE のフォーマット指定オプションが GA Cloud Run func...,2026-02-03
3c359310cb8d76b7c33f7083a081880c,Ggen_Blog,BigQueryのConversational Analytics（対話型分析）を徹底解説,https://blog.g-gen.co.jp/entry/bigquery-conversational-analytics-explained,2026-02-02T09:00:00+09:00,G-gen の杉村です。BigQuery には Conversational Analytics（対話型分析）機能が備わっており、データに関する質問を生成 AI に対してチャット形式で投げかけることができます。この機能を使うことで、SQL の知識がなくても、自然言語でデータをクエリすることができます。 概要 Conversational Analytics とは 使用イメージ 料金 他の手法との比...,2026-02-03
fe3429a4709802ac7e32e0f1ee1a1100,Ggen_Blog,Cloud Storageのロケーションタイプに起因する料金スパイクについて,https://blog.g-gen.co.jp/entry/cloud-storage-cost-spikes-by-location-types,2026-01-29T09:00:00+09:00,G-gen の森です。Google Cloud のオブジェクトストレージサービスである Cloud Storage において、見落とされがちなのがレプリケーション料金です。当記事では、ロケーションタイプの選択による料金スパイクの事象と、リージョン間レプリケーション料金の仕組み、ロケーションタイプを決めるポイントについて解説します。 事象 原因 ロケーションタイプ ロケーションタイプと可用性 リージ...,2026-02-03
7489b5818a71a00a8c6669f00528938f,Ggen_Blog,BigQueryデータキャンバスを使いこなすためのプロンプトエンジニアリング,https://blog.g-gen.co.jp/entry/prompt-engineering-for-bigquery-data-canvas,2026-01-26T09:00:00+09:00,G-gen の min です。BigQuery に統合された AI アシスタント機能である BigQuery データキャンバス について、より実践的な活用方法と、技術的な制約事項について解説します。 はじめに BigQuery データキャンバスとは Conversational Analytics API とは 効果的な質問のテクニック コンテキストを具体的に提示する 複雑な分析は複数のステップに...,2026-02-03
27ef38ed7d4bfed4d2bab8393e8fac2a,Ggen_Blog,Nano Banana Pro（Gemini 3 Pro Image）を徹底解説,https://blog.g-gen.co.jp/entry/nano-banana-pro-explained,2026-01-22T09:00:00+09:00,G-gen の川村です。この記事では、Google の画像生成 AI モデルである Gemini 3 Pro Image、通称 Nano Banana Pro について紹介します。 はじめに 当記事について Nano Banana Pro とは Nano Banana と Nano Banana Pro Nano Banana Pro の利用 概要 Google Workspace での利用 AP...,2026-02-03
dc544f87442e3e8739fe0db097c3abc4,Ggen_Blog,Google Cloudのデータサイエンスエージェントを解説,https://blog.g-gen.co.jp/entry/data-science-agent-explained,2026-01-19T09:00:00+09:00,G-gen の佐々木です。当記事では、Google Cloud が提供するデータサイエンスエージェント（Data Science Agent）について解説します。データサイエンスエージェントは、Colab Enterprise ノートブック上で、AI エージェントがデータクレンジングや分析などのタスクを自動的に行う機能です。 概要 データサイエンスエージェントとは 注意点 Google Colab...,2026-02-03
