id,source,title,link,published,summary,collected_date
9d1eeadc1496ffd39e477edd1cd5f371,GCP_Blog,Intelligent code conversion: Databricks Spark SQL to BigQuery SQL via Gemini,https://cloud.google.com/blog/products/data-analytics/automate-sql-translation-databricks-to-bigquery-with-gemini/,"Thu, 21 Aug 2025 16:00:00 +0000","As data platforms evolve and businesses diversify their cloud ecosystems, the need to migrate SQL workloads between engines is becoming increasingly common. Recently, I had the opportunity to work on ...",2025-08-24
372beffc770e703fa2e3524dfe7c6df1,GCP_Blog,How to build a real-time voice agent with Gemini and Google ADK,https://cloud.google.com/blog/products/ai-machine-learning/build-a-real-time-voice-agent-with-gemini-adk/,"Thu, 21 Aug 2025 16:00:00 +0000","Building advanced conversational AI has moved well beyond text.
Now, we can use AI to create real-time, voice-driven agents. However, these systems need low-latency, two-way communication, real-time i...",2025-08-24
ce61630287910b684a737e22b5544eb5,GCP_Blog,Introducing ‘Gemini for Government’: Supporting the U.S. Government’s Transformation with AI,https://cloud.google.com/blog/topics/public-sector/introducing-gemini-for-government-supporting-the-us-governments-transformation-with-ai/,"Thu, 21 Aug 2025 14:00:00 +0000","Google is proud to support the U.S. government in its modernization efforts through the use of AI. Today, in partnership with the General Services Administration (GSA) and in support of the next phase...",2025-08-24
753d06845d9aef0a14583a97eaa83e30,GCP_Blog,How much energy does Google’s AI use? We did the math,https://cloud.google.com/blog/products/infrastructure/measuring-the-environmental-impact-of-ai-inference/,"Thu, 21 Aug 2025 12:00:00 +0000","AI is unlocking scientific breakthroughs, improving healthcare and education, and could add trillions to the global economy. Understanding AI’s footprint is crucial, yet thorough data on the energy an...",2025-08-24
729eab04e8ed9c6917b008c0225650b0,GCP_Blog,"From silos to synergy: New Compliance Manager, now in preview",https://cloud.google.com/blog/products/identity-security/streamline-auditing-compliance-manager-is-now-in-preview/,"Wed, 20 Aug 2025 16:00:00 +0000","As organizations increase their focus on security and regulatory compliance, Google Cloud is helping our customers meet these obligations by fostering better collaboration between security and complia...",2025-08-24
5add6338837f318c56c2a7b55d05e939,GCP_Blog,Here’s which Google AI developer tool to use for each situation,https://cloud.google.com/blog/products/ai-machine-learning/choose-the-right-google-ai-developer-tool-for-your-workflow/,"Wed, 20 Aug 2025 16:00:00 +0000","Do you remember packing for an extended trip twenty years ago? We had to load up a camera, a day planner, a pile of books, a handheld gaming device, a map-stuffed tourist guide, a phone, a CD player, ...",2025-08-24
5c68fca1aba1e26e3804b8554d1b1b29,GCP_Blog,Going beyond basic data security with Google Cloud DSPM,https://cloud.google.com/blog/products/identity-security/going-beyond-dspm-to-protect-your-data-in-the-cloud-now-in-preview/,"Wed, 20 Aug 2025 16:00:00 +0000","In the age of data democratization and generative AI, the way organizations handle data has changed dramatically. This evolution creates opportunities — and security risks. The challenge for security ...",2025-08-24
3f71572b0de1155e327d158d9fc32e9f,GCP_Blog,IP address management made easy: Announcing auto IPAM for GKE clusters,https://cloud.google.com/blog/products/containers-kubernetes/gke-auto-ipam-simplifies-ip-address-management/,"Wed, 20 Aug 2025 16:00:00 +0000","Managing IP addresses in Kubernetes can be a complex and daunting task — but a crucial one. In Google Kubernetes Engine (GKE), it’s important that you manage IP addresses effectively, given the resour...",2025-08-24
32bee9b92fbe575142dffca25bcea018,GCP_Blog,A Cereal Offender: Analyzing the CORNFLAKE.V3 Backdoor,https://cloud.google.com/blog/topics/threat-intelligence/analyzing-cornflake-v3-backdoor/,"Wed, 20 Aug 2025 14:00:00 +0000","Written by: Marco Galli

Welcome to the Frontline Bulletin Series
Straight from Mandiant Threat Defense, the ""Frontline Bulletin"" series brings you the latest on the most intriguing compromises we are...",2025-08-24
c89f4c70ae3ed60045c2c978bb8f1980,GCP_Blog,An efficient path to production AI: Kakao’s journey with JAX and Cloud TPUs,https://cloud.google.com/blog/products/infrastructure-modernization/kakaos-journey-with-jax-and-cloud-tpus/,"Tue, 19 Aug 2025 16:00:00 +0000",When your messaging platform serves 49 million people – 93% of South Korea’s population – every technical decision carries enormous weight. The engineering team at Kakao faced exactly this challenge w...,2025-08-24
92493cba5bb873858e68e13220067a5e,GCP_Blog,Announcing new capabilities for enabling defenders and securing AI innovation,https://cloud.google.com/blog/products/identity-security/security-summit-2025-enabling-defenders-and-securing-ai-innovation/,"Tue, 19 Aug 2025 16:00:00 +0000",AI presents an unprecedented opportunity for organizations to redefine their security posture and reduce the greatest amount of risk for the investment. From proactively finding zero-day vulnerabiliti...,2025-08-24
9017a6590254d5966a9d701d1b28369c,GCP_Blog,"ChromeOS desk sync keeps your momentum going, across devices",https://cloud.google.com/blog/products/chrome-enterprise/chromeos-desk-sync-keeps-your-momentum-going-across-devices/,"Tue, 19 Aug 2025 14:40:00 +0000","For many workers, the frequent need to switch between devices can become cumbersome and disruptive. Otherwise simple tasks like logging in, reopening applications, and re-establishing your workspace e...",2025-08-24
fa599d4b64229748ad568fa852d16094,GCP_Blog,Google is a Leader and positioned furthest in vision in the 2025 Gartner® Magic Quadrant™ for Conversational AI Platforms,https://cloud.google.com/blog/products/ai-machine-learning/gartner-magic-quadrant-for-conversational-ai-platforms/,"Mon, 18 Aug 2025 16:00:00 +0000","Google has been named a Leader in the 2025 Gartner® Magic Quadrant™ for Conversational AI Platforms (CAIP) report, and positioned furthest in vision among all vendors evaluated. 
We believe this repor...",2025-08-24
8f8fa8b68c8a1f68c6b3a61ebd176e9e,GCP_Blog,Now available: Cloud HSM as an encryption key service for Workspace client-side encryption,https://cloud.google.com/blog/products/identity-security/introducing-cloud-hsm-as-an-encryption-key-service-for-workspace-cse/,"Mon, 18 Aug 2025 16:00:00 +0000","Organizations in highly-regulated sectors, such as government, defense, financial services, and healthcare, are required to meet stringent standards to safeguard sensitive data. Client-side encryption...",2025-08-24
60e03ec3e0fc6a1f0e4c51dedfc8b74d,GCP_Blog,The AI-powered shift to “living games:” Meet the customers and partners leveling up the ways we play,https://cloud.google.com/blog/products/gaming/games-start-ups-developers-partners-innovating-with-gen-ai/,"Mon, 18 Aug 2025 07:00:00 +0000","The games industry is on a powerful ride, surging forward with innovation and a sharp focus on the player experience. For years, the industry’s evolution was defined by familiar IPs getting better gra...",2025-08-24
45577d7fb16e75ff64ceadd2f0256842,GCP_Blog,Beyond guardrails: A taxonomy of platform engineering control mechanisms,https://cloud.google.com/blog/products/application-modernization/platform-engineering-control-mechanisms/,"Fri, 15 Aug 2025 16:00:00 +0000","The promise of platform engineering is to accelerate software delivery by empowering developers with self-service capabilities. However, this must be balanced with security, compliance, and operationa...",2025-08-24
432d01977bfada2ce3f9dd7c79dd3f35,GCP_Japan,【Google Cloud Next Tokyo】 DAY 2 基調講演まとめ： AI エージェントが変える、開発、データ活用、そしてセキュリティ,https://cloud.google.com/blog/ja/topics/next-tokyo/google-cloud-next-tokyo-25-day-2-keynote-summary/,"Fri, 22 Aug 2025 02:00:00 +0000","Google Cloud Next Tokyo の 2 日目は、1 日目の発表をさらに発展させ、AI 時代の核となるインフラ、アプリケーションのモダナイゼーション、データ、セキュリティを紹介しました。本レポートでは、その興奮と熱気に満ちた基調講演の模様を各セクションのハイライトと共にお伝えします。見逃した方はぜひこちらからご覧ください。







  
    
      
  

    ...",2025-08-24
181249e12228c32b41c7325760129cdf,GCP_Japan,【Google Cloud Next Tokyo】 DAY 1 基調講演まとめ：顧客体験から働き方まで、AI エージェントがすべてを変える,https://cloud.google.com/blog/ja/topics/next-tokyo/google-cloud-next-tokyo-25-day-1-keynote-summary/,"Thu, 21 Aug 2025 03:00:00 +0000","Google Cloud Next Tokyo の初日では、AI、特に自律的に思考し業務を遂行する「AI エージェント」が、企業の成長をいかにして加速させる強力なテクノロジーとなるかが示されました。本記事では、その基調講演で語られた内容を、各セクションのハイライトと共にお伝えします。見逃した方はぜひこちらからご覧ください。







  
    
      
  

    <figure...",2025-08-24
258daf70f3df9d5df80488a64e07008e,GCP_Japan,【Next Tokyo】120 以上のアーカイブ セッションを本日公開！,https://cloud.google.com/blog/ja/topics/next-tokyo/over-120-next-tokyo-archive-sessions-available/,"Thu, 21 Aug 2025 02:00:00 +0000","すでに公開していた基調講演（DAY 1 | DAY 2 ）に加え、120 以上のブレイクアウト セッション、スポンサー セッションを本日、Google Cloud Next Tokyo 公式サイトにて公開しました。





  
    

      
        

        
          Google Cloud Next Tokyo セッション アーカイブ公開
    ...",2025-08-24
9f4bb1b1b7419d244459f4734ed42aba,GCP_Japan,Google Cloud Partner Top Engineer 2026 アワードプログラム 申し込みを開始,https://cloud.google.com/blog/ja/topics/partners/google-cloud-partner-top-engineer-2026/,"Thu, 21 Aug 2025 01:00:00 +0000",2025 年 6 月 12 日に本ブログにて発表させていただきましたアワードプログラム 「Google Cloud Partner Top Engineer 2026」 の申し込みを本日より開始しましたのでお知らせいたします。本プログラムへの自薦・他薦によるお申し込みを Google Cloud Partner Top Engineer のサイトにて受付開始いたします。内容をご確認の上、サイト内の...,2025-08-24
8015985adf98e0181def73979990444d,GCP_Japan,Google が 2025 年の IDC MarketScape: FinOps Cloud Costs Optimization でリーダーに選出,https://cloud.google.com/blog/ja/topics/cost-management/google-leader-in-idc-marketscape-finops-cloud-costs/,"Wed, 20 Aug 2025 02:10:00 +0000","※この投稿は米国時間 2025 年 8 月 6 日に、Google Cloud blog に投稿されたものの抄訳です。
Google はお客様を第一に考え、お客様がクラウド支出を把握し、効率性を最適化し、費用が想定外にならないようにするための FinOps ツールを構築することに注力してきました。このたび、Google の取り組みが評価され、2025 年の IDC MarketScape for ...",2025-08-24
70ff77c6c0d904ca286193a9ae1b1d89,GCP_Japan,Cloud Hub の最適化と Cost Explorer を使用してクラウド費用を最適化する,https://cloud.google.com/blog/ja/products/management-tools/announcing-cloud-hub-optimization-and-cost-explorer-for-developers/,"Wed, 20 Aug 2025 02:00:00 +0000","※この投稿は米国時間 2025 年 8 月 5 日に、Google Cloud blog に投稿されたものの抄訳です。
 
アプリケーション オーナーがクラウド費用の最適化を検討する際に求めているのは、次の 3 つです。


最も費用のかかるリソースはどれですか？


今週または今月、どのリソースの費用が上がっているか？


利用率が低いリソースはどれか？


これらの質問にすばやく簡単に回答でき...",2025-08-24
b3dc64df543f39f97f493248387b51db,GCP_Japan,Google の ADK を使用して見込み顧客を発掘するための Deep Research エージェントを構築する方法,https://cloud.google.com/blog/ja/products/ai-machine-learning/build-a-deep-research-agent-with-google-adk/,"Wed, 20 Aug 2025 01:30:00 +0000",※この投稿は米国時間 2025 年 8 月 13 日に、Google Cloud blog に投稿されたものの抄訳です。見込み顧客を発掘する従来の方法は、適応能力や推論能力に欠ける、脆弱なスクレイパーや静的なスクリプトに依存することがよくあります。エージェントがデータを取得するだけでなく、市場調査チームの分析プロセスをエミュレートするように設計できたらどうでしょうか。成功の定義を動的に理解し、この...,2025-08-24
386418511ee74cf755368c667233cb77,GCP_Japan,Google、2025 年 Gartner® Magic Quadrant™ でコンテナ管理部門のリーダーに選出,https://cloud.google.com/blog/ja/products/containers-kubernetes/2025-gartner-magic-quadrant-for-container-management-leader/,"Wed, 20 Aug 2025 01:20:00 +0000","※この投稿は米国時間 2025 年 8 月 13 日に、Google Cloud blog に投稿されたものの抄訳です。
Gartner は 2025 年の Gartner® Magic Quadrant™ で、「ビジョンの完全性と実行能力」に基づき、Google を3 年連続でコンテナ管理のリーダーとして認定しました。Google は、評価対象となった全ベンダーの中で実行能力において最も高い評価...",2025-08-24
b601fc62e772ecb55e726ee46ac24ce6,GCP_Japan,チュートリアル: Gemini Multimodal Live API を QA に使用する方法,https://cloud.google.com/blog/ja/topics/developers-practitioners/gemini-live-api-real-time-ai-for-manufacturing/,"Wed, 20 Aug 2025 01:00:00 +0000",※この投稿は米国時間 2025 年 8 月 13 日に、Google Cloud blog に投稿されたものの抄訳です。Gemini Multimodal Live API は、動画や音声などのデータを生成 AI モデルにストリーミングし、リアルタイムで回答を受け取ることができる強力なツールです。処理を開始する前に完全なデータ アップロードが必要な従来の API とは異なり、この「ライブ」または「...,2025-08-24
3f45a3dd7969953a1585f44f8b82dd7b,GCP_Japan,Google Cloud 向けの AI ファーストの Colab ノートブック エクスペリエンスを発表,https://cloud.google.com/blog/ja/products/ai-machine-learning/ai-first-colab-notebooks-in-bigquery-and-vertex-ai/,"Tue, 19 Aug 2025 02:00:00 +0000",※この投稿は米国時間 2025 年 8 月 6 日に、Google Cloud blog に投稿されたものの抄訳です。Google I/O 2025 で、Google はエージェント機能を備えた新しい AI ファーストの Colab を発表しました。これにより、現在のコード、アクション、意図、目標を理解する真のコーディング パートナーが実現します。このたび、Colab Enterprise ノート...,2025-08-24
4c02e9d943090cba9ffbbfb712d32981,GCP_Japan,よりスマートなオーサリング、より優れたコード: AI が Google Cloud の開発者エクスペリエンスをどのように変革しているか,https://cloud.google.com/blog/ja/topics/developers-practitioners/smarter-authoring-better-code-how-ai-is-reshaping-google-clouds-developer-experience/,"Mon, 18 Aug 2025 02:00:00 +0000","※この投稿は米国時間 2025 年 8 月 14 日に、Google Cloud blog に投稿されたものの抄訳です。
Google Cloud デベロッパー エクスペリエンス チームの使命はシンプルで、デベロッパーが学習からリリースまでをできるだけ迅速かつ効果的に行えるよう支援することです。そのための主なツールは、堅牢なハンズオン ドキュメントと、そのドキュメントに直接埋め込まれたすぐに使用で...",2025-08-24
b6c290921c88f7357b3722ca283073a5,GCP_Japan,Google Cloud Partner All Certification Holders 2025 応募開始,https://cloud.google.com/blog/ja/topics/partners/google-cloud-partner-all-certification-holders/,"Mon, 18 Aug 2025 01:00:00 +0000",Google Cloud Japan はこの度、Google Cloud のパートナー企業にご所属のエンジニアの方を対象とした新しい認定資格のプログラムとして、「Google Cloud Partner All Certification Holders」を開始いたします。本プログラムは Google Cloud の認定資格を全て保持されている方を発表するものです。本プログラムによって、Googl...,2025-08-24
a8624918bcccac6be30b266a1e900c86,GCP_Japan,Google、Gartner® Magic Quadrant 戦略的クラウド プラットフォーム サービス部門のリーダーに,https://cloud.google.com/blog/ja/products/compute/google-is-a-leader-in-gartner-magic-quadrant-for-scps/,"Fri, 15 Aug 2025 02:00:00 +0000",※この投稿は米国時間 2025 年 8 月 9 日に、Google Cloud blog に投稿されたものの抄訳です。Gartner® は、Gartner Magic Quadrant™ 戦略的クラウド プラットフォーム サービス部門のリーダーとして Google を選出しました。これで、Google は 8 年連続で選出されたことになります。さらに、今年は Google がビジョンの完全性で最も...,2025-08-24
6f84b81ed0e2b8b165a4bbe07f09739e,GCP_Japan,Google が 2025 年の IDC MarketScape for Business Intelligence and Analytics Platforms でリーダーに選出,https://cloud.google.com/blog/ja/products/data-analytics/google-leader-2025-idc-marketscape-for-business-intelligence/,"Fri, 15 Aug 2025 02:00:00 +0000",※この投稿は米国時間 2025 年 8 月 13 日に、Google Cloud blog に投稿されたものの抄訳です。このたび、IDC が Google を「IDC MarketScape: Worldwide Business Intelligence and Analytics Platforms 2025 Vendor Assessment」のリーダーに選出しました。このポジションは、組織...,2025-08-24
ade306ec16e90ead66baa016906c57eb,GCP_Japan,OVERSTEP バックドアを使用した SonicWall Secure Mobile Access（SMA）の悪用キャンペーンが継続中,https://cloud.google.com/blog/ja/topics/threat-intelligence/sonicwall-secure-mobile-access-exploitation-overstep-backdoor/,"Thu, 14 Aug 2025 01:20:00 +0000"," 

※この投稿は米国時間 2025 年 7 月 17 日に、Google Cloud blog に投稿されたものの抄訳です。
はじめに
Google Threat Intelligence グループ（GTIG）は、UNC6148 として追跡している、金銭目的の脅威アクターであると疑われるグループによる継続的なキャンペーンを確認しました。このキャンペーンは、完全にパッチが適用されたサポート終了の ...",2025-08-24
66b650625dc57eefc672c9e5e75e0cb9,GCP_Japan,Google Cloud で実行される SAP ワークロードのシステム中心のモニタリングとオブザーバビリティ,https://cloud.google.com/blog/ja/products/sap-google-cloud/workload-management-adds-sap-observability-and-monitoring/,"Thu, 14 Aug 2025 01:20:00 +0000","※この投稿は米国時間 2025 年 8 月 1 日に、Google Cloud blog に投稿されたものの抄訳です。
複雑な SAP 環境の管理は、迷路を歩くようなものです。ユーザーは、パフォーマンス、データベースの健全性、インフラストラクチャの安定性などをすべて両立させながら、シームレスなビジネス アプリケーションの実現に努めています。このたび Google は、Workload Manage...",2025-08-24
3d4898d74d0af6a39b4e3d90fc2058b1,GCP_Japan,利便性を超えたリスク: VMware vSphere Active Directory 統合の危険性の顕在化,https://cloud.google.com/blog/ja/topics/threat-intelligence/vsphere-active-directory-integration-risks/,"Thu, 14 Aug 2025 01:15:00 +0000"," 

※この投稿は米国時間 2025 年 7 月 24 日に、Google Cloud blog に投稿されたものの抄訳です。
エグゼクティブ サマリー
Broadcom の VMware vSphere プロダクトは、プライベート クラウドの仮想化に依然として広く利用されており、重要なインフラストラクチャを支えています。vSphere は、安定性と制御の面で組織に大きく貢献しており、その重要性は...",2025-08-24
539d492e180bb10ca390345000415273,GCP_Japan,ヘルプデスクからハイパーバイザまで: UNC3944 から VMware vSphere 環境を防御する,https://cloud.google.com/blog/ja/topics/threat-intelligence/defending-vsphere-from-unc3944/,"Thu, 14 Aug 2025 01:05:00 +0000","※この投稿は米国時間 2025 年 7 月 24 日に、Google Cloud blog に投稿されたものの抄訳です。
はじめに
2025 年半ば、Google Threat Intelligence グループ（GTIG）は、小売、航空、保険など、複数の業界を標的とした高度で攻撃的なサイバー キャンペーンを特定しました。これは、金銭目的の脅威グループである UNC3944 の仕業でした。このグル...",2025-08-24
3394c5c98a12b79e5e40e1ead402cf4a,GCP_Japan,一般提供開始: ローカル SSD、ベアメタル、特大シェイプを備えたインテル Xeon 6 搭載の C4 VM シリーズのご紹介,https://cloud.google.com/blog/ja/products/compute/c4-vms-based-on-intel-6th-gen-xeon-granite-rapids-now-ga/,"Thu, 14 Aug 2025 01:00:00 +0000","※この投稿は米国時間 2025 年 8 月 1 日に、Google Cloud blog に投稿されたものの抄訳です。
このたび、28 個の強力な新しいシェイプの一般提供が開始され、C4 仮想マシンシリーズが大幅に拡張されました。今回の拡張では、Google の次世代 Titanium ローカル SSD、C4 ベアメタル インスタンス、新しい特大シェイプが C4 シェイプに導入されました。いずれも...",2025-08-24
d203a020bb62b0d0e735a638a017fff9,GCP_Japan,エージェント AI によるライドシェア型の計画: Pluto7 と Google Agentspace がサプライ チェーンを変革,https://cloud.google.com/blog/ja/topics/partners/pluto7-pi-agent-ai-meets-agentspace/,"Thu, 14 Aug 2025 00:10:00 +0000","※この投稿は米国時間 2025 年 7 月 31 日に、Google Cloud blog に投稿されたものの抄訳です。
Pluto7 は Google の初期からのパートナーで、Agentspace を Planning in a Box プラットフォーム Pi Agent に統合し、在庫と需要の計画に関する課題に対処しています。
Agentspace は、専門エージェントを構築するための Ag...",2025-08-24
0be08a40a16ce2bea6f2e42d6f9f84d3,Ggen_Blog,GeminiのURL context toolを解説。スクレイピングなしでWebコンテンツを取得,https://blog.g-gen.co.jp/entry/gemini-url-context-tool-explained,2025-08-22T09:00:00+09:00,G-genの杉村です。Vertex AI の API 経由で Gemini を呼び出す際に、URL context tool を使って、明示的にスクレイピングをしなくても Web サイトの内容を取得してコンテキストとして利用する方法について解説します。 概要 URL context tool とは ユースケース サポートされているモデル 使用方法 URL context tool の検証 tool...,2025-08-24
1c26825e076402ebc089a26e199bac37,Ggen_Blog,Gemini CLIだけでTo Doアプリを開発してみた（前編）,https://blog.g-gen.co.jp/entry/todo-app-demo-with-gemini-cli-1,2025-08-21T09:00:00+09:00,G-genの西田です。当記事では、Gemini CLI での対話だけで、To Do タスクを管理するWebアプリケーションの開発手順を紹介します。 はじめに 当記事について 開発ステップ Gemini CLI の起動 要件定義と開発計画の決定 アプリケーションの開発 開発の開始 動作確認 アプリケーションの修正 はじめに 当記事について 当記事では、Webアプリケーションの開発経験が無い方でも、G...,2025-08-24
23a989c96604ae41aa880e1631694d3f,Ggen_Blog,Cloud Runにおける環境変数の設定について,https://blog.g-gen.co.jp/entry/environment-variables-with-cloud-run,2025-08-20T09:00:00+09:00,G-gen の佐々木です。当記事では Cloud Run における環境変数の設定について解説します。 Cloud Run の環境変数 仕様 暗黙的な環境変数 Dockerfile と重複して定義した場合 環境変数の設定方法 コンソール gcloud CLI --set-env-vars オプション --update-env-vars --env-vars-file オプション 環境変数の削除 YA...,2025-08-24
8f9306903796395634bba6e8c8e30415,Ggen_Blog,Googleフォームの回答がスプレッドシートに同期されない原因と対処法,https://blog.g-gen.co.jp/entry/limit-for-google-forms-spreadsheet-sync,2025-08-19T09:00:00+09:00,G-gen の min です。Google Workspace の Google フォームでは、回答数が上限に達するとリンク先の Google スプレッドシートへデータが同期されなくなることがあります。本記事では、その原因と対処法を解説します。 事象 原因 対処法 その他の上限 事象 本件では、Google フォームで収集した回答を、Google スプレッドシートで集計・分析していました。 フォー...,2025-08-24
