id,source,title,link,published,summary,collected_date
87cf9b20e42b6f6fc18cc607fcf3facc,Business_Insider,カルティエの腕時計がZ世代に人気…中古品販売データで明らかに,https://www.businessinsider.jp/article/2510-cartier-watches-winning-gen-z-shoppers-pre-owned-watch-data/,"Sun, 02 Nov 2025 23:00:00 GMT",カルティエの時計は、テイラー・スウィフトのようなスターに愛され、Z世代の間でも人気が高まっています。実際に中古市場での販売が急増していることが、新たな報告書で示されました。,2025-11-02
3bf714af576f2ac76fc1ff246fe04a1e,Business_Insider,アマゾン、AWSで追加「10％削減」指示の証言。人員削減1.4万人は序章、3万人規模に拡大か,https://www.businessinsider.jp/article/amazon-layoffs-hit-retail-managers-hardest-aws-could-be-next-2025-10/,"Sun, 02 Nov 2025 22:20:00 GMT","アマゾンが10月28日に1万4000人の人員整理を発表、様々な意味で世界を震撼させました。
同社のクラウド事業を担うアマゾン・ウェブ・サービス（AWS）の従業員たちは、自分たちをターゲットとしたさらなる人員削減の可能性を危惧しています。",2025-11-02
0399b6bf717f6f2aeda349c9d57888bb,Business_Insider,高額な「名古屋の嫁入り」でも離婚率は下がらない──「月額制ジムなら行かないと損」は本当に合理的？,https://www.businessinsider.jp/article/gym-marriage-english-the-paradox-of-persistence-a/,"Sun, 02 Nov 2025 22:15:00 GMT",チョコザップではなくエニタイムでジム通いを続ける編集部員。その理由は高い月会費のためと言いますが、果たして本当の意味でのモチベーションとなっているのでしょうか。英会話や結婚生活など継続のために念頭に置くべき経営理論を解説します。,2025-11-02
ac4534e3be6803b66e8137b5f1af69e9,Business_Insider,ワールドシリーズ優勝トロフィーはティファニー製。製作に半年【ドジャース連覇】,https://www.businessinsider.jp/article/2511-mlb-world-series-2025-winner-dodgers-trophy-tiffany/,"Sun, 02 Nov 2025 20:30:00 GMT",WS優勝トロフィーは宝飾ブランドの米ティファニー社が制作を手がけており、同社の公式Webサイトの情報によると、約半年、140時間かけて製作されると言います。,2025-11-02
357b85cf2f57ab196f13c99b78ee386c,Business_Insider,娘のために寮部屋をアレンジしたら、高収入「副業」になった。ミシシッピ州の教師が語る成功談,https://www.businessinsider.jp/article/2510-teacher-side-hustle-getting-paid-design-decorate-college-dorm-rooms/,"Sun, 02 Nov 2025 08:30:00 GMT",ミシシッピ州で教師として働くシェリー・ゲイツ氏（49歳）は、2020年に娘のためにミシシッピ州立大学の寮の部屋をデザイン。その写真を投稿したところ、ほかの母親たちから自分の子供の寮もデザインしてほしいと依頼が来たそうです。,2025-11-02
4cbe84a4bfb5c6de7cddbda69fb45d77,Business_Insider,中国、トラックからシャヘド型ドローンを発射する映像を公開,https://www.businessinsider.jp/article/2510-china-rare-look-shahed-like-drone-asn-301-launcher-truck/,"Sun, 02 Nov 2025 06:00:00 GMT",中国国営メディアが放映した映像には、デルタ翼のASN-301がトラックの発射台からロケット推進で飛び出し、急上昇した後、標的に向かって急降下する様子が映っていました。,2025-11-02
96536b9360f2b89cc806653c2ec38231,Business_Insider,ゴールド（金）は2026年末までに12％下落する…英調査会社が「上昇の主因はFOMO」と指摘,https://www.businessinsider.jp/article/2510-gold-price-today-outlook-bullion-sell-off-record-setting/,"Sat, 01 Nov 2025 23:00:00 GMT",キャピタル・エコノミクスは、ゴールド（金）の価格が2026年末までに最大12％下落すると見ています。この貴金属のFOMO（取り残される恐怖）に支えられた上昇が失速するからです。,2025-11-02
f09280d1b75908bc1918ce34a9bfa9cc,Business_Insider,5つのAIツールが私の人生を変えた…収入は倍増、週に15時間の作業時間を節約,https://www.businessinsider.jp/article/2510-ai-tools-doubled-income-save-me-fifteen-hours-each-week/,"Sat, 01 Nov 2025 23:00:00 GMT",フリーランサー兼起業家が、5つのAIツールを使って6カ月で収入を倍増させ、週に15時間以上節約した方法を共有してくれました。,2025-11-02
b580c9e07b55318d40777319f3033fcc,Business_Insider,【佐藤優】盛り上がっている会議で反対意見を言いづらい。微妙な結果に終わるモヤモヤどうすれば？,https://www.businessinsider.jp/article/282355d/,"Sat, 01 Nov 2025 22:30:00 GMT",「盛り上がっている会議で反対意見を出しにくい」。読者からのお悩みに佐藤優さんが回答。日本の特徴的な組織文化、反対意見を言っても孤立しないために気をつけるべきこととは？,2025-11-02
96aeab60dda06ee2e7df2a09b1ec46c5,Business_Insider,史上最強級ハリケーン「メリッサ」、カリブ海の島国ジャマイカを壊滅させる。衛星画像が明かす「破壊」の全貌,https://www.businessinsider.jp/article/2510-hurricane-melissa-satellite-images-before-and-after-jamaica/,"Sat, 01 Nov 2025 10:00:00 GMT",カリブ海諸国を襲ったハリケーン「メリッサ」は、ジャマイカ全土に壊滅的な被害を与えました。ハリケーン前後の衛星画像は、その破壊の全貌を浮き彫りにしています。,2025-11-02
1c45bef3e420d73d8873690cabaac680,Business_Insider,ハワイで買った約240万円の土地に、5年をかけて小屋を手作り。ミネソタ出身46歳男性の移住計画,https://www.businessinsider.jp/article/2511-gen-xer-hawaii-off-grid-property-construction-slow-life-2024-8/,"Sat, 01 Nov 2025 08:30:00 GMT",,2025-11-02
85bc42a66c84dc50b73d5e629d79d728,Business_Insider,生成はしないけど便利な「Lightroom」のAI新機能,https://www.businessinsider.jp/article/2510-adobe-max-2025-lightroom-update/,"Sat, 01 Nov 2025 08:00:00 GMT",日々Lightroomを使う記者が、Adobe MAX 2025で発表された新機能に注目。派手さはありませんが、写真のピントや表情をAIが点数化し選別を助ける「アシスト選別」。その実用的な魅力に迫ります。,2025-11-02
d79e64a6427629842205313d7bd84a09,Business_Insider,今や面接ではAIについて必ず聞かれる…AIで仕事をより良く、速く、安くこなせることを示す3つのポイント,https://www.businessinsider.jp/article/2510-partner-with-ai-to-get-hired-and-win-job-interview/,"Sat, 01 Nov 2025 06:00:00 GMT",ガブリエラ・フラックスは、求職中の彼女のクライアントが直面する最大の失敗は、面接でAIの話題を避けてしまうことだと話しています。では、どのように話せばよいのでしょうか。,2025-11-02
85aaa5cc8d73085cb508afe25e1688b9,Business_Insider,元日テレ、桝太一アナが「テレビと科学のはざま」に立つワケ…「正しければ伝わる」の幻想,https://www.businessinsider.jp/article/2511-science-communication-masu/,"Sat, 01 Nov 2025 01:50:00 GMT",2022年に日本テレビを退職し、同志社大学で助教として研究者の道を歩み始めた桝太一さん。なぜ、大企業での磐石なキャリアを捨ててまで、「テレビと科学のはざま」に挑戦しようとしたのでしょうか。理由を尋ねました。,2025-11-02
87bfb3f0673d70d1380c351f76aac4bf,Business_Insider,世界の超富裕層は約60兆ドルの資産を保有…近年、その投資先が変化している,https://www.businessinsider.jp/article/2510-how-the-worlds-richest-are-investing-their-60-trillion-fortunes/,"Fri, 31 Oct 2025 23:30:00 GMT",約60兆ドルを手にしている世界の超富裕層は資産を不動産、美術品、インパクト投資へ移しています。アルトラタの2025年のデータを見てみましょう。,2025-11-02
2504010d62ac7843d41f9f29b2130671,Business_Insider,73歳のフィットネス・インストラクターに聞いた、活力を保つ3つの秘訣,https://www.businessinsider.jp/article/2510-73-year-old-trainer-longevity-habits-eat-protein-lift-weights/,"Fri, 31 Oct 2025 23:00:00 GMT",カリフォルニア州の73歳の女性は、40年以上ダンスを教えています。彼女は筋トレ、ガーデニング、そしてタンパク質を摂ることで若々しさを保っているそうです。,2025-11-02
c440a6a916eaed5d686a35bbfe2fcce2,Business_Insider,日野が見せた最新の「働くクルマ」。小型EVトラックと国内初「量産」燃料電池大型トラックの現在地,https://www.businessinsider.jp/article/2511-hinos-japan-mobility-show-2025/,"Fri, 31 Oct 2025 22:30:00 GMT",Japan Mobility Show 2025の商用車系の出展企業のなかから、日野自動車を「EVトラック」と国内初の量産「水素燃料大型トラック」を中心に取り上げます。,2025-11-02
cb6e730146d8eb634ea285c31f71cbb5,Business_Insider,人も資源もない「小国」が、なぜ稼げるのか。日本人が知るべきデンマーク流5つの逆転戦略,https://www.businessinsider.jp/article/denmark-small-country-big-power-a/,"Fri, 31 Oct 2025 22:10:00 GMT",連載『北欧はなぜ「幸福の国」になれたのか』が本になりました。人口も資源も少ない上に、短時間労働──それでも稼ぐ国・デンマークから日本が学ぶべき戦略を考えます。,2025-11-02
26f1cd0ab69b3e201845523dfe84769e,Business_Insider,ANAのCAを辞めて公認会計士試験に合格。「もう遅い」かどうか決めるのは自分じゃない,https://www.businessinsider.jp/article/life-shifter-sunadomemiho/,"Fri, 31 Oct 2025 12:00:00 GMT",「自分らしい選択｣をしてキャリアをシフトさせた砂溜美保さんにインタビュー。客室乗務員から公認会計士試験に合格しスクール講師となるまでを聞きます。,2025-11-02
d00fcb11b939c153534eb5c6e87c9c8c,Business_Insider,グーグル創業者たちの総資産、コストコやバンカメの時価総額を凌駕する。いまや2人で約68兆円に,https://www.businessinsider.jp/article/2510-alphabet-page-brin-google-ai-stock-wealth-billionaires-ellison-musk/,"Fri, 31 Oct 2025 08:30:00 GMT",ラリー・ペイジとセルゲイ・ブリンは、オラクル（Oracle）のラリー・エリソンに次いで今年最も資産を増やした人物です。グーグル（Google）の共同創業者たちは、わずか3カ月でそれぞれの資産を550億ドル（約8兆2500億円）以上増やしました。,2025-11-02
e78b90dd040547b140fe241e1a009b7d,ITmedia_AI_Plus,「赤本AI」爆誕、教学社が実証実験　小論文対策を支援　2026年春に発売へ,https://www.itmedia.co.jp/aiplus/articles/2511/01/news023.html,"Sat, 01 Nov 2025 09:00:00 +0900",大学入試の過去問題集「大学赤本シリーズ」で知られる世界思想社教学社は、生成AIを活用した小論文の学習支援教材「赤本AI」の実証実験を始めると発表した。11月から実証実験を始め、2026年4月をめどに商品として発売する予定。,2025-11-02
3027db933325d65429ec22a665432488,ITmedia_AI_Plus,「@Copilot」でTeamsグループチャットにAI呼び出し可能に　利用手順と注意点,https://www.itmedia.co.jp/enterprise/articles/2511/01/news013.html,"Sat, 01 Nov 2025 08:00:00 +0900",MicrosoftはTeamsのグループチャットでMicrosoft 365 Copilotを利用可能にした。従来の1対1利用から拡張し、会話の要約や質問応答、ドキュメント整理を支援する。利用には条件があり、共有制御や制限も設けられている。,2025-11-02
0d5c15c99623262c33973d58b0fd6965,ITmedia_AI_Plus,プロンプトインジェクションを防御に応用？　シャドーAI対策に新提案,https://www.itmedia.co.jp/enterprise/articles/2511/01/news007.html,"Sat, 01 Nov 2025 07:00:00 +0900",Eye Securityは企業内のシャドーAI問題に対処するため、攻撃技術のプロンプトインジェクションを防御目的に転用する実験を公表した。文書に警告文を埋め込み、AIが自動検出して警告を表示する仕組みで、有効性が確認されている。,2025-11-02
d5962e33243728e02871eaf941fb35f6,ITmedia_AI_Plus,アスクル、顧客情報流出を確認　「なりすましメール」に注意喚起,https://www.itmedia.co.jp/business/articles/2511/01/news026.html,"Sat, 01 Nov 2025 05:00:00 +0900",アスクルは、ランサムウェア感染に起因するシステム障害に関して、保有する情報の一部が外部に流出したことを確認したと発表した。,2025-11-02
1bb45eed3a5499eadf7e6e8906588202,ITmedia_AI_Plus,「作家の尊厳を踏みにじった」――集英社、動画生成AI「Sora 2」に抗議　権利侵害には「厳正な対応」,https://www.itmedia.co.jp/aiplus/articles/2510/31/news143.html,"Fri, 31 Oct 2025 20:07:00 +0900",集英社は、生成AIを利用した権利侵害への対応方針を示す声明を発表した。,2025-11-02
af18313398e91bdda387b45d13897e16,ITmedia_AI_Plus,AI活用の推進だけでは危険　生成AI時代に必須な「セット型ガバナンス」とは？,https://www.itmedia.co.jp/business/articles/2510/31/news123.html,"Fri, 31 Oct 2025 19:15:00 +0900",今や業務でのAI活用は当たり前になりつつある一方、AIをめぐる技術的な不確実性は依然として高く、インシデントも急増している。これから求められるAIガバナンスの考え方とは。,2025-11-02
8049e7e0b1241198c7f4365338bfc343,ITmedia_AI_Plus,講談社やKADOKAWAなど19団体が生成AI巡り共同声明　「Sora 2」問題受け,https://www.itmedia.co.jp/aiplus/articles/2510/31/news130.html,"Fri, 31 Oct 2025 17:32:00 +0900",講談社やKADOKAWAなどの出版社17社と、日本漫画家協会、アニメ制作会社を中心に構成される日本動画協会、“生成AI時代”における創作と権利の考え方をまとめた共同声明を発表した。,2025-11-02
d98c6016698ca20987294ac1dbed4309,ITmedia_AI_Plus,Meta、AIへの投資発表で株価急落　Microsoftも下落,https://www.itmedia.co.jp/news/articles/2510/31/news122.html,"Fri, 31 Oct 2025 16:35:00 +0900",米国株式市場は主要3指数がいずれも下落して終了。ナスダック総合とS＆P総合500種が下げを主導した。人工知能（AI）支出の急増に対する懸念から米Metaや米Microsoftが売られた他、米連邦準備理事会（FRB）の金利見通しを巡る懸念が重しとなった。,2025-11-02
c0a0828dfaf6ab7af260fbcf5075c67b,ITmedia_AI_Plus,GitHub、AIエージェントを統べる「Agent HQ」構想を発表　ClaudeやCodex、Devinなど他社AIエージェントも利用可能に,https://www.itmedia.co.jp/news/articles/2510/31/news112.html,"Fri, 31 Oct 2025 14:30:00 +0900",米GitHubは、10月29日未明（日本時間）から開催中の年次イベント「GitHub Universe 2025」で、新たなビジョンとして「Agent HQ」を発表しました。,2025-11-02
17a07a638fa9b6117195494527067706,ITmedia_AI_Plus,「Gemini 3」は年内リリース予定──Google・ピチャイCEOが投稿,https://www.itmedia.co.jp/aiplus/articles/2510/31/news110.html,"Fri, 31 Oct 2025 14:12:00 +0900",「Gemini 3」は年内リリース予定だ──米Googleのスンダー・ピチャイCEOは10月30日（現地時間）、自身のXアカウント（＠sundarpichai）でそんな投稿をした。,2025-11-02
0577c3edf5d2836ab3b769c96ce5f1fe,ITmedia_AI_Plus,OpenAI、GPT-5搭載のサイバーセキュリティエージェント「Aardvark」発表,https://www.itmedia.co.jp/aiplus/articles/2510/31/news092.html,"Fri, 31 Oct 2025 10:55:00 +0900",OpenAIは、サイバーセキュリティ研究エージェント「Aardvark」を発表した。GPT-5を搭載し、ソースコードを継続的に分析して脆弱性の特定、評価、パッチ提案までを自律的に行う。プライベートβ版として提供を開始した。,2025-11-02
f4961aab197c98f191d1bfb473ea3ef9,ITmedia_AI_Plus,「市場の独占は起きない」　さくらインターネット田中社長が語るAI業界の未来,https://www.itmedia.co.jp/enterprise/articles/2510/31/news063.html,"Fri, 31 Oct 2025 08:00:00 +0900",生成AIは産業構造をどう変えるのか。さくらインターネットと東大発スタートアップneoAIのキーパーソンが「AGI元年」をテーマに未来を語った。IT産業が転換期を迎える中、インフラとアプリ、それぞれの視点から見えた日本のAIの勝ち筋とは。,2025-11-02
889d8edc4c7e6febc57dec287df14e1a,ITmedia_AI_Plus,「2年以内にAIで成果を出さないとクビになる」　CIO／CDOへの圧力が増大か,https://www.itmedia.co.jp/enterprise/articles/2510/31/news029.html,"Fri, 31 Oct 2025 08:00:00 +0900",Dataikuの国際調査の結果から、95％のデータリーダーがAI意思決定の可視性欠如を認め、経営層との認識乖離や責任集中、説明可能性の不足がAI導入停滞の要因となっていることが明らかとなった。,2025-11-02
b08ceb510d1a3bf5f40600fc9b1c2f82,ITmedia_AI_Plus,攻撃者の次の狙いは“AIの中身”　新たなるサプライチェーンリスクに備えよう,https://www.itmedia.co.jp/enterprise/articles/2510/15/news010.html,"Fri, 31 Oct 2025 07:30:00 +0900",「Apache Log4j」の脆弱性など、ソフトウェアサプライチェーンのリスクは多くの企業が知るところだ。しかし注意すべきはそれだけではない。AI時代に本格化の兆しが見える新たなサプライチェーンリスクについて解説する。,2025-11-02
5b9c638100a1ce11ab9a5f706e50f4e8,ITmedia_AI_Plus,CrowdStrikeが7つのAIエージェントを発表　セキュリティ業務はどう変わるか？,https://www.itmedia.co.jp/enterprise/articles/2510/31/news038.html,"Fri, 31 Oct 2025 07:00:00 +0900",クラウドストライクは新製品および製品アップデートを公開した。CrowdStrike FalconプラットフォームにAIエージェントを組み込み、セキュリティ業務の大幅な効率化を実現するという。,2025-11-02
508b3eb9898ed74c50739f31f838d8f6,ITmedia_AI_Plus,Python 3.14新機能：PyREPL（対話型シェル）に追加された構文ハイライト機能とそのカスタマイズ,https://atmarkit.itmedia.co.jp/ait/articles/2510/31/news027.html,"Fri, 31 Oct 2025 05:00:00 +0900",Python 3.14ではPyREPLやモジュールのヘルプなどで、構文がハイライト表示されるようになりました。その概要とカスタマイズの方法について見てみましょう。,2025-11-02
d6a0b0fdb944e8c234962277ddbb7962,ITmedia_AI_Plus,人型ロボット、日本の物流倉庫で働く　山善が実証実験　人型にこだわる理由は？,https://www.itmedia.co.jp/aiplus/articles/2510/30/news110.html,"Thu, 30 Oct 2025 17:35:00 +0900",山善は、物流倉庫における人型ロボット導入の実証実験の様子を公開した。デモンストレーションでは、人型ロボットがぬいぐるみをピックアップする姿を披露した。,2025-11-02
c748774c23a7f57976a9af0cf2f14358,ITmedia_AI_Plus,TBS、ドラマ「VIVANT」続編に動画生成AI　「Veo 3」の映像を採用へ　地上波放送のドラマで初,https://www.itmedia.co.jp/aiplus/articles/2510/30/news102.html,"Thu, 30 Oct 2025 16:02:00 +0900",TBSは、現在制作中のテレビドラマ「VIVANT」続編に、動画生成AI「Veo 3」の映像を採用すると発表した。,2025-11-02
6a888754cbff267e323bc3f624688898,ITmedia_AI_Plus,「AI動画ではない」証明　ソニー、動画対応の真正性証明技術を報道機関向けに提供,https://www.itmedia.co.jp/aiplus/articles/2510/30/news099.html,"Thu, 30 Oct 2025 15:47:00 +0900",ソニーは、動画に対応した真正性証明技術を開発し、業界で始めて、同技術を活用した真正性カメラソリューションの提供を報道機関向けに開始する。,2025-11-02
35a6be2f35c4024302abe1d98b479909,ITmedia_AI_Plus,「Claude」のAnthropic、東京オフィスを開設　アモデイCEOが高市総理と面会,https://www.itmedia.co.jp/news/articles/2510/30/news084.html,"Thu, 30 Oct 2025 12:40:00 +0900",「Claude」を手掛ける米Anthropicが、アジア太平洋地域で初となる東京オフィスを開設した。これに合わせ、ダリオ・アモデイ最高経営責任者（CEO）が高市早苗総理大臣と会談し、AIの安全性評価手法を検討する日本の政府機関「AIセーフティ・インスティテュート」（AISI）と、AI評価手法に関する協力の覚書に署名した。,2025-11-02
d704c194f40cf296b97fa23f79888319,Hatena_IT,就職せずに自己資本でクラスメソッドを起業して21年掛けて年商950億円になった話,https://speakerdeck.com/satoshi7/classmethod-20251018,,,2025-11-02
f74d15b77e914455dc9ed14a0d681c4c,Hatena_IT,ノア・スミス「AI がちょっぴり期待外れになるどうかにアメリカの未来はかかってるのかも」（2025年10月12日）｜経済学101,https://note.com/econ101_/n/nb73c3aba3bee,,Photo by Siddhant Kumar on Unsplashアメリカ経済の支柱がひとつ倒れたら，トランプ政権は大コケするだろういま大勢の人たちの脳裏でざわついている問題といえば，これだ：「なんでアメリカ経済は持ちこたえてるんだろう？」 トランプ関税で製造業は大打撃を受けているし，雇用統計の数字もふるわないし，消費者感情は2...,2025-11-02
b1c016834b1575ceea45bae34976917f,Hatena_IT,もうワシITエンジニア生命終わったかもしれん。IT勉強会行きたいって思わないもん。息子とマリカーしたいし、休みの日は試験勉強じゃなくて遊びたいんだよな子供と→第二部が始まったんだ,https://posfie.com/@kalofollow/p/dBakngb,,夏目葉太🦈2025/02から第2子育休中 @infragirl644 #インフラ女子の日常 の人。旧名：なつよ。北陸ド田舎インフラエンジニア。エッセイ漫画やイラストを描いたりしてましたが、最近は娘と息子に振り回される日々。K13改→RX-8→MAZDA2 Sport 青空は infragirl755.bsky.social natsuyo.net 夏目葉太🦈2025/02から第2子育休中...,2025-11-02
84fbdd348a4b27b136e2476b7a56b5d8,Hatena_IT,土地代で45億稼ぐ科学大、クラファンでトイレ改修する金沢大…国立大学「金策」の明暗｜楽待不動産投資新聞,https://www.rakumachi.jp/news/column/385270,,「2026年度から75年間、年45億円の土地貸付料収入」 これは東京科学大学（旧東京工業大学・東京医科歯科大学）が、保有している田町キャンパスの土地再活用を行うにあたり、開発事業者から今後受け取る土地貸付料収入だ。 2021年、旧東京工業大学が田町キャンパスの再開発にかかる事業協定書の締結を発表し、その金額の...,2025-11-02
ca18b1dd36bee8d290d1e823902ee38d,Hatena_IT,Google、誰でも学べるAI学習サイト「Google Skills」を正式公開──Cloud・DeepMind・教育部門を横断する3000講座を展開 | Ledge.ai,https://ledge.ai/articles/google_skills_ai_learning_platform_launch,,Top > ラーニング > Google、誰でも学べるAI学習サイト「Google Skills」を正式公開──Cloud・DeepMind・教育部門を横断する3000講座を展開,2025-11-02
47c64e9c3cc61ec57bcd95591f08253c,Hatena_IT,設計に疎いエンジニアでも始めやすいアーキテクチャドキュメント,https://speakerdeck.com/phaya72/she-ji-nishu-ienziniademoshi-meyasuiakitekutiyadokiyumento,,Kome Kaigi 2025 で登壇させていただいた際の資料です。 https://komekaigi.dev/,2025-11-02
6a53915dcdd3cc9c0fb733bf8fbbbc25,Hatena_IT,OSS監視ツール徹底比較【2025年版】：あなたの環境に最適な選択はどれか - Qiita,https://qiita.com/keitah/items/70e6b63e4c504b4796fa,,これにより、柔軟なクエリとアグリゲーションが可能になります。 強み 1. Kubernetes / マイクロサービスへの最適化 ネイティブ統合: Kubernetes環境では、PodやServiceの自動検出が可能 動的環境対応: コンテナの追加・削除に自動で対応 高カーディナリティ: 大量のラベルを持つメトリクスを効率的に処理 2. 強力なクエ...,2025-11-02
8bc000a10cd571bf18d2ded6d2103ddd,Hatena_IT,5つのAIツールが私の人生を変えた…収入は倍増、週に15時間の作業時間を節約 | Business Insider Japan,https://www.businessinsider.jp/article/2510-ai-tools-doubled-income-save-me-fifteen-hours-each-week/,,ジェシカ・カミレリ＝シェルトンによると、AIツールにはそれぞれ得意分野があり、ChatGPTがすべてに最適というわけではないという。Jessica Camilleri-Shelton ジェシカ・カミレリ＝シェルトンは、コピーライターの仕事と自分で立ち上げたビジネスにAIを活用することで収入を倍増させた。彼女はChatGPTやClaudeといったA...,2025-11-02
