id,source,title,link,published,summary,collected_date
51ed1c60dc80a96cae33ae515ec7213e,GCP_Blog,Zero-shot forecasting in BigQuery with the TimesFM foundation model,https://cloud.google.com/blog/products/data-analytics/bigquery-ml-timesfm-models-now-in-preview/,"Wed, 09 Jul 2025 16:00:00 +0000","Accurate time-series forecasting is essential for many business scenarios such as planning, supply chain management, and resource allocation. BigQuery now embeds TimesFM, a state-of-the-art pre-traine...",2025-07-13
06cc28116e972ef6da871409f282c6d7,GCP_Blog,Strengthening network resilience with the Sol transatlantic cable,https://cloud.google.com/blog/products/infrastructure/announcing-sol-transatlantic-cable/,"Wed, 09 Jul 2025 10:00:00 +0000","Today, we’re announcing Sol, a new transatlantic subsea cable system to connect the U.S., Bermuda, the Azores, and Spain. Sol translates to “sun” in Spanish and Portuguese, a nod to the cable system’s...",2025-07-13
4ad87efdfbda48a50bbe2ebb5090608b,GCP_Blog,"London Summit: agentic AI leaders, training 100,000 civil servants, AI sovereignty, and more",https://cloud.google.com/blog/topics/inside-google-cloud/london-summit-2025-gen-ai-agents-transforming-business-civil-service/,"Wed, 09 Jul 2025 08:00:00 +0000","There’s a buzz of excitement here at Tobacco Dock as we welcome our customers and partners to the Google Cloud Summit London. Together, we’re exploring the essential role Google Cloud is playing in dr...",2025-07-13
49d517d3dce5b8dcdb9b2fa7c0f2bad1,GCP_Blog,Accelerate your AI workloads with the Google Cloud Managed Lustre,https://cloud.google.com/blog/products/storage-data-transfer/google-cloud-managed-lustre-for-ai-hpc/,"Tue, 08 Jul 2025 17:00:00 +0000","Today, we're making it even easier to achieve breakthrough performance for your AI/ML workloads: Google Cloud Managed Lustre is now GA, and available in four distinct performance tiers that deliver th...",2025-07-13
c04a3c313051f0a83618fd501a1327b3,GCP_Blog,Expanding Z3 family with 9 new VMs and a bare metal instance for storage and I/O intensive workloads,https://cloud.google.com/blog/products/compute/expanded-z3-vm-portfolio-for-io-intensive-workloads/,"Tue, 08 Jul 2025 16:00:00 +0000","Today, we are thrilled to announce the expansion of the Z3 Storage Optimized VM family with the general availability of nine new Z3 virtual machines that offer local SSD capacity ranging from 3 TiB to...",2025-07-13
b5a9ab5c74c4edd55d6ba69acbb38310,GCP_Blog,Google is a Leader in the 2025 Gartner® Magic Quadrant™ for Search and Product Discovery,https://cloud.google.com/blog/products/ai-machine-learning/gartner-magic-quadrant-for-search-and-product-discovery/,"Tue, 08 Jul 2025 16:00:00 +0000","We’re thrilled to announce that Google has been named a Leader in the Gartner® Magic Quadrant™ for Search and Product Discovery.
We believe this recognition affirms Google’s evolving commitment to del...",2025-07-13
ccf56f1a0b8a12443441258dbde1eb69,GCP_Blog,Announcing Vertex AI Agent Engine Memory Bank available for everyone in preview,https://cloud.google.com/blog/products/ai-machine-learning/vertex-ai-memory-bank-in-public-preview/,"Tue, 08 Jul 2025 16:00:00 +0000","Developers are racing to productize agents, but a common limitation is the absence of memory. Without memory, agents treat each interaction as the first, asking repetitive questions and failing to rec...",2025-07-13
8d173094934d6cbc896a35da0cc97a15,GCP_Blog,Google Public Sector supports AI-optimized HPC infrastructure for researchers at Caltech,https://cloud.google.com/blog/topics/public-sector/google-public-sector-supports-ai-optimized-hpc-infrastructure-for-researchers-at-caltech/,"Tue, 08 Jul 2025 13:00:00 +0000","For decades, institutions like Caltech, have been at the forefront of large-scale artificial intelligence (AI) research. As high-performance computing (HPC) clusters continue to evolve, researchers ac...",2025-07-13
a1dfa47d242fba3b807a0070020bb8f4,GCP_Blog,Formula E accelerates its work with Google Cloud Storage and Google Workspace,https://cloud.google.com/blog/products/ai-machine-learning/formula-e-accelerates-its-work-with-google-cloud-storage-and-google-workspace/,"Tue, 08 Jul 2025 08:00:00 +0000","In the high-speed world of global motorsport, operational efficiency and technological innovation are as critical off the track as they are on it. And when it comes to innovating in the field, Formula...",2025-07-13
42aeb899191191e83fb1f3b7b158720b,GCP_Blog,This migration from Snowflake to BigQuery accelerated model building and cut costs in half,https://cloud.google.com/blog/products/data-analytics/smarterx-migrating-to-bigquery-from-snowflake-cut-costs-in-half/,"Mon, 07 Jul 2025 16:00:00 +0000","In 2024, retail sales for consumer packaged goods were worth $7.5 trillion globally. Their sheer variety — from cosmetics to clothing, frozen vegetables to vitamins  — is hard to fathom. And distribut...",2025-07-13
3644ec1c53d5e928b24dc806424947a8,GCP_Japan,安心して会話: Looker の会話分析のセキュリティを解説,https://cloud.google.com/blog/ja/products/business-intelligence/understanding-looker-conversational-analytics-security/,"Fri, 11 Jul 2025 03:00:00 +0000","※この投稿は米国時間 2025 年 7 月 8 日に、Google Cloud blog に投稿されたものの抄訳です。
ビジネス インテリジェンスは急速な進化を遂げており、AI を活用した、優れたセルフサービス機能と自然言語機能への期待はますます高まっています。Looker の会話分析は、データに内在する豊富な情報を、組織の誰もが活用できるようにするツールです。調べたいデータを選び、同僚に話すよう...",2025-07-13
7317dcfd71baa6ec521fd4e11b42db4c,GCP_Japan,Vertex AI Agent Engine Memory Bank のプレビュー版が一般提供開始,https://cloud.google.com/blog/ja/products/ai-machine-learning/vertex-ai-memory-bank-in-public-preview/,"Fri, 11 Jul 2025 02:00:00 +0000","※この投稿は米国時間 2025 年 7 月 9 日に、Google Cloud blog に投稿されたものの抄訳です。
デベロッパーはエージェントの製品化に向けてしのぎを削っていますが、記憶機能の欠如による制限にしばしば遭遇します。記憶機能がない場合、エージェントは個々のインタラクションを空白の状態から始めるため、同じ質問を繰り返したり、ユーザーの好みを思い出せなかったりします。コンテキストを認識...",2025-07-13
56b8ee8637f688874c12f2290084bfed,GCP_Japan,Google Cloud Managed Lustre で AI ワークロードを加速,https://cloud.google.com/blog/ja/products/storage-data-transfer/google-cloud-managed-lustre-for-ai-hpc/,"Fri, 11 Jul 2025 02:00:00 +0000","※この投稿は米国時間 2025 年 7 月 9 日に、Google Cloud blog に投稿されたものの抄訳です。
このたび、AI / ML ワークロードで画期的なパフォーマンスをより簡単に実現できるようになりました。Google Cloud Managed Lustre が一般提供され、4 つの異なるパフォーマンス ティアで利用できるようになりました。各ティアでは容量 1 TiB あたり 1...",2025-07-13
95a7d7b8a95b5130516190f3cc5603bf,GCP_Japan,革新的な技法: Aviatrix Controller でのリモートコード実行,https://cloud.google.com/blog/ja/topics/threat-intelligence/remote-code-execution-aviatrix-controller/,"Thu, 10 Jul 2025 01:04:00 +0000","※この投稿は米国時間 2025 年 6 月 24 日に、Google Cloud blog に投稿されたものの抄訳です。
このブログ投稿では、「初期アクセス ブローカー」アプローチをシミュレートした Mandiant のレッドチームのケーススタディを紹介します。このアプローチにより、さまざまなクラウド ベンダーとリージョン間のリンクを作成できるソフトウェア定義ネットワーク（SDN）ユーティリティで...",2025-07-13
a904e6a42841832efb6d53af16b29c82,GCP_Japan,監査をスマートに: Google Cloud の Recommended AI Controls フレームワークのご紹介,https://cloud.google.com/blog/ja/products/identity-security/audit-smarter-introducing-our-recommended-ai-controls-framework/,"Thu, 10 Jul 2025 01:03:00 +0000","※この投稿は米国時間 2025 年 6 月 26 日に、Google Cloud blog に投稿されたものの抄訳です。
組織が新しい生成 AI アプリケーションや AI エージェントを構築してビジネス ワークフローの自動化に取り組むなかで、セキュリティ管理やリスク管理のリーダーは新たなガバナンスの課題に直面しています。AI モデルや AI エージェントは複雑で、不透明な性質を持つことが多いうえに...",2025-07-13
35e4c209bbc8ccf76930968cbbaca956,GCP_Japan,BigQuery ObjectRef のご紹介: マルチモーダル データと AI 処理の強化,https://cloud.google.com/blog/ja/products/data-analytics/new-objectref-data-type-brings-unstructured-data-into-bigquery/,"Thu, 10 Jul 2025 01:02:00 +0000","※この投稿は米国時間 2025 年 6 月 26 日に、Google Cloud blog に投稿されたものの抄訳です。
従来のデータ ウェアハウスは、今日の分析ワークロードにまったく対応できていません。今や生成されるデータのほとんどが非構造化データであり、マルチモーダル（ドキュメント、音声ファイル、画像、動画）であるのがその理由です。非構造化データのクリーニングと変換は複雑で、これまでは非構造化...",2025-07-13
f46100461e0e24a5cc5add5600b6369a,GCP_Japan,セキュリティ分析プラットフォームを評価する The Forrester Wave が Google を「Strong Performer」に選出,https://cloud.google.com/blog/ja/products/identity-security/google-named-a-strong-performer-in-the-forrester-wave-for-security-analytics-platforms/,"Thu, 10 Jul 2025 01:01:00 +0000","※この投稿は米国時間 2025 年 6 月 26 日に、Google Cloud blog に投稿されたものの抄訳です。
Google は、初めて参加した The Forrester Wave™: Security Analytics Platforms, Q2 2025 で「Strong Performer」に選出されました。このレポートで評価されている Google Cloud のビジョンは、...",2025-07-13
2de696bc6b8b6352da657afb195b0be9,GCP_Japan,AI と IoT を利用した医療機関における患者のプライバシー保護とインシデント検出の両立,https://cloud.google.com/blog/ja/topics/healthcare-life-sciences/detecting-hospital-incidents-with-ai-without-compromising-patient-privacy/,"Thu, 10 Jul 2025 01:00:00 +0000","※この投稿は米国時間 2025 年 6 月 25 日に、Google Cloud blog に投稿されたものの抄訳です。
医療機関は私たちの健康維持に不可欠な存在ですが、ストレスや不安の原因となる可能性もあります。医療機関を、患者だけでなく、患者ケアに取り組んでいる献身的なスタッフにとっても、より安全かつ効率的な場にできれば……？テクノロジーによって、転倒の予測や、異変が表れる前の未然の察知など、...",2025-07-13
b05449a337a341459cc9d9caa25f1482,GCP_Japan,Spanner の永続的な影響: 2025 ACM SIGMOD Systems Award の受賞,https://cloud.google.com/blog/ja/products/databases/spanner-wins-the-2025-acm-sigmod-systems-award/,"Tue, 08 Jul 2025 03:00:00 +0000","※この投稿は米国時間 2025 年 6 月 18 日に、Google Cloud blog に投稿されたものの抄訳です。
今年に入り、Association for Computing Machinery's Special Interest Group on Management of Data（ACM SIGMOD）は、Google のグローバル分散型データベースである Spanner が 2...",2025-07-13
9650b3be62b5294eac6823c69e282e72,GCP_Japan,Cloud Run ワーカープールで Kafka ワークロードのスケーリングを簡単に,https://cloud.google.com/blog/ja/products/serverless/exploring-cloud-run-worker-pools-and-kafka-autoscaler/,"Tue, 08 Jul 2025 02:20:00 +0000","※この投稿は米国時間 2025 年 6 月 27 日に、Google Cloud blog に投稿されたものの抄訳です。
Apache Kafka は、多くのイベント ドリブン アーキテクチャとストリーミング データ パイプラインに不可欠です。しかし、Kafka トピックからのデータを処理するアプリケーションである Kafka コンシューマーを効果的にスケールするのは容易ではありません。
今回は、...",2025-07-13
b94b7683b7ddca48b9eef7e68f122627,GCP_Japan,Eon と Google Cloud のバックアップを使用して自動化された大規模なデータ レジリエンスを実現,https://cloud.google.com/blog/ja/products/storage-data-transfer/data-resilience-eons-approach--google-cloud-best-practices/,"Tue, 08 Jul 2025 02:00:00 +0000","※この投稿は米国時間 2025 年 6 月 19 日に、Google Cloud blog に投稿されたものの抄訳です。
かつて、クラウドのバックアップは保険のようなものと考えられていました。しかし今では、バックアップの役割はデータの復元だけにとどまりません。デフォルトで自律性があり、コスト効率に優れ、分析に対応している必要があります。
そこで、Eon は Google Cloud と連携するプラ...",2025-07-13
e77778d1fded9d23bde43fc7ee02f40d,GCP_Japan,Schroders によるマルチエージェント型の財務分析リサーチ アシスタントの構築,https://cloud.google.com/blog/ja/topics/customers/how-schroders-built-its-multi-agent-financial-analysis-research-assistant/,"Tue, 08 Jul 2025 02:00:00 +0000","※この投稿は米国時間 2025 年 6 月 26 日に、Google Cloud blog に投稿されたものの抄訳です。
財務アナリストは、膨大な市場や企業データの分析、そしてその分析結果を使用した重要なシグナルの抽出や多様なデータソースの統合、企業調査の作成に多くの時間を取られています。Schroders は、世界有数のアクティブ運用会社です。アクティブ マネージャーであるということは、綿密な調...",2025-07-13
5d1529138f71dd4efce95c11a67d736d,GCP_Japan,Cloud WAN の仕組み: 差別化されたネットワーキング機能の詳細,https://cloud.google.com/blog/ja/products/networking/cloud-wan-networking-for-third-party-services/,"Tue, 08 Jul 2025 01:30:00 +0000","※この投稿は米国時間 2025 年 6 月 28 日に、Google Cloud blog に投稿されたものの抄訳です。
現在の急速に変化するデジタル環境では、企業は Google Cloud 上でさまざまなネットワーキング ベンダーやネットワーク セキュリティ ベンダーと連携してネットワークを構築することを選択しています。その理由は明らかです。Google Cloud は、トップクラスのサービス...",2025-07-13
9359f2a109e3769aa09cea40c4dba233,GCP_Japan,エージェントを作り上げるツール: ADK を使用してゼロからアシスタントを作成,https://cloud.google.com/blog/ja/topics/developers-practitioners/tools-make-an-agent-from-zero-to-assistant-with-adk/,"Tue, 08 Jul 2025 01:00:00 +0000","※この投稿は米国時間 2025 年 6 月 27 日に、Google Cloud blog に投稿されたものの抄訳です。
あなたは、世界的なコーヒー メーカー企業である QuantumRoast のプロジェクト マネージャーです。







  
    
      
  

    <figure class=""article-image--large
      
      
    ...",2025-07-13
d617672a97ae0b1bcdc9a24045d5feb8,GCP_Japan,Zephr.xyz: Google Cloud を使用して Android 上でリアルタイムの GNSS 精度を向上,https://cloud.google.com/blog/ja/products/networking/reimagining-gps-zephr-powers-real-time-gnss-precision-on-the-cloud/,"Tue, 08 Jul 2025 00:00:00 +0000","※この投稿は米国時間 2025 年 6 月 19 日に、Google Cloud blog に投稿されたものの抄訳です。
地図上の小さな青い点が、現在地を正確に示していないという状況は、誰しも経験があるのではないでしょうか。ライドシェアの相手が道路の反対側に到着したり、運転中に曲がり角を間違えたり、朝のランニングで負かしたはずの友人がフィットネス トラッキング アプリで自分よりも速いタイムを記録し...",2025-07-13
6c819d9f165f6d6c128f424703fa35bd,GCP_Japan,UNC3944 に対する防御: 最前線からのサイバー犯罪対策強化ガイダンス,https://cloud.google.com/blog/ja/topics/threat-intelligence/unc3944-proactive-hardening-recommendations/,"Sun, 06 Jul 2025 01:06:00 +0000","背景
※この投稿は米国時間 2025 年 5 月 7 日に、Google Cloud blog に投稿されたものの抄訳です。
UNC3944 は、金銭目的の脅威アクターであり、その活動には Scattered Spider に関する公開報告との一致が見られます。ソーシャル エンジニアリングを執拗に使用し、大胆な方法で被害者にコンタクトを取ることが特徴です。UNC3944 は当初、SIM スワップ攻...",2025-07-13
7d7e48a064ce097dd2f4f684cddee713,GCP_Japan,Gemini 2.5 を使用して Vertex AI で動画をファインチューニングする方法,https://cloud.google.com/blog/ja/products/ai-machine-learning/how-to-fine-tune-video-outputs-using-vertex-ai/,"Fri, 04 Jul 2025 01:08:00 +0000","※この投稿は米国時間 2025 年 6 月 25 日に、Google Cloud blog に投稿されたものの抄訳です。
Google は先日、Vertex AI での Gemini 2.5 の一般提供開始を発表しました。今回のアップデートではチューニング機能が拡張され、テキストだけでなく画像、音声、動画も Vertex AI の入力としてチューニングできるようになりました。
教師ありファインチュ...",2025-07-13
a6d6d73eec8e8b004550690ff57e4770,GCP_Japan,Mandiant M-Trends 2025: 公共機関にとって重要な 3 つの分析情報,https://cloud.google.com/blog/ja/topics/public-sector/mandiant-m-trends-2025-3-key-insights-for-public-sector-agencies/,"Fri, 04 Jul 2025 01:04:00 +0000",※この投稿は米国時間 2025 年 5 月 28 日に、Google Cloud blog に投稿されたものの抄訳です。サイバー防御と脅威ランドスケープは、防御をかいくぐるための戦術を刷新し続けている脅威アクターに対して、継続的に適応していく必要があります。カスタム マルウェア、ゼロデイ攻撃、高度な回避手法など、攻撃者のアプローチが巧妙化している場合もありますが、成功した攻撃すべてが必ずしも複雑ま...,2025-07-13
8591a7f68e3b764f70f107583f8009f5,GCP_Japan,カレンダーを悪用した C2 : APT41 の革新的な戦術,https://cloud.google.com/blog/ja/topics/threat-intelligence/apt41-innovative-tactics/,"Fri, 04 Jul 2025 01:02:00 +0000","※この投稿は米国時間 2025 年 5 月 29 日に、Google Cloud blog に投稿されたものの抄訳です。
Google Threat Intelligence グループ（GTIG）の使命は、Google の何十億ものユーザーと Google の多種多様なプロダクトやサービスを保護することです。2024 年 10 月下旬、GTIG は、政府のウェブサイトが悪用されていることを発見しま...",2025-07-13
894518633013f7cc5abbdb935f7a5034,GCP_Japan,通話の代償: ビッシングから始まるデータ恐喝,https://cloud.google.com/blog/ja/topics/threat-intelligence/voice-phishing-data-extortion/,"Fri, 04 Jul 2025 01:00:00 +0000","※この投稿は米国時間 2025 年 6 月 5 日に、Google Cloud blog に投稿されたものの抄訳です。
 
はじめに
Google Threat Intelligence グループ（GTIG）は UNC6040 を追跡しています。UNC6040 は、組織の Salesforce インスタンスを侵害して大規模なデータ窃取とその後の恐喝を目的として特別に設計された音声フィッシング（ビッ...",2025-07-13
39ddfe2e58eaeb8791cb9aee4d56be55,Ggen_Blog,GeminiとGoogle Workspaceを連携する方法,https://blog.g-gen.co.jp/entry/connect-gemini-with-google-workspace,2025-07-11T09:00:00+09:00,G-gen の横澤です。Gemini アプリの Google Workspace Apps を利用することで、Gemini アプリを Google カレンダーや Google ToDo リストと連携し、業務効率を高めることができます。 概要 Google Workspace Apps とは 有効化方法 Google カレンダーとの連携でできること 予定の検索・取得 予定の追加 時間の分析 Goog...,2025-07-13
f107a3059a3c82978943f9fdda66bd3f,Ggen_Blog,Compute Engine VMのgce_workload_cert_refreshプロセスで404エラー,https://blog.g-gen.co.jp/entry/gce-workload-cert-refresh-error,2025-07-10T09:00:00+09:00,G-gen の高井（Peacock）です。Compute Engine (GCE) VM に Ops エージェントのインストールを試みた際、gce_workload_cert_refresh というプロセスから HTTP 404 エラーがログに出力され Ops エージェントのインストールが失敗する事象について、その原因と対処法を解説します。本記事ではまず Ops エージェントについて簡単に触れ、そ...,2025-07-13
3f1e023b190a34600a401354cf5bed0e,Ggen_Blog,メダリオンアーキテクチャ2.0とGoogle CloudのAIエージェント活用,https://blog.g-gen.co.jp/entry/medallion-architecture-2-0-with-google-cloud,2025-07-09T09:00:00+09:00,G-genの杉村です。当記事では、AI エージェント時代に対応する次世代データ基盤アーキテクチャとして「メダリオンアーキテクチャ 2.0」と、その中核をなす「プラチナレイヤー」をGoogle Cloudで実現する方法を解説します。 はじめに 概要 メダリオンアーキテクチャとは AI エージェント時代のメダリオンアーキテクチャ アーキテクチャ メダリオンアーキテクチャ（従来） メダリオンアーキテクチ...,2025-07-13
6dc0ae19169ee6c772b4b4c80b92fc0d,Ggen_Blog,Google CloudのMarketplace Channel Private Offer（MCPO）を解説,https://blog.g-gen.co.jp/entry/marketplace-channel-private-offer-explained,2025-07-08T09:00:00+09:00,G-gen の向井です。当記事では、Google Cloud Marketplace のサードパーティ製ソフトウェアを、G-gen のような販売パートナー経由で購入できる Marketplace Channel Private Offer（MCPO）を解説します。 Google Cloud Marketplace とは プライベートな購入方法 プライベートオファーとは Marketplace Ch...,2025-07-13
e3cbc9b975ad9b6cf5faad07f06ac783,Ggen_Blog,Looker Studioでフィルタを適用したレポートを共有する方法,https://blog.g-gen.co.jp/entry/sharing-looker-studio-report-with-filter,2025-07-07T09:00:00+09:00,G-genの min です。Looker Studio には、フィルタや期間などを適用した特定の表示状態を URL として保存・共有する機能があります。本記事では、特定の表示状態を保存・共有するための「レポートの現在のビューにリンクする」と「カスタム ブックマーク リンク」という2つの機能について、設定方法から利用例まで解説します。 概要 レポートの現在のビューにリンクする（手動生成） 概要 設定...,2025-07-13
67b44203afd6dd87053026d4d61e0d4d,Ggen_Blog,Looker Studioの「レポートの公開設定」でバージョンを管理する方法,https://blog.g-gen.co.jp/entry/looker-studio-publish-settings,2025-07-04T09:00:00+09:00,G-gen の min です。Looker Studio のレポートの公開設定は、レポートに加えた変更が閲覧者に表示されるタイミングを制御する機能です。この機能を利用して、レポートのバージョンを管理する方法を解説します。 概要 使用方法 公開設定を有効にする 変更内容を公開する 下書き版と公開版を切り替えて表示する バージョンの仕組み バージョン履歴との連携 レポートコピー時の挙動 概要 レポート...,2025-07-13
8dbd7d272585679d9ed9cb51a92bc7bb,Ggen_Blog,Cloud Run worker poolsを徹底解説！,https://blog.g-gen.co.jp/entry/cloud-run-worker-pools-explained,2025-07-03T09:00:00+09:00,G-gen の佐々木です。当記事では、Google Cloud のサーバーレス コンテナサービスである Cloud Run の機能の一つ、Cloud Run worker pools について解説します。 注意点 Cloud Run worker pools とは 概要 ユースケース Cloud Run services と共通の仕様 リビジョン単位の管理 CPU、メモリ容量の制限 ボリュームマウ...,2025-07-13
cad5298496cd86f09a90432495da0ca3,Ggen_Blog,Looker StudioとBigQuery連携で予想外のコスト増加の原因となる2つの挙動,https://blog.g-gen.co.jp/entry/looker-studio-bigquery-cost-saving-tips,2025-07-02T09:00:00+09:00,G-gen の min です。Looker Studio から BigQuery をデータソースとして利用する際、意図しない挙動により BigQuery の利用料金が高額になるケースがあります。本記事では、特に CURRENT_DATE() のような非決定性関数を使用した場合のキャッシュの扱いや、プルダウンリストのコントロールによるクエリ発行時に注意が必要な挙動がありました。その共有と対策を解説し...,2025-07-13
