id,source,title,link,published,summary,collected_date
2a18b102ce3a05449e509149b484ca29,Business_Insider,AIチャットボットがホワイトカラーの就職面接でも活用され始めている,https://www.businessinsider.jp/article/2607-ai-bot-job-interview-white-collar-work/,"Fri, 24 Jul 2026 23:00:00 GMT",人材採用の際、応募者の一次選考にチャットボットを活用する動きが、時給制の職種以外にも広がっています。企業側は、これにより従来よりも多くの応募者を選考対象にできるようになったと説明しています。,2026-07-24
999ba164e591daba22d42c78b0310455,Business_Insider,テスラの2Q決算発表に違和感。マスク氏はネガティブ発言を連発、発音不明瞭で「体調が優れない」と,https://www.businessinsider.jp/article/cutting-edge-20260724-tesla-2q-earnings-negative-mentions/,"Fri, 24 Jul 2026 00:55:00 GMT",昨日公開の記事では、イーロン・マスク氏率いるテスラ（Tesla）について、個人投資家のマスク氏関連銘柄に向けられる関心がテスラからスペースX（SpaceX）に移ったことを主な要因の一つとして、決算発表が「盛り上がりに欠ける」ことを指摘しましたが、実際、アナリスト向け説明会の現場にもそんな雰囲気が満ちていたように思います。,2026-07-24
76d709b41d65a0b01a5640283608ee29,Business_Insider,「会議出席者は“ピザ2枚”」の時代は終わった。ビジネスとテック界の8人のトップ経営者がチーム規模について語っていること,https://www.businessinsider.jp/article/2607-ai-workforce-changes-team-size-pizza-rule/,"Thu, 23 Jul 2026 21:35:00 GMT",ジェフ・ベゾスは「2枚のピザルール」を実践していたことで有名ですが、AIのおかげで、大規模なチームが必要だった時代は終わったのかもしれません。,2026-07-24
67f3e23c845691279546dfe3abe65257,Business_Insider,一生に一度は見たい、マグリットの奇妙な傑作（宇都宮美術館）,https://www.businessinsider.jp/article/daikazoku_must-see-in-a-lifetim/,"Fri, 24 Jul 2026 12:00:00 GMT",社会人の教養として「一生に一度は見たい美術品」をご紹介。今回は宇都宮美術館が所蔵するルネ・マグリットの《大家族》を取り上げます。,2026-07-24
c67ccf6504175d61ba7eb9ad992e84e0,Business_Insider,スティーブ・ジョブズは細部にこだわっていたが、彼ほど権限委譲に長けたリーダーはいなかった,https://www.businessinsider.jp/article/2607-former-apple-executive-ron-johnson-steve-jobs-delegation/,"Fri, 24 Jul 2026 10:00:00 GMT",ロン・ジョンソン氏は、約12年間にわたるアップル在籍中、350店舗のApple Storeの開設を統括しました。,2026-07-24
67c85d663171c0ce83b34e8557aabf03,Business_Insider,鳥貴族、三井住友トラストG……8月に「株式分割」を実施する8銘柄リスト。各社のファンダメンタルズも解説する,https://www.businessinsider.jp/article/2607-list-of-8-stocks-with-a-stock-split-around-august-1/,"Fri, 24 Jul 2026 08:30:00 GMT",日経平均株価は7月以降、下落し続け、現在は6万円台中盤を推移。それでも、いまだ高水準と言えるため、最低投資金額が50万円を超える銘柄は多いです。そんななか、8月1日に株式分割を実施する8銘柄の特徴について解説していきます。,2026-07-24
84df1c024489ad34749c856705b91c5d,Business_Insider,中国の新型AIモデル「Kimi K3」について、テック業界と学術界の識者はどう見ているのか,https://www.businessinsider.jp/article/2607smart-people-saying-chinas-hot-new-kimi-k3-ai-model/,"Thu, 23 Jul 2026 21:50:00 GMT",中国のスタートアップ企業ムーンショットAIが、テック業界で話題を呼んでいる強力な新モデル「Kimi K3」をリリースしました。著名人や専門家からは、次のような声が上がっています。,2026-07-24
e67eccbccf87cde7a5c2b0561c893a88,Business_Insider,ウクライナの兵器メーカーが明かす、ドローン作戦成功の影にあったフェドロフ前国防相の「前代未聞の組織改革」,https://www.businessinsider.jp/article/2607-ukraine-arms-makers-fear-slowdown-after-tech-champion-fedorov-dismissal/,"Thu, 23 Jul 2026 22:00:00 GMT",ウクライナのフェドロフ国防相の解任は、地元兵器メーカー各社にも衝撃を与えました。前国防相はどのような改革を進めてきたのか、兵器メーカー関係者たちが明かしました。,2026-07-24
9321b910c0c100f429567fcc50488fef,Business_Insider,実機で分かった「Galaxy Z Fold8」の画面比率が変わった利点。薄型・大画面化を両立させたサムスンの挑戦,https://www.businessinsider.jp/article/2607-samsung-galaxy-z-fold8-first-impression/,"Fri, 24 Jul 2026 02:50:00 GMT",新しく発表されたサムスンの「Galaxy Z Fold8」をいち早く体験。薄型軽量のボディと新しい画面比率は、まるでタブレットのような没入感を生み出します。より便利になったAI機能の使い勝手も紹介します。,2026-07-24
9591558a1d3de6989e05fca80779fcc2,Business_Insider,コストコの「神コスパ」クラフトビールが販売終了。在庫をまとめ買いするなら今だ,https://www.businessinsider.jp/article/2607-costcos-kirkland-signature-lager-discontinued-load-up-now/,"Fri, 24 Jul 2026 03:30:00 GMT",コストコとオレゴン州の有名醸造所デシューツ・ブルワリーは、人気を博したコラボレーション・クラフトビール「カークランドシグネチャーラガー」の生産契約満了に伴い、販売を終了します。,2026-07-24
fe801feedd56dda6ac7fa045841c027d,Business_Insider,M7の支配は終わりつつある――。それがS&amp;P 500にとって“問題”を意味すると、トップファンドマネージャーは言う,https://www.businessinsider.jp/article/2607-stock-market-outlook-sp500-mag-7-lost-decade-bill-smead/,"Fri, 24 Jul 2026 07:00:00 GMT",「すでに下落傾向にあるようだ」とビル・スミード氏はS&amp;P 500について述べ、2026年にはバリュー株指数が幅広いベンチマークを上回るペースで推移していることを指摘しました。,2026-07-24
5e509d94724612c6074a651f281aaa6e,Business_Insider,メタがAIツールを悪用し、病気・育児休暇中の従業員を「狙い撃ち」で解雇か…現・元従業員26人が提訴,https://www.businessinsider.jp/article/2607-meta-faces-lawsuit-over-ai-driven-layoffs-targeting-leave-takers/,"Fri, 24 Jul 2026 23:30:00 GMT",メタの元・現従業員26人が、病気や育児などで休暇中の従業員が低評価になることを知りながら、AI活用度を測る指標でレイオフ対象者を選定していたとして、同社を提訴しました。,2026-07-24
54a26df57430670303eac6f6519cec87,Business_Insider,ニューヨークの森にある隠れ家トレーラーハウスに2泊してみた。24㎡でも5人が暮らせる,https://www.businessinsider.jp/article/2607-tiny-home-resort-catskills-tour-inside-260-square-foot-house/,"Fri, 24 Jul 2026 03:00:00 GMT",ニューヨーク州サウスカイロに位置する「A Tiny House Resort」は、約24㎡というコンパクトさでありながら、最大5人が宿泊できるトレーラーハウスです。高天井や8つの窓、多目的家具や階段下の隠し収納など、縦空間を巧みに活かした空間デザインにより、驚くほど開放的な住空間を実現しています。,2026-07-24
144c4bb75d5b77911b3c619d944fdcf6,Business_Insider,ペルチェ空調ベスト、脱ツナギ...JALが現場の暑さ対策を公開。「体感50度くらい」「新人はひと夏で体重10キロ減」“酷暑現場”のいま,https://www.businessinsider.jp/article/2607-hot-summer2026-jal/,"Fri, 24 Jul 2026 02:05:00 GMT",夏の暑さが本格化する中、日本航空（JAL）が羽田空港で勤務する整備士など現場スタッフの暑さ対策を報道陣に公開しました。,2026-07-24
b3a70fbd8a0d841a51122536e6dce070,Business_Insider,裁判官は「AIのでっち上げ」に忍耐を失いつつある…存在しない「架空の判例」を提出した弁護士4人を制裁,https://www.businessinsider.jp/article/2607-mississippi-judge-removes-lawyers-lawsuit-ai-hallucinations-court-filings/,"Fri, 24 Jul 2026 01:30:00 GMT",法曹界のAIハルシネーション問題と言えば、昨年は裁判官側に相次いだことで話題になりましたが、今度は弁護士側にもミスが発覚、判事から厳しい制裁を受けました。,2026-07-24
660fd8520ea96c14366887ac199e2ba9,Business_Insider,世界で最も平均身長が高い国・地域トップ25。上位はヨーロッパが独占,https://www.businessinsider.jp/article/2607-countries-with-tallest-people-ranking/,"Fri, 24 Jul 2026 04:00:00 GMT",世界で平均身長が高い国・地域はどこでしょうか。NCD Risk Factor Collaborationの医療データをもとに、Business Insiderが25の国・地域をランキングしました。上位の大半をヨーロッパ勢が占める一方、アメリカはトップ25圏外でした。,2026-07-24
27fad30e7cfd2a0c111824d14e9e5e4d,Business_Insider,「出社 vs. リモート」論争の本質,https://www.businessinsider.jp/article/2607-remote-vs-office-not-about-location/,"Thu, 23 Jul 2026 21:30:00 GMT",先週、GMOインターネットグループがフル出社に戻すことを発表、一方でさくらインターネットがフルリモート（在宅）継続を宣言。対極とも言える意思決定が話題となり、働き方をめぐる議論が再燃しています。,2026-07-24
2b170094b1b9bb4f9a00e4268f7f2d01,Business_Insider,雨音のような響きが心地いいキーボード「Rainy 75 Pro」レビュー：文字を打つ時間が楽しくなる,https://www.businessinsider.jp/article/2607-rainy-75-pro-keyboard-review/,"Fri, 24 Jul 2026 09:45:00 GMT",「Rainy 75 Pro」は、雨音を思わせる心地いい打鍵音が特徴のメカニカルキーボードです。約1.8kgの重厚な筐体が安定したタイピングを支えます。,2026-07-24
1a8256a5b1fb0f4655c76c55cbf458a4,Business_Insider,強いエルニーニョ現象が発生すれば、さらなる「インフレショック」が起こる可能性,https://www.businessinsider.jp/article/2607-el-nino-record-supply-shock-inflation-global-economy-iran-war/,"Thu, 23 Jul 2026 21:00:00 GMT",ドイツ銀行は、エルニーニョ現象が、インフレを一段と加速させる新たなショックを引き起こす可能性が高まっていると警告しました。,2026-07-24
172519d68c8f28d17fc7e9859650d60f,Business_Insider,休日に読み切れる。自分の人生や働き方を見つめ直すための9冊,https://www.businessinsider.jp/article/9-books-for-career-and-life-reflection-a/,"Fri, 24 Jul 2026 08:05:00 GMT",休日に読書はいかが？「この本を読んだら人生が変わった」と思わせてくれるであろう、比較的短い、面白くて読みやすい9冊の本を紹介します。,2026-07-24
152c8f5c78cdd6d8a730718f0730ed6b,ITmedia_AI_Plus,Anthropic、「Claude Opus 5」公開　Fable 5に迫る性能を半額で――サイバー安全策は緩和、拒否時は自動フォールバックも,https://www.itmedia.co.jp/news/articles/2607/25/news016.html,"Sat, 25 Jul 2026 07:28:00 +0900",Anthropicは、最新LLM「Claude Opus 5」を公開した。上位モデル「Claude Fable 5」に迫る知能を半額の価格で提供する。プログラミングやナレッジワークにおいて高い評価を獲得し、推論の深さを調整するパラメータや安全性分類器に連動する自動フォールバック機能などを備える。,2026-07-24
ffae09a43ec5d08c01e75b4bdaa17de5,ITmedia_AI_Plus,スーパーに並んだ「ごちゃごちゃ生成AIポップ」が物議　“看板王”こと、きぬた歯科院長「これはアリ」,https://www.itmedia.co.jp/news/articles/2607/24/news094.html,"Fri, 24 Jul 2026 19:20:00 +0900",スーパーの青果売り場に並ぶ、生成AIで作ったとみられる派手な商品ポップがXで物議を醸している。吸血鬼や戦国武将を描いたデザインに「見づらい」との声が相次ぐ中、看板広告で知られるきぬた歯科のきぬた泰和院長は「これはアリ」と評価。その理由とは。,2026-07-24
9eded143fd04d71dcb9053cf61831783,ITmedia_AI_Plus,近畿大、入試にAIの利用認める　情報学部の総合型選抜で,https://www.itmedia.co.jp/aiplus/article/2607/24/2000000221/,"Fri, 24 Jul 2026 17:45:19 +0900",近畿大学は、2027年度の情報学部の総合型選抜入学試験で、生成AIの利用を認めると発表した。提出する自己PR動画やプレゼンテーション資料などでのAIの利用方針を明示した。,2026-07-24
b61177e66b0b42ee933d7b91da30f272,ITmedia_AI_Plus,AIにもサプライチェーン管理が必要？　中国AI「Kimi K3」を巡る批判でAIの調達リスクが浮き彫りに,https://atmarkit.itmedia.co.jp/ait/articles/2607/24/news054.html,"Fri, 24 Jul 2026 17:30:00 +0900",中国の最新AIモデルを巡り、米政府高官が、Anthropicの「Claude Fable 5」をモデルの学習に利用した“不正蒸留”が行われていたと指摘した。AIモデルの調達や導入を巡るサプライチェーンリスクが浮き彫りとなっている。,2026-07-24
273049204b7537eeae1a9021c73fac79,ITmedia_AI_Plus,メルカリ、「AI活用の最前線」明かす動画公開　「なぜCTOがCHRO兼CAIOになったのか」など13本,https://www.itmedia.co.jp/aiplus/article/2607/24/2000000220/,"Fri, 24 Jul 2026 15:23:26 +0900",メルカリは、自社のAI活用について紹介する動画を公開した。7月8日に開催したイベント「Mercari AI Career Fes 2026」で実施したセッションのアーカイブ動画、全13本を公式YouTubeチャンネルで視聴できる。,2026-07-24
9ecb1963ffb81bcebe4e923e9b7cd8fa,ITmedia_AI_Plus,海外の「Claude」や「GPT」ではダメなのか　日本企業向けai&、そのメリットは？,https://atmarkit.itmedia.co.jp/ait/articles/2607/24/news052.html,"Fri, 24 Jul 2026 13:00:00 +0900",ai&は、日本企業向けに設計したAI推論プラットフォーム「ai& Inference」の提供を開始した。ClaudeやGPTなど海外ベンダーのAIに代わる選択肢として、AI利用コストを大幅に削減できるとしている。,2026-07-24
ea80ef9fe41c65a5c3e6a89621f696e2,ITmedia_AI_Plus,開発工数見積もりの「負担が重い」をAIで解消へ　明治安田はどう実現？,https://atmarkit.itmedia.co.jp/ait/articles/2607/24/news050.html,"Fri, 24 Jul 2026 13:00:00 +0900",有識者に頼りがちなシステム開発工数の見積もりは、AIエージェントでどこまで効率化できるのか。明治安田生命保険がPoCで検証した仕組みを見ていこう。,2026-07-24
204d6d7a79b2351a9ec2352970c060c2,ITmedia_AI_Plus,「2日かかる攻撃が25分に」生成AIで“爆速化”するサイバー攻撃、パロアルトの識者が警鐘,https://www.itmedia.co.jp/news/articles/2607/24/news070.html,"Fri, 24 Jul 2026 12:28:00 +0900",パロアルトネットワークスの染谷征良氏（チーフサイバーセキュリティストラテジスト）は、生成AIの普及で変化するサイバー攻撃の動向と企業に求められるセキュリティ対策を、ソフトバンクの年次イベント「SoftBank World 2026」の講演で紹介した。,2026-07-24
4f96d292e542276c7a93adec83b88ea8,ITmedia_AI_Plus,Microsoft、GitHub CopilotやExcelで自社AIに切り替えへ――OpenAIやAnthropicのモデルは「引き続き併用」,https://www.itmedia.co.jp/aiplus/article/2607/24/2000000219/,"Fri, 24 Jul 2026 12:03:56 +0900",Microsoftは、GitHub CopilotやExcelで自社開発AIモデル「MAI」シリーズの本格導入を開始したと発表した。既存のフロンティアモデルと併用しつつ、高頻度なタスクを低コストな自社モデルへ振り分けることでコストパフォーマンスを向上させる。今後も他サービスへ同様のアプローチを拡大する方針だ。,2026-07-24
59171ddc2f64bb864eb343aa0316564b,ITmedia_AI_Plus,AIは“声で操作”する時代に？　ChatGPTとClaude、相次ぎ音声機能を強化,https://www.itmedia.co.jp/aiplus/article/2607/24/2000000218/,"Fri, 24 Jul 2026 11:15:46 +0900",米OpenAIと米Anthropicが相次いで自社AIサービスの音声機能を強化した。,2026-07-24
d9076fd01401cf64d596dd7281e8f2d8,ITmedia_AI_Plus,図面AIに「動かせる3Dモデル」の生成機能、関節や可動域を自動認識,https://monoist.itmedia.co.jp/mn/articles/2607/24/news012.html,"Fri, 24 Jul 2026 09:00:00 +0900",renueは、2D図面から3D CADモデルを生成するAI「Drawing Agent」に、関節や可動域を読み取り、動かせる3Dモデルを生成する新機能「可動アセンブリ」を追加した。生成したモデルをAIが動かし、接合部の離れや回転中心のずれなども検証する。,2026-07-24
74682869eb391d3fb9022621eb8c1840,ITmedia_AI_Plus,Googleが“自社AIの裏切り”に備え始めた　異例の構想「AI Control Roadmap」とは,https://www.itmedia.co.jp/aiplus/article/2607/24/2000000215/,"Fri, 24 Jul 2026 08:00:00 +0900",米Google DeepMindが発表した異例の構想「AI Control Roadmap」について解説する。,2026-07-24
db5e27b620372f43efd9a62c65bf1a4b,ITmedia_AI_Plus,【元経産省の専門家に聞く】中小企業がハマる「生成AIトラブル」5つの解決シナリオ,https://kn.itmedia.co.jp/kn/articles/2607/24/news049.html,"Fri, 24 Jul 2026 07:00:00 +0900",キーマンズネットの読者調査には、生成AIを巡る中小企業の切実な悩みが数多く寄せられた。代表的な5つの「あるある課題」を、経済産業省・中小企業庁でデジタル活用支援に携わった小池明氏にぶつけ、明日から使える乗り切り方を聞いた。,2026-07-24
af3d1d7242510b0166d5853cc5e9cab4,ITmedia_AI_Plus,「AIの提案」を妄信する人、疑える人――“眼力ある人材”を育てる絶対条件,https://www.itmedia.co.jp/business/articles/2607/24/news015.html,"Fri, 24 Jul 2026 07:00:00 +0900",プロンプト一つでUIやコードが数秒で量産される時代、人間の役割は「制作」から「目利き」へと変わる。しかし手を動かさなくなることで、AIの提案を無批判に受け入れてしまうリスクも漂う。米Figmaのロレダナ・クリサンCDOは「AIは過去しか見ない。世界を明日へ押し進めるのは人間だ」と断言。良い案に達するための「悪い案の量産」や手触り感の重要性を説く。AI時代にプロダクトへ魂を注ぎ続けるための思考法を語...,2026-07-24
546fca8577a398ed8d2809c1db47bfee,ITmedia_AI_Plus,「生成AIで仕事が楽に」のはずが……IT現場を蝕む“AI疲れ・AIうつ”の正体,https://www.itmedia.co.jp/news/articles/2607/24/news017.html,"Fri, 24 Jul 2026 06:30:00 +0900",耳にする機会が増えた「AI疲れ」「AI鬱（うつ）」。本稿では、“疲れの正体”を整理し、個人が何を考え、どう変わればよいのかという判断軸を整理します。,2026-07-24
4602c7f54ef42eac2371440cf30d6f88,ITmedia_AI_Plus,三井不動産がデータセンターに6000億円超投資、物流の枠超え「産業デベロッパー」へ,https://monoist.itmedia.co.jp/mn/articles/2607/24/news046.html,"Fri, 24 Jul 2026 06:15:00 +0900",三井不動産は事業説明会で「産業デベロッパー」への領域拡大を発表した。従来の物流拠点供給にとどまらず、研究開発施設や自動運転対応を進める。データセンター事業には累計6000億円超を投じ、稼働済みの3棟に加え7棟を開発中だ。,2026-07-24
09958ec5507bde9f8ccc9df00db3acb3,ITmedia_AI_Plus,「スパイダーロボ」登場　がれきを走破、モノに「触って判断」も　災害現場で活用へ　国内ベンチャー,https://www.itmedia.co.jp/aiplus/article/2607/23/2000000217/,"Thu, 23 Jul 2026 19:04:48 +0900",アトラックラボ（埼玉県入間郡）は、クモの形を模したロボットを開発したと発表した。実際のクモより2本少ない6本の脚を備えており、画像や触覚情報も処理できる。災害現場や危険区域などでの活用を目指す。,2026-07-24
7fd320c121b52c3b36d25843a265bb34,ITmedia_AI_Plus,三菱電機とソニー、AIビジョンセンサーで新会社設立へ,https://eetimes.itmedia.co.jp/ee/articles/2607/23/news079.html,"Thu, 23 Jul 2026 16:00:00 +0900",三菱電機とソニーセミコンダクタソリューションズは、製造業向けAIビジョンセンサーソリューションを開発する新会社を合弁で設立する。新会社の社名は「Advanced Vision Solutions」で、2026年10月より事業を始める予定。,2026-07-24
2ca0fe9949b11643db0429525483914f,ITmedia_AI_Plus,Markdownファイルが、AI時代の負債に？　Googleが提案する「ナレッジ標準化」の一手,https://atmarkit.itmedia.co.jp/ait/articles/2607/23/news055.html,"Thu, 23 Jul 2026 13:00:00 +0900",Google Cloudは、AIエージェントが利用するナレッジをMarkdownで標準化するオープンフォーマット「Open Knowledge Format」を公開した。ベンダー非依存で、異なるエージェント間でもナレッジをそのまま共有できる。,2026-07-24
19116a813ea7d2fddec7be9ed4e4b5de,ITmedia_AI_Plus,Macアプリ版「Claude Code」がiOSシミュレータと連携　「Computer Use」なしでアプリ操作,https://www.itmedia.co.jp/aiplus/article/2607/23/2000000216/,"Thu, 23 Jul 2026 10:56:04 +0900",,2026-07-24
a8a71f7919b3fbc098d0602c5212f2b8,Hatena_IT,[PDF]株式会社はてな　特別調査委員会による調査報告書の公表及び役員報酬の一部自主返上に関するお知らせ,https://ssl4.eir-parts.net/doc/3930/tdnet/2856001/00.pdf,,,2026-07-24
4c85a08167e0945af044bcbe671d38b5,Hatena_IT,ターミナルを自作したら、1日のコミット数が500を超えて、生産性がバグった話,https://zenn.dev/singularity/articles/diy-terminal-500-commits,,僕は長いこと、ターミナルの中で暮らしています。エディタは emacs、VS Code や GUI 系のツールはどうにも手に馴染まない。Web 上の開発環境も、あの「ちょっとした不便」が積もって結局使わなくなる。要するに、ターミナルに慣れ親しみすぎて、GUI のボタンがどこにあるのか探せない人間です。 そんな僕が、勢いで自分...,2026-07-24
f2c6a10f80b49458dd909658ad583a3a,Hatena_IT,自宅でローカルなテレビ局を開局してみた 【地上デジタル放送の仕組みに迫る】 - Qiita,https://qiita.com/Rabbit_Program/items/7c3b004ff56ec4cc6b06,,"はじめに 地上デジタル放送のテレビ局が送出しているものは、突き詰めると「MPEG-TS ストリーム」と「その中に埋め込まれた PSI/SI テーブル」の2つに集約される。 であれば、同じ構造のストリームを自前で組み立てれば、市販のテレビ録画ソフトがそれを ""本物のチャンネル"" として認識するのではないか —— そう思い立ち...",2026-07-24
a38f5ebe527c2557ed5acb43086ac185,Hatena_IT,AI時代のエンジニアリングマネージャーのあり方｜外部品質編 〜品質の可視化を、現場と経営をつなぐ形にするまで〜,https://zenn.dev/loglass/articles/ef099b123153cf,,この記事は毎週必ず記事がでるテックブログ Loglass Tech Blog Sprint の153週目の記事です！ 3年間連続達成まで残り7週となりました！ こんにちは、ログラスの飯田(@ysk_118)です。 ここ数年、AIによってコードを書く速度はずいぶん上がりました。一方で、「品質向上に対してどのようにアプローチしていくのか」という...,2026-07-24
7b5254c685d13dfc93aeacfd283ee542,Hatena_IT,AI時代におけるテストの基礎の再定義 / Rethinking the Fundamentals of Testing in the AI Era,https://speakerdeck.com/mineo_matsuya/rethinking-the-fundamentals-of-testing-in-the-ai-era,,AI時代到来です。 AIの台頭によって「このままテストをやっていて大丈夫なのか」「学んできたテスト技術は通用し続けるのか」と不安を感じているテストエンジニアも多いのではないでしょうか。 この講演では、AIを過度に恐れず、かといって過信もしないために、テストエンジニアとして押さえておきたい考え方を整理…,2026-07-24
a184f57ec608cf17b035874cbf0933dd,Hatena_IT,『生成AIガイドライン、誰か作って』と言われたときに読む実務メモ,https://zenn.dev/gangy/articles/0c6c2153784bd8,,この記事について 「生成AIの利用ガイドライン、誰か作っておいて」──情シスやセキュリティ担当なら、一度は言われた（言われそうな）お題だと思います。この記事は、そのガイドラインをゼロから実務で回る形に落とすための手順メモです。 前提として、ガイドラインの目的は「使わせないこと」ではありません。安全に使...,2026-07-24
