id,source,title,link,published,summary,collected_date
86c7753ac20867352fa83fee0aeb2a9e,GCP_Blog,Getting Started with Gemini 3: Deploy Your First Gemini 3 App to Google Cloud Run,https://cloud.google.com/blog/topics/developers-practitioners/getting-started-with-gemini-3-deploy-your-first-gemini-3-app-to-google-cloud-run/,"Thu, 22 Jan 2026 10:02:00 +0000","The previous blog demonstrated how simple it is to start using Gemini 3. With Google AI Studio, you can easily continue your journey by getting an API Key and ready-to-use code. This allows you to qui...",2026-01-23
548646b9ee6547b9332fc6f2a55f9e71,GCP_Blog,Accelerate migrations with new incentives from the Rapid Migration and Modernization Program (RaMP),https://cloud.google.com/blog/products/infrastructure-modernization/new-ramp-incentives-for-cloud-migration/,"Wed, 21 Jan 2026 16:00:00 +0000","To lead in 2026, you need to be AI-ready, lean, and optimized across every workload — and for many organizations, that means migrating and modernizing applications like SAP, Oracle, NetApp, and VMware...",2026-01-23
c3602f312b2e468e2201143d4034653e,GCP_Blog,Mastering Gemini CLI: Your Complete Guide from Installation to Advanced Use-Cases,https://cloud.google.com/blog/topics/developers-practitioners/mastering-gemini-cli-your-complete-guide-from-installation-to-advanced-use-cases/,"Wed, 21 Jan 2026 11:56:00 +0000",We’ve teamed up with DeepLearning.ai and are excited to announce a free course – Gemini CLI: Code &amp; Create with an Open-Source Agent. This comprehensive course is designed to empower users by teac...,2026-01-23
1d5fd67d95e2d3d8ad2f138c4ef2d78f,GCP_Blog,Sawasdee Thailand! Google Cloud launches new region in Bangkok,https://cloud.google.com/blog/products/infrastructure/google-cloud-launches-new-region-in-bangkok-thailand/,"Wed, 21 Jan 2026 05:00:00 +0000","ยินดีต้อนรับสู่ Google Cloud, Thailand! (Welcome to Google Cloud, Thailand!)
Thai businesses and public sector institutions share a common goal: to deliver high performance applications with low laten...",2026-01-23
d54de4dbec06d1a55ff3e463e0dac7fb,GCP_Blog,Elevate your applications with Firestore’s new advanced query engine,https://cloud.google.com/blog/products/data-analytics/new-firestore-query-engine-enables-pipelines/,"Tue, 20 Jan 2026 17:00:00 +0000","A hallmark of a valuable database is how easy it is to query the data inside, so that developers can build tailored and complex user experiences in an application. Last week marked a significant evolu...",2026-01-23
1dd91b2a20e5f3f9fd8ab2d273ce1b78,GCP_Blog,Getting Started with Gemini 3: Hello World with Gemini 3 Flash,https://cloud.google.com/blog/topics/developers-practitioners/getting-started-with-gemini-3-hello-world-with-gemini-3-flash/,"Tue, 20 Jan 2026 09:38:00 +0000","The Gemini 3 family of models, our most intelligent yet, features state-of-the-art reasoning to help you learn, build, and plan anything. Within this family, Gemini 3 Flash is designed for speed and e...",2026-01-23
75473a5e1a903c023843f60547400fc0,GCP_Blog,Cloud CISO Perspectives: Practical guidance on building with SAIF,https://cloud.google.com/blog/products/identity-security/cloud-ciso-perspectives-practical-guidance-building-with-saif/,"Fri, 16 Jan 2026 17:00:00 +0000","Welcome to the first Cloud CISO Perspectives for January 2026. Today, Tom Curry and Anton Chuvakin, from Google Cloud’s Office of the CISO, share our new report on using Google’s Secure AI Framework w...",2026-01-23
ecce74150ac689c5510f6a9a77f27a1a,GCP_Blog,How Palo Alto Networks built a multi tenant scalable Unified Data Platform,https://cloud.google.com/blog/topics/partners/palo-alto-networks-builds-a-multi-tenant-unified-data-platform/,"Fri, 16 Jan 2026 17:00:00 +0000","Enterprises across the world are processing significant amounts of data. Palo Alto Networks processes thousands of firewall logs, telemetry signals and threat events every second across its product po...",2026-01-23
8dfe3765b1ba10084d1f82bf78304b5a,GCP_Blog,Agent Factory Recap: Reinforcement Learning and Fine-Tuning on TPUs,https://cloud.google.com/blog/topics/developers-practitioners/agent-factory-recap-reinforcement-learning-and-fine-tuning-on-tpus/,"Fri, 16 Jan 2026 10:56:00 +0000","In our agent factory holiday special, Don McCasland and I were joined by Kyle Meggs, Senior Product Manager on the TPU Training Team at Google, to dive deep into the world of model fine tuning. We foc...",2026-01-23
626cb576a2e33f67d4f649a101d077a1,GCP_Blog,Introducing BigQuery managed and SQL-native inference for open models,https://cloud.google.com/blog/products/data-analytics/introducing-bigquery-managed-and-sql-native-inference-for-open-models/,"Thu, 15 Jan 2026 17:00:00 +0000","BigQuery provides access to a variety of LLMs for text and embedding generation, including Google's Gemini models, Google-managed models from partners like Anthropic and Mistral. Using Gemini models a...",2026-01-23
92ea9e7952a7b398d48210676141c52e,GCP_Blog,Closing the Door on Net-NTLMv1: Releasing Rainbow Tables to Accelerate Protocol Deprecation,https://cloud.google.com/blog/topics/threat-intelligence/net-ntlmv1-deprecation-rainbow-tables/,"Thu, 15 Jan 2026 14:00:00 +0000","Written by: Nic Losby

Introduction
Mandiant is publicly releasing a comprehensive dataset of Net-NTLMv1 rainbow tables to underscore the urgency of migrating away from this outdated protocol. Despite...",2026-01-23
4720b097f3a0cbd0dbc8c196c8579d0d,GCP_Japan,Gemini 3 を使ってみる: Gemini 3 Flash での Hello World,https://cloud.google.com/blog/ja/topics/developers-practitioners/getting-started-with-gemini-3-hello-world-with-gemini-3-flash/,"Fri, 23 Jan 2026 03:00:00 +0000","※この投稿は米国時間 2026 年 1 月 21 日に、Google Cloud blog に投稿されたものの抄訳です。
Gemini 3 は、Google 史上最もインテリジェントなモデル ファミリーであり、最先端の推論機能によって、あらゆる学習、創造、計画を支援します。このファミリーのなかでも、Gemini 3 Flash はスピードと効率性を重視して設計されており、複雑な推論、マルチモーダル...",2026-01-23
0617eb1d0bbc9547a0078efaccd82f84,GCP_Japan,VoC（ Voice of Customer ）起点のバーチャルリサーチで顧客理解を高速化 - Google Cloud 活用,https://cloud.google.com/blog/ja/topics/customers/panasonic-accelerates-customer-understanding-with-virtual-research/,"Fri, 23 Jan 2026 02:00:00 +0000",日本国内におけるパナソニック家電製品のマーケティングを一手に担う、パナソニック株式会社（以下、パナソニック） コンシューマーマーケティング ジャパン本部。同本部は、製造事業部と販売現場をつなぐ結節点として、販売戦略の策定やDX推進を通じ、お客様へ継続的な価値を届ける仕組みづくりを主導しています。その中核となるのが、「顧客理解」の深化です。今回は同本部の若松氏をお迎えし、コンタクトセンターに寄せられ...,2026-01-23
2c9d0259e90d69307bf0fb1d27314144,GCP_Japan,Palo Alto Networks がマルチテナントのスケーラブルな統合データ プラットフォームを構築した方法,https://cloud.google.com/blog/ja/topics/partners/palo-alto-networks-builds-a-multi-tenant-unified-data-platform/,"Fri, 23 Jan 2026 01:00:00 +0000","※この投稿は米国時間 2026 年 1 月 17 日に、Google Cloud blog に投稿されたものの抄訳です。
世界中の企業が大量のデータを処理しています。Palo Alto Networks は、同社の製品ポートフォリオ全体で、毎秒数千件のファイアウォール ログ、テレメトリー シグナル、脅威イベントを処理しています。この規模に対応するため、Palo Alto Networks は 30...",2026-01-23
2d51fd0857e0cc9235dc25f127ccfdc1,GCP_Japan,Palo Alto Networks、エージェント設計によりカスタマー インテリジェンスに関するドキュメントの作成を自動化,https://cloud.google.com/blog/ja/topics/partners/palo-alto-networks-customer-intelligence-agentic-design/,"Thu, 22 Jan 2026 02:00:00 +0000","※この投稿は米国時間 2026 年 1 月 15 日に、Google Cloud blog に投稿されたものの抄訳です。
Palo Alto Networks のような世界規模の大手サイバーセキュリティ企業にとって、各顧客を包括的に理解することは成功に不可欠です。Palo Alto Networks では、プリセールス チームが関与するすべてのエンゲージメントの包括的な情報が社内の記録文書（DOR...",2026-01-23
16127b0923cd1d2ffe4afff0502d815b,GCP_Japan,バイブクエリ: BigQuery のコメントを SQL に変換する機能を使って SQL クエリをすばやく作成,https://cloud.google.com/blog/ja/products/data-analytics/vibe-querying-with-comments-to-sql-in-bigquery/,"Wed, 21 Jan 2026 02:00:00 +0000","※この投稿は米国時間 2026 年 1 月 15 日に、Google Cloud blog に投稿されたものの抄訳です。
複雑な SQL クエリの作成は容易な作業ではありません。エンジニアであれば、SQL のワークフロー内で簡単な英文を使ってデータのニーズを直接表現できないものかと考えることも少なくないでしょう。最近では、自然言語の AI プロンプトを使用してコードを生成する「バイブ コーディング...",2026-01-23
33dfec4c31f63b39f0387f99ff664110,GCP_Japan,オープンモデルに対する BigQuery マネージド SQL ネイティブ推論の導入,https://cloud.google.com/blog/ja/products/data-analytics/introducing-bigquery-managed-and-sql-native-inference-for-open-models/,"Wed, 21 Jan 2026 02:00:00 +0000","※この投稿は米国時間 2026 年 1 月 16 日に、Google Cloud blog に投稿されたものの抄訳です。
BigQuery では、テキストやエンベディングの生成に利用できるさまざまな LLM（Google の Gemini モデルや、Anthropic、Mistral といったパートナーが提供する Google マネージド モデルなど）にアクセスできます。Gemini モデルや G...",2026-01-23
40028caf57614995bee65ea23da7dd0a,GCP_Japan,自動車業界のサイバーセキュリティ強化を目指して Auto-ISAC と Google がパートナーシップを締結,https://cloud.google.com/blog/ja/products/identity-security/auto-isac-google-partner-to-boost-automotive-sector-cybersecurity/,"Tue, 20 Jan 2026 01:10:00 +0000","※この投稿は米国時間 2026 年 1 月 6 日に、Google Cloud blog に投稿されたものの抄訳です。
カール ベンツが世界初の実用車として広く認められている発明により特許を取得し、ヘンリー フォードが工業技術により大量生産を推し進めて以来、消費者の行動と嗜好の変化が、自動車の性能、安全性、信頼性の向上を後押ししてきました。自動車開発は現在、自動車の機能化（自動車に追加機能を提供す...",2026-01-23
810fd3153fb07f09bea0873dccb280d4,GCP_Japan,VM OS エージェントの大規模な管理を簡素化: VM Extensions Manager のご紹介,https://cloud.google.com/blog/ja/products/compute/introducing-vm-extensions-manager/,"Tue, 20 Jan 2026 01:00:00 +0000","






  
    
      
  

    <figure class=""article-image--large
      
      
        h-c-grid__col
        h-c-grid__col--6 h-c-grid__col--offset-3
        
        
      "">

      
      
       ...",2026-01-23
8e74c876f556f7f0ceb7696b6d467a40,GCP_Japan,ビジョンの拡大: Palo Alto Networks が新たに Google Unified Security Recommended に参加,https://cloud.google.com/blog/ja/products/identity-security/expanding-the-google-unified-security-recommended-program/,"Tue, 20 Jan 2026 01:00:00 +0000","※この投稿は米国時間 2025 年 12 月 11 日に、Google Cloud blog に投稿されたものの抄訳です。
現代の組織は、使用するセキュリティ ツールを自由に選択できることを非常に重視しており、相互運用可能なセキュリティ環境へのニーズが高まっています。Google Cloud はお客様のそれぞれの状況に対応することを重視しており、これはお客様による連携するパートナーの選択においても...",2026-01-23
bf054e535a9925c9578b70ff92aeda12,GCP_Japan,Model Context Protocol の gRPC トランスポート,https://cloud.google.com/blog/ja/products/networking/grpc-as-a-native-transport-for-mcp/,"Mon, 19 Jan 2026 03:00:00 +0000","※この投稿は米国時間 2026 年 1 月 14 日に、Google Cloud blog に投稿されたものの抄訳です。
AI エージェントはテスト環境から企業業務の中核へと移行していて、複雑なマルチステップの目標を達成するには、外部のツールやシステムと確実にやり取りする必要があります。Model Context Protocol（MCP）は、こうしたエージェントとツールの間の通信を可能にする標準...",2026-01-23
4233be3c168cc8294c9996413b0294bf,GCP_Japan,Hackensack Meridian Health は VPC Flow Logs を使用してネットワーク移行のリスクを軽減,https://cloud.google.com/blog/ja/products/networking/using-vpc-flow-logs-to-de-risk-network-migration/,"Mon, 19 Jan 2026 02:00:00 +0000","※この投稿は米国時間 2026 年 1 月 10 日に、Google Cloud blog に投稿されたものの抄訳です。
ネットワーク管理者は、ネットワーク トラフィックの可視化に VPC Flow Logs を多用しています。昨年、Google は VPC Flow Logs をアップデートして、ネットワーク トラフィックの可視性を拡張し、サブネットだけでなく、VLAN アタッチメントと VPN...",2026-01-23
dd4c4dc7b92da150e584547561579d9a,GCP_Japan,日本の公的機関における Google Workspace 利用規約の改定と、安心・安全なクラウド活用に向けた環境整備について,https://cloud.google.com/blog/ja/products/gcp/revision-of-google-workspace-terms-of-service/,"Mon, 19 Jan 2026 02:00:00 +0000","Google Cloud では、日本の自治体や公共機関のお客様が、より安心してクラウドサービスや生成 AI を活用できる環境を整備するため、Google Workspace の利用規約を更新いたしました。
また、本改定に加え、総務省が公表している「地方公共団体における情報セキュリティポリシーに関するガイドライン」および「自治体における AI 活用・導入ガイドブック」等で求められる高度なセキュリティ...",2026-01-23
93738950e96bd07f4dc4cd28a9e17567,GCP_Japan,新しい書き込み最適化機能により Cloud SQL for MySQL の書き込みパフォーマンスを強化,https://cloud.google.com/blog/ja/products/databases/cloud-sql-for-mysql-introduces-optimized-writes/,"Mon, 19 Jan 2026 01:40:00 +0000","※この投稿は米国時間 2026 年 1 月 6 日に、Google Cloud blog に投稿されたものの抄訳です。
書き込み負荷の高いワークロード向けに MySQL インスタンスを調整することは、長年にわたるエンジニアリング上の課題です。このたび、Cloud SQL for MySQL Enterprise Plus エディションに、書き込み最適化機能が追加されました。これは、リアルタイムのワ...",2026-01-23
d89a0bb466d360e65374b6e0c8d9b0ca,GCP_Japan,Google Public Sector の新しい調査で、連邦政府機関の 90% 近くがすでに AI を使用していることが判明,https://cloud.google.com/blog/ja/topics/public-sector/new-google-public-sector-research-shows-that-nearly-90-of-federal-agencies-are-already-using-ai/,"Mon, 19 Jan 2026 01:30:00 +0000",※この投稿は米国時間 2026 年 1 月 14 日に、Google Cloud blog に投稿されたものの抄訳です。連邦政府機関では、その任務の規模と複雑さから、持続的な集中力が求められます。職員が、より少ないリソースでより多くのことを行うという使命を果たし、基本的なサービスをさらに効率的かつ安全に提供するためには、最新の AI とセキュリティのイノベーションにアクセスできることが喫緊の課題と...,2026-01-23
fe8a1c20b5048ab240ed2d863aa2eaf0,GCP_Japan,スマートな投資: DORA で改善の文化を構築した FINRA の事例,https://cloud.google.com/blog/ja/topics/financial-services/finra-builds-a-culture-of-improvement-with-dora-and-devops/,"Mon, 19 Jan 2026 01:00:00 +0000","※この投稿は米国時間 2026 年 1 月 9 日に、Google Cloud blog に投稿されたものの抄訳です。
米国金融取引業規制機構（FINRA）は、テクノロジーの運用において常に最高水準の成果を目指しています。米国の金融ブローカー ディーラーを監督する FINRA は、ソフトウェア開発ライフサイクルを改善するために、Google のコンサルタントを起用し、エンジニアリング プラクティス...",2026-01-23
a7a44e90d6a3630746f2e0d387a244de,GCP_Japan,変革とミッションの影響をともに振り返る,https://cloud.google.com/blog/ja/topics/public-sector/reflecting-on-a-year-of-transformation-and-mission-impact-together/,"Fri, 16 Jan 2026 02:00:00 +0000","※この投稿は米国時間 2026 年 1 月 7 日に、Google Cloud blog に投稿されたものの抄訳です。
この 1 年を振り返ると、私たちはともに多くのことを成し遂げ、大きな成果を挙げることができました。2025 年は、前例のないイノベーションの年でした。AI の可能性が、全国の政府機関、研究機関、教育機関にとって確固たる現実のものとなりました。Google Public Secto...",2026-01-23
177edb26566eae895dae8470235ecb84,GCP_Japan,Looker の新機能: セルフサービス Explore、タブ付きダッシュボード、カスタムテーマ,https://cloud.google.com/blog/ja/products/business-intelligence/looker-self-service-explores-tabbed-dashboards-custom-themes/,"Thu, 15 Jan 2026 02:00:00 +0000","※この投稿は米国時間 2025 年 12 月 20 日に、Google Cloud blog に投稿されたものの抄訳です。
データチームにとって、統制された信頼できる指標の必要性と、アドホックな分析を迅速に行うことに対するビジネスニーズの兼ね合いは常に課題となっているようです。Google Cloud は、統制されたレポート作成と迅速なデータ探索を両立させるため、Looker にいくつかの新機能を...",2026-01-23
884e6dd7a9e606fdc9e32404fe0c6af7,GCP_Japan,Mandiant が支援するサイバー レジリエンスのテストと強化,https://cloud.google.com/blog/ja/topics/threat-intelligence/how-mandiant-can-help-test-and-strengthen-your-cyber-resilience/,"Thu, 15 Jan 2026 02:00:00 +0000",※この投稿は米国時間 2025 年 12 月 17 日に、Google Cloud blog に投稿されたものの抄訳です。導入しているセキュリティ プログラムは堅牢で、監査も問題なかったとしても、実際の攻撃に備えた準備は本当にできているのでしょうか？執拗なサイバー攻撃者は、セキュリティ リーダーの盲点を突いてくるかもしれませんし、セキュリティプログラムによってコンプライアンスを確保できていたとして...,2026-01-23
0f0a82f56bb165b00d3c876731594a75,GCP_Japan,Google Cloud パートナー ネットワークのご紹介: パートナーの皆様に知っていただきたいこと,https://cloud.google.com/blog/ja/topics/partners/introducing-google-cloud-partner-network/,"Thu, 15 Jan 2026 00:00:00 +0000","※この投稿は米国時間 2025 年 12 月 17 日に、Google Cloud blog に投稿されたものの抄訳です。
Google Cloud パートナーの皆様に嬉しいお知らせがあります。本日、新しいパートナー プログラムである Google Cloud パートナー ネットワークについて発表しました。このプログラムは 2026 年第 1 四半期より正式に開始されます。
この新しいプログラムで...",2026-01-23
4d6726025eb75ac8e97d0c14954b4da1,GCP_Japan,複数の脅威アクターが React2Shell（CVE-2025-55182）を悪用,https://cloud.google.com/blog/ja/topics/threat-intelligence/threat-actors-exploit-react2shell-cve-2025-55182/,"Thu, 15 Jan 2026 00:00:00 +0000","※この投稿は米国時間 2025 年 12 月 13 日に、Google Cloud blog に投稿されたものの抄訳です。
はじめに
2025 年 12 月 3 日、React Server Components において認証不要でリモートコード実行（RCE）が可能となる重大な脆弱性（CVE-2025-55182、別名「React2Shell」）が公開されました。公開直後から Google Thr...",2026-01-23
27ef38ed7d4bfed4d2bab8393e8fac2a,Ggen_Blog,Nano Banana Pro（Gemini 3 Pro Image）を徹底解説,https://blog.g-gen.co.jp/entry/nano-banana-pro-explained,2026-01-22T09:00:00+09:00,G-gen の川村です。この記事では、Google の画像生成 AI モデルである Gemini 3 Pro Image、通称 Nano Banana Pro について紹介します。 はじめに 当記事について Nano Banana Pro とは Nano Banana と Nano Banana Pro Nano Banana Pro の利用 概要 Google Workspace での利用 AP...,2026-01-23
dc544f87442e3e8739fe0db097c3abc4,Ggen_Blog,Google Cloudのデータサイエンスエージェントを解説,https://blog.g-gen.co.jp/entry/data-science-agent-explained,2026-01-19T09:00:00+09:00,G-gen の佐々木です。当記事では、Google Cloud が提供するデータサイエンスエージェント（Data Science Agent）について解説します。データサイエンスエージェントは、Colab Enterprise ノートブック上で、AI エージェントがデータクレンジングや分析などのタスクを自動的に行う機能です。 概要 データサイエンスエージェントとは 注意点 Google Colab...,2026-01-23
d6f60a0c58af60a3ff92c69ae0a61258,Ggen_Blog,Google SecOpsにAWSのVPC Flow Logsを取り込む,https://blog.g-gen.co.jp/entry/aws-vpc-flow-logs-into-google-secops,2026-01-15T09:00:00+09:00,G-gen の武井です。当記事では Google SecOps に AWS の VPC Flow Logs を取り込む方法について解説します。 はじめに Google SecOps とは データフィードとは 設定の流れ AWS の設定 S3 バケット VPC VPC Flow Logs EC2 インスタンス IAM データフィードの設定 動作確認 関連記事 はじめに Google SecOps と...,2026-01-23
85d3a250e551e732bbeb39939490be87,Ggen_Blog,SAMLでGoogle Cloudにシングルサインオンする方法（Workforce IdentityによるOktaからのSSO）,https://blog.g-gen.co.jp/entry/sso-to-google-cloud-with-saml,2026-01-13T09:00:00+09:00,G-gen の武井です。当記事では Workforce Identity 連携を構成し、Google Cloud にアクセスする方法を解説します。IdP として Okta を、連携方法として SAML 2.0 を選択したケースの手順を紹介します。 はじめに Workforce Identity 連携とは 設定の流れ ユーザーとグループの設定 Workforce Identity プールの作成 Ok...,2026-01-23
28d053c5b8dac1b65f32c04ac7ebafe6,Ggen_Blog,Looker Studioで表示データを閲覧ユーザに応じて制御する方法,https://blog.g-gen.co.jp/entry/looker-studio-user-filtering-methods,2026-01-09T09:00:00+09:00,G-gen の齊間です。Looker Studio で作成したレポートにおいて、閲覧ユーザーに応じて表示するデータを制御したい（出し分けたい）場合があります。当記事では、そのための主要な3つの方法と、それぞれの設定手順や注意点を解説します。 概要 手法1. メールアドレスでフィルタ 手法2. BigQuery で行レベルのアクセスポリシーを設定 概要 手順 行レベルのアクセスポリシー設定例 手法3...,2026-01-23
c6afec2396587bf2cb4f4797fa2985e0,Ggen_Blog,Googleの生成AIサービスを整理。Geminiアプリ、Gemini Enterprise、NotebookLM等を比較,https://blog.g-gen.co.jp/entry/compare-between-gemini-apps-gemini-enterprise-notebooklm-etc,2026-01-07T09:00:00+09:00,G-gen の杉村です。当記事では、Google の生成 AI サービスである Gemini アプリや Gemini Enterprise、NotebookLM、Gemini for Google Workspace、Vertex AI などについて、それぞれの違いや使い分けなど、組織へ導入する際の検討に役立つ情報を解説します。 はじめに サービス全体像 当記事で紹介する AI サービス 概要図 ...,2026-01-23
ffe31fc41eb1fe4f425f002088312de6,Ggen_Blog,2025年12月のイチオシGoogle Cloudアップデート,https://blog.g-gen.co.jp/entry/update-in-this-month-2025-12,2026-01-05T09:00:00+09:00,G-gen の杉村です。Google Cloud や Google Workspace の、2025年12月に発表されたイチオシアップデートをまとめてご紹介します。記載は全て、記事公開当時のものですのでご留意ください。 はじめに Google Cloud のアップデート Cloud Run コンソールで GitHub、GitLab、Bitbucket からの継続的デプロイ BigQuery に自動...,2026-01-23
