id,source,title,link,published,summary,collected_date
bb96de85e58647644b91fa5ec286716a,GCP_Blog,Mastering Model Adaptation: A Guide to Fine-Tuning on Google Cloud,https://cloud.google.com/blog/topics/developers-practitioners/mastering-model-adaptation-a-guide-to-fine-tuning-on-google-cloud/,"Wed, 11 Feb 2026 09:13:00 +0000","If you are building AI applications, you might experiment with prompts, or even dip your toes into agents. But as you move from prototype to production, you might hit a common wall: the model is just ...",2026-02-15
50365ec609c487a4699ef8d05b37d7f1,GCP_Blog,7 Technical Takeaways from Using Gemini to Generate Code Samples at Scale,https://cloud.google.com/blog/topics/developers-practitioners/7-technical-takeaways-from-using-gemini-to-generate-code-samples-at-scale/,"Wed, 11 Feb 2026 08:36:00 +0000","Using Generative AI to write code is a well-known task, but relying on it to produce production-ready educational content is a different challenge. When we started using Gemini to assist with our work...",2026-02-15
bcd89a577435e19db225c6e4b31cc7f7,GCP_Blog,Google Distributed Cloud brings public-cloud-like networking to air-gapped environments,https://cloud.google.com/blog/products/networking/google-distributed-cloud-gdc-air-gapped-1-15-networking/,"Tue, 10 Feb 2026 17:00:00 +0000",Organizations in highly regulated industries often struggle to balance the rigid security of air-gapped environments with the need for the agility and flexibility that the cloud provides. To address t...,2026-02-15
aa705981f8551ce2ab9b5cfa4028cee7,GCP_Blog,"Gemini Enterprise Agent Ready (GEAR) program now available, a new path to building AI agents at scale",https://cloud.google.com/blog/products/ai-machine-learning/gear-program-now-available/,"Tue, 10 Feb 2026 17:00:00 +0000","Today’s reality is agentic – software that can reason, plan, and act on your behalf to execute complex workflows.
To meet this moment, we are excited to open the Gemini Enterprise Agent Ready (GEAR) l...",2026-02-15
241fdbda91bb552035ffd0eabd77c126,GCP_Blog,Beyond the Battlefield: Threats to the Defense Industrial Base,https://cloud.google.com/blog/topics/threat-intelligence/threats-to-defense-industrial-base/,"Tue, 10 Feb 2026 14:00:00 +0000","Introduction 
In modern warfare, the front lines are no longer confined to the battlefield; they extend directly into the servers and supply chains of the industry that safeguards the nation. Today, t...",2026-02-15
c4663013c5ead2e1a1e744fe0856e10a,GCP_Blog,OTLP everywhere: Cloud Monitoring now supports OpenTelemetry Protocol metrics,https://cloud.google.com/blog/products/management-tools/otlp-opentelemetry-protocol-for-google-cloud-monitoring-metrics/,"Mon, 09 Feb 2026 17:00:00 +0000","As part of our commitment to open standards, Google Cloud is deeply invested in making OpenTelemetry the universal client, data format, and set of standards for telemetry data.
Last year we announced ...",2026-02-15
ebb1d1280af79cf25408b4d18a22765e,GCP_Blog,UNC1069 Targets Cryptocurrency Sector with New Tooling and AI-Enabled Social Engineering,https://cloud.google.com/blog/topics/threat-intelligence/unc1069-targets-cryptocurrency-ai-social-engineering/,"Mon, 09 Feb 2026 14:00:00 +0000","Written by: Ross Inman, Adrian Hernandez

Introduction
North Korean threat actors continue to evolve their tradecraft to target the cryptocurrency and decentralized finance (DeFi) verticals. Mandiant ...",2026-02-15
70c967831e72e1613dbcc9fd93fe64ef,GCP_Blog,How we cut Vertex AI latency by 35% with GKE Inference Gateway,https://cloud.google.com/blog/products/containers-kubernetes/how-gke-inference-gateway-improved-latency-for-vertex-ai/,"Fri, 06 Feb 2026 18:00:00 +0000","As generative AI moves from experimentation to production, platform engineers face a universal challenge for inference serving: you need low latency, high throughput, and manageable costs. 
It is a di...",2026-02-15
2f7adc5407145e5f7e772462ca3a990c,GCP_Blog,"Delivering a secure, open, and sovereign digital world",https://cloud.google.com/blog/products/identity-security/delivering-a-secure-open-sovereign-digital-world/,"Fri, 06 Feb 2026 17:00:00 +0000","The global conversation about our digital future goes beyond technology; it’s about architecting a prosperous, secure, and resilient economy where the digital services we rely on every day — from bank...",2026-02-15
a81923a9da6eee3b5470ce34fe85fcf4,GCP_Blog,Starfish Space uses Google Cloud to accelerate satellite servicing in orbit,https://cloud.google.com/blog/topics/public-sector/starfish-space-uses-google-cloud-to-accelerate-satellite-servicing-in-orbit/,"Fri, 06 Feb 2026 14:00:00 +0000","The Defense Industrial Base (DIB) and Federal System Integrator (FSI) communities operate under intense pressure. The mandate is clear: do more, faster, and with greater efficiency. As the engine of o...",2026-02-15
529c716ef29a7534c46895f4191ac5ed,GCP_Blog,Announcing Claude Opus 4.6 on Vertex AI,https://cloud.google.com/blog/products/ai-machine-learning/expanding-vertex-ai-with-claude-opus-4-6/,"Thu, 05 Feb 2026 18:00:00 +0000","At Google Cloud, we’re committed to providing customers with the leading selection of models to build and scale production-ready AI apps and agents on a platform optimized for performance, trust, and ...",2026-02-15
40437abe16e2e0716424f7b8773e9509,GCP_Blog,What’s new with Google Data Cloud,https://cloud.google.com/blog/products/data-analytics/whats-new-with-google-data-cloud/,"Thu, 05 Feb 2026 17:00:00 +0000","February 2 - February 6

Join us on March 4 for our webinar, Win Your AI Strategy with Cloud SQL Enterprise Plus, to learn how to power your generative AI workloads with 3x higher performance and 99.9...",2026-02-15
8f9e0fa6f92f783e53c6a8a8f85fe237,GCP_Blog,Agent Factory Recap: Build an AI Workforce with Gemini 3,https://cloud.google.com/blog/topics/developers-practitioners/agent-factory-recap-build-an-ai-workforce-with-gemini-3/,"Thu, 05 Feb 2026 09:04:00 +0000","In this episode of the Agent Factory, Smitha Kolan and Vlad Kolesnikov are joined by Brandon Hancock, a full-stack engineer and the creator behind the YouTube channel AI with Brandon, where he teaches...",2026-02-15
ce67e4a55404863e407527275d74d52b,GCP_Blog,Ship Production Ready AI and Survive the Multimodal Frontier This February,https://cloud.google.com/blog/topics/developers-practitioners/ship-production-ready-ai-and-survive-the-multimodal-frontier-this-february/,"Thu, 05 Feb 2026 08:04:00 +0000","The AI landscape is moving at breakneck speed. One day you’re figuring out how to secure a basic chatbot, and the next, you’re looking at agents that can see, hear, and react in real-time.
This Februa...",2026-02-15
0747afb3bdf9d9c56b9ad139b054568c,GCP_Blog,The platform usage trap part 1: Why high activity doesn’t necessarily mean high value,https://cloud.google.com/blog/products/application-development/at-john-lewis-partnership-measuring-developer-platform-value/,"Wed, 04 Feb 2026 18:00:00 +0000","For any organization that has invested in an internal developer platform, a question inevitably arises: Is it actually working? 
Simply tracking adoption rates won't tell you if your platform is truly...",2026-02-15
3134c79454fa56b5c4966518e4c25df4,GCP_Blog,The platform usage trap part 2: Choosing meaningful monitoring metrics,https://cloud.google.com/blog/products/application-development/how-john-lewis-partnership-chose-its-monitoring-metrics/,"Wed, 04 Feb 2026 18:00:00 +0000","In part one of this article, Alex Moss from the John Lewis Partnership covered the metrics that they use to measure the value of their developer platform. Now, let's talk about a crucial aspect of any...",2026-02-15
f92de23ce397e97100e6edab88ffae46,GCP_Blog,Choosing Antigravity or Gemini CLI,https://cloud.google.com/blog/topics/developers-practitioners/choosing-antigravity-or-gemini-cli/,"Wed, 04 Feb 2026 08:37:00 +0000","
    aside_block
    &lt;ListValue: [StructValue([(&#x27;title&#x27;, &#x27;NOTE&#x27;), (&#x27;body&#x27;, &lt;wagtail.rich_text.RichText object at 0x7f0bd9265e80&gt;), (&#x27;btn_text&#x27;, &#x27;&...",2026-02-15
416dd22536e56fe5987fc7f7774630e2,GCP_Japan,GKE Inference Gateway で Vertex AI のレイテンシを 35% 削減した方法,https://cloud.google.com/blog/ja/products/containers-kubernetes/how-gke-inference-gateway-improved-latency-for-vertex-ai/,"Fri, 13 Feb 2026 03:00:00 +0000","※この投稿は米国時間 2026 年 2 月 7 日に、Google Cloud blog に投稿されたものの抄訳です。
生成 AI が試験運用から本番環境に移行するにつれて、プラットフォーム エンジニアは、低レイテンシ、高スループット、管理可能なコストの実現という、推論サービングに関する共通の課題に直面します。
バランスを取るのは簡単ではありません。トラフィック パターンは、大量のデータを処理する...",2026-02-15
0b4ee9ee604e63efde9c16737c13793c,GCP_Japan,「公共部門における AI の ROI」に関する初の調査から見えた主要なポイント,https://cloud.google.com/blog/ja/topics/public-sector/key-insights-from-our-inaugural-survey-on-the-roi-of-ai-in-the-public-sector/,"Fri, 13 Feb 2026 02:00:00 +0000",※この投稿は米国時間 2026 年 2 月 4 日に、Google Cloud blog に投稿されたものの抄訳です。イノベーションの新たな時代が到来し、公共部門がその先導役を担っています。2025 年に生成 AI や AI エージェントの価値が実証されたことを受け、公共部門は今後、こうした変革的なテクノロジーの導入をさらに拡大し、ミッションの成果を一層加速させていく段階に入ります。Google ...,2026-02-15
d3eeca22aa3e4611bfa0560781e5df44,GCP_Japan,プラットフォーム使用の落とし穴（パート 1）: アクティビティの多さが必ずしも価値の高さを示すとは限らない理由,https://cloud.google.com/blog/ja/products/application-development/at-john-lewis-partnership-measuring-developer-platform-value/,"Fri, 13 Feb 2026 01:00:00 +0000","※この投稿は米国時間 2026 年 2 月 5 日に、Google Cloud blog に投稿されたものの抄訳です。
社内デベロッパー プラットフォームに投資した組織では、必ず「実際に機能しているのか？」という疑問が生じます。
導入率を追跡するだけでは、プラットフォームがデベロッパーに真の価値をもたらしているかどうかはわかりません。英国の大手小売業者である John Lewis も、この課題に直...",2026-02-15
df8a48cbe63c06004a6d875b4cf7d4ba,GCP_Japan,プラットフォーム使用の落とし穴（パート 2）: 意味のあるモニタリング指標を選択する,https://cloud.google.com/blog/ja/products/application-development/how-john-lewis-partnership-chose-its-monitoring-metrics/,"Fri, 13 Feb 2026 01:00:00 +0000","※この投稿は米国時間 2026 年 2 月 5 日に、Google Cloud blog に投稿されたものの抄訳です。
この記事のパート 1 では、John Lewis Partnership の Alex Moss 氏が、同社がデベロッパー プラットフォームの価値を測定するために使用している指標について説明しました。ここでは、あらゆる測定戦略の重要な側面である、測定対象の適切な選択について説明し...",2026-02-15
23e818a3d5f3130473996982e86a301a,GCP_Japan,プロダクション レディな AI を導入してマルチモーダルの新境地を生き抜く,https://cloud.google.com/blog/ja/topics/developers-practitioners/ship-production-ready-ai-and-survive-the-multimodal-frontier-this-february/,"Thu, 12 Feb 2026 02:00:00 +0000","※この投稿は米国時間 2026 年 2 月 6 日に、Google Cloud blog に投稿されたものの抄訳です。
AI を取り巻く環境は驚異的なスピードで変化しています。基本的な chatbot のセキュリティを確保する方法を考えていた次の日には、リアルタイムで見て、聞いて、反応できるエージェントについて検討している、といった具合です。
今年の 2 月と 3 月に開催される Google C...",2026-02-15
958f3ed97a53139bdc497e163bc14011,GCP_Japan,Future Mode パート 1: 企業向けのインテリジェントで安全なブラウザ,https://cloud.google.com/blog/ja/products/chrome-enterprise/future-mode-part-1-the-intelligent-and-secure-browser-for-enterprises/,"Thu, 12 Feb 2026 01:00:00 +0000","※この投稿は米国時間 2026 年 1 月 29 日に、Google Cloud blog に投稿されたものの抄訳です。編集者注: Future Mode シリーズでは、Chrome Enterprise のブラウザにおける AI について、どのような取り組みが行われているかを企業向けにご説明します。このシリーズの今後のブログにもご期待ください。
ブラウザはすでに進化をとげ、現代の企業にとってもは...",2026-02-15
665e868e7e38e1557f864217a8a12aa0,GCP_Japan,Vertex AI の Claude Opus 4.6 を発表,https://cloud.google.com/blog/ja/products/ai-machine-learning/expanding-vertex-ai-with-claude-opus-4-6/,"Tue, 10 Feb 2026 02:00:00 +0000",※この投稿は米国時間 2026 年 2 月 6 日に、Google Cloud blog に投稿されたものの抄訳です。Google Cloud は、最先端のモデルをお客様に提供することに取り組んでおり、パフォーマンス、信頼性、グローバル スケールに最適化されたプラットフォーム上で、プロダクション レディな AI アプリケーションやエージェントを構築、スケールすることを支援しています。このたび Go...,2026-02-15
7153d6e5561633eb239a099c688eeeaf,GCP_Japan,より高度なデータ暗号化の制御を実現する Single-tenant Cloud HSM の一般提供を開始,https://cloud.google.com/blog/ja/products/identity-security/introducing-single-tenant-cloud-hsm-for-more-data-encryption-control/,"Tue, 10 Feb 2026 02:00:00 +0000","※この投稿は米国時間 2026 年 2 月 3 日に、Google Cloud blog に投稿されたものの抄訳です。
高度に規制された分野で機密性の高いデータを扱う組織は、しばしば難しい選択を迫られます。厳格なコンプライアンス要件を満たすために物理的なハードウェアを自社で構築および管理するか、あるいは必要とするレベルの分離性を必ずしも提供できないクラウド サービスを利用するかという選択です。
こ...",2026-02-15
225f6bfbb590da1b839f657f7d1014b2,GCP_Japan,BigQuery AI ハッカソン: イノベーションを称え、新機能を紹介,https://cloud.google.com/blog/ja/topics/developers-practitioners/bigquery-ai-hackathon-celebrating-innovation-and-a-look-at-whats-new/,"Tue, 10 Feb 2026 01:00:00 +0000","
    aside_block
    &lt;ListValue: [StructValue([(&#x27;title&#x27;, &#x27;免責事項&#x27;), (&#x27;body&#x27;, &lt;wagtail.rich_text.RichText object at 0x7f5f3dbf9190&gt;), (&#x27;btn_text&#x27;, &#x27;&...",2026-02-15
7e3b7b3e55f9bd775139bea31791f8e0,GCP_Japan,Gemini Enterprise でインテリジェントな従業員オンボーディングを実現,https://cloud.google.com/blog/ja/topics/developers-practitioners/how-to-build-onboarding-agents-with-gemini-enterprise/,"Tue, 10 Feb 2026 01:00:00 +0000","※この投稿は米国時間 2026 年 2 月 3 日に、Google Cloud blog に投稿されたものの抄訳です。
従業員のオンボーディングは、ほとんどの場合、一直線に進むプロセスではありません。
個々のプロフィールに応じて必要な手続きや条件が大きく異なり、依存関係が複雑に絡み合う構造になっています。たとえば、ノートパソコンを手配するという一見シンプルな依頼であっても、システム側は従業員の職種...",2026-02-15
9e885bf748b730c48f23268941db3179,GCP_Japan,NVIDIA RTX PRO 6000 により、Cloud Run 上で高性能推論とサーバーレス コンピューティングが融合,https://cloud.google.com/blog/ja/products/serverless/cloud-run-supports-nvidia-rtx-6000-pro-gpus-for-ai-workloads/,"Mon, 09 Feb 2026 02:00:00 +0000","※この投稿は米国時間 2026 年 2 月 3 日に、Google Cloud blog に投稿されたものの抄訳です。
大規模な推論モデルの実行には、クラスタ管理や VM の手動メンテナンスなど、運用面で大きな負担が伴うことが少なくありません。こうした負担を軽減する方法の一つが、基盤となるインフラストラクチャを意識せずに利用できるサーバーレスのコンピューティング プラットフォームを活用することです...",2026-02-15
910420c2c4d2e29a65c27b275d38dba9,GCP_Japan,一般提供が開始された Axion ベースの N4A VM で費用対効果が 2 倍に,https://cloud.google.com/blog/ja/products/compute/axion-based-n4a-vms-now-in-preview/,"Fri, 06 Feb 2026 02:00:00 +0000","※この投稿は米国時間 2026 年 1 月 28 日に、Google Cloud blog に投稿されたものの抄訳です。
2026 年 1 月 27 日: N4A の一般提供が開始されました。使用を開始するには、Google Cloud コンソールから N4A をデプロイしてください。
昨今の意思決定者と構築者は、クラウド費用の増加を管理しながら、顧客が求めるパフォーマンスを実現するという課題に絶...",2026-02-15
60ca5160f4ff4dea3891c2d649264695,GCP_Japan,BigQuery の会話型分析のご紹介,https://cloud.google.com/blog/ja/products/data-analytics/introducing-conversational-analytics-in-bigquery/,"Thu, 05 Feb 2026 03:00:00 +0000","※この投稿は米国時間 2026 年 1 月 30 日に、Google Cloud blog に投稿されたものの抄訳です。
企業はすばやく行動し、情報に基づいた意思決定を行いたいと考えていますが、昨今の組織ではデータが爆発的に増加しているため、ナレッジチームが作業に忙殺され、ビジネス ユーザーは必要なデータ分析情報を得るために長い順番待ちをすることがよくあります。AI エージェントは、この関係を根本...",2026-02-15
0fc54fde87295bf54da032ea9aef09a5,GCP_Japan,.NET 向け Google Cloud Vertex AI Extensions のご紹介,https://cloud.google.com/blog/ja/topics/developers-practitioners/introducing-google-cloud-vertex-ai-extensions-for-net/,"Thu, 05 Feb 2026 03:00:00 +0000","※この投稿は米国時間 2026 年 1 月 30 日に、Google Cloud blog に投稿されたものの抄訳です。
2024 年 10 月、Microsoft は .NET 用の Microsoft.Extensions.AI.Abstractions ライブラリと Microsoft.Extensions.AI ライブラリを発表しました。これらのライブラリは、Open AI、Azure、G...",2026-02-15
f6db10ec0330f0325e732a81d4947548,GCP_Japan,Next Tokyo 26 スピーカー募集：あなたの Google Cloud、生成 AI 活用を発信しませんか？,https://cloud.google.com/blog/ja/topics/next-tokyo/call-for-speakers-at-next-tokyo-26/,"Thu, 05 Feb 2026 02:00:00 +0000",革新的なアイデアを、AI で実現しよう。旗艦イベント Google Cloud Next Tokyo を 2026 年 7 月 30 日（木）、 31 日（金）に東京ビッグサイト 南展示棟にて開催します。Next Tokyo 2026 の主役は、現場の第一線で活躍するエンジニア、そしてビジネスリーダーのみなさまです。AI と Google Cloud の最新トレンドを先取りして、ビジネスを加速させ...,2026-02-15
bfa1ce0eded0b18c6ca19d2a049ccf6d,GCP_Japan,Dataflow の ML インフラストラクチャに関する最新情報,https://cloud.google.com/blog/ja/products/data-analytics/new-dataflow-features-to-enable-streaming-and-ml-workloads/,"Wed, 04 Feb 2026 03:00:00 +0000","※この投稿は米国時間 2026 年 1 月 28 日に、Google Cloud blog に投稿されたものの抄訳です。
AI の世界は電光石火のスピードで変化しています。Google Cloud は、AI ワークロードと ML ワークロードを強化する最高水準のインフラストラクチャを提供することに尽力しています。Dataflow は、Google Cloud の AI スタックの重要なコンポーネン...",2026-02-15
944e3d332fa3e30cbc57fc4e18a31a9a,GCP_Japan,ホーム ネットワークに潜む脅威: 世界最大級の住宅用プロキシ ネットワークの活動を阻止,https://cloud.google.com/blog/ja/topics/threat-intelligence/disrupting-largest-residential-proxy-network/,"Wed, 04 Feb 2026 03:00:00 +0000","※この投稿は米国時間 2026 年 1 月 29 日に、Google Cloud blog に投稿されたものの抄訳です。
はじめに
今週、Google とパートナーは、世界最大級の住宅用プロキシ ネットワークの一つと考えられている IPIDEA プロキシ ネットワークを停止させる措置を講じました。IPIDEA のプロキシ インフラストラクチャは、さまざまな不正な行為者が利用するデジタル エコシステ...",2026-02-15
323c1ff64140dc37d0f4eda39b1c8d01,GCP_Japan,2025 年の Spanner: インテリジェントなマルチモデル AI アプリケーションを強化するイノベーション,https://cloud.google.com/blog/ja/products/databases/spanner-in-2025/,"Wed, 04 Feb 2026 02:00:00 +0000","※この投稿は米国時間 2026 年 1 月 29 日に、Google Cloud blog に投稿されたものの抄訳です。
Google は 10 年以上にわたり、常時稼働でほぼ無制限のスケーリングが可能なデータベースである Spanner を基盤として、Gmail、YouTube、Google フォトなどの世界規模のアプリケーションを支えてきました。現在、Spanner が処理する秒間クエリ数は ...",2026-02-15
3c257594d7b5930dc712457fbb8cd9bf,GCP_Japan,Cloud Run における Flutter: フルスタックの Dart アーキテクチャ,https://cloud.google.com/blog/ja/topics/developers-practitioners/flutter-on-cloud-run-full-stack-dart-architecture/,"Tue, 03 Feb 2026 02:00:00 +0000","※この投稿は米国時間 2026 年 1 月 28 日に、Google Cloud blog に投稿されたものの抄訳です。
Flutter は、モバイル、ウェブ、デスクトップのアプリケーションを単一のコードベースから構築するためのフレームワークです。Flutter に使用されている言語である Dart は、バックエンド開発にも適したコンパイル言語です。
フロントエンドとバックエンドの両方に Dart...",2026-02-15
527417873be9b715e7e8f371095fb76a,GCP_Japan,Community Mobility: Google Maps Platform を活用したサービスで、交通空白解消へ,https://cloud.google.com/blog/ja/products/maps-platform/community-mobility-solving-the-transit-desert-problem-through-google-maps-platform/,"Tue, 03 Feb 2026 01:00:00 +0000",少子高齢化社会の到来は、生活のあらゆる部分に影響を及ぼしています。中でも喫緊の課題とされているのが、地方における交通です。公共性の高い交通サービスの需要が高まる中、逆にドライバー不足が深刻化し、社会生活の維持に支障をきたしつつあります。乗合型オンデマンド交通サービスの運営事業とコンサルティングを手掛ける Community Mobility株式会社（以下、Community Mobility）は、...,2026-02-15
31e2f577b5f2d0ac662521df7296b93b,Ggen_Blog,Google SecOps MCP serverを使ってみた,https://blog.g-gen.co.jp/entry/using-secops-remote-mcp-server,2026-02-13T09:00:00+09:00,G-gen の三浦です。当記事では、Gemini CLI から Google SecOps MCP server を使用して、ケース確認からログ調査までを自然言語で要約した検証結果を紹介します。 前提知識 Google SecOps とは Gemini CLI とは 概要 Google SecOps MCP server とは 使用可能なツール 注意点 検証手順 事前準備 IAM 権限の付与と M...,2026-02-15
d086eae5e1e0a551513165b7da83d17b,Ggen_Blog,Developer Knowledge APIをMCPサーバー経由で使ってみた,https://blog.g-gen.co.jp/entry/using-developer-knowledge-api-via-mcp,2026-02-12T09:00:00+09:00,G-gen の高宮です。Google 公式の技術ドキュメントを検索するための Developer Knowledge API を、Gemini CLI から MCP サーバー経由で使用した検証結果を紹介します。 はじめに Developer Knowledge API とは MCP サーバーで使用可能なツール 注意事項 事前準備 Google Cloud の設定 Gemini CLI の設定 se...,2026-02-15
6338fb886df756b5b121bf308f1c1988,Ggen_Blog,Google Antigravityでバイブコーディングしてみた,https://blog.g-gen.co.jp/entry/getting-started-with-google-antigravity,2026-02-09T09:00:00+09:00,G-gen の三浦です。当記事では Google Antigravity を使用し、バイブコーディングで目標管理アプリを開発する手順と、Browser Agent によるデバッグの流れを紹介します。 概要 Google Antigravity とは リリースステージ 使用可能なモデル データの保護 検証手順 検証 インストール 初期設定 日本語化とルール設定 自然言語による開発 Browser A...,2026-02-15
