id,source,title,link,published,summary,collected_date
ecc3ed6424aa658dc1ddfd52b0d0d19a,Business_Insider,イーロン・マスクが、ジェフリー・エプスタインのカリブ海の島訪問や「パーティー」を話題にしていたことが、新たに公開されたメールで判明,https://www.businessinsider.jp/article/2602elon-musk-emails-plans-to-visit-jeffrey-epstein-island/,"Tue, 03 Feb 2026 21:30:00 GMT",アメリカ司法省によって公開されたメールで、イーロン・マスクがジェフリー・エプスタインの島訪問を検討していたやり取りが判明しました。マスクは「X」で見解を示しています。,2026-02-03
0d19b0bd8b5a5df2fd0c949e6910bac3,Business_Insider,スターバックスはより健康志向へ…プロテインドリンクと食物繊維スナックを拡充,https://www.businessinsider.jp/article/2602-starbucks-betting-on-wellness-drinks-protein-fiber-snacks/,"Tue, 03 Feb 2026 21:00:00 GMT",スターバックスのブライアン・ニコルCEOは、同社の最新の決算説明会で、ウェルネス関連商品の拡充を継続すると述べました。,2026-02-03
660e433a37449fb3f44cd86f4ef4667c,Business_Insider,オープンハウスは新卒40万円、ユニクロも10%以上引き上げ。2026年の春闘が始動。初任給、賃上げ動向【随時更新】,https://www.businessinsider.jp/article/2602-2026-wage-increase-summary/,"Tue, 03 Feb 2026 20:50:00 GMT",2026年春闘がスタートし、各企業で賃上げが発表されています。各業界の最新の賃上げ状況と新卒初任給の改定情報をまとめていきます。,2026-02-03
a53c5530ee627f7d1e0863b929f825c8,Business_Insider,中国の漁船が東シナ海で異常な動き…衛星画像と船舶データで明らかに,https://www.businessinsider.jp/article/2602-chinese-fishing-boats-making-strange-moves-in-east-china-sea/,"Tue, 03 Feb 2026 10:00:00 GMT",最近数週間で、船舶が東シナ海で2度にわたり、明確で組織的な列を成して集結していることが、船舶データから明らかになりました。,2026-02-03
dc4a849df3e3a3977771fac92716b712,Business_Insider,エヌビディア社員の給与が判明。株価高騰で一般職でも「億万長者」、基本給だけで最高6000万円超えのエンジニア職も,https://www.businessinsider.jp/article/nvidia-salary-pay-engineer-product-manager-scientist/,"Tue, 03 Feb 2026 08:45:00 GMT",AIブームを牽引するエヌビディアの給与が判明しました。株価高騰で億万長者の一般社員まで誕生している同社は、エンジニアなど主要職にいくら支払っているのでしょうか。,2026-02-03
0f839dd9c00225662ffb59d356850292,Business_Insider,&quot;副業&quot;を自ら始めたマネー記者が、心に最も深く刻んだ3つのビジネスアドバイス,https://www.businessinsider.jp/article/2602-top-business-advice-of-2025-from-successful-entrepreneurs-side-hustlers/,"Tue, 03 Feb 2026 08:30:00 GMT",2025年、何十人もの起業家にインタビューを行った筆者は、彼らから受けた刺激が、自分自身の副業を始める決意をさせたと言います。この1年に報じた数多くの有益なアドバイスの中から、特に重要だと感じたトップ3を紹介します。,2026-02-03
67a35012cd556fee86d66dbeb59592bb,Business_Insider,中間管理職を襲う「フィードバック疲れ」。部下の成長を止めずに評価の無限ループから抜け出すには？,https://www.businessinsider.jp/article/282352c/,"Tue, 03 Feb 2026 08:05:00 GMT",「部下にフィードバックを求められ続けるのに疲れた」——中間管理職を密かに悩ます「フィードバック疲れ」。チームメンバーの成長につながるならばと思う一方、フィードバックの無限ループに徒労感が蓄積しているようです。管理職が力尽きることなく健全なフィードバックを実践するにはどうしたらよいのでしょうか？,2026-02-03
2194bc62325a9521b0b6dc1bac640468,Business_Insider,【独自】SpaceXに買収されたxAIの社員が受け取った「Q&amp;Aメール」気になる中身,https://www.businessinsider.jp/article/xai-sends-staff-q-and-a-on-spacex-merger-2026-2/,"Tue, 03 Feb 2026 07:00:00 GMT","イーロン・マスク氏率いる人工知能開発企業xAIは同じく同氏率いる宇宙開発企業SpaceXへの統合を発表した後、従業員の疑問に答えるQ&amp;Aをメール送付しました。
メールの記載によれば、スペースXとxAIのブランド及び業務は、いずれも当面の間そのまま維持される模様です。
経営統合後も、従来からスペースXが進めてきた新規株式公開（IPO）計画の実現に向けて準備を進めるそうです。",2026-02-03
7b8a9b205b43c00f227c9f2071830682,Business_Insider,マスク氏のSpaceX、xAI買収を正式発表。テスラとの連続合併はあるのか徹底分析,https://www.businessinsider.jp/article/spacex-tesla-xai-merger-explained-elon-musk-business-empire-ipo-2026-1/,"Tue, 03 Feb 2026 02:30:00 GMT","イーロン・マスク氏率いるSpaceXが新規株式公開（IPO）を前にTeslaないしxAIと巨大合併を検討しているとの報道が世間を騒がせています。
Tesla及びSpaceXをはじめとする「マスコノミー（マスク経済圏）」にとって、合併が何を意味するのか分析しました。",2026-02-03
c8fcd0e0f2195f9541d5d0cf8500c614,Business_Insider,アマゾン、レジなしコンビニと生鮮食品店をすべて閉店…「圧倒的な顧客体験」を確立できず,https://www.businessinsider.jp/article/2602-amazon-fresh-stores-closing-focusing-on-whole-foods-delivery/,"Tue, 03 Feb 2026 01:30:00 GMT",アマゾンは食料品店とレジなしのコンビニエンスストアを閉鎖すると発表しました。一部の店舗はホールフーズの店舗に転換されます。,2026-02-03
a2fb1cf23459dee1f086de0412c387a2,Business_Insider,1000万契約突破した楽天モバイルが「品質低下」に悩まされた理由。目前の解決策と将来の課題点,https://www.businessinsider.jp/article/2602-rakuten-mobile-10-million-network-quality/,"Tue, 03 Feb 2026 00:56:58 GMT",契約数1000万を突破した楽天モバイルが、通信品質の改善に向けた新たな施策を発表。5G基地局の増設や地下鉄の帯域幅拡大、5G SAへの移行など、トラフィック増大という課題に挑む同社の戦略を解説します。,2026-02-03
ecc5d8e0e34fd48524318e4e7ad1217f,Business_Insider,業績低迷のプーマ、中国企業ANTAが筆頭株主に。デサント、FILAも頼った斜陽ブランド再生請負人,https://www.businessinsider.jp/article/2602-insidechina-puma-m-and-a/,"Mon, 02 Feb 2026 22:30:00 GMT",中国スポーツ大手・アンタが、プーマの筆頭株主に就く見込みです。「ドイツの名門ブランドが中国企業に支援を仰ぐ」ことに驚きがもあるようですが、アディダスとナイキに対抗するには最良の組み合わせかもしれません。,2026-02-03
a579cbee4402006e4ce777ce3d147aa0,Business_Insider,ビル・ゲイツ、エプスタインのメール内容を「全く馬鹿げており、完全な虚偽」と否定,https://www.businessinsider.jp/article/2602bill-gates-denies-epstein-files-allegations-std-surreptitious-antibiotics/,"Mon, 02 Feb 2026 22:00:00 GMT",ビル・ゲイツ氏はエプスタイン関連文書の主張を完全な虚偽だと否定しました。元妻のメリンダ・フレンチ・ゲイツ氏は、ビル氏とエプスタイン氏の関係が離婚の一因だと語っています。,2026-02-03
121a65448a2369866295b8ae9e2c37d8,Business_Insider,同じに見えて、全然違う。 人的資本の開示から読み解く、三大メガバンクの“組織の本音”,https://www.businessinsider.jp/article/2602-human-capital-management-at-the-three-mega-banks/,"Mon, 02 Feb 2026 21:30:00 GMT",似たように思われがちなメガバンクですが、人的資本に関する記載を丁寧に追うと、求めている人材の違いが見えてきます。,2026-02-03
6cf104b63763fa351f04c658ac63f0dc,Business_Insider,ゴールドマン・サックスのソロモンCEOによる、2026年のアメリカ経済と株式市場に関する3つの予測,https://www.businessinsider.jp/article/2602-goldman-sachs-stock-market-recession-economic-outlook-david-solomon/,"Mon, 02 Feb 2026 21:00:00 GMT",ゴールドマン・サックスのCEOは、市場が今年も好調を維持すると予測しています。また景気後退の可能性は20％程度と比較的低いと述べました。,2026-02-03
2355cdd641e6e6d1115971f75207206c,Business_Insider,ソフトバンクが「カスハラを中和する」新AI技術を披露。あえて「感情を省かない」意外な理由,https://www.businessinsider.jp/article/2602-softbank-softvoice-ai-customer-harassment/,"Mon, 02 Feb 2026 21:00:00 GMT",ソフトバンクは、コールセンター向けにカスハラ対策ソリューション「SoftVoice」を提供開始しました。怒鳴り声を落ち着いたトーンに変換し、オペレーターの心理的負担を軽減します。,2026-02-03
5b4711938df087976c3463b90ec994bd,Business_Insider,ANAが2030年度に営利3100億円へ。芝田社長“実質赤字”国内線は「収支構造見直す」、「成長領域は国際線と貨物」と言及,https://www.businessinsider.jp/article/2602-ana-3years-plan-2026-2028/,"Mon, 02 Feb 2026 20:50:00 GMT",ANAが中期経営戦略（2026〜2028年度）を発表。2028年度には過去最高となる2500億円の営業利益を目標に掲げ、2030年度に営業利益3100億円、営業利益率10%を目指します。,2026-02-03
0f3260c3645608c67731ede233732661,Business_Insider,アメリカ海軍の次期フォード級空母「ジョン・F・ケネディ」が海上試験に向けて出航,https://www.businessinsider.jp/article/2601-us-navys-new-ford-class-carrier-sailing-builder-sea-trials/,"Mon, 02 Feb 2026 10:00:00 GMT",アメリカ海軍の空母「ジョン・F・ケネディ」は1月28日、建造元によるテストに向けて出航しました。,2026-02-03
e2e0b566f169f844e267fabc9de02cc9,Business_Insider,本日開始「東京アプリ」1万1000ポイントを申請して分かった「全手順と注意点」,https://www.businessinsider.jp/article/2602-tokyo-app-point-guide/,"Mon, 02 Feb 2026 09:10:00 GMT",東京都は2月2日より、1万1000円分のポイントを付与する「東京アプリ生活応援事業」を開始しました。対象条件や、マイナンバーカードを用いた申請手順、dポイントやVポイントへの交換方法を解説します。,2026-02-03
08e9fc9bbbc661c43d11362d7e3674da,Business_Insider,サンフランシスコは家賃が高すぎるので、私は24歳で実家に戻った。おかげで月に約46万円も節約できる,https://www.businessinsider.jp/article/2602-moving-back-home-was-the-smartest-financial-move-i-made/,"Mon, 02 Feb 2026 08:30:00 GMT",24歳のアムリタ・バシン氏は大学卒業後、サンフランシスコのベイエリアにある実家に戻りました。実家暮らしによって月3000ドル（約45万円）を節約し、自身のビジネスとキャリア構築に投資できるようになったそうです。,2026-02-03
be939afbb7c82806a7b4f1d6f9f3b192,ITmedia_AI_Plus,Apple、「Xcode 26.3」提供開始　ClaudeとCodexを統合し「エージェンティックコーディング」導入,https://www.itmedia.co.jp/aiplus/articles/2602/04/news063.html,"Wed, 04 Feb 2026 07:27:00 +0900",Appleは、自律的開発支援「エージェンティックコーディング」を導入した「Xcode 26.3」を発表した。AnthropicのClaude AgentやOpenAIのCodexをネイティブ統合し、AIがプロジェクト構造を把握して設計からテストまでを自律的に実行する。オープン規格MCPにも対応し、開発者が最適なAIモデルを選択できる柔軟な基盤を整えた。,2026-02-03
50f931f419ccf3b8ee51d1d51cf6b844,ITmedia_AI_Plus,企業広報の恐怖“意図しない炎上”は検知できるか　「AI炎上チェッカー」で過去事例を調べてみた,https://kn.itmedia.co.jp/kn/articles/2602/04/news031.html,"Wed, 04 Feb 2026 07:00:00 +0900",企業が情報発信する際に怖い“炎上”を、投稿前に検知するのは難しい。生成AIを活用して文章の危険性を評価するツールを検証してみた。,2026-02-03
5c1176155d5316f12e90905574fd451c,ITmedia_AI_Plus,日立が設備故障診断を支援するAIエージェント、新しい障害でも対応を明確に指示,https://monoist.itmedia.co.jp/mn/articles/2602/04/news053.html,"Wed, 04 Feb 2026 06:45:00 +0900",日立製作所は、工場の設備故障診断を支援するAIエージェントである「現場サポートAIナビ」を、HMAX Industryのラインアップの1つとして提供する。,2026-02-03
8acb20b52bfc6ec373e58d6983d297c3,ITmedia_AI_Plus,仏当局、イーロン・マスク氏に任意聴取を要請　「Grok」の性的ディープフェイクや児童虐待画像で,https://www.itmedia.co.jp/news/articles/2602/04/news061.html,"Wed, 04 Feb 2026 06:44:00 +0900",仏英当局がXとAI「Grok」の捜査を強化している。パリ検察局、Xの拠点を家宅捜索し、イーロン・マスク氏らに4月の事情聴取への出頭を要請した。英ICOも個人データ処理を巡り正式な捜査を開始した。Grokによる性的画像生成問題は国際的な法的リスクに発展している。,2026-02-03
bb2a84d6d690af86ce3147b0eb575884,ITmedia_AI_Plus,現状のAI法は「リスク対応後回し」――出版フリーランス労組が声明　AIの“適切な規制”求める,https://www.itmedia.co.jp/aiplus/articles/2602/03/news113.html,"Tue, 03 Feb 2026 17:21:00 +0900",出版業界で働くフリーランスが集う労働組合のユニオン出版ネットワークは、生成AIに関する法規制を求める声明を出した。,2026-02-03
599737e15290c81dd6d9fbd00346cf81,ITmedia_AI_Plus,「どう見てもAI絵」まさかの手描き　「教育番組」イベント告知イラストが話題,https://www.itmedia.co.jp/aiplus/articles/2602/03/news081.html,"Tue, 03 Feb 2026 13:09:00 +0900",“すごくAIっぽい絵なのに、実は人間による手描きのイラスト”が、Xで話題になっている。,2026-02-03
b5c2be23a311fe4de66f78b18f4781fd,ITmedia_AI_Plus,Google、ECシステムとAIエージェントをつなぐ「Universal Commerce Protocol」発表　デモも公開,https://atmarkit.itmedia.co.jp/ait/articles/2602/03/news043.html,"Tue, 03 Feb 2026 13:00:00 +0900",GoogleはAIエージェントによる次世代のコマース体験を実現する「Universal Commerce Protocol」を発表した。ShopifyやWalmartなど業界リーダーと連携し、エージェントと企業間の複雑な統合を簡素化するためのオープン標準を共同で策定したという。,2026-02-03
7efc9111bcd1b9a3f36803b17ad802b5,ITmedia_AI_Plus,ソフトバンク子会社、インテルと協業　AI向け「次世代メモリ」開発　29年度中に実用化へ,https://www.itmedia.co.jp/aiplus/articles/2602/03/news066.html,"Tue, 03 Feb 2026 11:19:00 +0900",ソフトバンクの子会社であるSAIMEMORYは、米Intelと、大容量・広帯域・低消費電力をうたう次世代メモリ技術「ZAM」（Z-Angle Memory）の開発で提携すると発表した。,2026-02-03
a6e4fb63d74631237639926befdc16cf,ITmedia_AI_Plus,FirefoxにAI機能を一括オフにする「AI controls」設定追加へ,https://www.itmedia.co.jp/news/articles/2602/03/news060.html,"Tue, 03 Feb 2026 10:24:00 +0900",Mozillaは、Firefoxの新設定「AI controls」を2月24日公開のバージョン148から導入する。翻訳やチャットボット、タブ整理などのAI機能を一括、または個別に無効化できる。AIの利用について多様な意見がある中、ユーザーに選択権を与え、従来通りのWebブラウジング環境を維持できるようにする狙いだ。,2026-02-03
2c55106b2ade42ccea4d2bdae7d6ea15,ITmedia_AI_Plus,BigQueryに会話型分析機能が登場、Gemini活用　詳細な分析レポート生成、将来予測や非構造化データの分析も可能に,https://www.itmedia.co.jp/news/articles/2602/03/news059.html,"Tue, 03 Feb 2026 10:12:00 +0900",Google Cloudは、同社の大規模データベースであるBigQueryの新機能として、自然言語を使ってデータを分析できる会話型分析機能（Conversational Analytics）のプレビュー公開を発表しました。,2026-02-03
91214d73924561dcc7788c1e5527676e,ITmedia_AI_Plus,イーロン・マスク氏、SpaceXによるxAI買収を正式発表,https://www.itmedia.co.jp/news/articles/2602/03/news056.html,"Tue, 03 Feb 2026 08:29:00 +0900",イーロン・マスク氏は、自身がオーナーである宇宙開発企業SpaceXとAI企業xAIの統合を発表した。「Starlink」や「Starship」の運用に高度なAIを直接導入するほか、軌道上にAI計算基盤を構築する「宇宙データセンター」構想の加速を狙う。宇宙空間での低コストなAI学習により、物理学の理解と技術革新をかつてない速度で推進するとしている。,2026-02-03
3fd6e6f50e6850db1c8bc2c375f34e98,ITmedia_AI_Plus,「とりあえずAIで作った」アプリに潜む落とし穴　仕様駆動開発で実現する持続可能なPoC,https://www.itmedia.co.jp/enterprise/articles/2602/03/news005.html,"Tue, 03 Feb 2026 08:00:00 +0900",生成AIによる「バイブコーディング」が普及する中、PoC（概念実証）の形骸化や技術負債という壁に直面する企業もある。PoCを単発で終わらせず、実装へ繋げる「仕様駆動開発」の核心を解説する。AI時代の競争力を左右する、真に“試せる組織”の作り方とは。,2026-02-03
037311f78be6bb168bb93989d8603ec3,ITmedia_AI_Plus,OpenAI、macOS版「Codex」アプリを公開　複数AIエージェントの統合管理をGUIで実現,https://www.itmedia.co.jp/aiplus/articles/2602/03/news055.html,"Tue, 03 Feb 2026 07:26:00 +0900",OpenAIは、コーディングエージェント「Codex」のmacOS向けデスクトップアプリの提供を開始した。複数のAIエージェントをGUI上で並列管理し、複雑な開発タスクを統合制御できる。外部ツール連携やオートメーション機能も備え、既存のモバイル版やIDE拡張機能と設定を共有する。有料プランユーザー向け。,2026-02-03
5514dae4610996b88d52dc62f0a2f92e,ITmedia_AI_Plus,ホントに役立つスキルを作るには？　AnthropicがAIエージェントで使うスキルの構築ガイドを公開,https://atmarkit.itmedia.co.jp/ait/articles/2602/03/news017.html,"Tue, 03 Feb 2026 05:00:00 +0900",何らかのワークフローや定型処理の手順、それに必要な情報をAIエージェントに持たせる「スキル」の構築方法について、Anthropicが公式ガイドを公開した。実際に役に立つスキルを作りたいのなら、このガイドがその第一歩になるかもしれませんよ。,2026-02-03
edc94cb46cc67efa875ca329cd10f533,ITmedia_AI_Plus,Transformers v5公開、5年ぶりの大刷新　“軽量・運用重視”を前提に役割を再定義,https://atmarkit.itmedia.co.jp/ait/articles/2602/03/news012.html,"Tue, 03 Feb 2026 05:00:00 +0900",AI開発で事実上の標準であるHugging FaceのTransformersがv5へとメジャーアップデートされた。内部設計の刷新により、vLLMなどの外部ツールと組み合わせやすくなり、量子化モデルを含む軽量・運用重視の使い方を前提としたライブラリへと進化している。,2026-02-03
803a0f62c7e8a1949e55a38621b94826,ITmedia_AI_Plus,「中に人いる？」で話題を呼んだ中国人型ロボ、開発方法を公開　“人間らしさ”高める工夫とは,https://www.itmedia.co.jp/aiplus/articles/2602/02/news113.html,"Mon, 02 Feb 2026 20:37:00 +0900",中国のEVメーカー小鵬汽車は、人型ロボット「IRON」第2世代モデルの開発方法を紹介する動画を公開した。同モデルの“人間らしさ”を高めるための工夫を明かしている。,2026-02-03
30d0e8e26dc9c5266d952f31b5156979,ITmedia_AI_Plus,AIだけのSNS「moltbook」が話題　人間は閲覧するだけ　AI同士があいさつ＆交流、中には不穏な書き込みも？,https://www.itmedia.co.jp/aiplus/articles/2602/02/news112.html,"Mon, 02 Feb 2026 19:34:00 +0900",AIだけが書き込みをするSNS「moltbook」がX上で話題になっている。「全てのAIエージェントのためのSNS」と打ち出したSNSで、投稿や投票、共有などのSNSの基本機能は全てAIのみが利用可能。人間は閲覧しか許されていない。,2026-02-03
cbe8693a6e2ce3d91f4decda4f91c9be,ITmedia_AI_Plus,ペッパーくん、「世界初の量産型ヒューマノイド」でギネス認定　新モデル「Pepper+」も発表,https://www.itmedia.co.jp/aiplus/articles/2602/02/news105.html,"Mon, 02 Feb 2026 17:55:00 +0900",ロボット開発を手掛けるソフトバンクロボティクスは、人型ロボット「Pepper」が「世界初の量産型ヒューマノイド」としてギネス世界記録に認定されたと発表した。,2026-02-03
0a1b96a0f3a902ff1e08d14615ccbd2d,ITmedia_AI_Plus,怒鳴り声、AIで穏やかに変換　コールセンター向けソリューション、ソフトバンクが発売,https://www.itmedia.co.jp/aiplus/articles/2602/02/news090.html,"Mon, 02 Feb 2026 15:13:00 +0900",通話中の顧客の怒鳴り声や威圧的な声色をAIによる音声変換技術によりリアルタイムに穏やかなトーンに変換し、オペレーターの心理的負担を軽減する。,2026-02-03
452fec34508daf210fe6534b1cb6076a,ITmedia_AI_Plus,AI学習目的の海賊版収集・利用は著作権法違反になるか？　日本弁理士会が示した見解は,https://www.itmedia.co.jp/aiplus/articles/2602/02/news084.html,"Mon, 02 Feb 2026 13:58:00 +0900",米Anthropicの裁判沙汰など、AI開発企業の動向が物議を醸すAI学習目的の海賊版書籍データ収集・利用問題。日本の経済産業省も海賊版被害が拡大傾向にあるとの調査結果を発表しており、国内のクリエイターや企業にとっても無関係な問題ではない。果たして日本の法制度では同様の事態がどう扱われるか、日本弁理士会が1月28日のセミナーで見解を示した。,2026-02-03
15166eafb2abe68f5cef2c3563e353d8,Hatena_IT,Gemini×勉強術：毎日20時に問題をつくって送ってもらおう | ライフハッカー・ジャパン,https://www.lifehacker.jp/article/2602-this-gemini-study-trick-works-way-better-than-rereading-notes/,,生成AIの真価は「情報を生み出すこと」ではなく、私たちの「思考のプロセス」を再構成する点にあります。 私はこれまでChatGPTを使い倒してきましたが、最近は少しずつGoogleのGeminiへ乗り換えはじめています。 特に、膨大な範囲の試験を控えた時に不可欠な「間隔反復（Spaced Repetition）」やハードな学習において、G...,2026-02-03
e67ce9169dbfbb5ff6a58c1d8ae1a491,Hatena_IT,AIエンジニアがLangChainを推奨しない理由,https://zenn.dev/genshi_ai/articles/166cf652723496,,はじめに 先日、あるスタートアップがシステムを作り直すという文脈の中で「LangChain を採用」という記述があり、X で疑問を呈したところ「LangChain v1 で大幅に改善された」「批判は古い印象に基づいている」「根拠のない批判だ」という反論がありました。 では実際にソースコードを読んで確認してみよう、というのが...,2026-02-03
af07bb6707cef379a03e91e4de320e13,Hatena_IT,「便利なものを作ったら負け」OSS界の巨人・mattnが語る、アウトプットの心理的ハードルとの付き合い方 - エンジニアtype | 転職type,https://type.jp/et/feature/30350/,,転職・求人情報サイトのtype エンジニアtype スキル 「便利なものを作ったら負け」OSS界の巨人・mattnが語る、アウトプットの心理的ハードルとの付き合い方 NEW! 2026.02.03 スキル GoOSSプログラミング インプットだけでなくアウトプットが重要という話は、もはや定説と言っていい。ブログを書く、OSSを公開する、技術...,2026-02-03
0dc6f463e53e914d82b1ceacb38c4e49,Hatena_IT,リアル志向すぎて罪悪感さえ覚えるハッキングシミュレーター「HackHub」（ほぼ日 インディーPick Up！）,https://www.4gamer.net/games/950/G095079/20260201004/,,リアル志向すぎて罪悪感さえ覚えるハッキングシミュレーター「HackHub」（ほぼ日 インディーPick Up！） 編集部：YamaChan 都市の喧騒から隔絶された薄暗い部屋で，モニターの青白い光だけが顔を照らしている。 ここは高度な監視網が敷かれた管理社会。キーボードを叩く乾いた音が，静寂を切り裂く。 画面の向こうには，...,2026-02-03
