id,source,title,link,published,summary,collected_date
d8b8accc53c09c484e034bfe1b255efe,GCP_Blog,"Cool stuff Google Cloud customers built, May edition: Agentic algorithms for supply chains; virtual try-on APIs; robotic camera operators & more",https://cloud.google.com/blog/topics/customers/cool-stuff-google-cloud-customers-built-monthly-round-up/,"Fri, 29 May 2026 16:00:00 +0000","AI and cloud technology are reshaping every corner of every industry around the world. Without our customers, who are building the future on our platform, there would be no Google 
Cloud. In this regu...",2026-05-31
69e2412128dfef330e37d02fd167fecb,GCP_Blog,From petabytes to predictions: Easy BigQuery insights in Google Sheets,https://cloud.google.com/blog/products/data-analytics/using-connected-sheets-to-analyze-bigquery-data/,"Fri, 29 May 2026 16:00:00 +0000","Many organizations’ single source of truth is data that resides in BigQuery, Google’s governed, secure and petabyte-scale data platform. However, the ""last mile"" of ad-hoc analysis, modeling, and repo...",2026-05-31
e5a55d2a734a549c3c1cbb3293ebf5d2,GCP_Blog,Developer's guide to Gemini Enterprise and A2UI integration,https://cloud.google.com/blog/topics/developers-practitioners/guide-to-gemini-enterprise-and-a2ui-integration/,"Fri, 29 May 2026 16:00:00 +0000","If you've built a chatbot, you know this conversation:
User: ""Book a table for two tomorrow at 7pm."" Agent: ""Okay, for what day?"" User: ""Tomorrow."" Agent: ""What time?""
A date picker would have ended t...",2026-05-31
78d6925e953948a3df2c7cf3cc3b71e1,GCP_Blog,"AlloyDB Hot Standby: Faster failovers, consistent performance",https://cloud.google.com/blog/products/databases/alloydb-hot-standby-faster-failovers-and-consistent-performance/,"Fri, 29 May 2026 16:00:00 +0000","AlloyDB for PostgreSQL is a fully managed, PostgreSQL-compatible database service designed for the most demanding enterprise workloads. It combines the best of PostgreSQL with the power of Google, del...",2026-05-31
80128aa5342c262fe524ac2aa5a6e516,GCP_Blog,Cloud CISO Perspectives: How to build an AI-ready security program for the public sector,https://cloud.google.com/blog/products/identity-security/cloud-ciso-perspectives-how-to-build-an-ai-ready-security-program-for-the-public-sector/,"Fri, 29 May 2026 16:00:00 +0000","Welcome to the second Cloud CISO Perspectives for May 2026. Today, Usman Chaudhary, Field CISO, Google Public Sector, offers a guide for CISOs protecting government agencies and critical infrastructur...",2026-05-31
eea9e41b602d31d694c8ba438552ee65,GCP_Blog,How the University of Central Oklahoma is using AI to streamline analysis of complex criminal cases,https://cloud.google.com/blog/topics/public-sector/how-the-university-of-central-oklahoma-is-using-ai-to-streamline-analysis-of-complex-criminal-cases/,"Thu, 28 May 2026 19:00:00 +0000","In the high-stakes world of forensic science, time is the enemy of justice. The University of Central Oklahoma (UCO) Forensic Science Institute (FSI) was looking for an innovative AI solution that cou...",2026-05-31
a0a65e4cc28ba23cd28af4c3f80b68c9,GCP_Blog,Evolving Dataflow to process massive datasets for machine learning,https://cloud.google.com/blog/products/data-analytics/ai-focused-innovations-in-dataflow/,"Thu, 28 May 2026 16:00:00 +0000","Google created MapReduce more than 20 years ago to solve the scaling problems in data processing that the then young company was running into. The AI era that we are in now demands efficient, large-sc...",2026-05-31
6d870c2077fe44092c0a64dfbe681f76,GCP_Blog,"Nano Banana 2 and Nano Banana Pro are generally available, and already powering creative workflows",https://cloud.google.com/blog/products/ai-machine-learning/nano-banana-2-and-nano-banana-pro-are-generally-available/,"Thu, 28 May 2026 16:00:00 +0000","Organizations are unlocking entirely new ways to use image generation and editing across their industries. To drive next-generation experiences, businesses are embedding AI directly into creative, age...",2026-05-31
2b627e18ad29d65d9e5c74a1b4c79d88,GCP_Blog,AI in SRE: Where and how Google is deploying agentic AI to improve operations,https://cloud.google.com/blog/products/devops-sre/how-google-sre-is-using-agentic-ai-to-improve-operations/,"Thu, 28 May 2026 16:00:00 +0000","Since its inception over 20 years ago, Google has used Site Reliability Engineering (SRE) to keep services like Search, Gmail, Maps, YouTube and Google Cloud reliable and highly available, adhering to...",2026-05-31
a12672580376e69715470ad9b1bc7712,GCP_Blog,Go from resource-level to business-level maintenance in Google Cloud,https://cloud.google.com/blog/products/application-development/app-centric-maintenance-visibility-in-unified-maintenance/,"Thu, 28 May 2026 16:00:00 +0000","Managing planned maintenance is a critical part of running a reliable business. But as your cloud footprint grows into hundreds or even thousands of projects, keeping track of every individual update ...",2026-05-31
5fa7e7ea9dbedf12b8c66006a77d2b21,GCP_Blog,"Announcing the newest cohort of the Google for Startups Accelerator: Middle East, North Africa & Turkey",https://cloud.google.com/blog/topics/startups/meet-the-newest-cohort-of-our-mena-t-startup-accelerator/,"Thu, 28 May 2026 07:00:00 +0000","Google’s mission is to organize the world’s information and make it universally accessible. In high-growth, technically ambitious markets like the Middle East, North Africa, and Türkiye (MENA-T), we f...",2026-05-31
377093b814fe4e443d5f02f21b6745e6,GCP_Blog,A Guide to AI Cold Starts on Cloud Run,https://cloud.google.com/blog/topics/developers-practitioners/a-guide-to-ai-cold-starts-on-cloud-run/,"Wed, 27 May 2026 17:23:00 +0000","I saw a developer asking on Reddit if there was any “sane way” to manage Cloud Run cold starts for AI across multiple regions. They were experiencing startup latencies of up to 20 seconds, a frustrati...",2026-05-31
282069ca4cc0f76df985aa3626a12098,GCP_Blog,Introducing Google AI Threat Defense to help you outpace the adversary,https://cloud.google.com/blog/products/identity-security/introducing-google-ai-threat-defense/,"Wed, 27 May 2026 12:00:00 +0000","
    aside_block
    &lt;ListValue: [StructValue([(&#x27;title&#x27;, &#x27;Summary of today’s news&#x27;), (&#x27;body&#x27;, &lt;wagtail.rich_text.RichText object at 0x7fd3c6e92e80&gt;), (&#x27;btn_...",2026-05-31
8097efad62c87376b786587e2d27d6f3,GCP_Blog,How we evolved Google’s global and data center networks for the AI era,https://cloud.google.com/blog/products/networking/data-center-and-global-networks-built-for-ai-era/,"Tue, 26 May 2026 16:00:00 +0000","Over the last 25 years of building Google’s global network, we’ve navigated major architectural eras — from the Internet, to streaming, and the cloud. Today, we are squarely in the midst of a fourth: ...",2026-05-31
030a9b012bc749229c6676e36944a8e2,GCP_Blog,New study: Securing AI in the browser is a top priority for IT Leaders,https://cloud.google.com/blog/products/chrome-enterprise/new-study-securing-ai-in-the-browser-is-a-top-priority-for-it-leaders/,"Tue, 26 May 2026 11:20:00 +0000","The way we work has fundamentally changed. From automated agents to sophisticated AI services, Generative AI (GenAI) has become a daily tool for a vast majority of employees. But with this rapid adopt...",2026-05-31
fe87af22e8fe1787d3b6d74fa5354544,GCP_Blog,Exploitation of KnowledgeDeliver via ViewState Deserialization Vulnerability,https://cloud.google.com/blog/topics/threat-intelligence/knowledgedeliver-viewstate-deserialization-vulnerability/,"Mon, 25 May 2026 14:00:00 +0000","Written by: Takahiro Sugiyama, Peter Revelant, Mathew Potaczek

Introduction
In late 2025, Mandiant responded to a security incident involving a compromised web server running KnowledgeDeliver. Knowle...",2026-05-31
d3168ccf46c05adbac8df69dd1aaea01,GCP_Blog,2 PhaaS 2 Furious: The Evolution of Chinese-Language Phishing Services,https://cloud.google.com/blog/topics/threat-intelligence/chinese-language-phishing-services/,"Mon, 25 May 2026 14:00:00 +0000","While Russian-speaking threat actors have historically dominated the phishing-as-a-service (PhaaS) landscape, a rival ecosystem is rapidly growing within the Chinese-language underground. Google Threa...",2026-05-31
1fe76f33d5b7d0b68c7dad5eaf971a05,GCP_Blog,The Blueprint: How Movix fills a gap in dental skills with specialized agentic AI,https://cloud.google.com/blog/topics/startups/filling-the-gaps-in-dental-skills-with-specialized-agentic-ai/,"Fri, 22 May 2026 16:00:00 +0000","Welcome to The Blueprint, a regular feature where we highlight how Google Cloud customers are tackling unique and common challenges across industries using the latest AI and cloud technologies. We hop...",2026-05-31
e9901500c56b53b43dc39dad879ba598,GCP_Blog,How Glance turns hours of video into mobile-ready clips with AI,https://cloud.google.com/blog/products/media-entertainment/how-glance-turns-hours-of-video-into-mobile-ready-clips-with-ai/,"Thu, 21 May 2026 17:00:00 +0000","Every day, thousands of hours of new video content sits waiting to be discovered. Most of it lives in long-form, horizontal formats, while audiences are scrolling through vertical feeds on their phone...",2026-05-31
9d7153df01e35b0e2d1b43bb3dda824c,GCP_Japan,Google、Gartner® Magic Quadrant™ の AI アプリケーション開発プラットフォーム部門でリーダーに選出: 中間報告,https://cloud.google.com/blog/ja/products/ai-machine-learning/google-named-a-leader-in-the-gartner-magic-quadrant/,"Fri, 29 May 2026 03:15:00 +0000","※この投稿は米国時間 2026 年 5 月 14 日に、Google Cloud blog に投稿されたものの抄訳です。
2026 年 5 月の更新: この投稿は、レポートが初公開された昨年 11 月から半年後の時点での Google のポジショニングとプラットフォームの進化を反映して更新されました。
昨年秋、Google は Gartner® Magic Quadrant™ の AI アプリケー...",2026-05-31
c1712a6e693bac7ae2fe6d91a94d0856,GCP_Japan,GKE 上の Agent Sandbox の一般提供開始のお知らせと Agent Substrate のご紹介,https://cloud.google.com/blog/ja/products/containers-kubernetes/bringing-you-agent-sandbox-on-gke-and-agent-substrate/,"Fri, 29 May 2026 03:00:00 +0000","※この投稿は米国時間 2026 年 5 月 21 日に、Google Cloud blog に投稿されたものの抄訳です。
AI は、単純なチャット インターフェースから、関数呼び出し、コード実行、持続的なターミナル使用が可能な自律型エージェントへと短期間で変化しました。しかし、これらの機能を安全にオーケストレートするには、エージェントにインテリジェンスだけでなく、コードを実行するための堅牢かつ安全...",2026-05-31
493b62d4c256e5b6e9a3f4e36b515d38,GCP_Japan,AI Edge Portal を使用してオンデバイス LLM のベンチマークと最適化を行う,https://cloud.google.com/blog/ja/products/ai-machine-learning/benchmark-llms-on-device-with-ai-edge-portal/,"Fri, 29 May 2026 03:00:00 +0000","※この投稿は米国時間 2026 年 5 月 21 日に、Google Cloud blog に投稿されたものの抄訳です。
LLM は小規模でも高い性能を実現できるようになりましたが、スマートフォンなどのエッジデバイスへのデプロイは依然として大きな課題です。現在、デベロッパーは、アクセラレータ、オペレーティング システム、無数のシステム オン チップ（SoC）構成の広範な組み合わせにわたって最適化を...",2026-05-31
a3c5ee9e617e2c0f80cc2316e8c4b396,GCP_Japan,Google Cloud Partner Tech Influencer Challenge 2026 / Google Cloud Next ’26 関連コンテンツのご紹介,https://cloud.google.com/blog/ja/topics/partners/google-cloud-partner-tech-influencer-challenge-2026-next-26-related-content/,"Fri, 29 May 2026 02:00:00 +0000",Google Cloud Partner Tech Influencer Challenge 2026 についてGoogle Cloud ではパートナー企業の社員の皆様による技術コンテンツの投稿を応援しています。2022 年より開始した「テクニカル ブログ チャレンジ」は、2025 年から「Google Cloud Partner Tech Influencer Challenge」と名称を変更し...,2026-05-31
d699736bd75b40491572b7e978904a4f,GCP_Japan,新たな次元の理解を可能にする: Google の画像を使用した高度な地理空間 AI,https://cloud.google.com/blog/ja/products/maps-platform/unlocking-a-new-dimension-of-understanding-advanced-geospatial-ai-using-google-imagery/,"Fri, 29 May 2026 01:20:00 +0000","※この投稿は米国時間 2026 年 4 月 24 日に、Google Maps Platform blog に投稿されたものの抄訳です。
Cloud Next では、Google Earth AI のイノベーションを活用した　Imagery Insights ポートフォリオの大幅な拡張を発表しました。地形に対する理解と意思決定方法の変革を支援するよう設計されています。また、Earth AI の一部...",2026-05-31
cb067e8f24e1619f448ce744cefc3959,GCP_Japan,ハイパーローカル データとリアルタイム ルーティングで移動効率と配送完了率を大幅に向上,https://cloud.google.com/blog/ja/products/maps-platform/supercharge-trip-efficiency-and-delivery-completion-with-hyperlocal-data-and-real-time-routing/,"Fri, 29 May 2026 01:10:00 +0000","※この投稿は米国時間 2026 年 4 月 16 日に、Google Maps Platform blog に投稿されたものの抄訳です。
すべての配送がビジネスを左右する
ドライバーが渋滞にはまっています。配送はすでに遅れており、荷物が今どこにあるのか、いつ届くのかもわかりません。ようやくドライバーが建物の前に到着しても、入口が見つからないことがあります。さらに悪い場合には、住所が間違っていて、配...",2026-05-31
c6b2ca80359c8cf40b5e7f68f2706e32,GCP_Japan,SAP SAPPHIRE 2026: Google Cloud が統合エージェントの構想と大規模なコンピューティングのスケーリングを発表,https://cloud.google.com/blog/ja/products/sap-google-cloud/sap-sapphire-2026-the-future-of-google-cloud-ai-agents/,"Fri, 29 May 2026 01:00:00 +0000","※この投稿は米国時間 2026 年 5 月 13 日に、Google Cloud blog に投稿されたものの抄訳です。
デジタル技術によって常時接続されている現在のハイパーコネクティッドな市場において、企業にとって最も価値あるアセットのミッション クリティカルなデータが、古いサイロに閉じ込められたままとなっていることも少なくありません。長年にわたり、リーダーシップ チームはデータ パイプラインに...",2026-05-31
f889dc5918817cdd0fd900b1339cd6df,GCP_Japan,Google AI Threat Defense 発表：攻撃者の先を行くために,https://cloud.google.com/blog/ja/products/identity-security/introducing-google-ai-threat-defense/,"Thu, 28 May 2026 03:10:00 +0000","※この投稿は米国時間 2026 年 5 月 28 日に、Google Cloud blog に投稿されたものの抄訳です。

    aside_block
    &lt;ListValue: [StructValue([(&#x27;title&#x27;, &#x27;本日のニュースの概要&#x27;), (&#x27;body&#x27;, &lt;wagtail.rich_text.Ric...",2026-05-31
959755dec0287fd8f47165ca1b1d7c85,GCP_Japan,AI モデルがかつてない速さで脆弱性を発見する時代に、企業はどう備えるべきか,https://cloud.google.com/blog/ja/topics/threat-intelligence/defending-enterprise-ai-vulnerabilities/,"Thu, 28 May 2026 03:00:00 +0000","はじめに
AI モデルを利用した脆弱性悪用の高度化により、その用途専用に設計されていない汎用 AI モデルであっても、脆弱性の発見に優れた性能を発揮できることが示されています。やがて、こうした機能は開発サイクルそのものに直接組み込まれ、コードの悪用はこれまで以上に困難になるでしょう。しかし、この移行期には重大なリスクが高まる局面が生じます。これは、AI による既存ソフトウェアの強化が進む一方で、脅...",2026-05-31
e6b99758b98f65785ebbeb2aead813b3,GCP_Japan,Google の分散エージェント ランタイム、Agent Executor のご紹介,https://cloud.google.com/blog/ja/products/ai-machine-learning/agent-executor-googles-distributed-agent-runtime/,"Thu, 28 May 2026 03:00:00 +0000","※この投稿は米国時間 2026 年 5 月 21 日に、Google Cloud blog に投稿されたものの抄訳です。
モデルとハーネスの進化に伴い、エージェントは数時間、場合によっては数日間にわたって実行される、より複雑なタスクを担うようになっています。しかし、エージェントにより多くの処理を任せるにつれ、新たな運用上の課題も明らかになってきました。長時間実行されるエージェント ワークフローは壊...",2026-05-31
11a539d73d8fb35dfcfc145750779452,GCP_Japan,立教学院：Google AI Pro for Education で描く「自由の学府」の未来。全専任職員 100% の利活用を目指す組織変革の舞台裏,https://cloud.google.com/blog/ja/products/ai-machine-learning/rikkyo-university-envisioning-the-future-of-university-of-freedom-with-google-ai-pro-for-education/,"Thu, 28 May 2026 02:00:00 +0000",Google Cloud は、日本国内の教育機関におけるデジタルトランスフォーメーション（DX）を強力に支援しています。今回、150 年以上の歴史を持つ立教学院が、Google Cloud の支援のもと、Gemini アプリケーションの有償版である Google AI Pro for Education を全専任職員へ導入しました。少子化という大きな社会課題を背景に、なぜ今、AI なのか。DX 推...,2026-05-31
259a65dad46b2c58874e9565c8d9d6e0,GCP_Japan,Roads Management Insights を拡張し、公共セクターと民間セクター向けの新機能を導入,https://cloud.google.com/blog/ja/products/maps-platform/roads-management-insights-expands-with-new-capabilities-for-the-public-and-private-sectors/,"Thu, 28 May 2026 01:05:00 +0000","※この投稿は米国時間 2026 年 4 月 22 日に、Google Maps Platform blog に投稿されたものの抄訳です。
Google Maps Platform は昨年、公共セクターの道路管理者が都市インフラを最適化するために必要となる詳細なネットワーク インテリジェンスを利用できるように、Roads Management Insights（RMI）をリリースしました。このたび、...",2026-05-31
54f441f8e1e014df6c31edfbb1db96eb,GCP_Japan,静的な地図から地理空間 AI へ: Population Dynamics Insights を発表,https://cloud.google.com/blog/ja/products/maps-platform/from-static-maps-to-geospatial-ai-announcing-population-dynamics-insights/,"Thu, 28 May 2026 01:00:00 +0000","※この投稿は米国時間 2026 年 4 月 22 日に、Google Maps Platform blog に投稿されたものの抄訳です。
このたび Cloud Next において、Google は Google Earth AI のデータセットである Population Dynamics Insights（PDI）のプレビュー版を発表しました。PDI は Google Maps Platform...",2026-05-31
2ef02cf2e99fa96d832d7eaf15267b7f,GCP_Japan,How Google Does It: フリート全体での大規模な A/B テスト,https://cloud.google.com/blog/ja/topics/systems/how-google-does-it-fleet-wide-large-scale-ab-experimentation/,"Wed, 27 May 2026 03:00:00 +0000","※この投稿は米国時間 2026 年 5 月 19 日に、Google Cloud blog に投稿されたものの抄訳です。
A/B テストと聞くと、ボタンの色、ランディング ページのレイアウト、購入手続きのフローを思い浮かべる人がほとんどでしょう。Google では、多くの基本的なインフラストラクチャの改善にも、A/B テストの厳密さが求められます。メモリ アロケータやカーネル スケジューラを最適化...",2026-05-31
7f22193c9bf7fda163859083e08e3648,GCP_Japan,現実世界の画像と AI を活用して構築する 3 つの新しい方法,https://cloud.google.com/blog/ja/products/maps-platform/three-new-ways-to-build-with-real-world-imagery-and-ai/,"Wed, 27 May 2026 01:05:00 +0000","※この投稿は米国時間 2026 年 4 月 22 日に、Google Maps Platform blog に投稿されたものの抄訳です。
インフラ計画から自然災害の評価まで、企業や都市計画担当者は現実世界を把握するために Google のマッピング ツールを活用しています。このたび Cloud Next において、Google は画像関連プロダクトに関する 3 つの AI アップデートを発表しまし...",2026-05-31
67698a294da9265aa8afe91feeee5b06,GCP_Japan,エージェント エクスペリエンスの新時代へ,https://cloud.google.com/blog/ja/products/maps-platform/powering-the-next-era-of-agentic-experiences-announcing-new-grounding-capabilities/,"Wed, 27 May 2026 01:00:00 +0000","※この投稿は米国時間 2026 年 4 月 22 日に、Google Maps Platform blog に投稿されたものの抄訳です。
今回の Cloud Next で、差別化された AI エクスペリエンスの構築に役立つ新機能と拡張機能を発表いたしました。単純なチャットを超えるために、AI エージェントには 2 つの基礎的なレイヤが求められています。推論を実世界に固定するグラウンディングの「真実...",2026-05-31
2755de466bf9f051a1baab8129caed92,GCP_Japan,KnowledgeDeliver の侵害: ViewState デシリアライゼーション脆弱性の悪用,https://cloud.google.com/blog/ja/topics/threat-intelligence/knowledgedeliver-viewstate-deserialization-vulnerability/,"Mon, 25 May 2026 01:00:00 +0000","著者: 杉山 貴裕、Peter Revelant, Mathew Potaczek

はじめに
2025 年終わりに、Mandiant は KnowledgeDeliver が稼働するウェブサーバーの侵害への対応を行いました。KnowledgeDeliver は株式会社デジタル・ナレッジが開発する学習管理システム (LMS) で、広く日本で使用されています。調査の結果、認証なしリモートコード実行 ...",2026-05-31
c0d1748da4ce3ff6894ad80108b3a9f8,GCP_Japan,2 PhaaS 2 Furious：中国語圏のフィッシングサービスの進化,https://cloud.google.com/blog/ja/topics/threat-intelligence/chinese-language-phishing-services/,"Mon, 25 May 2026 01:00:00 +0000",これまでPhaaS （PhaaS：サービスとしてのフィッシング）の領域はロシア語圏の脅威アクターが支配的でしたが、現在、中国語圏のアンダーグラウンドで競合となるエコシステムが急速に成長しています。Google Threat Intelligence Group（GTIG）は、中国のアンダーグラウンドで現在提供されている十数のPhaaSを分析しました。これらはすべて成熟したサービスであり、同地域のよ...,2026-05-31
5f5d6528e7f1fb905058e634bab9db11,GCP_Japan,Cloud Storage Rapid: AI と分析のための超高速化されたオブジェクト ストレージ,https://cloud.google.com/blog/ja/products/storage-data-transfer/cloud-storage-rapid-turbocharges-object-storage-for-ai-analytics/,"Fri, 22 May 2026 03:00:00 +0000","※この投稿は米国時間 2026 年 5 月 12 日に、Google Cloud blog に投稿されたものの抄訳です。
Google Cloud Next ’26 において、Google は AI や分析などのデータ集約型ワークロード向けのオブジェクト ストレージ機能ファミリーである Cloud Storage Rapid を発表しました。Cloud Storage Rapid は登場時点で、高...",2026-05-31
39cdeeb4c7133ef3e987253558db037b,GCP_Japan,将来を見据えたデータ戦略のために: AlloyDB に PostgreSQL 18 と新しい延長サポートを追加,https://cloud.google.com/blog/ja/products/databases/postgres-18-and-extended-support-for-legacy-versions-in-alloydb/,"Fri, 22 May 2026 02:00:00 +0000","※この投稿は米国時間 2026 年 5 月 12 日に、Google Cloud blog に投稿されたものの抄訳です。
2026 年のインフラストラクチャ ロードマップを検討するにあたっては、迅速なイノベーションの必要性と運用上の安定性のバランスを取ることが目標となります。最新のデータベース機能を導入することと、ワークロードに対応した安全な環境を維持することのどちらか一方を選択する必要はないはず...",2026-05-31
aebd4e23a94d97211710c787a5425edc,Ggen_Blog,Cloud MonitoringのMCPサーバーを使ってインシデント対処を自動化してみた,https://blog.g-gen.co.jp/entry/automated-incident-responses-with-mcp-servers,2026-05-29T09:00:00+09:00,G-gen の勝島です。当記事では、Gemini Enterprise Agent Platform と Cloud Monitoring の MCP サーバーを組み合わせて、エラーログの検知から AI による原因分析、Slack 通知までを自動化します。 はじめに Gemini Enterprise Agent Platform とは MCP（Model Context Protocol）とは ...,2026-05-31
e42e8ef492fbc85c8b5df448adff25d1,Ggen_Blog,Agent Skillsを徹底解説！,https://blog.g-gen.co.jp/entry/agent-skills-explained,2026-05-27T09:00:00+09:00,G-gen の福井です。当記事では、AI エージェントツールに専門知識やワークフローを追加するためのオープンフォーマットである Agent Skills について、概念や動作の仕組み、スキルの構造、使い方などを解説します。 概要 Agent Skills とは Skills が可能にすること Skills の実体 Agent Skills の仕組み 基本的な動作 コンテキスト肥大化の防止 Skil...,2026-05-31
