id,source,title,link,published,summary,collected_date
cc453821cec43e96c95cfe5d49cbebb3,Business_Insider,グーグル、新製品発表イベントでアップルを批判…遅れているAI対応、メッセージの色、ウォールドガーデンなど,https://www.businessinsider.jp/article/2508-google-criticizes-apple-ai-walled-garden-iphone-photos-text-bubbles/,"Sun, 24 Aug 2025 22:30:00 GMT",グーグルの2025年新製品発表イベントでは、同社は「ウォールド ガーデン」から「飽きられた」テキスト メッセージのバブルの色論争まで、アップルを何度か批判しました。,2025-08-24
4817073ab29fc6cb1da71a0959c6a937,Business_Insider,米国立研MARVEL計画の元責任者が共同創業、小型原子炉ベンチャーAalo Atomicsの1億ドル調達に注目,https://www.businessinsider.jp/article/aalo-atomics-100-million-valor-nuclear-reactor-startup-data-center-2025-8/,"Sun, 24 Aug 2025 21:55:00 GMT","量産可能な小型モジュール炉（SMR）の開発を進めるアーロ・アトミックス（Aalo Atomics）が1億ドルの調達に成功しました。
リード投資家のヴァーラー・エクイティ・パートナーズ（Valor Equity Partners）はイーロン・マスク氏率いる人工知能開発企業xAIの大規模出資元です。",2025-08-24
6e97107b0d06d792a419736004fd90c9,Business_Insider,米大企業の変節：AT&amp;Tは多くの管理職に転勤か、退職かの選択を迫っている…ヘルプデスク部門の統合を推進,https://www.businessinsider.jp/article/2508-att-help-desk-manager-relocation-stankey-memo/,"Sun, 24 Aug 2025 21:40:00 GMT",AT&amp;Tのサービスデスク部門の管理職は、全社的な調査で従業員のエンゲージメントが低下していることが判明したため、部門のオフィス統合計画が加速したと述べています。,2025-08-24
7df24cb0a4f8e952a0ae4467369fa455,Business_Insider,「16事業売却」の先に目指すのは。レゾナックが仕掛ける半導体“材料”革命…「理想はオイシックス」と語る理由,https://www.businessinsider.jp/article/2508-resonac-cfo-interview/,"Sun, 24 Aug 2025 21:15:00 GMT",2023年1月に昭和電工と昭和電工マテリアルが統合して誕生した化学メーカーのレゾナックが、半導体事業に注力しています。これまでに16事業を売却するなど、経営の選択と集中を進めてきた染宮秀樹CFOに、レゾナックのこれまでとこれからを聞きました。,2025-08-24
88b3d82d0a6d6e48b4b97593fae79fd1,Business_Insider,お茶会、豆まき、花火大会まで──令和の東京に“昭和のご近所”が蘇る。築50年の中古マンションに学ぶ、新たな共助モデル,https://www.businessinsider.jp/article/2508-apartment/,"Sun, 24 Aug 2025 12:00:00 GMT",「ただいま！」という声とともに、子どもたちが帰宅してまず向かうのは、自宅ではなくマンションの“管理人室”です。そして、節分には豆まき、夏には花火大会。東京都世田谷区にある築50年以上の「柿の木坂パレス」は、独自の“コミュニティづくり”によって、現代の課題に向き合い、住民主体のオルタナティブな運営モデルを築いてきました。,2025-08-24
0d7ee53da3383a6554a30a253b839845,Business_Insider,ビリオネアの子育ては「バランス調整が難しい」。不動産王のジェフ・グリーン氏は語る,https://www.businessinsider.jp/article/2508-jeff-greene-parenting-wealth-billionaires-jets-yachts-mansions-balance-philanthropy/,"Sun, 24 Aug 2025 08:30:00 GMT",,2025-08-24
2c4543516e6d68a5dd81315dfd23ffad,Business_Insider,AIボットだけのSNSを作ってみた…彼らはすぐに派閥を形成し、極端な意見を増幅させ、少数のエリート層が支配するようになった,https://www.businessinsider.jp/article/2508-researchers-ai-bots-social-media-network-experiment-toxic/,"Sun, 24 Aug 2025 06:00:00 GMT",研究者たちは、二極化のループを打破するために6つの介入策も試してみたそうですが、いずれも問題を解決することはできませんでした。,2025-08-24
e441f3a501bf009473ef08de8cce33ea,Business_Insider,学士号を必要としない工学系・建築系の仕事の報酬トップ12 [2025年版],https://www.businessinsider.jp/article/2508-pay-engineering-architecture-jobs-without-bachelors-degree/,"Sat, 23 Aug 2025 23:30:00 GMT",例えば、電気・電子工学の技術者は通常、学士号を必要とせず、約7万7000ドルの収入を得ています。,2025-08-24
7c6617e83ef9a135c457ce6775d7b555,Business_Insider,92歳の金融界のレジェンド、早期引退すべきではない理由を語る…『ウォール街のランダム・ウォーカー』の著者,https://www.businessinsider.jp/article/2508-burt-malkiel-careers-personal-finance-retirement-trump-tariffs-immigration-universities/,"Sat, 23 Aug 2025 23:00:00 GMT",92歳のバート・マルキールはBusiness Insiderに対し、人生は予測不可能なのだから人々は退職を遅らせるべきで、中でもトランプ大統領の政策は懸念事項だと語っています。,2025-08-24
5f0a452ea6fbebe334a85596fa4450dc,Business_Insider,【佐藤優】中学受験は「予防接種」。正解のない世界を生き抜く「非認知能力」はどう身につければいい？,https://www.businessinsider.jp/article/278882d/,"Sat, 23 Aug 2025 23:00:00 GMT",複雑性の高まる世界で子どもが生き抜く力をつけるにはどうすればいいのか？　読者からの相談に、佐藤優さんが回答します。中学受験は予防接種のようなもの、受験勉強で生き抜く力は身につかない—— その真意とは。,2025-08-24
84c3b5195eb7338d1ba2b0736a039388,Business_Insider,24歳で家を購入した私は、自分が人生に何を望んでいるのか分かっていなかった,https://www.businessinsider.jp/article/2508-bought-first-house-at-24-quickly-regretted-now-live-abroad/,"Sat, 23 Aug 2025 08:30:00 GMT",筆者は素晴らしい投資と考え家を購入しましたが、それにより自信を得るどころか、行き詰まりを感じたそうです。あらゆる判断を、家のことを考慮して行わなければならず、友人や家族からの孤立を感じるようになったのだとか。,2025-08-24
abff3c261b1899bf6df322edffb39e61,Business_Insider,グーグルが警戒するアップル「iPhone 17」はどんなスマホになる？,https://www.businessinsider.jp/article/2508-apple-iphone-17-rumors-and-specs/,"Sat, 23 Aug 2025 08:00:00 GMT",今週はグーグルのPixel 10シリーズに沸きました。これを皮切りにまだ見ぬiPhoneなど、製品ラッシュが続くIT業界。各社どんなアプローチをしていくでしょうか。,2025-08-24
cc09707da8f749cac184172892c566a6,Business_Insider,中小企業は労働者へ「RTOは不要」とアピールすることで大企業と戦える,https://www.businessinsider.jp/article/2508-big-firms-push-rto-small-startups-recruit-talent-young-workers/,"Sat, 23 Aug 2025 06:00:00 GMT",大企業がRTOの実施を迫られる中、スタートアップにとってはその逆を行って優秀な人材を獲得する絶好のタイミングとなる可能性があります。,2025-08-24
cb020a3136a9c85349d75cd18822dfeb,Business_Insider,日立財団、東大教授らがあえて“男女”で考えた「理系女子少ない」問題。「女子は文系」時代の終わり,https://www.businessinsider.jp/article/2508-hitachi-foundation-and-tokyo-university-professors-on-why-there-are-so-few-women-in-stem/,"Sat, 23 Aug 2025 02:00:00 GMT",日本はOECD諸国のなかで、理系の女性割合が世界最下位──その現状を前に、日立財団と東大教授らが“本当の課題”を考えました。,2025-08-24
cde2ec9c6c27d92d0bf2951ca45c46a0,Business_Insider,米証券大手シタデルの幹部6人による「休暇におすすめ」の書籍と動画,https://www.businessinsider.jp/article/2508-citadel-securities-leaders-summer-reading-summer-sam-altman-2025-7/,"Fri, 22 Aug 2025 23:30:00 GMT",米証券大手のシタデル・セキュリティーズの幹部たちは休暇で、AIの未来、歴史の流れ、そして死なないための方法など哲学的な考察を深めているようです。彼らの推薦する図書と動画を紹介します。,2025-08-24
f4b93ba205c2e253e03f1f13e3b10515,Business_Insider,ウクライナ戦争における対ドローンDIY装甲、ますます「マッドマックス」的になる,https://www.businessinsider.jp/article/2508-images-show-wild-vehicle-cage-armor-for-drones-ukraine-war/,"Fri, 22 Aug 2025 23:00:00 GMT",ロシアとウクライナは戦車や軍用車両にドローン対策のDIY装備を施していますが、そのデザインはますます奇妙になっています。,2025-08-24
72bf372deb710d62ce03c18367d93d3c,Business_Insider,トレーダージョーズで3年間働きました。今でも10種類の「過小評価されている逸品」を求めて、頻繁にお店に通っています,https://www.businessinsider.jp/article/9ae6787b-c64e-4cd1-9695-0426ef082e53/,"Fri, 22 Aug 2025 23:00:00 GMT",,2025-08-24
fa0f0749f2f5bda81f711c1bad3a0ffd,Business_Insider,【佐藤優】ビジネスパーソンがTOEICより簿記2級を取るべき理由。公務員でも活かせる会計の視点,https://www.businessinsider.jp/article/what-qualifications-should-business-people-get-instead-of-toeic-a/,"Fri, 22 Aug 2025 22:30:00 GMT",「国家公務員でも簿記2級を取得すべきか？」という読者からの質問に佐藤優さんが回答。公務員どころか、全てのビジネスパーソンが取るべき資格だと断言します。最大のメリットは企業の財務諸表をある程度読み解けるようになる点で、パートナー企業の選定や、転職、投資まで活きると指摘します。,2025-08-24
3dc2cd1d62f3b370ece99e49b4f450d7,Business_Insider,FRB・パウエル議長、ジャクソンホールで「利下げ」を示唆。3指数は1.5％以上の急騰を見せる,https://www.businessinsider.jp/article/2508-powell-jackson-hole-speech-stock-market-interest-rate-cut-inflation/,"Fri, 22 Aug 2025 15:23:47 GMT",FRB・パウエル議長のジャクソンホールでの発言が投資家にとって最良のシナリオを示したことを受けて、米国株は急騰。同氏は、中央銀行が9月に25ベーシスポイントの利下げを実施する用意があることを示唆しました。,2025-08-24
a494a1af98b10225db6afc7e2b856890,Business_Insider,一生に一度は見たい「裏話で見方が変わる絵」（東京国立近代美術館）,https://www.businessinsider.jp/article/2508-wada-sanzo-south-wind/,"Fri, 22 Aug 2025 12:00:00 GMT","一生に一度は見たい、東京美術案内。今回から東京国立近代美術館の4作品を取り上げます。和田三造の作品《南風》はコレクション展のハイライトに展示。案内してくれた主任研究員の成相肇さんは「東京国立近代美術館にとって、この作品はコレクションの起点になります」と語ります。
《南風》が発表されたのは1907年（明治40年）のこと。同作品は初めて国が主催した美術展覧会「文部省美術展覧会（文展）」で最高賞の二等賞...",2025-08-24
c68f6217fafde6b2d1890733f2ae5c2e,ITmedia_AI_Plus,富岳NEXTの開発は「Made with Japan」、NVIDIAが加わりアプリ性能100倍の達成へ,https://monoist.itmedia.co.jp/mn/articles/2508/25/news047.html,"Mon, 25 Aug 2025 07:30:00 +0900",スーパーコンピュータ「富岳」の次世代となる新たなフラグシップシステム「富岳NEXT」の開発体制が発表された。理研を開発主体に、全体システムと計算ノード、CPUの基本設計を富士通が担当する一方で、GPU基盤の設計を米国のNVIDIAが主導するなど「Made with Japan」の国際連携で開発を推進する。,2025-08-24
66241f8760e2532196d488549c0e7236,ITmedia_AI_Plus,NotebookLMからフルカスタムまで　Google CloudでRAGを構築する方法を徹底解説,https://kn.itmedia.co.jp/kn/articles/2508/25/news026.html,"Mon, 25 Aug 2025 07:00:00 +0900",LLMの精度を高める「RAG」をGoogle Cloudで実装するには。無料ツールから本格的な開発まで、レベルに応じた4つのパターンを網羅的に解説する。自社に最適な手法を探す上で参考にしてほしい。,2025-08-24
1e0f499def70f93f79ee54ffdf5f83c4,ITmedia_AI_Plus,Brave、PerplexityのAIブラウザ「Comet」の深刻な脆弱性を指摘　「間接的プロンプトインジェクション」で情報漏えいの危険,https://www.itmedia.co.jp/aiplus/articles/2508/25/news056.html,"Mon, 25 Aug 2025 06:52:00 +0900",Braveは、PerplexityのエージェントAIブラウザ「Comet」に深刻な脆弱性があると指摘した。Webページ上の隠れた命令でAIが乗っ取られ、別タブの個人情報などを盗む危険性があるという。Braveは修正が不完全とし、新たなセキュリティ対策の必要性を訴えた。,2025-08-24
04141ff6d605366d12028a9a6c9e88be,ITmedia_AI_Plus,VS Code Python拡張機能、2025年8月アップデート　シェル統合機能の設定と使い方,https://atmarkit.itmedia.co.jp/ait/articles/2508/25/news018.html,"Mon, 25 Aug 2025 05:00:00 +0900",MicrosoftがPython in Visual Studio Code（Python拡張機能）の2025年8月版を公開した。シェル統合機能がPython 3.13以降のバージョンに対応し、ターミナルでのコード補完ができるようになった。その他の機能についても簡単にまとめる。,2025-08-24
b484e6aa97b3e595076e0c1a9c86f7f4,ITmedia_AI_Plus,Excelで学ぶ、やさしいデータ分析【仮説検定編】 ～ 考え方とP値の基礎,https://atmarkit.itmedia.co.jp/ait/articles/2508/25/news012.html,"Mon, 25 Aug 2025 05:00:00 +0900",初歩から応用までステップアップしながら学んでいく『やさしいデータ分析』シリーズ第4弾がスタート。第1回は仮説検定の考え方や知っておくべきキーワード、今後の連載予定を紹介します。データ分析を実践的に役立てるための基礎をしっかり学んでみませんか？,2025-08-24
9ef0063847cd029c2a2b3af7b7ec3d91,ITmedia_AI_Plus,Google直伝、生成AIの使い方14選　Gemini、NotebookLM、Imagen、Veoで業務効率化,https://www.itmedia.co.jp/enterprise/articles/2508/24/news017.html,"Sun, 24 Aug 2025 08:00:00 +0900",Googleは社内業務でのAI活用事例を紹介し、生成AIを中心に業務効率化や創造性の発揮に貢献していると説明した。ソフトウェア開発、マーケティング、営業、会議などで導入され、作業時間の短縮や業務品質の向上が実現している。,2025-08-24
5958f16f706c0eb0000c836bba2174e2,ITmedia_AI_Plus,新入社員の78.3％が生成AI活用経験者に　企業はどう向き合うべきか,https://atmarkit.itmedia.co.jp/ait/articles/2508/22/news117.html,"Fri, 22 Aug 2025 19:30:00 +0900",産業能率大学総合研究所が新入社員を対象にした調査によると、78.3％が生成AIを活用した経験があるという。企業が生成AI活用を推進するか否かにかかわらず、デジタルネイティブな若手従業員ほど自律的に生成AIを使い始めつつある。だが、生成AIの活用を禁止すれば、業務効率化やイノベーションを阻害するリスクにもなりかねない。どう向き合うべきなのか。,2025-08-24
2dfa05b2f2dc849a3bb364045b47e835,ITmedia_AI_Plus,富士通、日立製作所、NEC、NTTデータ──IDC発表の国内ITサービス市場ベンダー売り上げランキング,https://atmarkit.itmedia.co.jp/ait/articles/2508/22/news124.html,"Fri, 22 Aug 2025 19:22:00 +0900",IDC Japanが2024年の国内ITサービス市場売上ランキングを発表。上位ベンダーは高い成長を遂げ、生成AIが市場構造を変革する中、AI駆動型組織への支援が今後の鍵となる。,2025-08-24
ef8cfc1e1bc94c34d183acec7359ac3e,ITmedia_AI_Plus,「もし富士山が噴火したら」をAIで動画化　東京都、火山灰の被害や対策を伝える特設サイト公開,https://www.itmedia.co.jp/aiplus/articles/2508/22/news114.html,"Fri, 22 Aug 2025 18:04:00 +0900",東京都は、富士山が噴火した場合に想定される都内の被害を再現した動画を公開した。動画の制作には生成AIを活用。同日に公開した、富士山の噴火による火山灰の被害や対策をまとめた特設サイトに掲載している。,2025-08-24
8cd196703f39e4a6e1a2476f9dfda6a1,ITmedia_AI_Plus,ヤマト、自動配送ロボットの実証実験を開始　マンションの宅配ボックス→各戸の“最終区間”で,https://www.itmedia.co.jp/aiplus/articles/2508/22/news099.html,"Fri, 22 Aug 2025 15:59:00 +0900",ヤマト運輸は、荷物の配送に自動配送ロボットを活用する実証実験を開始した。大規模マンションにおいて、エントランスなどの宅配ボックスから各戸までの配送にロボットを使い、実用性を検証する。,2025-08-24
26c2091fc4d531ecf64dcce096679b17,ITmedia_AI_Plus,地方の廃校がAIデータセンターに　NVIDIA「A4000」を120台設置　GPUクラウドのハイレゾ,https://www.itmedia.co.jp/news/articles/2508/22/news095.html,"Fri, 22 Aug 2025 15:22:00 +0900",GPUクラウド事業を手掛けるハイレゾが、廃校を転用したデータセンターを佐賀県玄海町に開設したと発表した。既存施設を改装して使うことで建設費や工期を抑え、低廉なサービス提供につなげるという。,2025-08-24
884c57a24d1ac45edc792e227892231a,ITmedia_AI_Plus,Google検索の「AIモード」、英語版なら日本でも利用可能に,https://www.itmedia.co.jp/aiplus/articles/2508/22/news094.html,"Fri, 22 Aug 2025 15:14:00 +0900",Google検索の「AIモード」の米国版に新機能が追加された。レストラン予約などを代行するエージェント機能と、利用者の好みを反映するパーソナライズ機能だ。また、日本を含む180以上の国や地域でも英語版を利用できるようになる。,2025-08-24
678f2826e28d5ccdc68309f34aac6f4c,ITmedia_AI_Plus,スパコン「富岳NEXT」、NVIDIAが開発に参加　同社のGPUと富士通のCPUを連携　“世界最高”のAI性能目指す,https://www.itmedia.co.jp/aiplus/articles/2508/22/news079.html,"Fri, 22 Aug 2025 12:05:00 +0900",理化学研究所は、スーパーコンピュータ「富岳」の後継機「富岳NEXT」の開発に、米NVIDIAが参加すると発表した。NVIDIAはGPU基盤に関する設計を担う。これにより、高いAI処理性能の実現を目指す。,2025-08-24
1b4318a613fd31c9280e08f5b4d552e9,ITmedia_AI_Plus,Anthropic、AI「Claude」に“核兵器への悪用”を防ぐシステム実装,https://www.itmedia.co.jp/aiplus/articles/2508/22/news074.html,"Fri, 22 Aug 2025 10:54:00 +0900",Anthropicが米政府機関と協力し、AIの核兵器開発への悪用を防ぐシステムを開発した。「Claude」に実装済みのこの分類器は96％の精度で危険な対話を検知する。成果は他分野への応用も視野に業界で共有する予定だ。,2025-08-24
dd95708423d9168d4c273b85f868374f,ITmedia_AI_Plus,Google、「Gemini」の環境負荷を公表　テキストプロンプト1回で「水5滴分、TV視聴9秒以下」,https://www.itmedia.co.jp/aiplus/articles/2508/22/news070.html,"Fri, 22 Aug 2025 09:14:00 +0900",Googleは、Geminiの環境負荷を公表した。テキストプロンプト1回で水5滴分、TV視聴9秒以下の消費量と主張する。測定にはLLMのトレーニングや画像生成は含まれていないが、過去1年で効率は大幅改善したとしている。,2025-08-24
78c9f2bd990b3fcc8079d812e6edd940,ITmedia_AI_Plus,Excelに「COPILOT関数」爆誕　自然言語による指示が可能に　使い方と利用例,https://www.itmedia.co.jp/enterprise/articles/2508/22/news047.html,"Fri, 22 Aug 2025 08:00:00 +0900",MicrosoftはExcelに新AI機能「COPILOT関数」を導入した。自然言語で指示を出し、データの要約や分類、生成を行える。関数は従来のExcel関数と組み合わせ可能とされ、利用にはMicrosoft 365 Copilotライセンスが必要となる。,2025-08-24
5c0ddd60f4e4ea46871becdcc305d5e7,ITmedia_AI_Plus,トヨタコネクティッドが実感した生成AI活用のボトルネック　「年間9000時間削減」のノウハウ,https://www.itmedia.co.jp/enterprise/articles/2508/22/news038.html,"Fri, 22 Aug 2025 08:00:00 +0900",AIを単なるツールで終わらせず、大きな成果につなげるには何が必要か。トヨタ自動車のグループ企業トヨタコネクティッドが実践する、AIを全社に浸透させる戦略と文化づくりの秘訣に迫る。,2025-08-24
c982e0104a53dbfe691bf83be4bb95e3,ITmedia_AI_Plus,自然言語でMicrosoft Excelに指示が可能に　「COPILOT関数」が数式作成を支援,https://atmarkit.itmedia.co.jp/ait/articles/2508/22/news030.html,"Fri, 22 Aug 2025 08:00:00 +0900",Microsoftは2025年8月19日、自然言語入力から自動的に数式を生成できる「COPILOT関数」をMicrosoft Excelに追加すると発表した。同社は「大規模言語モデルの機能をExcelに直接導入することで、これまでよりも簡単にテキストを分析できるようにする」としている。,2025-08-24
e9819d8c721f7e663027f06f0783ec5c,ITmedia_AI_Plus,「GPTはGPTである」　一見ふざけたOpenAIの論文タイトルが“真”を突いている件,https://www.itmedia.co.jp/enterprise/articles/2508/22/news018.html,"Fri, 22 Aug 2025 08:00:00 +0900",アイ・ティ・アールの入谷光浩氏の新しい連載が始まります。第1回は、先の見えない時代に、企業が生成AIを“羅針盤”としていかに活用するかがテーマです。ブームに乗って導入したものの、「活用している」と胸を張って言えない企業がすべきこととは。,2025-08-24
f854170c9057f6ebe2c50aac015d0988,ITmedia_AI_Plus,Google、米連邦政府向けAIを年間0.47ドルで提供　OpenAIとAnthropicの半額以下,https://www.itmedia.co.jp/news/articles/2508/22/news067.html,"Fri, 22 Aug 2025 07:25:00 +0900",Googleは政府向けAI「Gemini for Government」を発表した。米連邦政府機関に年間0.47ドルという破格で提供し、OpenAIなど競合を下回る価格で参入する。トランプ政権のAI戦略に沿った動きで、各機関は独自AIの構築も可能だ。,2025-08-24
52ad547bcce56b2ba2efe85b1c299c1a,Hatena_IT,はてなブックマークに人生を狂わされて9万ブクマ - 本しゃぶり,https://honeshabri.hatenablog.com/entry/bookmark20th,,はてなブックマーク20周年！ 俺の累計ブクマ9万超！！ どうしてこうなった。 俺のはてなブックマーク はてなブックマークが20周年で、特別お題キャンペーン「私のはてなブックマーク」が行われている。 思い出のページを1つ選ぶのがルールだが、俺の場合は「される方」の印象が強くて、特定の記事に絞るのは難しい。 そ...,2025-08-24
95985357e3dbd25703a8e9ff791d25f3,Hatena_IT,Goの野暮ったさとどう付き合うか | ドクセル,https://www.docswell.com/s/Songmu/K6E6GM-How-to-get-along-well-with-Go,,"Fellow at Henry, Inc. Tech SaaSのPdM、スタートアップ取締役CTOや外資スタートアップのIC等を経て現任。好きな言語はGoとPerlと中国語で雑なOSSを200以上量産している。3 times ISUCON winner. 著書「みんなのGo言語」共著他。Podcast: https://oss4.fun/",2025-08-24
c7f05badeaa11d108e83c4f23207af97,Hatena_IT,上昇するITエンジニア採用ハードルの正体——就活や転職活動にも直結する「社会人基礎力」｜久松剛,https://comemo.nikkei.com/n/n192e676bd20a,,doda転職求人倍率を見ると、6ヶ月連続で求人倍率が低下した後、低迷している状態です。各社の求人公開状況を見ると、営業職は継続して募集されています。ITエンジニアに近いところでは売上に直結するプリセールスや、チャーンレート低下などが期待されるFDE（フィールドデータエンジニア）といった職種もまた継続されて...,2025-08-24
e36df12b23974f3c57b981519f7c8807,Hatena_IT,SuperClaude とは？Claude Codeのコード品質を30%改善できた神ツールの完全ガイド！ - Qiita,https://qiita.com/tomada/items/2eb1b0623c9f59424235,,Deleted articles cannot be recovered. Draft of this article would be also deleted. Are you sure you want to delete this article? こんにちは、とまだです。 Claude Code でコードを書いていて、「セキュリティ的に大丈夫かな？」とか「もっとパフォーマンス改善できない...,2025-08-24
