id,source,title,link,published,summary,collected_date
ffa3fbcaa6f7860af95683f27b4324e1,Business_Insider,アップル3年ぶりの完全新型ワイヤレスイヤホン「AirPods Pro 3」を注目すべき3つのポイント,https://www.businessinsider.jp/article/2509-what-is-new-airpods-pro-3/,"Tue, 09 Sep 2025 23:00:00 GMT",アップルが3年ぶりに「AirPods Pro 3」を発売。フィットネスで使える心拍数センサーや、AIを活用したライブ翻訳機能を搭載し、単なるイヤホンからの進化を遂げました。その実力を詳しく解説します。,2025-09-09
a642de359f68c9bb2346c1177d25a42c,Business_Insider,テスラが提案したイーロン・マスクへの1兆ドル報酬パッケージ…見逃してはいけない5つのポイント,https://www.businessinsider.jp/article/2509-elon-musk-tesla-pay-package-trillion-takeaways-succession-valuation-voting/,"Tue, 09 Sep 2025 22:30:00 GMT",この報酬パッケージは、その金額においても、またイーロン・マスクがそれを得るためにテスラが成長しなければならない規模においても前例のないものです。,2025-09-09
5589ac4c4411084a56f105caa6ca844c,Business_Insider,AIによる「コスト削減の行き過ぎ」をCEOが認めた…エンジニアやマーケ担当を顧客サポートに再配置した決済企業の顛末,https://www.businessinsider.jp/article/2509-klarna-reassigns-workers-to-customer-support-after-ai-quality-concerns/,"Tue, 09 Sep 2025 22:15:00 GMT",関係者が語ったところによると、クラーナの人材プールに配置された従業員の一部は、後にカスタマーエクスペリエンスチームでの役職を打診されました。,2025-09-09
8a177fa9b42563efdbecd2d484cb70b2,Business_Insider,アマゾンはAIエージェント競争に本格参入する準備ができている…内部文書を入手,https://www.businessinsider.jp/article/2509-amazon-ready-enter-ai-agent-race/,"Tue, 09 Sep 2025 21:35:00 GMT",クラウド大手のアマゾンは、収益性の高いSaaS市場への本格的な進出に苦戦しています。しかし、エージェント型AIは同社に新たなチャンスを与える可能性があります。,2025-09-09
393086add4e99589b3d07dd1d11cf0da,Business_Insider,アップル「iPhone Air」がわかる4つのポイント。シリーズ史上最薄約5.6mmを実現できた理由は？,https://www.businessinsider.jp/article/2509-apple-iphone-air-unveiled/,"Tue, 09 Sep 2025 21:00:00 GMT",アップル（Apple）が、新型スマートフォン「iPhone Air」を発表しました。約5.6mmの薄さが特徴です。iPhone Airの4つのポイントを解説します。,2025-09-09
b428ebf35e0d69049646939ded17f7cb,Business_Insider,「イギリスで日本の軽自動車が人気」は本当か？ 本当に人気なのはアルファードや日産の「あの車」,https://www.businessinsider.jp/article/its-a-lie-that-japanese-kei-cars-are-popular-in-the-uk/,"Tue, 09 Sep 2025 12:00:00 GMT","「イギリスで軽自動車が人気らしい」──そんな噂を耳にしたことはないでしょうか。
SNSでも「イギリスで日本の軽が爆売れ」といったポストが数万リポストされるなど、あたかも「イギリスで軽がブームになっている」かのようなストーリーが生まれました。
この噂は果たして本当なのか？　結論から言うと、残念ながらフェイクです。ですが、実際には軽よりもミニバンが選ばれていたり、とある日本車がクラシックカーとして高い...",2025-09-09
eef9c348968e9fb8e16b4cbdbc792937,Business_Insider,90歳を過ぎても働いていたジョルジョ・アルマーニの健康法,https://www.businessinsider.jp/article/2509-giorgio-armani-dead-worked-age-90-daily-routine-longevity/,"Tue, 09 Sep 2025 10:00:00 GMT",ジョルジオ・アルマーニが91歳で死去しました。アルマーニ社によると「最期の時まで働いていた」そうです。彼は毎日、美味しく栄養価の高い食事を摂るという習慣がありました。,2025-09-09
3a629d8e853c1972ba88067412d60c68,Business_Insider,元コンサルタントの男は、いかにアマゾンで数億円売れる&quot;清掃用品&quot;ブランドを構築したか？ 「セクシーで流行に左右される製品は避けるべき」,https://www.businessinsider.jp/article/2509-how-to-select-products-to-sell-online-amazon-ecommerce-business/,"Tue, 09 Sep 2025 08:30:00 GMT",アレックス・イェール氏は就職して数年経ったあと、清掃用品ブランドの「アンクル・トッズ」を立ち上げました。最初の商品として浄化槽用のポッドをアマゾンに出品し、そのあとは小売店への進出に注力したそうです。,2025-09-09
ac249a8df3a259846adc503701be0f5d,Business_Insider,「年間1000万円超を消費する」日本の富裕層の頭の中…BCGが調査,https://www.businessinsider.jp/article/bcg-high-spending-consumer-survey-a/,"Tue, 09 Sep 2025 08:00:00 GMT",ボストン･コンサルティング･グループ（BCG）が、日本で年収3000万円以上かつ、年間消費額が1000万円以上の「高額消費者」の実態について調査しました。,2025-09-09
ddbb263725a37d07a221035fa9bc3989,Business_Insider,「iPhone 17」発売前に古いiPhoneは高く売れるのか。伊藤忠子会社「にこスマ」の担当者に聞いた,https://www.businessinsider.jp/article/2509-nicosuma-how-to-sell-your-iphone/,"Tue, 09 Sep 2025 08:00:00 GMT",古いiPhoneを売却するベストタイミングや、売却時の注意点について、中古スマホの買取・販売サイト「にこスマ」を手掛けるBelongの担当者に聞きました。,2025-09-09
1ca92e067886c36c4398c4b6f318f3d8,Business_Insider,「映画より難しい」米づくりと“10億円ヒット”を生んだ成功の法則──二刀流アカデミー賞監督の仕事術,https://www.businessinsider.jp/article/2509-rice-farmer-and-film-director-academy-award-winner-samurai-time-slipper/,"Tue, 09 Sep 2025 05:00:00 GMT",第48回「日本アカデミー賞」で最優秀作品賞に輝いた『侍タイムスリッパー』。本作を監督した安田淳一氏は、米づくりを行う農業従事者でもあります。日本の現状に思うこと、ビジネスを成功に導く方法論を聞きました。,2025-09-09
ebbef71f01d909d8fecd0f94f3486e41,Business_Insider,史上最高値レベルの株式市場は崩壊間近？…歴史は心配するなと言っている,https://www.businessinsider.jp/article/2509-stock-market-crash-all-time-highs-sp500-recession-jobs-report/,"Tue, 09 Sep 2025 04:00:00 GMT",株価指数が史上最高値をわずかに下回る水準にあり、「高所恐怖症」になりやすい状況です。,2025-09-09
4d9d42a5dba0a7e9a82d63091bef4acb,Business_Insider,ロボット掃除機は階段昇降や急速充電も可能。エコバックス、アンカー、ロボロックの最新機種を見てきた,https://www.businessinsider.jp/article/2509-ifa-robot-cleaner-trends/,"Tue, 09 Sep 2025 02:45:00 GMT",競争が激化するロボット掃除機市場。ドイツで開催されたIFA 2025で発表された、各社のユニークな新製品から次世代ロボット掃除機のトレンドを探ります。,2025-09-09
415559c875015fcc9a1b5b0ffd8bb924,Business_Insider,アップル「iPhone 17」まもなく発表…ウォール街のアナリストたちの値上げ予想は？,https://www.businessinsider.jp/article/2509-apple-iphone-17-price-increase-models-pro-air-analysts/,"Tue, 09 Sep 2025 01:30:00 GMT",アナリストは、関税やストレージの変更がコストに影響し、アップルのiPhone 17シリーズは50ドルから100ドルの値上がりが見込まれると予測しています。,2025-09-09
15429d482740a8c31951f33b8e85dc21,Business_Insider,グーグルもフラット化を推進、小規模チームの管理職を3分の1以上削減,https://www.businessinsider.jp/article/2509-google-has-slashed-more-manager-roles-in-its-efficiency-drive/,"Mon, 08 Sep 2025 22:30:00 GMT",グーグルは過去1年間で小規模なチームを管理するマネージャーを3分の1以上削減したと、幹部が社員に伝えました。,2025-09-09
abd2c8d8764688866becd3185bc5a2bd,Business_Insider,「中国版バンダイ」「無印そっくりチェーン」……ラブブブーム追い風、次のPOP MARTに挙がる注目企業,https://www.businessinsider.jp/article/2509-insidechina-next-popmart/,"Mon, 08 Sep 2025 22:30:00 GMT",ラブブブームで中国のキャラクタービジネスを手掛ける企業の資金調達・上場が相次ぎ、「次のPOP MART」候補と目される企業への注目度も高まっています。,2025-09-09
6829fc7832c5677166f9009cd8292c98,Business_Insider,大手コンサルからマイクロソフトに転職して2年でレイオフ。けれど「今の方が良い生活」だと私が言える理由,https://www.businessinsider.jp/article/2509-microsoft-cutting-jobs-again-better-off-after-being-laid-off/,"Mon, 08 Sep 2025 21:40:00 GMT",,2025-09-09
384ea772ddf24ee13a29ade1f3241feb,Business_Insider,ゲームストップ株で巨額損失の空売り投資家が「次のPalantir」と推すAI企業、気になるその根拠,https://www.businessinsider.jp/article/andrew-left-commentary-databricks-bull-case-short-seller-palantir-2025-9/,"Mon, 08 Sep 2025 21:35:00 GMT","問題企業に関する調査レポートを発表して批判、空売りを仕掛ける手法で知られるアンドリュー・レフト氏は最近、データ分析企業パランティアの株価を割高だと指摘して同社の株価を15％以上下落させました。
一方、レフト氏は今、あるAI開発企業が「次のパランティア」になり得ると期待しているようです。",2025-09-09
c785ff0054af5df016a873c897b7cb38,Business_Insider,「学びたくない日本」アメリカとは8倍差。リスキリングブーム凋落の納得の理由,https://www.businessinsider.jp/article/2509-reskilling-management/,"Mon, 08 Sep 2025 21:20:00 GMT",日本の労働者のリスキリング意欲は、アメリカの労働者と比べて、8倍「学びたくない」——。人材大手のIndeedがそんな調査結果を発表しました。なぜ日本のビジネスパーソンにはリスキリングが浸透しないのでしょうか。,2025-09-09
e6505a3f3a405028f65ddba5d1676f25,Business_Insider,新浪氏の“辞任“は「早すぎ」か「妥当」か。サントリーの危機管理、判断の課題,https://www.businessinsider.jp/article/2509-suntory-governance/,"Mon, 08 Sep 2025 21:10:00 GMT",サントリーHDの新浪剛史会長が9月1日に辞任しました。購入したサプリメントをめぐり警察の捜査を受けたことが背景です。未上場の「家族企業」が示した判断を、危機管理の専門家はどう受け止めたのかを聞きました。,2025-09-09
7ba2d9ca73cc62bb656c206723952f44,ITmedia_AI_Plus,そのプロンプト、実は偏見まみれ？　思考のクセから生まれる脆弱性を回避せよ,https://www.itmedia.co.jp/enterprise/articles/2509/10/news005.html,"Wed, 10 Sep 2025 07:00:00 +0900",生成AIは非常に有用なツールである一方、入力したプロンプトによっては自身の偏見を色濃く反映した“都合のいい結果”を返します。ではこれを回避するにはどうすればいいのでしょうか。認知バイアスを回避するプロンプト術を伝授します。,2025-09-09
d05b332e22f778bc9f55042d3e2227ee,ITmedia_AI_Plus,ヘリンガー距離（Hellinger distance）とは？,https://atmarkit.itmedia.co.jp/ait/articles/2509/10/news012.html,"Wed, 10 Sep 2025 05:00:00 +0900",2つの確率分布間の“距離”を測る指標で、値は0（一致）～1（不一致）の範囲に収まる。ユークリッド距離に似た計算式で定義されており、確率分布の違いを直感的に扱えるのが特徴である。主に統計学や機械学習の分野で、確率分布間の比較や類似度評価に利用されている。,2025-09-09
9393a212f6d03f6fcd9aebc02773df71,ITmedia_AI_Plus,「AirPods Pro 3」で“ほんやくコンニャク”可能に　まずは5カ国語　日本語も年末までに対応,https://www.itmedia.co.jp/aiplus/articles/2509/10/news074.html,"Wed, 10 Sep 2025 02:25:00 +0900",米Appleは9月9日（現地時間）、ワイヤレスイヤフォン「AirPods Pro 3」を発表した。「ライブ翻訳」機能を搭載し、装着しながら人と話すと相手の言語を自分が理解できる言語に変換できる。まずは英語、フランス語、ドイツ語、ポルトガル語、スペイン語に対応。日本語にも年末までに対応するとしている。,2025-09-09
69578cffa63096a437262f2407fc9b43,ITmedia_AI_Plus,「AI恋人」はどこまでアリなのか──“しゃべるアクスタ”の先にあるもの,https://www.itmedia.co.jp/news/articles/2509/09/news100.html,"Tue, 09 Sep 2025 16:00:00 +0900",AIによるチャットが一般化し始めた現在、AIに対して何らかの人格を見いだす人も出てきている。対話型AIアプリ「SynClub」の調査では、全年代の4人に1人が「AIは将来的に恋愛・結婚のパートナーになりえる」と回答。特に30代男性で顕著だ。推し活の延長としてのAI恋愛から、精神的支えとしての活用まで、人間とAIの新たな関係性が生まれている。,2025-09-09
4a29bf134e8c58df0f9cd567e54b8b52,ITmedia_AI_Plus,腕とテニスラケットが“一体化”――とあるアニメに注目集まる　「作画崩壊」はAIのせい？,https://www.itmedia.co.jp/aiplus/articles/2509/09/news099.html,"Tue, 09 Sep 2025 15:34:00 +0900",女性キャラクターの腕とテニスラケットが“一体化”している――アニメ「週刊ラノベアニメ」のワンシーンがX上で注目を集めている。これに対し「生成AI画像を使ったのか」「チェック体制どうなってるの？」など、さまざまな意見が飛び交っている。,2025-09-09
e56fe4fdd076c63bbabf379f5ea5b9e3,ITmedia_AI_Plus,「自分の声が無断で生成AIに」──プリキュア声優の山村響さんが告発　とある音声合成AIが波紋　経緯は,https://www.itmedia.co.jp/aiplus/articles/2509/09/news059.html,"Tue, 09 Sep 2025 10:39:00 +0900",無料のAI音声合成ソフト「AivisSpeech」の標準モデル「Anneli」の開発では、声優の山村響（やまむら ひびく）さんの許諾を取っていない――同モデルの作成者による告白により、AivisSpeechがSNS上で波紋を広げている。一体、何があったのか。,2025-09-09
631b7a9f47853c46696e7ace274a6efd,ITmedia_AI_Plus,コナミ、「遊戯王」AI実況の動画を削除　人気声優の声“無断学習”問題で,https://www.itmedia.co.jp/aiplus/articles/2509/09/news072.html,"Tue, 09 Sep 2025 10:38:00 +0900",コナミが「遊戯王カードゲーム」世界大会のAI実況に使った音声モデルが、人気声優の音声を“無断学習”していた疑い。,2025-09-09
09c65fb9720be25101c1e4dfb8454694,ITmedia_AI_Plus,「誰これ？」　流行の“写真→AI動画”を試したら、動く別人ができた　これは“記憶のディープフェイク”か,https://www.itmedia.co.jp/aiplus/articles/2509/09/news070.html,"Tue, 09 Sep 2025 08:53:00 +0900",写真の中の人物を動かして、動画にするAIを試してみた。自分は「動く他人」になったし、子どもの写真でやってみて強く後悔した。,2025-09-09
5b42c49183f38977ba652148af98e2c8,ITmedia_AI_Plus,初受注まで「1年→5カ月」に短縮　AIで実現する営業の育成改革とは？,https://www.itmedia.co.jp/business/articles/2509/09/news011.html,"Tue, 09 Sep 2025 08:30:00 +0900",セールスイネーブルメントの取り組みやSFA活用の事例を踏まえつつ、AIを使った強い営業組織の作り方を考えていく。,2025-09-09
0525746b8dbb16cf3ced8b4e254d7425,ITmedia_AI_Plus,AIに“性格”を与えて視点を自由に設定　NRIがデータ分析支援システムを発表,https://atmarkit.itmedia.co.jp/ait/articles/2509/09/news032.html,"Tue, 09 Sep 2025 08:00:00 +0900",野村総合研究所は、利用者が設定した役割や性格に応じてAIがデータを分析する「多視点分析システム」を開発したと発表した。特定の視点に基づくデータ分析によって、企業の迅速な意思決定を支援するという。,2025-09-09
0ecfce9d2544bb51f1da18e491c4ace3,ITmedia_AI_Plus,Google Cloud、生成AI導入の「設計図」101選を公開　脱・概念実証、実用化を促進,https://www.itmedia.co.jp/enterprise/articles/2509/09/news025.html,"Tue, 09 Sep 2025 08:00:00 +0900",Googleは生成AI導入を支援する「101のアーキテクチャブループリント」を公開した。業界横断的に有効な設計指針を提供し、PoCから本番運用への移行を促進する実践的な指針となっている。,2025-09-09
c96753e7e8220bcd170d74f24a6c92c1,ITmedia_AI_Plus,「AIと共生」する未来へ　ガートナーが働き方と人材のハイプ・サイクルを公開,https://atmarkit.itmedia.co.jp/ait/articles/2509/08/news028.html,"Tue, 09 Sep 2025 08:00:00 +0900",ガートナージャパンは「日本における未来の働き方と人材のハイプ・サイクル：2025年」を発表した。33個のテクノロジーとトレンドを整理した上で、それらの多くに関わるAIの重要性を強調している。,2025-09-09
fc57620cad66374c1f140573a94f48ad,ITmedia_AI_Plus,プラントの生産効率分析を1カ月から1日に短縮、NTTの高速スパースモデリング技術,https://monoist.itmedia.co.jp/mn/articles/2509/09/news057.html,"Tue, 09 Sep 2025 06:30:00 +0900",NTTは、大量のデータから重要な情報を選択してデータ分析を高速化する情報選択AIアルゴリズム群「高速スパースモデリング技術」を確立した。精度を理論保証しつつ従来アルゴリズムと比較して最大73倍の高速化が可能であり「世界最速級」（同社）とする。,2025-09-09
a1e18beae08ae2073d1de332ee5c2bd9,ITmedia_AI_Plus,［Pythonクイズ］アクセサ？　property関数？　デコレーター？　それとも？　クラス定義時の属性アクセス手段には何を使っていますか？,https://atmarkit.itmedia.co.jp/ait/articles/2509/09/news016.html,"Tue, 09 Sep 2025 05:00:00 +0900",インスタンスの属性へのアクセスを提供するときにどんなやり方をしています？　これクイズじゃなくてアンケートな気がしてきたぞ（笑）。,2025-09-09
1165d17df3c7ff805ea3267a6df3b285,ITmedia_AI_Plus,「仕様駆動開発」を支援するツールキット「Spec Kit」を、GitHubがオープンソースで公開,https://atmarkit.itmedia.co.jp/ait/articles/2509/09/news014.html,"Tue, 09 Sep 2025 05:00:00 +0900",GitHubが新しいAI開発手法「仕様駆動開発」を実現するツールキット「Spec Kit」をオープンソースで公開した。エージェントへのあいまいな指示を基にコードを生成するバイブコーディングから、エージェントとの対話から明確な仕様を策定し、そこからコードを生成する時代がやってくるのかもしれない。,2025-09-09
1c4ddd9bb6e02f95a68c61f04442866b,ITmedia_AI_Plus,富士通、「生成AI再構成技術」で同社LLM「Takane」を強化,https://atmarkit.itmedia.co.jp/ait/articles/2509/08/news116.html,"Mon, 08 Sep 2025 23:20:00 +0900",量子化前と比較して精度維持率は89％、量子化前の3倍高速化。,2025-09-09
47d34d864ee3693a61d33e6c1141e4bc,ITmedia_AI_Plus,富士通、LLMの軽量化技術を発表　1ビット量子化でも約9割の精度を維持　3倍に高速化も,https://www.itmedia.co.jp/aiplus/articles/2509/08/news113.html,"Mon, 08 Sep 2025 19:23:00 +0900",富士通は、大規模言語モデル（LLM）を軽量化・省電力化する技術「生成AI再構成技術」を開発したと発表した。,2025-09-09
7c31409a3f367b657ee1dc2b80b26ae8,ITmedia_AI_Plus,DeNA「AIにオールイン」の内実　キーパーソンが明かす“リアルな”取り組み,https://www.itmedia.co.jp/aiplus/articles/2509/08/news048.html,"Mon, 08 Sep 2025 12:00:00 +0900",ディー・エヌ・エーが掲げるAI戦略「AIオールイン」。その内実について、同社の住吉政一郎氏（AIイノベーション事業本部 本部長）が登壇したイベントで語った。,2025-09-09
bde1a89ea6bd06a3084568b246f89631,ITmedia_AI_Plus,Google、オンプレミスに対応した「Gemini」正式提供スタート　Google Distributed Cloudを基盤に,https://www.itmedia.co.jp/news/articles/2509/08/news059.html,"Mon, 08 Sep 2025 10:48:00 +0900",Google Cloudは、同社が提供するオンプレミス環境に対応した分散クラウド基盤であるGoogle Distributed Cloud上で、ネットと完全に分離された環境において生成AIモデルのGeminiを正式提供すると発表しました。,2025-09-09
983434fede582325a7c1d3283aa9ffbf,ITmedia_AI_Plus,デジタル庁、生成AIの利用実績を初公表、職員の間で利用格差も,https://kn.itmedia.co.jp/kn/articles/2509/08/news039.html,"Mon, 08 Sep 2025 10:00:00 +0900",デジタル庁は生成AI利用環境「源内」を職員向けに内製導入し、その利用実績を公開した。業務効率化や文章校正などにおいて、約8割の職員が効果を実感しているという。役職や年齢、経歴によって利用状況には差が見られた。,2025-09-09
6006dfaa905d1013a007ab0ac2f3111a,Hatena_IT,反AIやっていたら心が壊れて人生終わった,https://anond.hatelabo.jp/20250909201045,,Xで反AI活動をやっている、あるいはやりたいと思っている人はいる？ 悪いことは言わないからやめておけ 私は反AI活動のせいで心が壊れて仕事も失い人生転落中 AIが世間を騒がせた3年前くらい、かなり初期の方から反AI活動を始めた きっかけは特にないけど、いわゆる絵師界隈に属していたこと、好きなイラストレーターさ...,2025-09-09
0a09606f024df2fb281c1d63e68400bf,Hatena_IT,初めて質問させていただきます。 パスキーの仕組みについてわからないことがあります。 巷で解説されているパスキー認証の仕組みサイトを読むと、 ①サーバーからデバイスにチャレンジが送られる ②デバイスが秘密鍵でチャレンジに署名をして送り返す ③サーバーが署名を公開鍵で復号してチャレンジと同じか検証する というような事が書かれています。 そしてその仕組みは「公開鍵暗号方式」が使われていると書かれています。 けれども、基本情報技術者の教科書を読むと、公開鍵暗号方式は ①受信者の公開鍵で暗号化し ②受信者の秘密鍵で,https://mond.how/ja/topics/8t9i33a9lt6rh87/t9tua01k8j5m39h,,まことにもっともな疑問だと思います。公開鍵暗号には、狭義の公開鍵暗号と、広義の公開鍵暗号があります。パスキーで使われているのは、広義の公開鍵暗号です。 狭義・広義だと紛らわしいので、狭義の方をPublic Key Encryption(PKE)、広義の方をPublic Key Cryptography(PKC)と表記する場合があります。光成さんのブロ...,2025-09-09
37fbc865ed460323286cb943eb429da5,Hatena_IT,"「iPhone 17」シリーズの日本での価格が公開。「iPhone Air」は159,800円〜",https://game.watch.impress.co.jp/docs/news/2046068.html,,,2025-09-09
0901bbd1996e805b8d86b0f356b6e5aa,Hatena_IT,店員の7割、レジでイヤフォンしたままの客に「ストレス感じる」,https://www.itmedia.co.jp/news/articles/2509/09/news078.html,,イヤフォンを着けたままの顧客に対応した店員の74.6％が「ストレスを感じる」――ソフトバンクが、レジ業務経験がある人1000人を対象に実施したアンケートで、こんな結果が出た。 レジでのイヤフォン着用は、「聞こえていれば問題ない」と考える人が46.7％に対し、「外すのがマナー」と考える人が53.3％と過半数を占めた。...,2025-09-09
4ac18171870ed28d4e44d925381ba6a0,Hatena_IT,脆弱性情報、勝手に開示しないで　経産省などがクギを刺す　FeliCaの事例念頭か,https://www.itmedia.co.jp/news/articles/2509/09/news110.html,,経済産業省は9月9日、報道におけるソフトウェアなどの脆弱性情報の取り扱いについて、改めて「情報セキュリティ早期警戒パートナーシップガイドライン」に即した対応を求める声明を出した。8月28日に共同通信が報じた「FeliCa」の事例が念頭にあるとみられる。 このガイドラインでは、発見された脆弱性情報は関係者の間...,2025-09-09
