id,source,title,link,published,summary,collected_date
decee3d5a9b38e33a0da3f363b474d49,Business_Insider,伝説の投資家、価値保存手段としてのゴールド（金）に疑問を呈する…「人々が信じていること以外に評価の理由がない」,https://www.businessinsider.jp/article/2601-gold-price-rally-bullion-store-of-value-howard-marks/,"Fri, 23 Jan 2026 23:00:00 GMT",マークスは2010年に顧客に送った手紙に言及しました。その中で彼は価値保存手段としてのゴールドを「自己欺瞞的」と表現しています。,2026-01-23
3317d3b82a289cd60a53ef899dbcc5aa,Business_Insider,あなたの声を聞かせてください【ジェンダー意識調査】,https://www.businessinsider.jp/article/gender-survey-2026/,"Fri, 23 Jan 2026 09:15:00 GMT",インクルーシブな未来を拓くメディア＆コミュニティ「Mashing Up（マッシングアップ）」では、「ジェンダー意識」をテーマにアンケート調査を実施します。,2026-01-23
712a0a09efe6287e43e0ff6c45e59702,Business_Insider,バリ島で出会ったカップル、約470万円で田んぼの中に2棟の「狭小住宅」を建てる。ミニマル生活の秘訣と効果,https://www.businessinsider.jp/article/2601-millennial-couple-tiny-house-bali-ubud-sustainable-permaculture-slow-life/,"Fri, 23 Jan 2026 08:30:00 GMT",オリビア・プルバさんとディルクヤン・テイスさんは、インドネシアのバリ島で、よりシンプルで持続可能な生活を送りたいと考えていました。そこで2人は、内陸のウブドでのタイニーハウス暮らしに切り替えたそうです。,2026-01-23
6f63ffad099e53503aa0a69602e67d38,Business_Insider,約6万円のスマートウォッチ「Amazfit T-Rex 3 Pro」を試す。AIを呼んで操作できるタフネスモデル,https://www.businessinsider.jp/article/2601-amazfit-t-rex-3-pro-review/,"Fri, 23 Jan 2026 08:00:00 GMT",Amazfit T-Rex 3 Proは、タフネス系らしい堅牢さに加え、音声操作や長時間バッテリーで使いやすさも両立したスマートウォッチです。運動・睡眠・食事管理を無理なく続けたい人に向いています。,2026-01-23
371762ac5f22d4d15b523edc71c90b70,Business_Insider,10万円超のiPhoneをどう守るか。ガジェット高騰時代に選ぶべきTORRASの堅牢性とデザイン両立スマホケース,https://www.businessinsider.jp/article/2601-torras-ces2026-smartphone-case/,"Fri, 23 Jan 2026 08:00:00 GMT",スマートフォンの高騰が続く中、CES 2026で注目を集めたスマホケースメーカー「TORRAS」。独自技術「AIR PRO-TECH」の秘密と、多彩なデザインの魅力をレポートします。,2026-01-23
d3897ec38f9238ac4f6e3fada5639f47,Business_Insider,「資金がない」「仲間がいない」。NPOが抱える共通課題にグローバル視点で寄り添う岡部晴人氏【BEYOND AWARD 2026】,https://www.businessinsider.jp/article/2601-beyondaward2026-haruto-okabe/,"Fri, 23 Jan 2026 02:30:00 GMT",,2026-01-23
5791c0a6419954b7a841aa431e420265,Business_Insider,装着するだけで便利になる――CESで提唱された「Phone Case 3.0」とは何か,https://www.businessinsider.jp/article/2601-torras-phonecase/,"Fri, 23 Jan 2026 02:00:00 GMT",スマホケースは、保護だけでなく、機能強化アイテムへ。｢CES2026｣の会場で目立っていたのが、スマホ周辺アイテムを幅広く取り扱うTORRASのブース。そこで提唱された「Phone Case 3.0」とは何か。,2026-01-23
fce44acbbf47011e54f1eaa8724d961a,Business_Insider,高級腕時計市場が低迷…これが10年続く可能性があるとアナリストは指摘,https://www.businessinsider.jp/article/2601-luxury-watch-market-rolex-prices-crash-quiet-luxury-bubble/,"Fri, 23 Jan 2026 01:30:00 GMT",業界の専門家はBusiness Insiderに対し、2021年から2022年が市場のピークだった可能性が高く、高級時計の価格は近い将来、同様の急騰は見られないだろうと語りました。,2026-01-23
cf3a64f282a814c758fa79a4ccc01db8,Business_Insider,800年続く京都の「変わらない」お茶屋から、売上200億円目指す「変わる」中小企業まで。今、日本の地方が問われている,https://www.businessinsider.jp/article/2601-the-happiness-theory-of-sme-final/,"Thu, 22 Jan 2026 22:00:00 GMT",企業にとって、売り上げを伸ばすことだけが本当に正解なのでしょうか。連載「中小企業の幸福論」で考えました。,2026-01-23
9377813bb5612b92469f87dc40fbd865,Business_Insider,グーグル、アマゾン、セールスフォースで働いたエンジニアが教える、AI時代の面接に備える方法…ハイブリッドエンジニアとしてアピールしよう,https://www.businessinsider.jp/article/2601-how-ai-integration-transforming-software-engineering-hiring/,"Thu, 22 Jan 2026 21:35:00 GMT",シニアソフトウェアエンジニアのアカッシュ・ヴィシャル・ハザリカ氏が、AI統合とプロンプトエンジニアリングがビッグテック企業のソフトウェア職の採用をどう変えているかを説明してくれました。,2026-01-23
b2b40b8b3cae555a0b13817e0df00c4b,Business_Insider,億万長者の投資家レイ・ダリオ氏、トランプ大統領の政策は「資本戦争」を引き起こす危険性があると警告,https://www.businessinsider.jp/article/2601-ray-dalio-investing-outlook-capital-wars-trump-greenland-us-debt/,"Thu, 22 Jan 2026 21:00:00 GMT",億万長者のヘッジファンド創業者レイ・ダリオはダボス会議で、貿易赤字と貿易戦争の結果として「資本戦争」が起こり得ると述べました。,2026-01-23
e090a092d91af2e472861523fd086a8c,Business_Insider,記者が見た「トランプ・ダボス演説」。不気味な静寂のなか、世界のエリートたちの反応は予想以上に冷ややかだった【ダボス会議2026】,https://www.businessinsider.jp/article/2601-i-attended-trump-speech-davos-audience-experience/,"Thu, 22 Jan 2026 11:45:00 GMT",世界中が注目するなか、ダボス会議で演説したトランプ大統領。聴衆の反応は、アメリカ国内で浴びる熱狂的な喝采とは正反対のものでした。,2026-01-23
b9c99f3bf707925721fa7bebf61f67a7,Business_Insider,ウォーレン・バフェット、投資ルールについて語る…現金は「酸素」のように必要なものだが「良い資産ではない」,https://www.businessinsider.jp/article/2601-warren-buffett-cnbc-interview-berkshire-hathaway-deals-acquisitions-cash-investing/,"Thu, 22 Jan 2026 10:00:00 GMT",ウォーレン・バフェットは、昨年5月に収録されて今週公開されたインタビューで、「今日の午後にでも1000億ドルを喜んで使っただろう」と語っています。,2026-01-23
8544aa7d03805710ca59e59f4279dafc,Business_Insider,ビッグテック偏重でいいのか？ 株価の&quot;勢い&quot;にこだわる「SMTトレンドランキングシリーズ」をレビュー,https://www.businessinsider.jp/article/2601-smt-trend-ranking-series-review/,"Thu, 22 Jan 2026 09:30:00 GMT",三井住友トラスト・アセットマネジメントは12月、新たに4つの投信で構成される「SMT トレンドランキングシリーズ」をリリース。米国・日本・欧州・中国市場が対象で、株価の勢い「モメンタム」に沿って、それぞれ21銘柄を選定しています。,2026-01-23
4a4680f9fcb519423319ede837d2be67,Business_Insider,CES2026の主役はロボット。Roborockが世界に突きつけた「階段を掃除する」ための解,https://www.businessinsider.jp/article/2601-roborock-stair-climbing-robot/,"Thu, 22 Jan 2026 08:00:09 GMT",ロボット掃除機はすでに成熟した市場となっていますが、ロボット掃除機メーカーのRoborock（ロボロック）は「まだ進化の余地がある」と、CES2026の現場で力強く主張していました。,2026-01-23
91a73d34c125cc9136114ba2d3beb54a,Business_Insider,クレカ、医療、住宅…トランプ氏らしい“ハルシネーション”混じりのダボス演説をファクトチェックしたら、経済課題のリアルが見えてきた【ダボス会議2026】,https://www.businessinsider.jp/article/2601-trump-affordability-davos-claims-vs-reality-housing-prices-gas-healthcare/,"Thu, 22 Jan 2026 07:45:00 GMT",トランプ大統領のダボス演説をめぐり、海外メディアが続々と事実誤認の指摘を行っています。Business Insiderは経済政策について検証しました。,2026-01-23
f5c64987e387acf2f6939cb59ff67f79,Business_Insider,【独自】デロイトが米国社員の役職名を一斉変更へ。「時代遅れ」な人材構造を「現代化」と,https://www.businessinsider.jp/article/deloitte-gives-us-employees-new-job-titles-leader-role-2026-1/,"Thu, 22 Jan 2026 07:20:00 GMT","デロイト（Deloitte）が米国勤務の従業員を対象に役職名（肩書き）を変更し、新たに「リーダー」職を設置します。
従業員向けに新たな役職名が通知されるのは1月29日、変更が適用されるのは6月からです。",2026-01-23
b3aa7629d0fd767f349a8454178d82aa,Business_Insider,【発表】境界を越える力が、未来をつくる。｢BEYOND AWARD 2026｣受賞者・企業が決定,https://www.businessinsider.jp/article/2601-beyond-award-2026-winners-and-companies/,"Thu, 22 Jan 2026 04:30:00 GMT",既存のルールや境界を軽やかに飛び越え、新たな時代の兆しをつくる人・企業を表彰する「BEYOND AWARD」。2026年注目の受賞者7名・受賞企業6社を発表します。,2026-01-23
45cc8e5d9285615a85886afe5d598d38,Business_Insider,ブラックロックのラリー・フィンク氏、ダボスでAIバブル論争に言及【ダボス会議2026】,https://www.businessinsider.jp/article/2601blackrock-larry-fink-ai-bubble-china-competition-davos-we/,"Thu, 22 Jan 2026 02:40:00 GMT",ブラックロックのラリー・フィンクCEOは、AIはバブルではないとし、中国に対抗するためアメリカと同盟国の協力や投資拡大、技術の幅広い普及が重要だと述べた。,2026-01-23
974cd2cfff55299f1bb4fcfebbb5fa16,Business_Insider,エヌビディアのジェンスン・フアンCEO「今は配管工になるのに絶好の時代」。それはAI時代に安泰な職業だから…ではない【ダボス会議2026】,https://www.businessinsider.jp/article/2601nvidia-jensen-huang-plumber-construction-jobs-ai-data-center/,"Thu, 22 Jan 2026 02:15:00 GMT",エヌビディアのジェンスン・フアン氏は、世界経済フォーラムで「AIブームによって建設業などの職業の需要が高まっている」と述べた。これらの職種の賃金はアメリカでは急上昇している。,2026-01-23
d1e639ae91067e805f985bb1042f5486,ITmedia_AI_Plus,Sakana AIがGoogleとパートナーシップ締結、研究開発に「Gemini」活用へ　資金調達も,https://www.itmedia.co.jp/aiplus/articles/2601/23/news095.html,"Fri, 23 Jan 2026 15:39:00 +0900",Sakana AIは、米Googleと戦略的パートナーシップを締結したと発表した。研究開発に「Gemini」をはじめとしたGoogleのAIモデルを活用する。,2026-01-23
bb26359d5ad79170653160d11896c5c6,ITmedia_AI_Plus,自動車メーカーなのに“車の存在感ゼロ”――「ロボット」に全振りした韓国ヒョンデ,https://www.itmedia.co.jp/news/articles/2601/23/news048.html,"Fri, 23 Jan 2026 12:30:00 +0900",米ラスベガスで開催された「CES」で最も話題をさらったものといえば、米Boston Dynamicsの二足歩行ロボット「Atlas」だろう。基調講演で披露された滑らかで人間離れした動きはSNSを中心に大きな反響を呼んだ。そのAtlasを見ようと親会社であるHyundaiのブースを訪ねた。そこで目にしたのは、自動車メーカーなのに車が主役じゃない異様なブースだった。,2026-01-23
f366c69e1efbba2f2a6071b14d472fba,ITmedia_AI_Plus,AI無断学習は「窃盗」──スカーレット・ヨハンソンら800人が「盗みはイノベーションではない」キャンペーン,https://www.itmedia.co.jp/news/articles/2601/23/news062.html,"Fri, 23 Jan 2026 09:31:00 +0900",スカーレット・ヨハンソンら800人以上のクリエイターが、AI企業による著作物の無断学習を非難するキャンペーン「Stealing Isn’t Innovation」を開始した。「盗みはイノベーションではない」と断じ、著作権無視の現状を「窃盗」と定義。NYタイムズへの全面広告掲載など強力な抗議を展開している。,2026-01-23
6ce784e2a501120718c378f59a98a697,ITmedia_AI_Plus,AI「幻滅期」でも2026年の支出は前年比44％増　ガートナー予測,https://www.itmedia.co.jp/enterprise/articles/2601/22/news069.html,"Fri, 23 Jan 2026 08:00:00 +0900",ガートナーは、2026年の世界AI支出が前年比44％増の2兆5200億ドルに達すると予測。市場は幻滅期に位置付けられる中、企業は実証済みの成果を重視する傾向にある。,2026-01-23
ea01f36b595862b98218c41d8afe88d7,ITmedia_AI_Plus,なぜAIブームでもIT運用はラクにならないのか？　「自律運用」の本質を改めて考える,https://www.itmedia.co.jp/enterprise/articles/2601/23/news021.html,"Fri, 23 Jan 2026 08:00:00 +0900",AIツールは続々と登場しているのに、IT運用は一向にラクにならない――そう感じている方は多いはずです。自律運用への関心は高まる一方で、誤解されがちな概念でもあります。作業の自動化と自律運用は何が違うのか、人の役割はどう変わるのか。IT運用が抱える構造的課題から整理します。,2026-01-23
11f28a35456c78ac44bc05b48736c114,ITmedia_AI_Plus,「エヴァ」イラストコンテスト、受賞作の“AI疑惑”にpixiv反論　「制作過程を確認済み」　誹謗中傷に警告,https://www.itmedia.co.jp/aiplus/articles/2601/23/news058.html,"Fri, 23 Jan 2026 07:44:00 +0900",受賞候補作品は、AI検出ツールを複数使った後、レイヤー別データやタイムラプス動画の提出を求めて制作過程を検証し、専門知識を持つクリエイターによる目視確認まで行っているという。,2026-01-23
cf73545d61047ccfbc04f7fdc45b2c68,ITmedia_AI_Plus,Google検索の「AIモード」にも「Personal Intelligence」　検索結果に個人の好みや予定を反映,https://www.itmedia.co.jp/aiplus/articles/2601/23/news057.html,"Fri, 23 Jan 2026 07:36:00 +0900",Googleは検索の「AIモード」で、GmailやGoogleフォトの個人情報を回答に反映させる「Personal Intelligence」のβ版提供を米国で開始した。過去の予約や写真からユーザーの好みや予定をAIが把握し、旅行計画や商品提案を高度にパーソナライズする。Gemini 3をベースとしつつ、個人データそのものの学習利用は行わない方針だ。,2026-01-23
1cb6aa7bcd01fe7fb1fdef00e6b6ebf5,ITmedia_AI_Plus,Claude Coworkを使ってみたら、AIが「同僚」になる感覚が分かった（かも？）,https://atmarkit.itmedia.co.jp/ait/articles/2601/23/news013.html,"Fri, 23 Jan 2026 05:00:00 +0900",ClaudeのPro版のサブスクリプション契約者にもリサーチプレビューの範囲が広まった「Claude Cowork」。さっそく、使ってみました。どんなものだったのでしょう？,2026-01-23
0fd9333c87ac88d16a9fc45ef488d09c,ITmedia_AI_Plus,ChatGPTの“本音”が分かる？　「私があなたをどう扱ってきたか画像にして」と指示する遊びが流行,https://www.itmedia.co.jp/aiplus/articles/2601/22/news140.html,"Thu, 22 Jan 2026 19:32:00 +0900",「私があなたをどう扱ってきたかを画像にして」――ChatGPTにこのような指示を出す遊びが、Xを中心としたSNSで流行している。多くのユーザーが試した結果を投稿しており、方向性の異なる画像も見られることから注目を集めている。,2026-01-23
f4ecb1aaaa125dddb36125355db10da8,ITmedia_AI_Plus,世界初、AIで新種の化石を発見　北大などのチームが発表　約7000万年前の地層から産出,https://www.itmedia.co.jp/aiplus/articles/2601/22/news138.html,"Thu, 22 Jan 2026 18:47:00 +0900",北海道大学などの研究チームは、AIによって7000万年前の新種となる化石を発見したと発表した。,2026-01-23
68cc930c8bb8968395b094c5bddd3f9e,ITmedia_AI_Plus,社員2万人への「Copilot」導入を突然中止……一体何が？　Microsoft製品3つの事件簿,https://www.itmedia.co.jp/enterprise/articles/2601/22/news137.html,"Thu, 22 Jan 2026 18:30:00 +0900",あるユーザーは、Microsoft OneDriveに預けていた30年分のデータが突然ロックされ、失われてしまった。また、ある企業は従業員2万人規模で予定していたMicrosoft 365 Copilotの導入を、突如として撤回した。一体、何が起きたのか。,2026-01-23
d59a50faf15953586ba7411c1ebd5da9,ITmedia_AI_Plus,シャープ堺工場跡地のAIデータセンターが稼働開始　KDDI,https://www.itmedia.co.jp/aiplus/articles/2601/22/news115.html,"Thu, 22 Jan 2026 15:19:00 +0900",KDDIが、旧シャープ堺工場（大阪府堺市）の土地や建物を活用したAIデータセンター「大阪堺データセンター」の稼働を開始した。既存の電力・冷却設備を転用し、「NVIDIA GB200 NVL72」などのAIサーバからなる計算基盤を整備。KDDIや子会社などが活用し、ソブリンAI（主権を国内で保持・コントロールできるAI）需要に対応する。,2026-01-23
85c28d04c3b63f1c33969f2c9fe095c2,ITmedia_AI_Plus,AIが“卵の段階”でニワトリの雌雄を判別、オスのヒヨコ処分回避へ　日立傘下,https://www.itmedia.co.jp/aiplus/articles/2601/22/news111.html,"Thu, 22 Jan 2026 15:01:00 +0900",日立グループのSIerである日立ソリューションズ・クリエイトは、ニワトリの雌雄を卵の状態で判別するAIを開発したと発表した。,2026-01-23
337e4b115571ce826872db00818cba6b,ITmedia_AI_Plus,NVIDIA、「フィジカルAI」を支援するオープンモデルやフレームワークを発表,https://atmarkit.itmedia.co.jp/ait/articles/2601/22/news053.html,"Thu, 22 Jan 2026 13:00:00 +0900",NVIDIAはフィジカルAI向けの新たなオープンモデルとフレームワークを発表した。併せて、Boston Dynamicsをはじめとするパートナー企業がこれらを活用した次世代ロボットやロボット運用を効率化している事例も発表された。,2026-01-23
3147d0cbac251b957166a292103e2329,ITmedia_AI_Plus,YouTube、AI分身での動画制作など、次世代戦略を発表,https://www.itmedia.co.jp/news/articles/2601/22/news081.html,"Thu, 22 Jan 2026 11:43:00 +0900",YouTubeのニール・モーハンCEOは、クリエイター向けにAIで生成した本人の分身を使った動画制作機能を導入すると発表した。一方で、AIによる低品質な粗製乱造コンテンツの拡散を抑えるためのアルゴリズム刷新や、AIラベル付けの徹底に言及。創造性の拡張とプラットフォームの信頼性維持の両立を目指すと語った。,2026-01-23
63fc7fd61667910de999c5d4c6c9a417,ITmedia_AI_Plus,みずほ証券、自律型AIエンジニア「Devin」を大規模導入　国内大手金融で初,https://www.itmedia.co.jp/aiplus/articles/2601/22/news078.html,"Thu, 22 Jan 2026 11:26:00 +0900",専用環境の構築を含めたセキュリティ対策も行ったという。,2026-01-23
0a6bde5f27d74d1e6e51205bf4dc75d8,ITmedia_AI_Plus,Anthropic、Claudeの“憲法”改訂　倫理と有用性の優先順位を再定義,https://www.itmedia.co.jp/aiplus/articles/2601/22/news067.html,"Thu, 22 Jan 2026 09:23:00 +0900",AnthropicはAI「Claude」の価値観を規定するnew constitution（新憲法）を公開した。2023年版から進化し、単なるルールを超え「なぜその倫理が必要か」を理解させることで、安定したキャラクターの構築を目指す。全文をCC0で公開し、AI開発の透明性と安全性の標準化を推進する。,2026-01-23
e5db832892fee80471a95eee898b07dd,ITmedia_AI_Plus,OpenAIとゲイツ財団、アフリカの医療をAI化する「Horizon 1000」に5000万ドル,https://www.itmedia.co.jp/news/articles/2601/22/news065.html,"Thu, 22 Jan 2026 08:05:00 +0900",OpenAIとビル・ゲイツ氏のGates Foundationは、アフリカの医療をAIで支援する「Horizon 1000」を共同発表した。5000万ドル（約79億円）を投じ、2028年までに1000拠点の保健施設にAIを導入する。診断支援や事務自動化を通じて、アフリカのプライマリヘルスケアの質と効率を向上させるとしている。,2026-01-23
2476560595e7ddcc659c922efb65c337,ITmedia_AI_Plus,トークン破産、情報漏えい、LLM実行遅延――全部「AI Gateway」に任せよう　無料枠で学ぶAIエージェント開発、運用の新常識,https://atmarkit.itmedia.co.jp/ait/articles/2601/22/news004.html,"Thu, 22 Jan 2026 05:00:00 +0900",気軽に試せるラップトップ環境で、チャットbotを提供するオールインワンの生成AI環境構築から始め、Kubernetesを活用した本格的なGPUクラスタの構築やモデルのファインチューニングまで解説する本連載。今回は、LLMアプリケーション開発や運用で避けて通れない課題を、AI Gatewayで解決するアプローチを解説します。,2026-01-23
9e7a7f4835664be9eaa8d161d31dcb9c,ITmedia_AI_Plus,「日本ブランド」だけど中身は中国製？　日本企業の人型ロボット「cinnamon 1」の狙い,https://www.itmedia.co.jp/aiplus/articles/2601/21/news113.html,"Wed, 21 Jan 2026 19:36:00 +0900",ロボット開発企業のドーナッツロボティクスは、「日本ブランド」をうたう人型ロボット「cinnamon 1」を公開した。中国のロボット開発企業のOEMモデルで、量産もできるという。,2026-01-23
2a74a37fc1d38ce27fdb1d20a47b90b8,Hatena_IT,git-wtを導入した - koicの日記,https://koic.hatenablog.com/entry/introduce-git-wt,,"git-wt を導入したので、メモとして導入ログを記しておく。 github.com 導入動機 Agentic Coding によってにわかに脚光を浴びている git worktree だけれど、実際のところワークツリーディレクトリどこに置くの？といった話などちょっとした敷居がある。特に ghq ユーザーにとっては、ghq root (e.g, ~/src, ~/ghq) のデ...",2026-01-23
2275f981d1ee9fc4b5563268bd0aeec4,Hatena_IT,「人間がコードを書く時代は終わった」議論は2種類のコードを混同している,https://zenn.dev/uryyyyyyy/articles/f127af4277aa32,,ちょうど最近このような投稿を連続して見かけたので、「コード」が何を指しているのかの自分の理解を整理しておきます。 世の中的に見ればソフトウェアエンジニアは未だに売り手市場であると言えると思うので、上記の指摘について「そんなことはないはず」と反論する人も多いと思います。 また、上のRyanさんのツイート...,2026-01-23
f35ec08a2aa2f9ea07ef1e3f0057d09f,Hatena_IT,Best Practices for Claude Code - Claude Code Docs,https://code.claude.com/docs/en/best-practices,,"Tips and patterns for getting the most out of Claude Code, from configuring your environment to scaling across parallel sessions. Claude Code is an agentic coding environment. Unlike a chatbot that an...",2026-01-23
fdce6a5b6410ea2ef44e0e3ba1f07932,Hatena_IT,Claude Codeがわずか30分でCUDAをROCmへ移植：崩れ去る「CUDAの掘」とAIが書き換える半導体業界の勢力図 | XenoSpectrum,https://xenospectrum.com/claude-code-ports-cuda-to-rocm-nvidia-moat-analysis/,,この出来事は、後世の世において、テクノロジー業界における歴史的な瞬間だったと記録されることになるかもしれない。 発端は、Redditのとあるスレッドへの投稿だった。「有名な」自律型AIコーディングプラットフォームである「Claude Code」を用い、NVIDIAのCUDAバックエンドコードを、競合であるAMDのROCm（Radeon Ope...,2026-01-23
325162f6c9967d4739d2509d352d5c06,Hatena_IT,個人で静的型付け言語のコンパイラをフルスクラッチで作れる時代が来た！ - Islands in the byte stream,https://gfx.hatenablog.com/entry/2026/01/23/212644,,"今年に入ってからふと思いつきで新しいプログラミング言語を設計しつつagentic codingで実装したところ、なんと3週間ほどで基礎的なところができちゃいました。とはいえまだ本当に基礎的なところで、B-Tree Mapを実装できる程度です*1。 github.com このプログラミング言語 ""Wado""（ワドゥ）は、2026年1月3日にinitial c...",2026-01-23
