id,source,title,link,published,summary,collected_date
b4db13be35726e812536ba5de04a28ac,Business_Insider,「バイブコーディング」の名付け親、次は「エージェントエンジニアリング」だと語る,https://www.businessinsider.jp/article/2602-agentic-engineering-andrej-karpathy-vibe-coding/,"Sun, 15 Feb 2026 21:30:00 GMT",OpenAIの共同創設者、アンドレイ・カーパシーは「エージェントエンジニアリングはAIコーディングの進化形だ」と述べています。,2026-02-15
fb2a021e9db95d058d87381762af102f,Business_Insider,キリンは何の会社になるのか。過去最高益の裏で育つ“新たな稼ぎ頭”,https://www.businessinsider.jp/article/2602-kirin-vision-2035/,"Sun, 15 Feb 2026 21:30:00 GMT",キリンHDが2025年通期決算で過去最高益を更新しました。ヘルスサイエンス事業が初の黒字化を達成し、ビール増収の裏で新たな「稼ぎ頭」が育っています。,2026-02-15
abd9e98c7e84dcc942b45aa256d9a9f7,Business_Insider,オリンピックの後、サラエボに何が起こったか…今も残る、廃墟になった五輪会場,https://www.businessinsider.jp/article/250410-583/,"Sun, 15 Feb 2026 10:00:00 GMT",【アーカイブ記事】1984年の冬季オリンピックの開催都市サラエボは今でもオリンピック会場をどうするかが論争になっています。その 多くは放棄され、崩壊しているのが実情です。,2026-02-15
5c064d5b308f2d9b119e2548d80cb3f3,Business_Insider,スポーツイベントを大金に変える、エアビーのホストたち。1週間のイベントで約155万円の収益化も可能,https://www.businessinsider.jp/article/2602-airbnb-near-world-cup-stadium-real-estate-rental-hottest-investment/,"Sun, 15 Feb 2026 08:30:00 GMT",,2026-02-15
6d85ef83d9591fdc28a827295edeaec5,Business_Insider,JPモルガンはソフトウエア株の押し目買いを推奨。その5つの理由とは,https://www.businessinsider.jp/article/2602-software-stock-crash-buy-the-dip-tech-stocks-jpmorgan/,"Sun, 15 Feb 2026 06:00:00 GMT",ソフトウェアセクターの売り浴びせによる混乱が続く中、JPモルガンのアナリストは下落局面での買いを推奨する5つの理由を提示しています。,2026-02-15
358497d3a16209a73214ba2387cdcc6f,Business_Insider,アジア最大の航空イベントは対ドローン技術で溢れていた…レーザー兵器や電子妨害ライフルなど,https://www.businessinsider.jp/article/2602-singapore-airshow-counter-drone-uas-warfare-craze-taking-hold/,"Sat, 14 Feb 2026 23:30:00 GMT",シンガポール航空ショーでは、従来見られた軍用機や旅客機に加え、クアッドコプターやレーザー砲も展示されていました。その様子を紹介します。,2026-02-15
6031924b2dba64de6577110800eaf718,Business_Insider,ビットコインが苦戦を強いられる3つの理由…もう「デジタルゴールド」ではない,https://www.businessinsider.jp/article/2602-bitcoin-price-today-bear-market-why-btc-is-down-crypto/,"Sat, 14 Feb 2026 23:00:00 GMT",ビットコインは他のリスク資産が上昇する中、低迷しています。先週の安値からの一時的な上昇の後、7万ドルを維持することができていません。その理由を専門家に聞きました。,2026-02-15
85945b282aba2aa645e0155db8571c8e,Business_Insider,五輪施設の今がわかる34枚の写真…巨額の投資によって生まれた施設はどうなったか,https://www.businessinsider.jp/article/238559-281/,"Sat, 14 Feb 2026 10:00:00 GMT",【アーカイブ記事】多くのオリンピック会場は、大会が終わった後、衰退するままになっています。,2026-02-15
80150192a602d49526a59f0189dfd30d,Business_Insider,グーグルの「100年債」に、債券投資家たちは賭けている,https://www.businessinsider.jp/article/2602-google-alphabet-100-year-bond-ai-debt-financing-goog-tech/,"Sat, 14 Feb 2026 08:30:00 GMT",アルファベット（Alphabet）は、AIプロジェクトへの資金調達のため、借入ラッシュの中で、珍しい100年債を発行しました。同社は最近、さまざまな通貨建てで数百億ドル（数兆円）の債券を販売。世紀債の社債は珍しいです。,2026-02-15
4c56354465af47f3d278d93542520c3c,Business_Insider,スターラックス航空、エアバスの新型機A350-1000を導入…豪華なビジネスクラスを見てみよう,https://www.businessinsider.jp/article/2602-starlux-a350-1000-new-aircraft-business-class-seats-taiwan-airline/,"Sat, 14 Feb 2026 06:00:00 GMT",,2026-02-15
40f130ce186112464fdaa7ba0d7483ba,Business_Insider,料理研究家に聞く「辛ラーメン」の世界一おいしい食べ方。ある調味料をちょい足しするだけで…,https://www.businessinsider.jp/article/293437-548-694/,"Sat, 14 Feb 2026 03:00:00 GMT",暑い時季って、なぜか辛いものをガツンと食べたくなりませんか？今回つくってみたのは、「胃袋沼らせモテごはん」が人気の料理研究家・双松桃子さんが教えてくれた「世界一の旨辛ラーメン」。インスタントの袋麺（双松さんのオススメは「辛ラーメン」）に、ある調味料をちょい足しするだけで、コクと深みが倍増するんです！双松さんの著書『手間ゼロなのに褒められ確定 全人類ウケ沼落ちレシピ』（KADOKAWA）からご紹介し...,2026-02-15
a4ec9af17d022a8ed3aa649ad00cefe8,Business_Insider,ビル・アックマン氏のヘッジファンド、メタに巨額投資「AI統合の最有力受益企業の一つ」,https://www.businessinsider.jp/article/2602bill-ackman-pershing-square-meta-stake/,"Sat, 14 Feb 2026 00:00:00 GMT",ビル・アックマン氏が率いるヘッジファンド、パーシング・スクエアは資産の約10％をメタに投資。AI統合の最有力受益企業と評価しています。,2026-02-15
d43a5475b4f1ecbe494ef60b09e98e9b,Business_Insider,自分の仕事をAI対応にする5つのステップ,https://www.businessinsider.jp/article/2602-ways-to-help-ai-proof-your-job/,"Fri, 13 Feb 2026 23:30:00 GMT",AIがすでにあなたの職務内容を変えているかどうかに関わらず、キャリアの将来に備えるために実行できる5つのステップを紹介します。,2026-02-15
75708f5b03014d0b77d77b25f3d325f5,Business_Insider,キャリアコーチが教える、扱いにくい上司に対処するときに避けるべき間違い,https://www.businessinsider.jp/article/2602-difficult-boss-deal-with-mistake-career-coach/,"Fri, 13 Feb 2026 23:00:00 GMT",テック業界の従業員向けキャリアコーチであるカイル・エリオットは、彼のクライアントは困難な上司に対処する際に、間違った相手に不満をぶつけてしまうことがあると話しています。,2026-02-15
1f90fa0b4dccb45c79209afdc13a6a50,Business_Insider,【佐藤優】「名ばかり管理職」にご用心。管理職にならない判断が正しいケースとは？,https://www.businessinsider.jp/article/when-is-it-the-right-choice-not-to-become-a-manager-a/,"Fri, 13 Feb 2026 22:20:00 GMT",一般職として20年働いてきた読者から「管理職に打診されているが、今後のキャリアはどうすべきか？」という相談が佐藤優さんに寄せられました。相談内容から「名ばかり管理職」の可能性があると佐藤さんは指摘。引き受けるべきではない管理職のオファーについて解説します。,2026-02-15
2bbcf4434e672f6aa11b0f8dfe707b9c,Business_Insider,21日間使えるスマートウォッチ「HUAWEI WATCH GT 6 Pro」を試す。仕事でも運動でも使える万能機,https://www.businessinsider.jp/article/2602-huawei-watch-gt-6-pro-review/,"Fri, 13 Feb 2026 10:43:00 GMT",「HUAWEI WATCH GT 6 Pro」の実機レビューをお届けします。最大輝度3000nitのディスプレイや強化されたスポーツ機能、ロングバッテリーで、日々の健康管理を支援します。,2026-02-15
f29854a2ead52ca0aab4f5cbd30ffe10,Business_Insider,「お金で不幸は変わらない。だが、ストレスは変わる」と、マーク・キューバンは言う,https://www.businessinsider.jp/article/2602-mark-cuban-responds-elon-musk-on-whether-money-buys-happiness/,"Fri, 13 Feb 2026 08:30:00 GMT",イーロン・マスクの話題になった投稿は、富で本当に幸福を買うことができるのかという議論を再燃させました。マーク・キューバンは、「お金はあなたの人格を高め、悲惨さを解決することなく経済的なストレスを軽減する」と言っています。,2026-02-15
9219f71880c8519aca382370db2c9aad,Business_Insider,「不動産は大嫌い」なセルフメイド・ミリオネアが語る、不動産を管理せずに不動産に投資する方法,https://www.businessinsider.jp/article/how-self-made-millionaires-invest-in-real-estate-in-their-own-words-a/,"Fri, 13 Feb 2026 08:05:00 GMT",ブレナン・シュラグバウム氏は、不動産の管理にはまったく興味はありません。しかし、不動産投資には関心があります。彼の解決策は、不動産シンジケーションへの投資。これは、まったく手間がかかりません。これは、複数の投資家が資本を出し合って、単一の投資物件を購入するものです。,2026-02-15
ec02f3e30e72a4f6b298fed6e00160af,Business_Insider,イーロン・マスク、xAIの新体制を発表、一部社員との「袂を分かつ」決断も明かす,https://www.businessinsider.jp/article/2602elon-musk-xai-all-hands-new-structure-recording/,"Fri, 13 Feb 2026 08:00:00 GMT",イーロン・マスクは全社ミーティングでxAIの新体制を公表。一部社員との別れも明らかにしました。,2026-02-15
42b495b2f2ce211e1bd2b1d3f9e08d3a,Business_Insider,PayPay、年300兆円のアメリカ市場へ「茨の道」歩む。Visaと組む勝算,https://www.businessinsider.jp/article/2602-paypay-visa-usa-partnership/,"Fri, 13 Feb 2026 04:18:03 GMT",PayPayとVisaが戦略的提携。300兆円規模のアメリカ現金市場へ挑みます。1枚のカードで支払い方法を切り替えられる技術の国内導入など、上場を見据えた世界戦略の全貌を解説します。,2026-02-15
fd94021382737409afd6efda8787f292,ITmedia_AI_Plus,NXPがエッジへのAIエージェント実装を推進、数百TOPSクラスの新たなNPUも開発へ,https://monoist.itmedia.co.jp/mn/articles/2602/16/news056.html,"Mon, 16 Feb 2026 06:00:00 +0900",NXPセミコンダクターズは、同社が開発を進めているエッジ環境にAIエージェントを組み込むための開発ツール「eIQ Agentic AI Framework」をはじめエッジAI戦略について説明した。,2026-02-15
93550c3ad2a0fb4766987b28dc5456c8,ITmedia_AI_Plus,生成AIにも現場業務にも役立つ「ビジネスメタデータ」、誰がどう整備する？,https://atmarkit.itmedia.co.jp/ait/articles/2602/16/news003.html,"Mon, 16 Feb 2026 05:00:00 +0900",企業における生成AIの活用が加速する一方、蓄積したデータをAI自身に理解させなければAI活用の取り組みは頓挫しかねない――AI活用の成否を分ける「データマネジメント」に焦点を当てた本連載。今回は組織でビジネスメタデータの整備を始める方法を整理する。,2026-02-15
66b62a6ad5d541884790b119aa59e548,ITmedia_AI_Plus,コナンやウルトラマンがAI動画に――「TikTok」運営元の動画生成AI巡り、小野田大臣「実態把握急ぐ」,https://www.itmedia.co.jp/news/articles/2602/13/news119.html,"Fri, 13 Feb 2026 20:20:00 +0900",小野田紀美AI戦略担当相は2月13日の記者会見で、中国ByteDanceの動画生成AI「Seedance 2.0」を使い、日本のキャラクターを用いた動画が生成・拡散されている問題に言及。関係省庁と連携して実態調査に着手するとともに、ByteDanceに事案の改善を求めるよう事務方に指示したことを明らかにした。,2026-02-15
00ba29dbf5bf1b2771363c6ec5691cae,ITmedia_AI_Plus,注目のAI VTuber「ゆめみなな」の配信を先行体験してきた　笑顔も言葉も作り物、それでも視聴者の心を動かす工夫,https://www.itmedia.co.jp/aiplus/articles/2602/13/news106.html,"Fri, 13 Feb 2026 16:50:00 +0900",AIで声や表情を生成するVTuber「ゆめみなな」の配信を先行体験。結果は……。,2026-02-15
ee5c39bad8fc17b875319bb52209fd6d,ITmedia_AI_Plus,人型ロボットの格闘大会を開催へ　中国　優勝者には“2億円相当”の純金ベルト,https://www.itmedia.co.jp/aiplus/articles/2602/13/news101.html,"Fri, 13 Feb 2026 16:22:00 +0900",ロボット開発企業の中国ENGINEAIテクノロジーは、イベント「第1回世界人型ロボット自由格闘大会」（URKL、Ultimate Robot Knock-out Legend）を開催すると発表した。,2026-02-15
c53bead66c2251595c35eb3294d4f547,ITmedia_AI_Plus,AI規制をビッグテックはどう見る？　公取委のフォーラムでApple、Google、Microsoft、OpenAIが語ったこと,https://www.itmedia.co.jp/news/articles/2602/13/news089.html,"Fri, 13 Feb 2026 13:30:00 +0900",公正取引委員会が1月30日に開催した第2回デジタル競争グローバルフォーラムにて、Apple、Google、Microsoft、OpenAIが競争政策の未来を語った。Appleは「EUのDMAは失敗」と批判し、日本のスマホ新法を評価。一方、AI市場への規制については「今から硬直化したルールを作るべきでない」との見解で一致した。ビッグテックが語る、AI時代の競争政策とは。,2026-02-15
f82a082c73d4b6f70e7148331655b28c,ITmedia_AI_Plus,Geminiに追われるOpenAI、5.4兆円投じるSBGの見方は……後藤CFOの一言,https://www.itmedia.co.jp/aiplus/articles/2602/13/news088.html,"Fri, 13 Feb 2026 13:22:00 +0900",米Googleの「Gemini」躍進による危機的状況が報じられる米OpenAI。OpenAIに約5兆4000億円を投資するソフトバンクグループ（SBG）が2月12日に開いた決算会見では、後藤芳光CFOが引き続きOpenAIに期待する方針を示した。記者からはリスク評価やその根拠を問う質問が多数挙がったが……。,2026-02-15
ee752eff33a95f4572443844a44e5e2e,ITmedia_AI_Plus,Spotify「シニアエンジニアは12月以降、1行もコードを書いていない」　共同CEOが同社のAIコーディング事情明かす,https://www.itmedia.co.jp/aiplus/articles/2602/13/news074.html,"Fri, 13 Feb 2026 12:01:00 +0900",「当社のシニアエンジニアと話をすると『12月以降、自分ではコードを1行も書いていない』という。彼らは今やコードを生成し、それを監督するだけだ」──米Spotifyのグスタフ・ソダーストロム共同CEOがアナリスト向け電話会議で、自社のAIコーディング事情を明かした。,2026-02-15
0057ed81f1a5153ff7aaba28e68b6097,ITmedia_AI_Plus,Google、推論特化型「Deep Think」を大幅強化　手書きスケッチから3Dモデル生成も可能に,https://www.itmedia.co.jp/aiplus/articles/2602/13/news064.html,"Fri, 13 Feb 2026 10:19:00 +0900",Googleは、AIモデル「Gemini 3」の推論モード「Deep Think」をアップグレードしたと発表。科学やエンジニアリング等の複雑な課題解決に特化し、スケッチからの3Dモデル生成も可能。「Google AI Ultra」ユーザー向けに提供を開始している。,2026-02-15
1ce71586041c9970136941149086fe1b,ITmedia_AI_Plus,OpenAI、Cerebrasチップ搭載の高速エージェントコーディングツール「GPT-5.3-Codex-Spark」,https://www.itmedia.co.jp/aiplus/articles/2602/13/news061.html,"Fri, 13 Feb 2026 07:57:00 +0900",OpenAIは、エージェントコーディングツールの高速版「GPT-5.3-Codex-Spark」をリリースした。Cerebrasの専用チップ「WSE-3」を活用し、毎秒1000トークン以上の爆速推論を実現。リアルタイムでの対話型コーディングを可能にする。ChatGPT Proユーザー向けにVS Code拡張機能等を通じてプレビュー提供を開始した。,2026-02-15
02a46fd0559520f739bb45eade532eac,ITmedia_AI_Plus,Claude拡張機能にCVSS10.0の脆弱性　現在も未修正のため注意,https://www.itmedia.co.jp/enterprise/articles/2602/13/news030.html,"Fri, 13 Feb 2026 07:00:00 +0900",Claudeの拡張機能にカレンダーの予定から任意のコードを実行されるゼロクリック脆弱性が判明した。サンドボックスを介さない特権動作やコネクター間の信頼設計に構造的欠陥があり、現在も未修正のため注意を要する。,2026-02-15
c70d91f1d60e68e5c90dd0c4cd1040d2,ITmedia_AI_Plus,AIエージェントを自治体業務で使いこなすには？　エージェントスキルで“業務手順書”作ってみた,https://www.itmedia.co.jp/business/articles/2602/13/news016.html,"Fri, 13 Feb 2026 07:00:00 +0900",自律的に仕事を進めるAIエージェントは注目を集めてきたが、実業務でどのように役立つのかは分かりにくかった。しかし近年、役割や使い方が整理され「エージェントスキル」を用いることで、自治体業務への活用も現実味を増している。,2026-02-15
35d001b5f2095aa33531509aeaff708d,ITmedia_AI_Plus,Anthropic、300億ドル（約4兆6000億円）調達　評価額は3800億ドルに,https://www.itmedia.co.jp/news/articles/2602/13/news059.html,"Fri, 13 Feb 2026 06:44:00 +0900",Anthropicは、シリーズGで300億ドル（約4兆6000億円）調達した。評価額は3800億ドルと、前回の倍以上に急上昇した。GICやFounders Fund、MGXなどが主導し、MicrosoftやNVIDIAも参加。調達資金はエンタープライズ向けモデル開発とインフラ構築に充てるとしている。,2026-02-15
d8a79e7679eac12e31e90d6d8df858cf,ITmedia_AI_Plus,AIがゼロデイ脆弱性を発見する時代へ　Claudeは500件超の脆弱性をどうやって見つけたか,https://atmarkit.itmedia.co.jp/ait/articles/2602/13/news017.html,"Fri, 13 Feb 2026 05:00:00 +0900",Claude Opus 4.6はサイバーセキュリティに関する能力も大きく向上している。Anthropicの発表によれば、Claudeはオープンソースソースソフトウェアから500件を超える脆弱性を発見したという。Claudeは何を試し、何を考え、どのようにして脆弱性を見つけたのだろう。そして悪用リスクにどう対処しているのか。,2026-02-15
75349606d81a9559139fc9adfc873749,ITmedia_AI_Plus,富士通、“Made in Japan”のAIサーバを製造開始　国内一貫生産で“主権性”確保,https://www.itmedia.co.jp/aiplus/articles/2602/12/news083.html,"Thu, 12 Feb 2026 13:56:00 +0900","主要部品のトレーサビリティを確保しつつ、プリント基板組立から装置組立まで一貫生産する“Made in Japan""により、データ流出などのセキュリティリスクを軽減する。",2026-02-15
811135433dc8be5eb32598a6ebc14ea6,ITmedia_AI_Plus,Anthropic、AIによる「電気代高騰」を防止へ　インフラ増設費の100％自社負担を約束,https://www.itmedia.co.jp/news/articles/2602/12/news080.html,"Thu, 12 Feb 2026 13:33:00 +0900",Anthropicは、AIインフラ拡大に伴う一般家庭の電気料金高騰を防ぐため、増加コストを自社で全額負担する新方針を発表した。将来的に50GW以上の電力が必要とされる中、送電網の増設費用を100％カバーし、独自の発電設備も調達する。AI開発の加速と、一般市民の生活コスト保護の両立を目指す。,2026-02-15
a12f8cd4ab970f7ff7f1e0455b6853ae,ITmedia_AI_Plus,香川県がエヌビディアと連携協定　全国の自治体で初,https://www.itmedia.co.jp/aiplus/articles/2602/12/news079.html,"Thu, 12 Feb 2026 13:29:00 +0900",香川県が、米NVIDIAの日本法人エヌビディアと同社のGPUを活用する企業の誘致などに向けた連携協定を結ぶと発表した。県によれば、自治体がエヌビディアと連携協定を結ぶのは初という。,2026-02-15
5ae4a431db95a2b2c3b536270225ba6c,ITmedia_AI_Plus,「高市首相vs.ウルトラマン」「悟空vs.ドラえもん」も……中国発の新動画AI「Seedance2.0」物議,https://www.itmedia.co.jp/aiplus/articles/2602/12/news068.html,"Thu, 12 Feb 2026 12:02:00 +0900",中国ByteDanceが2月10日（現地時間）までに発表した動画生成AIの新モデル「Seedance 2.0」がSNS上で物議を醸している。一貫性のある映像を出力しやすいとうたう同モデルだが、XやTikTokではSeedance 2.0で生成したという、日本のIPの映像が続出。中には「高市首相vs.ウルトラマン」といった動画もあり、米OpenAIの動画生成AI「Sora 2」と同様に物議を醸してい...,2026-02-15
8241c1e585c1b845a0c702922d58a382,ITmedia_AI_Plus,論文の図を生成するAI「PaperBanana」 Googleなどが開発　ブラウザ上で試せるジェネレーターも公開中,https://www.itmedia.co.jp/aiplus/articles/2602/12/news026.html,"Thu, 12 Feb 2026 12:00:00 +0900",北京大学とGoogle Cloud AI Researchに所属する研究者らは、学術論文における図や統計プロットを自動生成するフレームワークを開発した研究報告を発表した。,2026-02-15
41446d6d0cf51baa04d464a4f128e85c,ITmedia_AI_Plus,Google広告責任者、「エージェントコマース」は2026年に実働段階に移行と語る,https://www.itmedia.co.jp/news/articles/2602/12/news066.html,"Thu, 12 Feb 2026 11:39:00 +0900",Googleの広告責任者は2026年の年次書簡で、AIが購買を代行する「エージェントコマース」の本格始動を宣言した。オープン標準「UCP」により「Gemini」などからの直接購入が可能になるほか、「AIモード」内への広告統合や個別割引を提示する「Direct Offers」も導入。広告は対話を通じた支援体験へと進化するとしている。,2026-02-15
824c6e41d503a6843d9e46da136bc6d0,Hatena_IT,また病院がVPN経由でやられたわけだがVPNは悪だね｜ロードバランスすだちくん（仮）,https://note.cloudnative.co.jp/n/ndee08b72db63,,シンジです。2026年2月9日の午前1時50分、日本医科大学武蔵小杉病院のナースコールシステムがランサムウェア攻撃を受けました。侵入経路は医療機器保守用VPN装置です。またVPNです。またです。人類は過去の経験から学ばない生き物でしたね。 約1万人分の患者の個人情報（氏名、性別、住所、電話番号、生年月日、患者ID）...,2026-02-15
7d1cb02b5f68d277f12a3fe16e075f5d,Hatena_IT,3年間凍結されていたTwitter（X）アカウントがBBB（米国ビジネス改善協会）への申し立てであっさり復活した話｜ししかわ,https://note.com/stack_chan/n/nfea877fdddc5,,"復活し た！！！！！！！！！！！！！！！！！！！！！！！！！！！！！！！！！！！！！！！！！！ わあーーーーー！！！ — ししかわ/Shinya Ishikawa (@meganetaaan) February 14, 2026 ししかわです。掲題のとおりアカウントが復活しましたので経緯や詳しい手続きを記します。 経緯約3年前、私のX（旧Twitter）アカウ...",2026-02-15
d926f4a5e2d969049b4eed01f32528ef,Hatena_IT,AGENTS.mdを自動で育てる仕組みを作った,https://nyosegawa.github.io/posts/agents-md-generator/,,こんにちは！逆瀬川 (@gyakuse) です！ 今日は「AGENTS.mdを自動で育てたい」という話をしていきたいと思います。作ったものはagents-md-generatorとして公開しています。 CLAUDE.mdを毎回考えるのがつらい Coding Agentを日常的に使っていると、新しいリポジトリを作るたびに頭を悩ませるものがあります。CLAUDE.md（あ...,2026-02-15
f8225c5ced35c4b559e0736fa564e989,Hatena_IT,プログラミングは今が一番楽しい,https://iwashi.co/2026/02/15/programming-is-most-fun-now,,AIコーディングの進化に伴い、特に2026年に入ってから、プログラミングに対する自分の見方がかなり変わってきました。現時点で考えていることを、いったん記録として残しておきます。あとで振り返ったら面白いと思うので。 なお、この記事はAIによる「てにをは修正」「タイポ修正」などの校正は入っていますが、内容その...,2026-02-15
98eb259759453b97d978e810d23a5985,Hatena_IT,【緊急】AIエージェントの12%がマルウェアだった。OpenClaw史上最悪のサプライチェーン攻撃の全貌 - Qiita,https://qiita.com/emi_ndk/items/bf3b5f0f3eef99a4d124,,Deleted articles cannot be recovered. Draft of this article would be also deleted. Are you sure you want to delete this article?,2026-02-15
