id,source,title,link,published,summary,collected_date
c1b3e19d3f19582b830279e343def3cd,Business_Insider,「暗号資産はポートフォリオの最大40%を占めるべき」…ファイナンシャルアドバイザーが提言する理由とは？,https://www.businessinsider.jp/article/2507-how-much-crypto-investment-portfolio-bitcoin-ric-edelman-btc-advisor/,"Tue, 08 Jul 2025 22:30:00 GMT",リック・エデルマンは、投資はより長い期間にわたって収益を生み出す必要があるとして、投資家に対しポートフォリオのより多くの部分を暗号資産に割り当てることを推奨しています。,2025-07-08
c87bf7cb68d9f9b1eda0b7f252ae21d1,Business_Insider,三井住友FG、元マイクロソフト幹部とAI新会社を設立へ。5年後に売上200億円超を目指す,https://www.businessinsider.jp/article/2507-smbc-group-ahmed-jamil-mazhari/,"Tue, 08 Jul 2025 22:15:00 GMT",三井住友FGが、元マイクロソフトアジア社長のマザーリ氏をAIアドバイザーに迎え、シンガポールでAIソリューション新会社を共同設立すると発表しました。5年後に売上200億円超を目指します。,2025-07-08
384479f92f632b590e61b4d2392ce54d,Business_Insider,【佐藤優】同僚からの嫉妬にどう対処すればいい？手帳を捨てられた経験から言えること,https://www.businessinsider.jp/article/how-to-deal-with-jealousy-from-colleagues/,"Tue, 08 Jul 2025 22:00:00 GMT",近しい同僚から「お前のプロジェクトはお金と時間の無駄遣い」と言われた読者から佐藤優さんに相談が来ました。嫉妬のマネジメント方法について、佐藤さんは「本人に対処することは難しい」と指摘。では、どうすれば？,2025-07-08
7fc95f457e6274610c474f0ff3c3de37,Business_Insider,マイクロソフトの社内メモを入手…大規模な人員削減を行った営業部門の責任者が掲げる「最先端AI企業」への野望とは,https://www.businessinsider.jp/article/2507-internal-microsoft-memo-lays-out-new-strategy-for-selling-ai/,"Tue, 08 Jul 2025 21:35:00 GMT",マイクロソフトの社内メモによると、ジャドソン・アルトフ氏は「最先端のAI企業」になるために営業部門を刷新しています。,2025-07-08
f6364ecd9a1d6631c9ea727019b8caba,Business_Insider,「ずっと工事してる渋谷」が、ついに終わる？再開発“最終章”の中身,https://www.businessinsider.jp/article/2507-site-visit-to-shibuya-redevelopment/,"Tue, 08 Jul 2025 21:30:00 GMT",「いつ行っても工事中」と言われた渋谷駅周辺。再開発はいよいよ最終章に入りました。工事はいつ終わり、何が変わるのかを紹介します。,2025-07-08
094f7db69cbf759066d64575df09dfaf,Business_Insider,「その猛暑は温暖化のせい？」を即分析。新組織WACの正体,https://www.businessinsider.jp/article/2507-why-wac-established/,"Tue, 08 Jul 2025 21:15:00 GMT",連日続く猛暑…果たしてこれは、地球温暖化の影響によるものなのか。この5月、日本の気候科学に携わる研究者たちによって、異常気象が発生した際に気候変動の影響の度合いを迅速に可視化するための専門組織が立ち上がりました。,2025-07-08
4da74a44620dfa77e53cd873446143bd,Business_Insider,見た目は旧車、中身は最新。ベッカムも投資するレストモッドの世界,https://www.businessinsider.jp/article/classic-looks-modern-guts/,"Tue, 08 Jul 2025 12:00:00 GMT",レストモッドとは、外装は1960年代から1980年代のクラシックカーですが、中身は2020年代の最新技術を用いた現代車のことを指します。壊れず、熱を持たず、冬の朝でもエンジンは一発でかかる。アクセルを踏めば鋭く加速し、高速道路では直進安定性が高く、ブレーキは瞬時に応答する—— 。そんな現代車の信頼性と性能を持ちながら、見た目はあの頃のまま。そんな理想を叶える文化が、今まさに世界各地の工房で花開いて...,2025-07-08
fc8821c8815bede507cc1706afd76241,Business_Insider,AI時代には「人間らしい感性とこだわり」が差別化要因になる…元OpenAIマーケティング部門の幹部が指摘,https://www.businessinsider.jp/article/2507-stem-degree-human-taste-important-ai-marketing-former-openai-vp/,"Tue, 08 Jul 2025 10:00:00 GMT",「差別化を図る企業は、その技術力を示す企業だ」と、OpenAIの元マーケティング担当バイスプレジデントは述べています。,2025-07-08
20c24539472f4c6a86cd1894e8365a77,Business_Insider,【佐藤優】凋落する日本。今こそ英語を学び、海外で働くべきなのか？,https://www.businessinsider.jp/article/291805d/,"Tue, 08 Jul 2025 09:00:00 GMT",円安やインフレ、一人当たりGDPの低下など、日本の競争力低下が懸念されています。「今のうちに外資や海外で働く経験を積んでおくべきか？」という読者の質問に佐藤優さんが回答します。,2025-07-08
77621dac357e9bebbafc238d25aba8fb,Business_Insider,クルーズ船で暮らす60代の2人姉妹、退職後すでに1500日以上を海上で過ごしている,https://www.businessinsider.jp/article/2507-how-retirees-live-on-cruises-full-time-sold-houses/,"Tue, 08 Jul 2025 08:30:00 GMT",クルーズ船で暮らす、ジョー・ジョンストン（69歳）とエレイン・ダーハム（63歳）の姉妹。2人は独身の退職生活者で、これまでに合計1500日以上を船上で過ごしています。2025年は100日以上に及ぶクルーズ船の旅を予約済みだそうです。,2025-07-08
d550225908a3c7001fcc103d1e19f89b,Business_Insider,アマゾン出品サービスで年商6億円超達成。28歳の起業家が教える、Eコマースビジネスを成功に導く4つのポイント,https://www.businessinsider.jp/article/278352c/,"Tue, 08 Jul 2025 08:05:00 GMT",28歳のリーブス氏は、アマゾンで財布を販売するECビジネスを1年余りで1億円規模へと成長させました。商品作りのこだわりから在庫の持ち方、商品紹介ページ作成の際のコツなど、成功の秘訣を明かしてもらいました。,2025-07-08
756ad479418cd92b352c47887ed2816e,Business_Insider,Xの新たな責任者はMeta元幹部で起業家。イーロン・マスク氏へのラブコールが成就,https://www.businessinsider.jp/article/2507-x-new-product-head-nikita-bier/,"Tue, 08 Jul 2025 02:50:00 GMT",元Meta幹部のニキータ・ビア氏が、Xの新たな製品責任者に就任しました。ビア氏は50万以上のフォロワーを持ち、複数のアプリを作り出した実績もある起業家です。,2025-07-08
d3e144643a72266a6f5812cf60db59cb,Business_Insider,消費減税も現金給付も間違いと言える当然の理由。そもそも財政拡張は物価高対策にならないので…【25参院選】,https://www.businessinsider.jp/article/2507-house-of-councillors-summer-election-finance/,"Tue, 08 Jul 2025 02:01:00 GMT",7月20日に投開票される参院選は「物価高対策」に関心が集中し、各政党とも「消費減税か、現金給付か」を軸に主張を展開していますが、みずほ銀行チーフマーケット・エコノミストの唐鎌大輔氏によれば、主張のいずれも論外で物価高対策になっていないそうです。,2025-07-08
8b488befecb52c3196a7bfa08b55438a,Business_Insider,先端科学技術から新規事業を生み出すには？：東大IPC／天地人から学ぶスケールする事業ビジョン【8月5日（火）開催】,https://www.businessinsider.jp/article/2507-utokyo-ipc-and-tenchijin-seminar/,"Tue, 08 Jul 2025 02:00:00 GMT",,2025-07-08
e92c1aeaa11dd03f8893ec439f8d2775,Business_Insider,2025年下半期は株式市場のバブルがリスクに…バンカメのアナリストがそれに備える投資戦略を共有,https://www.businessinsider.jp/article/2507-stock-market-outlook-rate-cuts-tax-bill-bubble-growth-stocks-2025-6/,"Tue, 08 Jul 2025 01:30:00 GMT",バンク・オブ・アメリカのアナリストは、低金利と減税の見通しに煽られて、2025年後半に株式バブルが形成されると予想しています。,2025-07-08
07a701b7aec3ec4baecc0e0b7de75373,Business_Insider,トランプ大統領が新たな関税措置を発表し、株価が下落…日本からの輸入品に25％を課税,https://www.businessinsider.jp/article/2507-stock-market-today-trump-tariffs-sp500-japan-korea-trade-war/,"Tue, 08 Jul 2025 00:10:00 GMT",投資家がトランプ大統領の最新の貿易政策を消化することで主要株価指数が下落し、中でもダウ平均株価は400ポイント以上下落しました。,2025-07-08
9ffe751db130baa52925e0303769e6a8,Business_Insider,アマゾンは「リーダーシップ原則」をより重視、厳格なパフォーマンス評価プロセスを導入する,https://www.businessinsider.jp/article/2507-amazon-stricter-performance-review-process-leadership-principles/,"Mon, 07 Jul 2025 23:45:00 GMT",,2025-07-08
9b0b2515b6605d9d3d5ce5fa85be0b2e,Business_Insider,ハーゲンダッツ、中国で大苦戦で浮き彫りになった日本市場の優秀な戦術,https://www.businessinsider.jp/article/2507-insidechin-haagendazs-marketing/,"Mon, 07 Jul 2025 22:30:00 GMT",高級アイスの象徴だったハーゲンダッツが、中国で苦境に陥っています。現地カフェの大量閉店、SNSでは「#売れない」の声。なぜ消費者は離れたのか。そこには日中で分かれたブランド戦略の明暗がありました。,2025-07-08
be612eed1eb6b835ea33c06334703c62,Business_Insider,AIの普及で試される経営者のコミュニケーション能力…「仕事が奪われる」と口にするのは会社に悪い影響を与える可能性がある,https://www.businessinsider.jp/article/2507-how-ceos-talk-ai-job-impact-employees/,"Mon, 07 Jul 2025 22:30:00 GMT",一部のCEOは、AIが幅広いホワイトカラー労働者に取って代わると予想しているようです。それに対して専門家は、悲観的なことを伝えると士気が下がると警告しています。,2025-07-08
35a1b571470a60c07cec5d92a8da4b76,Business_Insider,1日1億人以上が使うSNS「Threads」が開始2周年。Meta幹部に聞く「X（Twitter）」対抗からその後,https://www.businessinsider.jp/article/2507-threads-2nd-anniversary-interview/,"Mon, 07 Jul 2025 22:15:00 GMT",X（Twitter）の代替ではない、Threads独自の進化とは？ 2周年を迎えたThreadsの現状と、新機能のDMや今後の展開など、MetaのThreads開発担当者へインタビューしました。,2025-07-08
0efda15f9a192ace2b854251b1d5afb8,ITmedia_AI_Plus,生成AI時代の「学び」とは？　サイバー大学が挑む「教育とテクノロジー」の融合,https://www.itmedia.co.jp/business/articles/2507/09/news046.html,"Wed, 09 Jul 2025 05:00:00 +0900",生成AIの波は教育現場にも押し寄せ、従来の学びの在り方を変えようとしている。生成AIと教育の未来を見据えたサイバー大学の取り組みを、川原洋学長に聞いた。,2025-07-08
0512699bb008ec54c7be8f054fa82fe7,ITmedia_AI_Plus,“6分で分かる”ビジネスパーソン向け「AIエージェント入門資料」、パナソニックコネクトが公開,https://www.itmedia.co.jp/aiplus/articles/2507/08/news127.html,"Tue, 08 Jul 2025 18:34:00 +0900",パナソニックコネクトは、「6分でわかるビジネスパーソンのためのやさしいAIエージェント入門」と題した資料を公開した。AIエージェントの特長や仕組みなどを、全24枚のスライドで解説している。,2025-07-08
0b401772491f8c445d658ed59677ffc5,ITmedia_AI_Plus,AI英会話アプリ「スピークバディ」、IT業界特化のレッスン提供開始　頻出表現学べる,https://www.itmedia.co.jp/aiplus/articles/2507/08/news122.html,"Tue, 08 Jul 2025 17:16:00 +0900",AI英会話アプリ「スピークバディ」を運営するスピークバディ社は、IT業界で働くユーザー向けのレッスンコンテンツ「ITプロジェクト英語」の提供を始めた。ITスタートアップ企業での業務を題材に、IT業界で頻出の表現などを学べるという。,2025-07-08
dee10bdddf1cb4a77ae428c5c76c84b4,ITmedia_AI_Plus,人気YouTuber「きまぐれクック」さんかたるAI偽動画、本人と事務所が注意喚起　詐欺サイトに誘導、すでに被害者も,https://www.itmedia.co.jp/aiplus/articles/2507/08/news092.html,"Tue, 08 Jul 2025 13:17:00 +0900",釣りや料理動画で知られる人気YouTuber「きまぐれクック」さんになりすましたAI詐欺動画をYouTube上で確認したとして、本人と所属事務所が注意を呼び掛けている。,2025-07-08
a39f30ab36e2297e230bddddaedc8983,ITmedia_AI_Plus,高まる“AI学習熱”　 中でも「MCP」の需要拡大　eラーニング「Udemy」でAI関連検索ワード急上昇,https://www.itmedia.co.jp/aiplus/articles/2507/08/news093.html,"Tue, 08 Jul 2025 12:45:00 +0900",検索数が急上昇したワードの上位をAI関連が独占。1位は「AIエージェント」、2位は「Cursor」、3位は「Gemini」だった。,2025-07-08
7fa459b606704c5e7f67974063505166,ITmedia_AI_Plus,ネコ型配膳ロボ、修理担当者の“知られざる苦労”とは？　クモの巣で不具合が出た「激レア」ケースも,https://www.itmedia.co.jp/aiplus/articles/2507/07/news019.html,"Tue, 08 Jul 2025 12:00:00 +0900",飲食店で働く姿をよく見かける、ネコ型配膳ロボット「BellaBot」。普段知ることのできない現場での不具合や、修理方法について、国内で同ロボットの販売・保守を手掛けるDFA Roboticsに聞いた。,2025-07-08
1fcaab59024621368919172e5c43d666,ITmedia_AI_Plus,Google、AIでメンタルヘルスケアの民主化目指す　フィールドガイド公開や研究投資,https://www.itmedia.co.jp/aiplus/articles/2507/08/news078.html,"Tue, 08 Jul 2025 10:38:00 +0900",GoogleがAIによるメンタルヘルスケア支援の新施策を発表。ケアのアクセス民主化を目指し、組織向けの活用ガイドを公開した。また、DeepMindなどが研究機関と提携し、不安症やうつ病などの治療法開発に向けたAI研究に投資する。,2025-07-08
b8a8d217485782925561f345d395a4b3,ITmedia_AI_Plus,Amazonプライム責任者に聞く「AI×CX戦略」　サブスクビジネス成功の「3つの要点」,https://www.itmedia.co.jp/business/articles/2507/08/news069.html,"Tue, 08 Jul 2025 09:45:00 +0900",7年ぶりに来日したAmazonプライムのグローバル責任者に、AI活用と顧客体験（CX）向上策の現状、そしてその経営戦略における位置づけについて話を聞いた。,2025-07-08
b8cce620f832d3a7e64677be5868b0d4,ITmedia_AI_Plus,AI Alliance Japan設立　オープンソースAI技術の発展を支援,https://www.itmedia.co.jp/enterprise/articles/2507/08/news059.html,"Tue, 08 Jul 2025 08:00:00 +0900",The AI Allianceは、日本に新たに設立した拠点「AI Alliance Japan」を発表した。この拠点は、日本の文化・経済に対応したAI技術の発展を目的とし、国内外の協力を推進する。,2025-07-08
8d0fc1dc49811e3698a814be97e965f7,ITmedia_AI_Plus,「AIはどれだけ巡回し、どれだけ人を連れてくるのか」　Cloudflareが可視化,https://atmarkit.itmedia.co.jp/ait/articles/2507/08/news052.html,"Tue, 08 Jul 2025 08:00:00 +0900",Cloudflareは、AIモデルによるWebサイトのクロールに関する影響を分析した結果を発表した。AIクローラーは、膨大な量のWebページをクロールしているが、従来とは異なり、Webサイトへのトラフィック還元が極めて少ないという特徴があるという。,2025-07-08
f227125a67afbde26870cfb23b05d876,ITmedia_AI_Plus,DeNA人事が“AIをフル活用”して分かった「AIがフィットする業務、しない業務」,https://www.itmedia.co.jp/business/articles/2507/08/news030.html,"Tue, 08 Jul 2025 07:00:00 +0900",多岐にわたる人事業務にAIを活用しているディー・エヌ・エー。さまざまなトライアルエラーをへて、どの施策に手応えを得たのか。また反対に、AI活用がフィットしないと判断した施策とは？,2025-07-08
9e5a59f0ec7d3ebd1037abf22a12fb60,ITmedia_AI_Plus,パナソニックの「設計AI」が“勘と経験”を超える設計の自動化を実現,https://monoist.itmedia.co.jp/mn/articles/2507/08/news027.html,"Tue, 08 Jul 2025 07:00:00 +0900",パナソニック ホールディングスは、高速化に強みを持つ自社のシミュレーション技術とAIを掛け合わせ、自動で素早くデバイスを設計する独自の「設計AI」の開発に取り組んでいる。その特長や成果について担当者に聞いた。,2025-07-08
5e19f73cd544089ab03b9392b3fbcd6d,ITmedia_AI_Plus,GTPちゃう、GPTや　漫画「15日間、生成AIでやらかし続ける中小企業」【残り13日】,https://www.itmedia.co.jp/aiplus/articles/2506/04/news125.html,"Tue, 08 Jul 2025 07:00:00 +0900",本連載では、生成AIに関する“失敗あるある”を繰り返す架空の中小企業を舞台に、生成AI活用の基礎的な注意点を漫画形式で紹介します。更新は毎営業日。,2025-07-08
313acddd876fc99017673f5c34f19489,ITmedia_AI_Plus,常陽銀行が「1500人の営業」を分析して分かった、スキルと売上成績の関係,https://www.itmedia.co.jp/business/articles/2507/08/news038.html,"Tue, 08 Jul 2025 05:00:00 +0900",めぶきフィナンシャルグループは2025年3月期有価証券報告書で、子会社である常陽銀行における従業員のスキルと、営業成績との関係性を示す情報を開示した。Institution for a Global Societyが提供する能力測定ツール「GROWシリーズ」により取得した人材のスキルデータを活用している。,2025-07-08
55bcaba9d12f50dee984653f9c19dd54,ITmedia_AI_Plus,［Pythonクイズ］データをまとめるクラス、もっとラクに書けるって知ってる？,https://atmarkit.itmedia.co.jp/ait/articles/2507/08/news025.html,"Tue, 08 Jul 2025 05:00:00 +0900",複数のデータをまとめて1つのクラスとして表現したいことってありますよね。でも、いっつも決まった初期化とか比較とか、文字列化とかのコードを書くのも面倒くさくないですか？,2025-07-08
9e35907ce0adc7af3e3f1531386817f3,ITmedia_AI_Plus,仮面ライダー新作「ゼッツ」発表、「生成AIか否か」に注目集まる　デザインやティーザー映像の背景が話題,https://www.itmedia.co.jp/news/articles/2507/07/news116.html,"Mon, 07 Jul 2025 19:48:00 +0900",東映がテレビシリーズ「仮面ライダー」の新作「仮面ライダーゼッツ」を発表した。ティーザー映像も公開。SNSでは映像の背景や仮面ライダーそのもののデザインに漂う“生成AIっぽさ”が話題になっており、7月11日に予定されている続報に注目が集まっている。,2025-07-08
e9c134d6eebc5f2539805f322cebe12b,ITmedia_AI_Plus,AIエージェント連携技術「A2A」標準化へ　7社の狙いと「顔ぶれ」の意味を読む,https://www.itmedia.co.jp/enterprise/articles/2507/07/news073.html,"Mon, 07 Jul 2025 17:40:00 +0900",多種多様なAIエージェントを連携する「A2A」プロトコルを標準技術に仕立て上げるプロジェクトが、ハイパースケーラーや業務アプリケーションベンダー大手など7社により発足した。この顔ぶれにどんな“意味”があるのか。SIerに出番はあるのか。,2025-07-08
991adc9b7d5bf1b06255ad7b95046b8a,ITmedia_AI_Plus,パチンコ「海物語」のSANYOイメージガール「ミスマリンちゃん」にAI版　12人の“AI候補生”でオーディション,https://www.itmedia.co.jp/aiplus/articles/2507/07/news099.html,"Mon, 07 Jul 2025 17:38:00 +0900",パチンコ・パチスロメーカーの三洋物産と三洋販売は、パチンコ「海物語」シリーズに登場する同社のイメージガール「ミスマリンちゃん」のAIキャラクターを生み出す企画「AIミスマリンオーディション」を始めた。,2025-07-08
0219285de13dca03d5e7bc03f941b1d5,ITmedia_AI_Plus,MIXI、AIプラットフォーム「Google Agentspace」を全社導入,https://www.itmedia.co.jp/aiplus/articles/2507/07/news096.html,"Mon, 07 Jul 2025 15:39:00 +0900",MIXIは、Google Cloudが提供するエンタープライズ向け生成AIプラットフォーム「Google Agentspace」を全従業員（約2000人）に導入した。,2025-07-08
a75fa00578fd342a29749878af6c6311,ITmedia_AI_Plus,副業用AIアシスタント「ランサーズAI」公開　初心者でもAIでブログ記事やLINEスタンプ作成,https://www.itmedia.co.jp/aiplus/articles/2507/07/news083.html,"Mon, 07 Jul 2025 14:05:00 +0900",ランサーズは、副業向けにチューニングした各種AIアシスタントを利用できる「ランサーズ副業AI」の提供を始めた。,2025-07-08
6a764e329bb9d4b3b30f699d1f40b856,Hatena_IT,ガザ：「援助に見せかけた虐殺」──イスラエルと米国による食料配給システムの解体と封鎖の解除を | プレスリリース | 国境なき医師団,https://www.msf.or.jp/news/press/detail/pse20250630nt.html,,配給所で撃たれて負傷し、診療所で治療を受けた32歳の男性。「自分が配給所に行かないと家族を食べさせられない」と話す＝2025年6月6日　© Nour Alsaqqa/MSF,2025-07-08
2e153027d162582f3e32aea2cd7935bb,Hatena_IT,ある日IT企業社長が自治会会長になったときにやった10のこと | DevelopersIO,https://dev.classmethod.jp/articles/10-actions-community-chair/,,ある日IT企業社長が自治会会長になったときにやった10のこと 皆さんこんにちは、代表の横田です。今日は設立記念日ということでブログを書いてみたいと思います。 クラスメソッド株式会社は、主に最新のITテクノロジーを駆使して企業のクラウド化やデジタル活用をする企業の参謀として活動してきました（そうありたいと...,2025-07-08
09860f328274a8e939a3f045f4e93ee4,Hatena_IT,社内AI推進者はつらいよ｜Kakko🌸🌈,https://note.com/kakowara/n/n46ca355a6aa6,,PoCの沼、終わらない説得、孤独な戦いの先に光はあるか 「AIで、わが社に革命を！」 そんな熱い想いを胸に、社内のAI推進担当に名乗りを上げた、あるいは任命された皆さん。こんにちは。 その志、本当に素晴らしいと思います。しかし、その一方で、理想と現実のギャップに打ちのめされ、心が折れそうになってはいません...,2025-07-08
a6d0fe9db6eff2b6ce7373c5a1d07806,Hatena_IT,オフィスで立ったまま寝られる仮眠ボックス、イトーキから販売開始,https://pc.watch.impress.co.jp/docs/news/2029327.html,,,2025-07-08
e9bd58bd57f262e18579db3517673d83,Hatena_IT,マウスもイヤホンも充電が面倒で有線に戻しました→「わかる」「場所が決まってるものは有線で良い」「無線は落として無くすし…」,https://posfie.com/@mumimushunyu/p/HpRTd79,,さてよ@漫画かいてる @sateyo 🔈毎日更新目指してます！ エッセイ漫画🖊創作漫画🖊 本職はWebサイト関連とかプログラマー。 ジャンプルーキー月間ルーキー賞最終候補 【AmazonKindle無料エッセイ漫画▷ amzn.asia/d/9q7L62n】 コルクラボマンガ専科6期 ▷お仕事のご依頼お待ちしております！◁ note.com/sateyo/n/nf76f…,2025-07-08
1e6d3d3ef6cfcbd2aaa6e02f33f495ba,Hatena_IT,パスキーの安全性について - cockscomblog?,https://cockscomb.hatenablog.com/entry/passkey-as-a-multi-factor-cryptographic-authenticator,,パスキーによる認証を開発したとき、パスキーの安全性をどう評価するのが妥当なのか検討していた。もちろんフィッシング耐性が高いというような特性については把握していて、サービス利用者にとって便益の多い認証であることはわかっている。ただそれが、例えばパスワードとTOTPを組み合わせた多要素認証に対して、どち...,2025-07-08
9835f1e7eb32b0ce7be87457ceaed2f8,Hatena_IT,SwitchBot、2980円の防犯ブザー　Apple「探す」対応,https://www.watch.impress.co.jp/docs/news/2029428.html,,,2025-07-08
27cab02040062a6cd2b6157e1554f415,Hatena_IT,職場のプロジェクトに必ず配置しちゃうMakefileの話,https://zenn.dev/loglass/articles/0016-make-makefile,,この記事は毎週必ず記事がでるテックブログ Loglass Tech Blog Sprint の99週目の記事です！ 2年間連続達成まで残り7週となりました！ 始めに ログラスに入社してから時間が経つのも早く、もう3ヵ月経ちました。 そんな私ですが、入社して最初に作成したPRの話をしていきます。 普段からVimやLinuxを使うのが好きではあ...,2025-07-08
