id,source,title,link,published,summary,collected_date
58fdfc860eaa8cf14473441bf840a27d,GCP_Blog,Your AI agents are ready. Is your data?,https://cloud.google.com/blog/topics/ai-infrastructure/state-of-ai-infrastructure-report-and-the-agentic-data-cloud/,"Thu, 23 Jul 2026 16:00:00 +0000",What’s one of the biggest bottlenecks stopping organizations from scaling their AI initiatives? It isn’t the capabilities of today’s models — it’s their access to business context and semantic meaning...,2026-07-24
17b2725d621203295d270f485b9074f9,GCP_Blog,From maintenance to innovation: Checkout's migration to Managed Service for Apache Airflow,https://cloud.google.com/blog/products/data-analytics/how-checkout-com-tallies-data-with-cloud-composer-3/,"Wed, 22 Jul 2026 14:00:00 +0000","Data engineering teams often face a “Day 2” operational reality after building a data platform: the ongoing work of maintaining the orchestrator itself.
For the Data Platform team at Checkout.com, man...",2026-07-24
b7ab6a80c4dfe4a07a76ba9285ca0b46,GCP_Blog,Accelerating the frontiers of scientific discovery: Google’s $40M commitment to the Genesis Mission,https://cloud.google.com/blog/topics/public-sector/accelerating-frontiers-of-scientific-discovery-40-million-dollar-commitment-genesis-mission/,"Wed, 22 Jul 2026 13:30:00 +0000","Scientists today face challenges of extraordinary scale and complexity. From shaping and simulating the intricate dynamics of fusion plasma, to exploring the vast search space of new materials, to mak...",2026-07-24
6ae453deadaea9a151718f57cf032e00,GCP_Blog,Why AI apps fail in production (And how Google solved it),https://cloud.google.com/blog/topics/developers-practitioners/why-ai-apps-fail-in-production/,"Tue, 21 Jul 2026 23:00:00 +0000","We are living in the golden age of the weekend AI side project. Thanks to agentic engineering and LLMs, the time to go from a blank IDE to a functional local application has dropped from quarters to h...",2026-07-24
e3cae7108c049fcb95fe9d546282260b,GCP_Blog,Supercharging pgvector: 4x faster HNSW vector search with AlloyDB,https://cloud.google.com/blog/products/databases/supercharge-pgvector-4x-faster-hnsw-with-alloydb/,"Tue, 21 Jul 2026 16:00:00 +0000","AlloyDB is a fully managed, PostgreSQL-compatible database service built for your most demanding enterprise workloads. It combines the best of open source PostgreSQL with Google’s advanced technology,...",2026-07-24
1e4cfc256d7482bb9f770772987e8167,GCP_Blog,Now in preview: Find and fix software vulnerabilities with CodeMender,https://cloud.google.com/blog/products/identity-security/find-and-fix-software-vulnerabilities-with-codemender/,"Tue, 21 Jul 2026 15:00:00 +0000","As adversarial AI threats accelerate attacks on code, security teams must counter them with machine-speed defenses that can automate code remediation and fight AI with AI.
CodeMender is our managed co...",2026-07-24
f57e9bfdb73e0d41483cf84fa75f2750,GCP_Blog,Generosity Under Conditions: Hardening Google Cloud Access Management,https://cloud.google.com/blog/topics/developers-practitioners/generosity-under-conditions-hardening-google-cloud-access-management/,"Tue, 21 Jul 2026 11:19:00 +0000","In Google Cloud, Identity and Access Management (IAM) helps you maintain access control over your cloud resources and operations. While it includes other features, this is its primary purpose. If you ...",2026-07-24
5029486d479b00e4c771d6ebab88a633,GCP_Blog,Accelerating automotive innovation with C4A-metal and Panasonic Automotive vSkipGen,https://cloud.google.com/blog/topics/partners/panasonic-automotive-vskipgen-runs-on-axion-based-c4a-metal/,"Mon, 20 Jul 2026 16:00:00 +0000","As the automotive landscape accelerates toward software-defined vehicles, Cockpit Domain Controllers (CDCs) are becoming the core of next-generation in-cabin experiences. The ability to rapidly develo...",2026-07-24
3927cb91e479931d9dbc7fa546fe0180,GCP_Blog,"Making highly available, multi-region Cloud Run services just got easier",https://cloud.google.com/blog/products/serverless/cloud-run-multi-region-services-enhanced-for-high-availability/,"Mon, 20 Jul 2026 16:00:00 +0000","Application downtime for mission-critical services can directly impact your reputation and bottom line. To avoid that, you need to be able to deploy regionally resilient workloads that detect and auto...",2026-07-24
702563286090f9727374e057621f7c10,GCP_Blog,13 hands-on demos to build on Gemini Enterprise Agent Platform,https://cloud.google.com/blog/products/ai-machine-learning/13-demos-on-gemini-enterprise-agent-platform/,"Fri, 17 Jul 2026 16:00:00 +0000","Earlier this year, we introduced Gemini Enterprise Agent Platform, where you can build, scale, govern, and optimize agents. Today, we’re sharing 13 demos that walk you through what Agent Platform can ...",2026-07-24
a68d68c59e86b49580a18c6ef43ef04a,GCP_Blog,Level Up Your Column-level Security: Using IAM Data Governance Tags in BigQuery,https://cloud.google.com/blog/products/data-analytics/level-up-your-column-level-security-using-iam-data-governance-tags-in-bigquery/,"Fri, 17 Jul 2026 16:00:00 +0000","Many BigQuery customers rely on policy tags for protecting their sensitive information in BigQuery. Policy tags were the go-to solution for applying column-level access controls, allowing only users w...",2026-07-24
67d084dc299912ad4f308647b7c299ce,GCP_Blog,Guide to AI Tokenomics: Eleven Principles for Token Efficient Software Engineering,https://cloud.google.com/blog/topics/developers-practitioners/guide-to-ai-tokenomics-eleven-principles-for-token-efficient-software-engineering/,"Fri, 17 Jul 2026 09:14:00 +0000","Optimizing token consumption is key to keeping AI coding assistants fast and accurate. You might not be writing every line of code any more, but now you’re responsible for directing those coding assis...",2026-07-24
5340b07e24e832a8bc63706b288d4a8a,GCP_Blog,Google is a Leader and positioned furthest in Vision and highest in Execution in the 2026 Gartner® Magic Quadrant™ for Conversational AI Platforms,https://cloud.google.com/blog/products/ai-machine-learning/google-is-a-leader-in-the-gartner-magic-quadrant-for-conversational-ai/,"Thu, 16 Jul 2026 19:00:00 +0000","For the second consecutive year, Google has been named a Leader in the Gartner® Magic Quadrant™ for Conversational AI Platforms. Google received the furthest and highest in positioning on the ""Vision""...",2026-07-24
ef3d50c572da197797525e91b3982aa1,GCP_Blog,What 10 autonomous film crews taught us about agent teamwork,https://cloud.google.com/blog/topics/developers-practitioners/what-we-learned-about-agent-teamwork/,"Thu, 16 Jul 2026 16:00:00 +0000","Can teams of AI agents collaborate to create a short film?
As part of an internal Google generative media hackathon, we put this question to the test – specifically, to uncover whether AI agents could...",2026-07-24
e9c91be4229b1a766fbdcabfe28b3a22,GCP_Blog,Bridging the gap between SQL and Python with BigQuery and the %%bqsql magic,https://cloud.google.com/blog/products/data-analytics/bridge-sql-and-python-with-bigquery/,"Thu, 16 Jul 2026 16:00:00 +0000","Data scientists and data engineers often find themselves caught between two worlds: SQL and Python. Some find SQL more intuitive, especially when combined with a powerful engine like BigQuery to proce...",2026-07-24
85592860cff8cd1011717b3f90ca9a7b,GCP_Japan,Google が 2026 年 Gartner® Magic Quadrant™ で会話型 AI プラットフォーム部門のリーダーに選出、ビジョンと実行能力が最高評価を獲得,https://cloud.google.com/blog/ja/products/ai-machine-learning/google-is-a-leader-in-the-gartner-magic-quadrant-for-conversational-ai/,"Fri, 24 Jul 2026 02:30:00 +0000","※この投稿は米国時間 2026 年 7 月 17 日に、Google Cloud blog に投稿されたものの抄訳です。
Google は 2 年連続で、Gartner® Magic Quadrant™ の会話型 AI プラットフォーム部門でリーダーに選出されました。Google は、「ビジョンの完全性」と「実行能力」の軸で最高評価を獲得し、4 つのクリティカル ケイパビリティ ユースケースのうち...",2026-07-24
522375331f1d1da646397a2a602a4587,GCP_Japan,IDC: 適切なネットワーキング アプローチがエージェント型 AI の基盤となる理由,https://cloud.google.com/blog/ja/products/networking/idc-on-the-right-networking-approach-for-agentic-ai/,"Fri, 24 Jul 2026 01:00:00 +0000","※この投稿は米国時間 2026 年 7 月 16 日に、Google Cloud blog に投稿されたものの抄訳です。
編集者注: 今回は、IDC の「2026 AI in Networking Special Report Survey」の結果についてお話を伺います。このレポートは、組織におけるエージェント型 AI の台頭を支えるネットワーキング インフラストラクチャに関する企業の懸念事項につ...",2026-07-24
5db9c20737c8997183882b67dd9e78a7,GCP_Japan,C4N の一般提供を開始: クラウドで最高レベルの vCPU あたりのネットワークとブロック ストレージの I/O を x86 ワークロードで実現,https://cloud.google.com/blog/ja/products/compute/c4n-network-and-storage-optimized-vms/,"Fri, 24 Jul 2026 00:00:00 +0000","※この投稿は米国時間 2026 年 7 月 9 日に、Google Cloud blog に投稿されたものの抄訳です。
組織が、高スループットのデータベースやネットワーク / セキュリティ アプライアンスから、リアルタイム分析や AI / ML 推論に至るまで、最新のワークロードをスケールすると、ネットワークとブロック ストレージのパフォーマンスがすぐにボトルネックになる可能性があります。標準の仮...",2026-07-24
f813a86f398962281612f2c977b88611,GCP_Japan,Google Cloud で Claude を大規模に展開: エンタープライズ本番環境向けに構築された最先端の AI,https://cloud.google.com/blog/ja/products/ai-machine-learning/claude-at-scale-on-google-cloud-frontier-ai-built-for-enterprise-production/,"Thu, 23 Jul 2026 03:00:00 +0000","※この投稿は米国時間 2026 年 7 月 15 日に、Google Cloud blog に投稿されたものの抄訳です。
最先端の AI を本番環境で運用するには、アクセラレータの管理、大陸間のレイテンシの安定化、規制対象データの地域内保持、長いコンテキストを扱うリクエストの確実な処理など、多くの課題があります。Google Cloud 上の Claude は、まさにこうした課題を解決するために構...",2026-07-24
70fda3ac21a879a03004aff22f23b488,GCP_Japan,BGP ルートポリシー: お客様の需要に基づく上位 3 つのユースケース,https://cloud.google.com/blog/ja/products/networking/bgp-route-policies-top-3-use-cases-by-customer-demand/,"Wed, 22 Jul 2026 01:30:00 +0000","※この投稿は米国時間 2026 年 7 月 8 日に、Google Cloud blog に投稿されたものの抄訳です。
1 年以上前に Cloud Router の BGP ルートポリシーの一般提供を開始した際、Google が目指したのは、ネットワーク管理者がネットワーク パスの評価と伝播の方法を詳細にプログラムで制御できるようにすることでした。それ以来、Google はお客様がこの機能をどのよ...",2026-07-24
8108d33e45579770ea21b19109c512ce,GCP_Japan,CodeMender プレビュー版の提供開始：ソフトウェアの脆弱性を検出および修正,https://cloud.google.com/blog/ja/products/identity-security/find-and-fix-software-vulnerabilities-with-codemender/,"Wed, 22 Jul 2026 01:00:00 +0000","敵対的な AI 活用による脅威がコードへの攻撃を加速させるなか、セキュリティ チームには、コードの修復を自動化し、 AI に対して AI で対抗するマシンスピードの防御策でこれらに立ち向かう必要があります。 
CodeMender は、Google のマネージド コード セキュリティ エージェントです。本日より、コード スキャンおよび修復機能をプレビュー版としてお客様に直接提供を開始します。 
C...",2026-07-24
56e80c31cef0fa90002177aae9376bbf,GCP_Japan,Gemini Enterprise Agent Platform のフルマネージド リモート MCP サーバーでエージェントをさらに迅速に構築,https://cloud.google.com/blog/ja/products/ai-machine-learning/gemini-enterprise-agent-platform-remote-mcp-server/,"Wed, 22 Jul 2026 00:10:00 +0000","※この投稿は米国時間 2026 年 7 月 1 日に、Google Cloud blog に投稿されたものの抄訳です。
数か月前に、50 を超える Google マネージド MCP サーバーが利用可能になったことをお知らせしました。
今回は、Gemini Enterprise Agent Platform のリモート MCP サーバーを使用して、外部の AI エージェントを Google Clou...",2026-07-24
25f4b535971a57139760c2eaabfd0b5a,GCP_Japan,Spanner のマルチモデル アーキテクチャでエージェントの時代を加速,https://cloud.google.com/blog/ja/products/databases/the-power-of-multi-model-spanner-for-the-agentic-era/,"Wed, 22 Jul 2026 00:00:00 +0000","※この投稿は米国時間 2026 年 6 月 30 日に、Google Cloud blog に投稿されたものの抄訳です。
エージェントの時代において、データベースの役割は根本的に変化しました。もはや単なる受け身のデータ保管場所ではありません。生成 AI アプリやモデルを支え、自律型ワークフローを強化する重要なコンテキスト エンジンへと進化しています。これを効果的に行うには、データベースは断片化され...",2026-07-24
8ecae29c09d0a3abd2db53b86043de34,GCP_Japan,BigQuery Graph を使用して不正防止のためにネットワーク分析をスケーリング,https://cloud.google.com/blog/ja/products/data-analytics/fraud-prevention-with-bigquery-graph/,"Wed, 22 Jul 2026 00:00:00 +0000","※この投稿は米国時間 2026 年 6 月 30 日に、Google Cloud blog に投稿されたものの抄訳です。
英国に拠点を置く Curve は、財務スーパーアプリを構築しています。これは、すべてのデビットカードとクレジット カードを 1 つのアプリとカードに統合するスマート ウォレットで、数百万人のユーザーの支出、送金、貯蓄の方法を簡素化します。
しかし、この規模で事業を行うということ...",2026-07-24
5418ae4b3535ea091fdf2e75fa247b21,GCP_Japan,Google Cloud で誰でも利用できるようになった AlphaEvolve で、より困難な課題も解決,https://cloud.google.com/blog/ja/products/ai-machine-learning/alphaevolve-is-available-for-everyone/,"Tue, 21 Jul 2026 02:10:00 +0000","※この投稿は米国時間 2026 年 7 月 10 日に、Google Cloud blog に投稿されたものの抄訳です。
世界には、極めて困難かつ価値の高い課題が数多く存在しますが、その多くは最適化に関連しています。今、AI の活用によって、こうした課題の解決が可能になりつつあります。マイクロチップの設計、配送ネットワークの計画、大規模 AI モデルのトレーニング アーキテクチャの最適化などに取り...",2026-07-24
d87fdc744861dac97df707d77c0a3a5f,GCP_Japan,最新 AI エージェント事例を厳選！ Gemini Enterprise で企業の業務を変える,https://cloud.google.com/blog/ja/products/ai-machine-learning/latest-ai-agent-case-studies/,"Tue, 21 Jul 2026 02:00:00 +0000",2026 年に入り、AI エージェントの開発環境が大きく変わりました。最新モデル Gemini 3.5 Flash が登場し、Google Antigravity をはじめ、エージェント開発の環境も充実してきました。AI によるコーディングは身近になり、業務で AI エージェントを開発・活用する企業が急増しています。作る手段が広がるほど、課題は全社で安全に使い、運用する段階へと移ります。それを支え...,2026-07-24
046d0b48aefac78a413390afa4a8d054,GCP_Japan,Google が「2026 IDC MarketScape for Worldwide Foundation Model Software」でリーダーに選出,https://cloud.google.com/blog/ja/products/ai-machine-learning/google-named-a-leader-in-idc-marketscape/,"Tue, 21 Jul 2026 02:00:00 +0000","※この投稿は米国時間 2026 年 7 月 15 日に、Google Cloud blog に投稿されたものの抄訳です。
Google は長年にわたり、企業の実用的なニーズを最優先するという明確な方針のもとで開発を続けており、生成 AI がニュースの見出しを飾るずっと前から、世界最大規模の組織を支えるグローバル インフラストラクチャ、セキュリティ フレームワーク、データ プラットフォームの構築に注...",2026-07-24
1a3867edae50802ee210744ad8e36863,GCP_Japan,Cloud Run サンドボックスで AI 生成コードを安全に実行,https://cloud.google.com/blog/ja/topics/developers-practitioners/google-cloud-run-sandboxes-are-in-public-preview/,"Tue, 21 Jul 2026 01:00:00 +0000","※この投稿は米国時間 2026 年 7 月 10 日に、Google Cloud blog に投稿されたものの抄訳です。
Google Cloud では、「ホスト アプリケーション、データ、クラウド認証情報を危険にさらすことなく、AI 生成コードや信頼できないバイナリを安全に実行するにはどうすればよいか？」という質問をよく受けます。これは言い換えると、「AI が作成したプログラムを実行するための安...",2026-07-24
3bc4a8f21afb55ec29497909caa0a5f8,GCP_Japan,Turner Industries の安全なクラウド ファースト インフラストラクチャのブループリント,https://cloud.google.com/blog/ja/products/chrome-enterprise/turner-industries-blueprint-for-a-secure-cloud-first-infrastructure/,"Tue, 21 Jul 2026 00:00:00 +0000",※この投稿は米国時間 2026 年 6 月 30 日に、Google Cloud blog に投稿されたものの抄訳です。編集者注: 本日の投稿は、建設、メンテナンス、製造サービスを提供する民間の産業請負業者である Turner Industries の情報セキュリティ担当ディレクター、Scott Gatreau 氏によるものです。Tuner Industries は、ワンストップ ショップのサービ...,2026-07-24
11155c885a405a0b716fb99c4556f95e,GCP_Japan,セガサミーホールディングス: Google Security Operations と Google Threat Intelligence を導入し、セキュリティ対策をグローバルで標準化へ,https://cloud.google.com/blog/ja/topics/customers/segasammy-implements-google-security-operations-and-google-threat-intelligence/,"Fri, 17 Jul 2026 02:00:00 +0000",セガサミーグループはグローバルにビジネスを展開する総合エンタテインメント企業です。そのコーポレート IT を担うセガサミーホールディングス株式会社（以下、セガサミー HD）IT ソリューション本部は、SIEM（Security Information and Event Management）の刷新を機に Google Cloud Security の利用検討を開始し、導入を決定。個別最適で積み上...,2026-07-24
22829dc5618fa2e72f0c374bb12f5e77,GCP_Japan,エージェンティック エンタープライズに関する 20 の質問（Agent Platform がどのように役立つか）,https://cloud.google.com/blog/ja/products/ai-machine-learning/20-questions-for-the-agentic-enterprise/,"Fri, 17 Jul 2026 02:00:00 +0000","※この投稿は米国時間 2026 年 7 月 8 日に、Google Cloud blog に投稿されたものの抄訳です。
IT リーダーであれば、エージェントの構築とデプロイの方法について多くの質問を受けているかもしれません。
迅速な対応を求めるプレッシャーは強いものですが、エンジニアリングの現実は極めて複雑です。チームはどこから着手すればよいのでしょうか。断片化し、バラバラに乱立するツール群を、ど...",2026-07-24
aedbd68c6f683397e7641046dfa99962,GCP_Japan,Gemini Enterprise と Google Cloud Marketplace でエージェントを公開するためのデベロッパー ガイド,https://cloud.google.com/blog/ja/topics/developers-practitioners/publish-agents-in-gemini-enterprise-and-google-cloud-marketplace/,"Fri, 17 Jul 2026 01:00:00 +0000","※この投稿は米国時間 2026 年 7 月 8 日に、Google Cloud blog に投稿されたものの抄訳です。
Software-as-a-Service（SaaS）は Agents-as-a-Service（AaaS）へと進化しています。
開発者は、複数の分離したアプリケーションではなく、相互運用する AI エージェントを作成するようになってきています。相互運用のためには、Agent2A...",2026-07-24
b3d88ad444894442ba6f8be0114f5ae1,GCP_Japan,Google Cloud 認定資格を最新の状態に保ち、キャリアアップを図る新しい方法,https://cloud.google.com/blog/ja/topics/training-certifications/new-ways-keep-google-cloud-certifications-current/,"Wed, 15 Jul 2026 02:00:00 +0000","※この投稿は米国時間 2026 年 7 月 9 日に、Google Cloud blog に投稿されたものの抄訳です。
これをお読みになっている方は、Google Cloud 認定資格を取得して、ご自身の能力を証明する努力をすでにされていることでしょう。調査によると、これが成功への近道です。認定資格を取得した方々からは、採用担当者からの連絡が増え、昇進が早まり、給与が上がったとの報告を受けています...",2026-07-24
25bc5cf8a72a36b230ee46f63c7b09c4,GCP_Japan,レポート: 83%の組織がエージェント型 AI に対応するためにインフラストラクチャのアップグレードを必要としている,https://cloud.google.com/blog/ja/products/compute/state-of-ai-infrastructure-report-overview/,"Wed, 15 Jul 2026 02:00:00 +0000","※この投稿は米国時間 2026 年 7 月 8 日に、Google Cloud blog に投稿されたものの抄訳です。
長年にわたり、企業向け AI といえば、日常的に利用するカスタマー サービス bot やデジタル アシスタントなどの会話型 AI を指していました。しかし今、市場は大きく変化しています。私たちは、簡単なチャットに回答する AI から、自ら行動し、ワークフローを自動化し、複雑なタス...",2026-07-24
c045e5584856ef8f260c2347174bcf05,GCP_Japan,Google Cloud 向け Claude アプリ ゲートウェイを使ってみる,https://cloud.google.com/blog/ja/topics/developers-practitioners/announcing-claude-apps-gateway-for-google-cloud/,"Wed, 15 Jul 2026 01:00:00 +0000","※この投稿は米国時間 2026 年 7 月 2 日に、Google Cloud blog に投稿されたものの抄訳です。
Anthropic のエージェント コーディング ツールである Claude Code が Google Cloud と連携するようになってから、しばらく経ちます。個々の開発者は簡単に、Google Cloud（GCP）プロジェクトを指すように CLAUDE_CODE_USE_V...",2026-07-24
03f429589c044ca927743f5e6b7d6eba,Ggen_Blog,StitchとAntigravity2.0でAI駆動開発をしてみた,https://blog.g-gen.co.jp/entry/ai-driven-development-with-stitch-and-antigravity,2026-07-23T09:00:00+09:00,G-gen の高宮です。当記事では、AI 駆動フロントエンドデザインツール Stitch と、AI 駆動統合開発環境 Google Antigravity 2.0 を組み合わせた、AI 駆動開発について紹介します。 はじめに AI 駆動開発（AI-Driven Development）とは Stitch とは Google Antigravity とは 環境準備 Stitch でのフロントエンドデ...,2026-07-24
1f77d157f58967a4940e7b556da5db16,Ggen_Blog,Sensitive Data Protectionの匿名化（de-identification）を解説,https://blog.g-gen.co.jp/entry/sensitive-data-protection-deidentification-explained,2026-07-22T09:00:00+09:00,G-gen の佐々木です。当記事では、Google Cloud の Sensitive Data Protection（旧称 Cloud Data Loss Prevention）による機密データの匿名化（de-identification）について解説します。 概要 Sensitive Data Protection とは 匿名化（de-identification）とは 匿名化と個人情報保護法...,2026-07-24
a53fd8ec971abd23759183067d64866b,Ggen_Blog,Gemini Enterprise Agent PlatformでAPIキーの取得が失敗する原因と対処法,https://blog.g-gen.co.jp/entry/troubleshoot-api-key-issuance-on-agent-platform,2026-07-21T09:00:00+09:00,G-gen の菊池です。Gemini Enterprise Agent Platform（旧称 Vertex AI）の画面で「API キーの取得」を行う際に発生するエラーの原因と、その推奨される対処法について解説します。 事象 原因 原因となる組織ポリシー サービスアカウントにバインドされた API キーとは API キーは何のために必要なのか デフォルトで作成が制限されている理由 対処の手法 2...,2026-07-24
4958ab49e89e149a038931504267de53,Ggen_Blog,Agent Registryを徹底解説！,https://blog.g-gen.co.jp/entry/agent-registry-explained,2026-07-17T09:00:00+09:00,G-gen の杉村です。当記事では、Google Cloud の Agent Registry について徹底解説します。AI エージェントや MCP サーバーの統合管理・ディスカバリを担う当サービスの機能やアーキテクチャを解説します。 概要 Agent Registry とは メリット 構成イメージ データモデル 概要 エージェント MCP サーバー エンドポイント コンポーネントの登録 概要 自...,2026-07-24
