id,source,title,link,published,summary,collected_date
b54625291c5f17b7f6e2b3020071c3df,Business_Insider,関税の混乱の中、KPMGら会計コンサルはAIを積極活用して「企業の時間とコスト」を節約している,https://www.businessinsider.jp/article/2604-ai-helps-us-businesses-manage-supreme-court-tariff-impacts/,"Sun, 19 Apr 2026 22:45:00 GMT",生成AIは、輸入業者の関税還付やシナリオプランニングを支援します。会計・コンサル「ビッグ4」の1つKPMGとEQIは、AIツールを活用して貿易コンプライアンスを円滑に進め、コストを最適化しています。,2026-04-19
c303ce2fd7dff4437f3e39e818b42029,Business_Insider,ネットフリックス株、弱い業績見通しと共同創業者リード・ヘイスティングス氏の取締役退任で時間外に急落,https://www.businessinsider.jp/article/2604netflix-first-quarter-earnings-advertising-price-increases-warner-bros-bid/,"Sun, 19 Apr 2026 22:45:00 GMT",ネットフリックスの株価は、第1四半期の決算発表後に下落した。同社の株価は、ワーナー・ブラザース買収計画を撤回した後、急騰していた。,2026-04-19
5442824d74a9e6dd48abba6cf14359ed,Business_Insider,「イーロンを“買い”、ジェンスンは“売り”」調査会社によると、個人投資家はテスラに戻り、エヌビディアから転換している,https://www.businessinsider.jp/article/2604-tesla-stock-nvidia-elon-musk-tsla-nvda-retail-traders/,"Sun, 19 Apr 2026 22:00:00 GMT",バンダ・リサーチのデータによると、個人投資家は年初来のテスラ株の下落局面で買いを入れている一方、Nvidia株を支持する動きは鈍化しています。,2026-04-19
68142f4fec1a4fd42b94af5bc7073c70,Business_Insider,TikTokの元北米広告責任者がグーグルに移籍します。社内向けメモの全文はこちらです,https://www.businessinsider.jp/article/2604-tiktok-former-america-ads-lead-joining-google/,"Sun, 19 Apr 2026 21:55:00 GMT",TikTokの広告部門元幹部だったカルトゥーン・ワイス氏が、グーグルに移籍。米国中堅企業向け販売・コマース担当副社長に就任した。同領域は、Web広告の巨人グーグルにとって、大きな成長分野だ。,2026-04-19
fccf08202e22916988e56f9db00dd9a5,Business_Insider,リード・ヘイスティングス氏、ネットフリックス取締役会を退任する,https://www.businessinsider.jp/article/2604netflix-cofounder-reed-hastings-is-leaving-the-company-sarandos-peters/,"Sun, 19 Apr 2026 21:45:00 GMT",1990年代後半にネットフリックスの創業に携わったリード・ヘイスティングス氏は、慈善活動やその他の活動に専念するため、同社の取締役を退任します。,2026-04-19
0938c191bbd19a383350e6c3ed6f230a,Business_Insider,Anthropicの新AI「Mythos」の脅威を、全米証券業協会が名指しで警告。大規模不正アクセスなど「金融システム全体を混乱させる恐れ」,https://www.businessinsider.jp/article/2604-anthropic-mythos-ai-cybersecurity-financial-system-risks-retail-investor-data/,"Sun, 19 Apr 2026 21:15:00 GMT",全米証券業協会は米財務長官宛ての公開書簡で、アンソロピックの新AIツール「Mythos」が、金融システム全体に極めて深刻な影響を及ぼす恐れがあると警告しました。,2026-04-19
efd9d81f1304eb86eb8a50085bcac8cd,Business_Insider,株主宛書簡から読み取る、アマゾンのジャシーCEOが従業員に求めるもの,https://www.businessinsider.jp/article/2604-andy-jassy-shareholder-letter-amazon-workforce-tiny-teams-flat-structure/,"Sun, 19 Apr 2026 21:00:00 GMT",アマゾンのアンディ・ジャシーCEOは、少人数のチームを推進し、フラットな組織構造を強調するとともに、従業員が不確実な状況に対処できる能力を持つことの重要性を訴えた。,2026-04-19
9384d0c6b8c2a5abf68e3c2d9ba24eac,Business_Insider,習近平が「中東ショック」に危機感を募らせている理由…統計が語る、原油・ガス輸入“急減”の実態,https://www.businessinsider.jp/article/2604-middle-east-shock-impact-on-china-energy/,"Sun, 19 Apr 2026 20:50:00 GMT",米イランの交渉決裂を受けた米軍の強硬策は、イラン産原油だけでなく、中国のエネルギー供給網にも無視できないダメージを与えつつあります。中国の統計データから、大国の思惑が交錯する中東情勢の今に迫ります。,2026-04-19
781f861ab7ac745e055b75349904d299,Business_Insider,Snapは「AIの急速な進歩」を理由に1000人をレイオフ、5億ドルのコスト削減効果を得る。【社長名の社内メッセージを入手】,https://www.businessinsider.jp/article/2604-snap-layoffs-ai-read-memo-snapchat/,"Sun, 19 Apr 2026 20:40:00 GMT",SnapのCEOであるエヴァン・シュピーゲル氏は、全世界の従業員の約16％にあたる1000人を削減すると述べ、AIを「スピードアップ」のためのツールとして挙げた。,2026-04-19
23bf7b472317f1650ed61a0fc5a15240,Business_Insider,【TSMC決算】中東影響にも言及、エージェンティックAIが半導体需要を押し上げ…通期売上高は30％増の見通し,https://www.businessinsider.jp/article/2604-tsmcs-result-26q1/,"Sun, 19 Apr 2026 20:25:00 GMT",TSMCが4月16日に公表した2026年第1四半期決算説明会は、同社の好調な業績を示す場になりました。ホルムズ海峡の閉鎖でエネルギーや素材確保の懸念があるなかで、中東情勢の影響についても幹部は言及しています。,2026-04-19
e9bcd675873f1b331046f3b7c21c903a,Business_Insider,カナダの30代夫婦は、たった数年でFIREを達成した。大好きな旅行を我慢せず、収入の70%を貯蓄した方法とは？,https://www.businessinsider.jp/article/2604-how-one-couple-retired-early-financial-independence-savings-investing-strategies/,"Sun, 19 Apr 2026 08:30:00 GMT",ある夫婦は、2015年にFIRE目標額を達成した後、仕事を辞めて世界中を旅する生活を始めました。それ以来、彼らは資産運用による収入で生活しています。,2026-04-19
bb2e497f845226d13d08543e1e874017,Business_Insider,栄養士が教える、多忙であっても1日に必要なタンパク質を摂取する秘訣,https://www.businessinsider.jp/article/2604-busy-dietitian-mom-eating-enough-protein-in-a-day/,"Sun, 19 Apr 2026 06:00:00 GMT",仕事、運動、子育てを両立させる栄養士が、細かな計算をすることなく、十分なタンパク質を摂取している方法を紹介します。,2026-04-19
c7cc512156364e4960419254f084c750,Business_Insider,「PCを起動するたびにパスワード入力」の手間から開放してくれたのは、極小サイズのコレだった,https://www.businessinsider.jp/article/286557-epl/,"Sun, 19 Apr 2026 03:00:00 GMT",意外と多いPCのパスワード入力にまつわるストレス。立ち上げるたびにパスワードやPINを打ち込んだり、カフェなどで私用のPCを開くときに、キーボードでパスワードを打ち込むのが周りから見えてしまうのも気がかりでした。,2026-04-19
77b2f6f28e3d2ef250c2edd26b25e458,Business_Insider,AIの影響で失職した労働者は、賃金が何年も低下したままになる…ゴールドマン・サックスの調査分析で,https://www.businessinsider.jp/article/2604-ai-job-cuts-layoffs-finding-new-job-pay-cut-goldman/,"Sat, 18 Apr 2026 23:30:00 GMT",ゴールドマン・サックスによると、歴史的に見て、新技術によって職を失った労働者は、その後数年にわたり収入が減少し、失業のリスクが高まる傾向にあるそうです。,2026-04-19
3cf426ec619905f911bfab5a0e335b12,Business_Insider,メタの新しいAI「Muse Spark」に私のランチを評価してもらった,https://www.businessinsider.jp/article/2604-used-meta-muse-spark-ai-rate-lunch-suggest-dinner/,"Sat, 18 Apr 2026 23:00:00 GMT",Muse Sparksは私の昼食を10点満点中7.5点と評価し、塩分の摂取量に気をつけるようアドバイスしてくれ、ほかにも残り物を活用できる夕食のレシピも教えてくれました。,2026-04-19
04d9a086b4b9a4ca7fbe55f3892043b5,Business_Insider,令和ロマン・松井ケムリ「吉本に入ったこと」が最大の転機だった。“指示待ち人間”こそ環境選びが大事,https://www.businessinsider.jp/article/2604-reiwa-roman-matsui-kemuri-on-a-turning-point-in-his-career/,"Sat, 18 Apr 2026 20:00:00 GMT",M-1王者・令和ロマンの松井ケムリさんは、自らを「指示待ち人間」と語ります。やりたいことがない、頑張れない。そんな弱さを自覚する彼が、吉本という環境を使い倒して結果を出した独自の生存戦略とは。,2026-04-19
086c8b81aa9a5e1498914563680d8a30,Business_Insider,タイニーハウスで育児をして、私たち夫婦は週に3日だけ働く。それで収入の半分を貯蓄している,https://www.businessinsider.jp/article/2604-family-toddlers-tiny-home-3-day-week-saves-income/,"Sat, 18 Apr 2026 08:30:00 GMT",小さな故郷の村で幼い子供を育てている夫婦にとって、物事は窮屈になることがあります。彼らは、住宅ローンなしで生活し、仕事を減らすことは価値があると言っています。,2026-04-19
a34c347b5b02903e0a878bf5cee7104e,Business_Insider,副業として&quot;キャンピングカー改装&quot;をはじめた夫婦、それが本業になる。約5年で17台を手掛け、最高額は約900万円,https://www.businessinsider.jp/article/2604-renovating-rvs-side-hustle-start-business-motorhome-remodeling-ideas/,"Sat, 18 Apr 2026 08:15:00 GMT",,2026-04-19
7de69237ca5dc27609bb013274630de0,Business_Insider,Google ChromeのAI機能「Skills」を使ってみたい,https://www.businessinsider.jp/article/2604-google-chrome-ai-skills/,"Sat, 18 Apr 2026 08:00:00 GMT",Google ChromeのAI機能「Skills」は、Geminiへの指示を保存して呼び出せる機能です。複数タブをまたぐ比較作業との相性が良さそうで、日本での展開が待ち遠しい内容だと感じました。,2026-04-19
1632a761f9fde5a701ae141cfa7a7418,Business_Insider,デルタ航空、エアバスのワイドボディ機に新しいビジネスクラススイートを導入,https://www.businessinsider.jp/article/7278fcdc-a72c-4275-8533-0dd81ea27d65/,"Sat, 18 Apr 2026 06:00:00 GMT",デルタ航空は、これまでの赤・白・青を基調としたビジネスクラスを、新しいデザインに刷新しました。,2026-04-19
f1913031db5526ecada37be3b7669539,ITmedia_AI_Plus,1300ページを読んでExcelに整理――地道な開示作業、AIで工数93％削減　NEC流の業務改革方法とは,https://www.itmedia.co.jp/business/articles/2604/20/news021.html,"Mon, 20 Apr 2026 07:00:00 +0900",有価証券報告書における「サステナビリティー情報」の開示業務が義務化されるのを前に、NECはAI活用によって開示業務の工数を93％削減したと発表した。その仕組みとは。,2026-04-19
be39314bbc7279fcf5b579d0da7b0781,ITmedia_AI_Plus,岸田元首相、公式YouTubeで自身のディープフェイク映像をセルフパロディー　「この画像は公式です」,https://www.itmedia.co.jp/news/articles/2604/17/news137.html,"Sat, 18 Apr 2026 08:00:00 +0900",岸田文雄元首相の公式YouTubeチャンネルが4月17日に公開した動画が話題だ。フェイク動画やSNS工作に関する内容だが、そのサムネイルは2023年に話題になった、岸田元首相のディープフェイク動画を模したもの。Xでは岸田元首相に対し「鋼の心過ぎる」と注目を浴びている。,2026-04-19
31827264add75097cc909223d52c9323,ITmedia_AI_Plus,Anthropic、AIデザインツール「Claude Design」プレビュー公開──「Opus 4.7」搭載でコーディングツールとの連携も,https://www.itmedia.co.jp/aiplus/articles/2604/18/news022.html,"Sat, 18 Apr 2026 07:13:00 +0900",Anthropicは、AIデザインツール「Claude Designer」を発表した。最新モデル「Claude Opus 4.7」をベースに、テキストや既存コードからプロトタイプを生成できる。デザインシステムとの一貫性保持や共同編集、直感的な微調整機能を備え、コーディングツール「Claude Code」との連携により実装までをシームレスに完結させる。,2026-04-19
245324260134cb2e319c72157f3aafa4,ITmedia_AI_Plus,21％がAIを仕事で「毎日利用」　ナレッジワーカー対象、Notion調査,https://www.itmedia.co.jp/aiplus/articles/2604/17/news130.html,"Fri, 17 Apr 2026 19:13:00 +0900",Notionがナレッジワーカーを対象に実施した調査によると、21％が業務でAIを「ほぼ毎日」使うと回答した。一方、「出力が独自性に欠ける」などの課題も見えてきた。,2026-04-19
b334a7d8878a4453a40a20b01d903dbb,ITmedia_AI_Plus,「なぜSalesforceにログインする必要があるのか」　“エージェント向けSalesforce”「Headless 360」発表,https://www.itmedia.co.jp/aiplus/articles/2604/17/news118.html,"Fri, 17 Apr 2026 16:00:00 +0900",Salesforceは同社サービスをAIエージェントを介して操作できるようにした「Salesforce Headless 360」を発表した。発表同日から複数機能を利用できる。,2026-04-19
2333d58d8b65199621d053880fd6fd6f,ITmedia_AI_Plus,ソフトバンク、米新興のAIスマホを1年間の国内独占販売　“ユーザーの行動先読み”うたう「Natural AI Phone」,https://www.itmedia.co.jp/news/articles/2604/17/news109.html,"Fri, 17 Apr 2026 14:20:00 +0900",ソフトバンクは4月17日、AI機能搭載スマートフォン「Natural AI Phone」を国内で販売すると発表した。同日に予約受付を始め、24日から国内で1年間独占販売する。,2026-04-19
ba78cd77baee129ab4e1c7eea30f640b,ITmedia_AI_Plus,「Claude Opus 4.7」レート制限リセット　長文リクエスト時のバグ修正,https://www.itmedia.co.jp/aiplus/articles/2604/17/news108.html,"Fri, 17 Apr 2026 14:01:00 +0900",有料ユーザー向けレート制限の調整機能にバグ。5時間／週間の使用制限をリセットした。,2026-04-19
e266e7d4165316319b50734d1fe5ef95,ITmedia_AI_Plus,Cloudflare、全サービスに対応するCLI開発へ　AIエージェントへの最適化目指す,https://www.itmedia.co.jp/news/articles/2604/17/news105.html,"Fri, 17 Apr 2026 13:50:00 +0900",米Cloudflareは、AIエージェントによる利用を最適化するため、同社が提供するすべてのサービスに対応したコマンドラインインターフェイス（CLI）を開発することを明らかにしました。,2026-04-19
a7d2bce1c503634c9c380bb2274ed169,ITmedia_AI_Plus,「その言葉、カスハラかも？」をAIで検知　会話のテキスト化で証跡を残す,https://atmarkit.itmedia.co.jp/ait/articles/2604/17/news045.html,"Fri, 17 Apr 2026 13:00:00 +0900",プラスアルファ・コンサルティングは、対面接客におけるカスハラをAIで検知する「AIカスハラガード」の提供を開始した。会話を音声認識でテキスト化し、接客状況の可視化と証跡の確保を支援する。,2026-04-19
9d582ad3fbf061745d0b56ce3876add2,ITmedia_AI_Plus,スマホOS事業者の他社AI排除を警戒　公取委が実態調査報告書　米大手に懸念表明,https://www.itmedia.co.jp/news/articles/2604/17/news100.html,"Fri, 17 Apr 2026 12:53:00 +0900",公正取引委員会は4月16日、生成AI市場の実態調査に関する報告書を公表した。スマートフォン端末の生成AIを使うアプリを開発しようとする企業に対し、基本ソフト（OS）を提供する企業がソフトウェアへのアクセスを制限すれば独禁法に抵触しかねないと示した。生成AIを利用した自動運転を巡っては、米中の大手企業などが国内企業との公正競争を阻害する懸念があると指摘した。,2026-04-19
69b502da4caa4c126b1436ae8755e8c6,ITmedia_AI_Plus,ChatGPTに「私に似たキャラ教えて」聞く遊び流行　ブラジル発、X翻訳で世界に拡散,https://www.itmedia.co.jp/aiplus/articles/2604/17/news099.html,"Fri, 17 Apr 2026 12:36:00 +0900",「私に似たキャラクターを1人教えてください。名前だけ」とAIに聞く、ブラジル発の遊びが流行中。,2026-04-19
6ae305109bf8215cadc00f8e534fd659,ITmedia_AI_Plus,生成AIの動画・音声　深刻化する無断利用の権利侵害を整理　法務省が検討会設置,https://www.itmedia.co.jp/news/articles/2604/17/news096.html,"Fri, 17 Apr 2026 12:33:00 +0900",有名人の顔や声に酷似する音声や動画が生成A）で無断作成される問題が深刻化していることを受け、法務省は4月17日、肖像や声などの利用を巡る民事責任を整理する検討会を設置することを明らかにした。現行法と判例を踏まえて具体例を検討し、権利侵害の有無や損害賠償請求の範囲などをガイドラインとして示す。,2026-04-19
dd3ad2163e0c5b483dce8aadc20a7abd,ITmedia_AI_Plus,ソフトバンク、国産LLM「Sarashina」の業務支援サービスを6月開始　Oracleサービス使い自社DCで構築、“ソブリン性確保”うたう,https://www.itmedia.co.jp/aiplus/articles/2604/17/news093.html,"Fri, 17 Apr 2026 12:20:00 +0900",ソフトバンクはLLM「Sarashina」を活用した企業向けサービスを6月に提供開始する。国内データセンターで運用することで、データ主権を確保した環境でAIを機密情報と連携させられるという。,2026-04-19
2b3474f6fdac9eec8e01032ab17532f5,ITmedia_AI_Plus,Claude Opus最新版「4.7」公開　「難しいコーディングも任せられる」「指示を無視せずちゃんと守る」　プロンプト再調整推奨,https://www.itmedia.co.jp/news/articles/2604/17/news072.html,"Fri, 17 Apr 2026 10:23:00 +0900",「ユーザーからは、これまで綿密な監視が必要だった最も困難なコーディング作業を安心して任せられるとの声が寄せられている」「指示の順守能力が大幅に向上している」,2026-04-19
24e4824fa77d715b597c26b619d9d370,ITmedia_AI_Plus,OpenAI、「Codex」刷新　PCの直接操作に対応し汎用作業エージェントへ,https://www.itmedia.co.jp/aiplus/articles/2604/17/news071.html,"Fri, 17 Apr 2026 09:38:00 +0900",OpenAIは、コーディングエージェント「Codex」の大幅アップデートを発表した。画面認識によるPCの直接操作や、90以上の外部ツール連携に対応し、「汎用作業エージェント」へと進化。画像生成モデルとの統合やメモリ機能も追加され、UI設計から開発ワークフローの自動化まで、広範なタスク実行を支援する。,2026-04-19
0abee29e50f13c8d80a38fcc11fdb1da,ITmedia_AI_Plus,AI見積もりシステムの類似図面検索機能が3D CAD図面に対応,https://monoist.itmedia.co.jp/mn/articles/2604/17/news017.html,"Fri, 17 Apr 2026 09:00:00 +0900",匠技研工業が提供するAI見積もりシステム「匠フォース」の類似図面検索機能が、3D CAD図面への対応を開始した。2Dと3D図面の混在環境で、閲覧から検索まで一元サポートできる。,2026-04-19
1d3459d0b1b726a889eb3f6acd93d673,ITmedia_AI_Plus,AIとデータを企業の壁越えて共有する「AIスペース」構想　実現に向けてソフトバンク、富士通など団体設立,https://www.itmedia.co.jp/aiplus/articles/2604/17/news060.html,"Fri, 17 Apr 2026 08:30:00 +0900",ソフトバンクなど産学8団体は、分散したAIとデータを安全に連携させる社会基盤「AIスペース」の実現を目指す「xIPFコンソーシアム」を設立した。AIとデータを社会で広く活用する基盤の整備を図る。,2026-04-19
81ac08d116a4e153e1ab473e33e895cd,ITmedia_AI_Plus,「190万行の表計算ファイル」と格闘していたカインズ、AI搭載のデータ基盤で発注・在庫管理を自動化,https://www.itmedia.co.jp/aiplus/articles/2604/17/news059.html,"Fri, 17 Apr 2026 08:00:00 +0900",カインズはGoogle CloudのAIエージェントを活用したデータ基盤を導入した。需要予測データの処理を効率化し、自然言語による分析や在庫管理の最適化を内製化。現場のニーズに即した迅速な運用を可能にしたという。,2026-04-19
ca873f2693dd5371448bd09189795129,ITmedia_AI_Plus,アサヒ・アスクルを襲った「PC1台の死角」　日本HPが説くセキュリティ投資の真意,https://www.itmedia.co.jp/business/articles/2604/17/news030.html,"Fri, 17 Apr 2026 07:00:00 +0900",2025年後半、ランサムウエアによるサイバー攻撃が、アサヒグループホールディングスやアスクルを襲った。システム障害と業務停止は、PC1台のハッキングが企業の命運を揺るがす事実を、日本中に突きつけた。「エンドポイント」を、いかに死守すべきか。日本HPの岡戸伸樹社長は「セキュリティは経費ではなく投資だ」と断言する。,2026-04-19
fdc62b5c2e9f644145a91e1acabea658,ITmedia_AI_Plus,もう入門書はいらない？　Colabに統合されたGeminiの学習モードを使ってみた,https://atmarkit.itmedia.co.jp/ait/articles/2604/17/news018.html,"Fri, 17 Apr 2026 05:00:00 +0900",Colabに統合されているGeminiに学習モードとカスタム指示が搭載されました。これらの機能を使いながら、それぞれについてちょっと考えてみました。,2026-04-19
6a26dca9a751eaed684c9a7bf2023502,Hatena_IT,Claude Codeで日常のタスクを45個自動化した東大院生の全記録,https://zenn.dev/shunya_sudo/articles/claude-code-45-automation-tasks,,これらが24時間、macOS上で動いています。PCを閉じない限り止まりません。 全体のアーキテクチャはこうです: ポイントは、Claude CLIを「考えるパーツ」として使っていること。データの取得・加工はPythonで行い、「この情報をどう要約するか」「このメールは返信が必要か」といった判断だけをClaudeに任せています。 カ...,2026-04-19
cce2eecce2c92c18772e1a358d2dd4f1,Hatena_IT,思い切った慶應義塾　全教職員にNotion導入で168年分の知的資産をAIに食わせるプロジェクトが始動（アスキー） - Yahoo!ニュース,https://news.yahoo.co.jp/articles/c465be8fe8c52668a13fb7cc6c5e789e15c511b5,,大学のDXやAI活用の話を聞く機会も増えてきた。 だが、その規模の大きさはまちまち。全学的な基盤整備として大規模に投資を進める大学もあれば、特定の学部や研究室単位で実証的に導入を進めるケースも少なくない。 前者は教育・研究・事務のあらゆる領域を横断的に変革するポテンシャルを持つ一方で、組織の合意形成や...,2026-04-19
ca12857e11ac425fb18d077827c279dc,Hatena_IT,プロンプトの再現性をAI に自動チューニングさせる方法 ~ 暗黙知を排除する,https://zenn.dev/mizchi/articles/empirical-prompt-tuning,,AI の技術記事は食傷気味なんですが、さすがにこれは効くと思ったパターンを見つけたので紹介します。 tl;dr プロンプト (skill / slash command) を書いた直後は「これで伝わるはず！」と思うのに、別のセッションで使うと暗黙知が不足していて、再現性がなくなる 思い込みは当人に修正できないバイアスなので、別の AI...,2026-04-19
b1b44a87ba993c6549d76eb5bc81c074,Hatena_IT,【Claude Code】アップデートされたDesktop版を触ってわかったCLIとの違い,https://zenn.dev/solvio/articles/901772dcec88cc,,はじめに みなさん、Claude Code使っていますでしょうか？ 2026年4月14日にClaude Codeのデスクトップアプリが全面リデザインされ、マルチセッション対応やRoutinesなど大幅なアップデートが入りました。 自分は普段CLIでClaude Codeを使い倒しているのですが、今回のDesktop版リデザインを実際に触ってみて「これはCLI...,2026-04-19
e9c5786eb37cd9cabd806c004ceb2c32,Hatena_IT,アプリで儲けようとしている人に、アプリ開発歴15年から言いたいこと,https://anond.hatelabo.jp/20260419113552,,99.9％儲かりません 理由 ・サービスを考える時、アプリとwebがあると思います webは検索導線があるのでまだ「たまたま来た」がありえますが アプリはwebに比べて流入導線が少ないです なので「バズる」「ストアで見つけてもらう」「広告を打つ」がほとんどの場合必要ですが その1人あたりの獲得単価を、アプリの価値が...,2026-04-19
30e3c6b5c7a4560a034abb503cf2935b,Hatena_IT,Vercel April 2026 security incident | Vercel Knowledge Base,https://vercel.com/kb/bulletin/vercel-april-2026-security-incident,,"We’ve identified a security incident that involved unauthorized access to certain internal Vercel systems. We are actively investigating, and we have engaged incident response experts to help investig...",2026-04-19
