id,source,title,link,published,summary,collected_date
10a692e98f50fcf612b82037b52b0488,GCP_Blog,What’s new with Google Cloud,https://cloud.google.com/blog/topics/inside-google-cloud/whats-new-google-cloud/,"Fri, 19 Dec 2025 17:00:00 +0000","Want to know the latest from Google Cloud? Find it here in one handy location. Check back regularly for our newest updates, announcements, resources, events, learning opportunities, and more. Tip: Not...",2026-01-02
0b7ea80bcb3c402c0f9fceb8af529073,GCP_Blog,The Year in Google Cloud — 2025,https://cloud.google.com/blog/products/gcp/top-google-cloud-blogs-2025/,"Fri, 19 Dec 2025 17:00:00 +0000","In the AI era, when one year can feel like 10, you’re forgiven for forgetting what happened last month, much less what happened all the way back in January. To jog your memory, we pulled the readershi...",2026-01-02
c46f59ee30d9e33ce360f2ac9eadb777,GCP_Blog,"New in Looker: self-service Explores, tabbed dashboards, and custom themes",https://cloud.google.com/blog/products/business-intelligence/looker-self-service-explores-tabbed-dashboards-custom-themes/,"Fri, 19 Dec 2025 17:00:00 +0000","Data teams seem to be constantly balancing the need for governed, trusted metrics with business needs for agility and ad-hoc analysis. To help bridge the gap between managed reporting and rapid data e...",2026-01-02
47dc4af60b4f2cc88166b376d84da128,GCP_Blog,Cloud CISO Perspectives: 2025 in review: Cloud security basics and evolving AI,https://cloud.google.com/blog/products/identity-security/cloud-ciso-perspectives-2025-in-review-cloud-security-basics-and-evolving-ai/,"Fri, 19 Dec 2025 17:00:00 +0000","Welcome to the second Cloud CISO Perspectives for December 2025. Today, Google Cloud’s Nick Godfrey, senior director, and Anton Chuvakin, security advisor, look back at the year that was.As with all C...",2026-01-02
2c2b8930e6d91cb7b99c6790ef6fea82,GCP_Blog,Agent Factory Recap: Supercharging Agents on GKE with Agent Sandbox and Pod Snapshots,https://cloud.google.com/blog/topics/developers-practitioners/agent-factory-recap-supercharging-agents-on-gke-with-agent-sandbox-and-pod-snapshots/,"Fri, 19 Dec 2025 10:02:00 +0000","In the latest episode of the Agent Factory, Mofi Rahman and I had the pleasure of hosting, Brandon Royal, the PM working on agentic workloads on GKE. We dove deep into the critical questions around th...",2026-01-02
af65929eda76ccbd12afeab9209acceb,GCP_Blog,Why Stochastic Rounding is Essential for Modern Generative AI,https://cloud.google.com/blog/topics/developers-practitioners/why-stochastic-rounding-is-essential-for-modern-generative-ai/,"Fri, 19 Dec 2025 07:46:00 +0000","In computing's early days of the 1940s, mathematicians discovered a flawed assumption about the behavior of round-off errors. Instead of canceling out, fixed-point arithmetic accumulated errors, compr...",2026-01-02
c27fa5c5ae66b101f05b0a4dd477352d,GCP_Blog,From Code to Cloud: Three Labs for Deploying Your AI Agent,https://cloud.google.com/blog/topics/developers-practitioners/from-code-to-cloud-three-labs-for-deploying-your-ai-agent/,"Fri, 19 Dec 2025 07:15:00 +0000","You've built a powerful AI agent. It works on your local machine, it's intelligent, and it's ready to meet the world. Now, how do you take this agent from a script on your laptop to a secure, scalable...",2026-01-02
c857dbcb12476f57037151cc70ebe9c2,GCP_Blog,How Google Public Sector and Google DeepMind can power the Genesis Mission and a new era of scientific discovery,https://cloud.google.com/blog/topics/public-sector/how-google-public-sector-and-google-deepmind-can-power-the-genesis-mission-and-a-new-era-of-scientific-discovery/,"Thu, 18 Dec 2025 19:00:00 +0000",The White House's Genesis Mission has set a bold ambition for our nation: to double our scientific productivity within the decade and harness artificial intelligence (AI) to accelerate the pace of dis...,2026-01-02
70236d7a83d32932020382e78e7e29db,GCP_Blog,Achieve near-100% accurate text-to-SQL for your agentic apps,https://cloud.google.com/blog/products/databases/optimizing-alloydb-ai-text-to-sql-accuracy/,"Thu, 18 Dec 2025 18:00:00 +0000","Today’s AI capabilities provide a great opportunity to enable natural language (NL) interactions with your enterprise data through applications using text and voice. In fact, in the world of agentic a...",2026-01-02
d622a95bf6629afe489197e9a843e351,GCP_Blog,"Cool stuff Google Cloud customers built, Dec. edition: AI for better toys, reliable mapping tech, Gemini stumps an all-star & more",https://cloud.google.com/blog/topics/customers/cool-stuff-google-cloud-customers-built-monthly-round-up/,"Thu, 18 Dec 2025 18:00:00 +0000","AI and cloud technology are reshaping every corner of every industry around the world. Without our customers, there would be no Google Cloud, as they are the ones building the future on our platform. ...",2026-01-02
a75b9f849915403be810da212fd55de9,GCP_Blog,Announcing advanced governance capabilities for Vertex AI Agent Builder,https://cloud.google.com/blog/products/ai-machine-learning/new-enhanced-tool-governance-in-vertex-ai-agent-builder/,"Thu, 18 Dec 2025 17:00:00 +0000","At Google Cloud, we continue to make critical investments to Vertex AI Agent Builder, our comprehensive and open platform, enabling you to build faster, scale efficiently, and govern with enterprise-g...",2026-01-02
40437abe16e2e0716424f7b8773e9509,GCP_Blog,What’s new with Google Data Cloud,https://cloud.google.com/blog/products/data-analytics/whats-new-with-google-data-cloud/,"Thu, 18 Dec 2025 16:00:00 +0000","December 15 - December 19

We introduced new self-service capabilities in Looker platform, enabling users to analyze local data alongside governed models, organize complex dashboards more effectively,...",2026-01-02
8d271a3dfc8cf13891ee6a4f9f774544,GCP_Blog,"Automate AI and HPC clusters with Cluster Director, now generally available",https://cloud.google.com/blog/products/compute/cluster-director-is-now-generally-available/,"Wed, 17 Dec 2025 18:00:00 +0000","The complexity of the infrastructure behind AI training and high performance computing (HPC) workloads can really slow teams down. At Google Cloud, where we work with some of the world’s largest AI re...",2026-01-02
a0a2677da1d1e0cee0caf2dd8623f6ce,GCP_Blog,"Google named a Leader in The Forrester Wave™: AI Infrastructure Solutions, Q4 2025",https://cloud.google.com/blog/products/compute/forrester-wave-ai-infrastructure-solutions-q4-2025-leader/,"Wed, 17 Dec 2025 17:00:00 +0000","For most organizations, the question is no longer if they will use AI, but how to scale it from a promising prototype into a production-grade service that drives business outcomes. In this age of infe...",2026-01-02
153fd8f93e0c09bd3cb116815b1b3777,GCP_Blog,Introducing Gemini 3 Flash: Intelligence and speed for enterprises,https://cloud.google.com/blog/products/ai-machine-learning/gemini-3-flash-for-enterprises/,"Wed, 17 Dec 2025 16:00:00 +0000","Today, we’re expanding the Gemini 3 model family with Gemini 3 Flash, which offers frontier intelligence built for speed at a fraction of the cost. 
Gemini 3 Flash builds on the model series that deve...",2026-01-02
80b3385e7c2e282824da7bda25e84ecf,GCP_Blog,How Mandiant can help test and strengthen your cyber resilience,https://cloud.google.com/blog/products/identity-security/how-mandiant-can-help-test-and-strengthen-your-cyber-resilience/,"Tue, 16 Dec 2025 17:00:00 +0000",Your security program is robust. Your audits are clean. But are you ready for a real-world attack? A tenacious human adversary can create a critical blind spot for security leaders: A program can be c...,2026-01-02
ef844975d90de372b6501d1c43c0ab31,GCP_Blog,Wayne State University and Syntasa: Transforming public health assessments with AI,https://cloud.google.com/blog/topics/public-sector/wayne-state-university-and-syntasa-transforming-public-health-assessments-with-ai/,"Tue, 16 Dec 2025 15:00:00 +0000","When it comes to public health, having a clear picture of a community’s needs is vital. These insights help officials secure crucial funding, launch new initiatives, and ultimately improve people’s li...",2026-01-02
56647d0721daba7645816b35358b25ce,GCP_Blog,Introducing Google Cloud Partner Network: What partners should know,https://cloud.google.com/blog/topics/partners/introducing-google-cloud-partner-network/,"Tue, 16 Dec 2025 14:00:00 +0000","We have exciting news for Google Cloud partners: Today we’re announcing our new partner program, Google Cloud Partner Network, which will formally roll out in the first quarter of 2026. 
This new prog...",2026-01-02
7a1654a1c8e63ce11332172284274c9a,GCP_Blog,Disaster declaration to safety check: Google Workspace with Gemini transforms disaster response communication,https://cloud.google.com/blog/topics/public-sector/disaster-declaration-to-safety-check-google-workspace-with-gemini-transforms-disaster-response-communication/,"Tue, 16 Dec 2025 11:00:00 +0000","When extreme weather or unexpected natural disaster strikes, time is the single most critical resource. For public sector agencies tasked with emergency management, the challenge isn't just about craf...",2026-01-02
f4501a7847611a80fb49264c07c93370,GCP_Blog,Connect your enterprise data to Google’s new Antigravity IDE,https://cloud.google.com/blog/products/data-analytics/connect-google-antigravity-ide-to-googles-data-cloud-services/,"Mon, 15 Dec 2025 17:00:00 +0000","The AI state of the art is shifting rapidly from simple chat interfaces to autonomous agents capable of planning, executing, and refining complex workflows. In this new landscape, the ability to groun...",2026-01-02
02bfcc857e555434aa963900b6d86c78,GCP_Japan,生成 AI の評価をマスター: 単一のプロンプトから複雑なエージェントまで,https://cloud.google.com/blog/ja/topics/developers-practitioners/master-generative-ai-evaluation-from-single-prompts-to-complex-agents/,"Thu, 25 Dec 2025 03:00:00 +0000","※この投稿は米国時間 2025 年 12 月 16 日に、Google Cloud blog に投稿されたものの抄訳です。
誰もが生成 AI アプリケーションを構築できるようになりましたが、アプリケーションをプロトタイプからプロダクション レディのシステムに移行するには、評価という重要なステップが必要となります。
LLM が安全かどうかはどのように判断すればよいでしょうか。RAG システムがハルシ...",2026-01-02
ce307fc8a1f89b2f5f2a1a6121464d87,GCP_Japan,災害宣言から安全確認まで: Google Workspace with Gemini が災害対応のコミュニケーションを変革,https://cloud.google.com/blog/ja/topics/public-sector/disaster-declaration-to-safety-check-google-workspace-with-gemini-transforms-disaster-response-communication/,"Thu, 25 Dec 2025 02:10:00 +0000","※この投稿は米国時間 2025 年 12 月 17 日に、Google Cloud blog に投稿されたものの抄訳です。
異常気象や予期せぬ自然災害が発生した場合、最も重要となるリソースは時間です。緊急事態対応を担う公共機関にとって、課題は迅速な対応策を策定することだけではありません。その対応策を市民に効果的に伝えることも課題となります。先日開催された Google Public Sector ...",2026-01-02
1fa91644e10d46f1fd86e35697094225,GCP_Japan,Cluster Director による AI および HPC クラスタ自動化の一般提供を開始,https://cloud.google.com/blog/ja/products/compute/cluster-director-is-now-generally-available/,"Thu, 25 Dec 2025 02:00:00 +0000","※この投稿は米国時間 2025 年 12 月 18 日に、Google Cloud blog に投稿されたものの抄訳です。
AI トレーニング ワークロードとハイ パフォーマンス コンピューティング（HPC）ワークロードを支えるインフラストラクチャの複雑さは、チームの作業ペースを低下させる可能性があります。Google Cloud において、世界最大規模の AI 研究チームとの共同作業を重ねる中で...",2026-01-02
0e3448183177f02647834ca534d4590c,GCP_Japan,ウェイン州立大学と Syntasa: AI で公衆衛生評価を変革,https://cloud.google.com/blog/ja/topics/public-sector/wayne-state-university-and-syntasa-transforming-public-health-assessments-with-ai/,"Thu, 25 Dec 2025 01:30:00 +0000",※この投稿は米国時間 2025 年 12 月 17 日に、Google Cloud blog に投稿されたものの抄訳です。公衆衛生においては、地域のニーズを明確に把握することが重要です。このような情報があれば、重要な資金を確保し、新しい取り組みを開始して、最終的に人々の生活を改善できます。このような考えから着想を得て、ウェイン州立大学の救急医学教授であり、公衆衛生およびトランスレーショナル サイエ...,2026-01-02
f3edb5c2f1df5408af1f91e3da04ec88,GCP_Japan,企業データを Google の新しい Antigravity IDE に接続する,https://cloud.google.com/blog/ja/products/data-analytics/connect-google-antigravity-ide-to-googles-data-cloud-services/,"Thu, 25 Dec 2025 01:00:00 +0000","※この投稿は米国時間 2025 年 12 月 16 日に、Google Cloud blog に投稿されたものの抄訳です。
AI の最先端技術は、単純なチャット インターフェースから、複雑なワークフローを計画、実行、改良できる自律型エージェントへと急速に移行しています。こうした新たな状況においては、これらのインテリジェント エージェントを企業データにグラウンディングする能力こそが、真のビジネス価値...",2026-01-02
4c82c904788bbd39ef63beb350cff239,GCP_Japan,Gemini 3 Flash のご紹介: 企業向けのインテリジェンスとスピード,https://cloud.google.com/blog/ja/products/ai-machine-learning/gemini-3-flash-for-enterprises/,"Wed, 24 Dec 2025 02:00:00 +0000","※この投稿は米国時間 2025 年 12 月 18 日に、Google Cloud blog に投稿されたものの抄訳です。
このたび、Gemini 3 モデル ファミリーに Gemini 3 Flash が加わりました。Gemini 3 Flash は、スピードを重視して構築された最先端のインテリジェンスを低コストで提供します。
Gemini 3 Flash は、デベロッパーや企業の皆様から高く評...",2026-01-02
90c69d4f2b4c6ebfa36d528155a288a2,GCP_Japan,"「The Forrester Wave™: AI Infrastructure Solutions, Q4 2025」で Google がリーダーに",https://cloud.google.com/blog/ja/products/compute/forrester-wave-ai-infrastructure-solutions-q4-2025-leader/,"Wed, 24 Dec 2025 02:00:00 +0000","※この投稿は米国時間 2025 年 12 月 18 日に、Google Cloud blog に投稿されたものの抄訳です。
使用するかどうかはもはや問題ではなく、有望なプロトタイプからビジネス成果を促進する本番環境グレードのサービスにどのようにスケーリングするかが問題になっています。推論の時代において、競争優位性は、世界中のユーザーに役立つ情報を可能な限り低いコストで提供する能力によって決まります...",2026-01-02
1b90a39a6f406d99402a08cacaba61e5,GCP_Japan,Vertex AI Agent Builder の高度なガバナンス機能の発表,https://cloud.google.com/blog/ja/products/ai-machine-learning/new-enhanced-tool-governance-in-vertex-ai-agent-builder/,"Tue, 23 Dec 2025 03:00:00 +0000","※この投稿は米国時間 2025 年 12 月 19 日に、Google Cloud blog に投稿されたものの抄訳です。
Google Cloud は、包括的かつオープンなプラットフォームである Vertex AI Agent Builder への重要な投資を継続することで、より迅速な構築、効率的なスケーリング、そしてエンタープライズ グレードのセキュリティによる管理を実現します。
このたび、C...",2026-01-02
06104a111c4efe5d60f71d8419ca0315,GCP_Japan,Web3 における MCP の使用: ブロックチェーン トランザクションを行うエージェントを保護する方法,https://cloud.google.com/blog/ja/products/identity-security/using-mcp-with-web3-how-to-secure-blockchain-interacting-agents/,"Tue, 23 Dec 2025 01:10:00 +0000","※この投稿は米国時間 2025 年 12 月 6 日に、Google Cloud blog に投稿されたものの抄訳です。
Google Cloud は、AI と Web3 という 2 つの変革的なテクノロジーが交差するユニークな位置にあります。ブロックチェーンとやり取りできる AI エージェントの登場により、金融戦略の自動化、迅速な支払い、複雑な DeFi オペレーションの実行や複数のブロックチェ...",2026-01-02
552b5d40bb338d5e408b7e9a66815906,GCP_Japan,プロダクション レディな AI Security Foundation の構築,https://cloud.google.com/blog/ja/topics/developers-practitioners/building-a-production-ready-ai-security-foundation/,"Tue, 23 Dec 2025 01:05:00 +0000","※この投稿は米国時間 2025 年 12 月 5 日に、Google Cloud blog に投稿されたものの抄訳です。
生成 AI アプリケーションを概念実証から本番環境に拡張する際、セキュリティ上の懸念、特に機密データの漏洩やプロンプト インジェクションがボトルネックになることがよくあります。
プロダクション レディなポスチャーを確立するには、以下の 3 つのレイヤにわたる多層防御戦略が必要で...",2026-01-02
c81db78f779c3c3705268107e3ae6941,GCP_Japan,BigQuery で利用可能になった PubMed データで医療研究を加速させる,https://cloud.google.com/blog/ja/topics/public-sector/accelerate-medical-research-with-pubmed-data-now-available-in-bigquery/,"Tue, 23 Dec 2025 01:04:00 +0000","※この投稿は米国時間 2025 年 12 月 5 日に、Google Cloud blog に投稿されたものの抄訳です。医療従事者は、国立衛生研究所（NIH）の国立医学図書館（NLM）が管理するデータベースである PubMed を定期的に参照しています。PubMed には 3,500 万件を超える生物医学に関する論文が収録されており、その数は毎年 150 万件ずつ増加しています。しかし、従来のキー...",2026-01-02
adc692f0c92651942b7902e73c5f822e,GCP_Japan,キュレートされたデータとコンテキストのための Dataplex Universal Catalog のデータ プロダクトのご紹介,https://cloud.google.com/blog/ja/products/data-analytics/introducing-data-products-in-dataplex-universal-catalog/,"Tue, 23 Dec 2025 01:02:00 +0000","※この投稿は米国時間 2025 年 12 月 5 日に、Google Cloud blog に投稿されたものの抄訳です。
多くの組織は、断片化されたデータが多すぎて、それがビジネス目標にどのように影響するのかを明確に把握できていません。これは、重大な断絶を引き起こします。データ利用者（分析情報を生成するためにデータを必要とするアナリストやデータ サイエンティスト）は、必要なデータを簡単に発見、アク...",2026-01-02
216617b10cf38e231b3fa1b659f5d549,GCP_Japan,GKE 10 周年記念ハッカソン: 受賞者とハイライトを発表,https://cloud.google.com/blog/ja/topics/developers-practitioners/winners-and-highlights-from-gke-hackathon/,"Tue, 23 Dec 2025 01:00:00 +0000","※この投稿は米国時間 2025 年 12 月 3 日に、Google Cloud blog に投稿されたものの抄訳です。
GKE 10 周年記念ハッカソンは、デベロッパーの創意工夫が光る素晴らしいイベントでした。最初の発表から大きな盛り上がりを見せたこのハッカソンでは、参加者が Google Kubernetes Engine（GKE）の堅牢性と Google AI モデル（Gemini など）の...",2026-01-02
ca096f8e10518fa08b1cb7f745c19b6c,GCP_Japan,DeNA: Spanner、C4A インスタンスを駆使して世界規模のゲームアプリ『Pokémon TCG Pocket』の安定運用を実現,https://cloud.google.com/blog/ja/topics/customers/dena-achieves-stable-game-app-operations-using-spanner-and-c4a-instances/,"Mon, 22 Dec 2025 02:30:00 +0000",2024 年 10 月 30 日より、150 の国と地域でサービスを開始した、スマートフォン向けポケモンカードゲーム『Pokémon Trading Card Game Pocket（以下、ポケポケ）』。株式会社ポケモン、株式会社クリーチャーズ、そして 株式会社ディー・エヌ・エー（以下、DeNA ）の合同プロジェクトである本アプリに、Google Cloud がどのように貢献しているのか。本プロジ...,2026-01-02
32715b308861d6ae19f2e932276439c9,GCP_Japan,Woodstock: 株式投資アプリ「Woodstock」に Gemini を活用した AI エージェントを実装し、次世代の投資体験を実現,https://cloud.google.com/blog/ja/topics/customers/woodstock-implements-ai-agents-utilizing-gemini/,"Mon, 22 Dec 2025 02:00:00 +0000",「貯蓄から投資へ」の流れが加速するなか、投資の初心者や若年層を中心に注目されているのが、Woodstock株式会社（以下、Woodstock）が運営する米国株投資アプリ「Woodstock」です。スマートフォンの優れた UI / UX で簡単に口座開設から取引まで一貫してできる利便性と、大手証券でも導入されていない時間外取引へのいち早い対応などで、店舗を持たないアプリのみのサービスながら高い評価を...,2026-01-02
50dc22287d6b5b6efb7089d3e5e9d2c7,GCP_Japan,radiko: BigQuery と Looker で DMP を刷新、大幅なコスト削減と業務効率化、850 万ユーザーのデータ活用を推進,https://cloud.google.com/blog/ja/topics/customers/radiko-revamps-its-dmp-with-bigquery-and-looker/,"Fri, 19 Dec 2025 03:00:00 +0000",アプリやウェブでラジオやポッドキャストが聴ける音声配信サービス「radiko」では、ユーザー数が順調に伸びる一方で、 DMP（データ マネジメント プラットフォーム）の処理能力やコストに課題を抱えていました。その解決のために導入されたのが、Google Cloud の BigQuery と Looker です。株式会社radiko（以下、radiko） のデータ統括チームと、移行作業をサポートした...,2026-01-02
7a6016d3cdbe2cd402aebd3941e41fa8,GCP_Japan,Vertex AI の Gemini Live API に関するデベロッパー ガイド,https://cloud.google.com/blog/ja/topics/developers-practitioners/how-to-use-gemini-live-api-native-audio-in-vertex-ai/,"Fri, 19 Dec 2025 03:00:00 +0000","※この投稿は米国時間 2025 年 12 月 13 日に、Google Cloud blog に投稿されたものの抄訳です。
単一の WebSocket 接続を通じて、AI アプリやエージェントに、人間のような自然なインターフェースを与えることができます。
このたび、Google は最新の Gemini 2.5 Flash ネイティブ音声モデルを搭載した Gemini Live API の一般提供を...",2026-01-02
01062a6461664fada854fe86d108c474,GCP_Japan,エージェント時代におけるリアルタイム データ イノベーションの認識,https://cloud.google.com/blog/ja/products/data-analytics/2025-data-integration-and-streaming-momentum/,"Fri, 19 Dec 2025 03:00:00 +0000","※この投稿は米国時間 2025 年 12 月 13 日に、Google Cloud blog に投稿されたものの抄訳です。
今日、多くの組織が業務に使用しているデータは、サイロ化された接続性のない以前のシステムに閉じ込められ、数日または数時間が経過したデータです。しかし、AI の台頭により、これらの環境を統合し、音声、動画、テキスト ファイルの非構造化データを利用する必要性と機会が生まれています。...",2026-01-02
cc59950530332b06a77e2a2aa030bcc8,GCP_Japan,公共機関の業務効率を高める: Google Workspace の試験運用版,https://cloud.google.com/blog/ja/topics/public-sector/boost-your-agencys-efficiency-take-google-workspace-for-a-test-drive/,"Fri, 19 Dec 2025 03:00:00 +0000","※この投稿は米国時間 2025 年 12 月 13 日に、Google Cloud blog に投稿されたものの抄訳です。
公共機関は常に少ないリソースでより多くの成果を出すよう求められています。予算が縮小し、責任が拡大するなか、効率的で安全な最新ツールの必要性がかつてないほど高まっています。システムが古くなると、コラボレーションが妨げられ、セキュリティ リスクが生じ、従業員の士気が低下して、住民...",2026-01-02
0efda97f10e0acbbfc62cd6967eb2c4d,GCP_Japan,Replit が Google Cloud でエンタープライズ グレードのバイブ コーディングを提供,https://cloud.google.com/blog/ja/products/ai-machine-learning/bringing-vibe-coding-to-the-enterprise-with-replit/,"Fri, 19 Dec 2025 01:10:00 +0000","※この投稿は米国時間 2025 年 12 月 5 日に、Google Cloud blog に投稿されたものの抄訳です。
バイブ コーディングは今年大ブームになりました。AI を使用してチャット インターフェースに会話形式で入力するだけで、斬新なアプリを作成したり、動的なウェブサイトを構築したりできるのは、魔法のように思えるかもしれません。しかし、この動きは主に個人の開発者の領域にとどまっており、...",2026-01-02
