id,source,title,link,published,summary,collected_date
dc1c96b46c6a541b2818244f69b51a28,Business_Insider,AGI開発のボトルネックは「人間のタイピングが遅いこと」…Codex開発責任者が指摘,https://www.businessinsider.jp/article/2601-openai-artificial-general-intelligence-bottleneck-human-typing-speed/,"Fri, 02 Jan 2026 23:00:00 GMT",OpenAIのコーディングプラットフォームの製品開発を率いるアレクサンダー・エンビリコスは、AIの作業をプロンプトで確認する必要性が進歩を制限していると述べました。,2026-01-02
04ac0d564ce3d8087c2de5a2a936d057,Business_Insider,日常生活に少し変化を加えるだけ…3カ月で体脂肪のほぼ半分を減らすことに成功,https://www.businessinsider.jp/article/busy-doctor-burned-fat-built-muscle-fast-simple-routine-a/,"Fri, 02 Jan 2026 21:35:00 GMT",35歳の男性が、ジムでのトレーニング時間を増やしたり、厳しい食事制限をしたりすることなく、運動と食事プランを少し変えるだけで、脂肪を燃焼し、筋肉を鍛えることに成功しました。,2026-01-02
1ecd6c23bcb4e5e952513afe4277dc2c,Business_Insider,一生に一度は見たい、山口華楊が80歳でたどりついた「遊ぶ狐」の優美（SOMPO美術館）,https://www.businessinsider.jp/article/tamaguchikayo-genge_a-must-see-in-a-lifetime/,"Fri, 02 Jan 2026 12:00:00 GMT",社会人の教養として「一生に一度は見たい美術品」をご紹介。今回は、山口華楊が80歳のときに描いた《幻化》を紹介します。,2026-01-02
8ada9c16ad8a24ac2cfd2272b88cb09a,Business_Insider,東京→軽井沢→マレーシア。「移動型家族」を続けて感じた国内・海外教育移住のリアル,https://www.businessinsider.jp/article/2601-life-between-tokyo-kualalumpur/,"Fri, 02 Jan 2026 12:00:00 GMT","このまま日本で子育てをしていいのだろうか。でも海外在住経験もないのに海外で子育ては難しい……。そう感じている人はいないでしょうか。
日本各地で子連れリモートワークをしていた山本裕介さんは、まさにその悩みを持ち、一歩踏み出した当事者。東京から軽井沢への家族での移住を経て、現在は海外での子育てにチャレンジ中です。何回かにわたり、子育てや国内・海外への教育移住の実践について寄稿してもらうことになりました...",2026-01-02
e5215abbb7762801d9f40dcaadd74143,Business_Insider,日本を旅行したアメリカ人が後悔する、お金に関する6つの失敗。事前に知っていたら良かった……,https://www.businessinsider.jp/article/2601-money-planning-mistakes-japan-american-made-first-trip/,"Fri, 02 Jan 2026 08:30:00 GMT",筆者は2025年、2人の友人と1週間ほど日本に旅行で訪れ、長年の夢をかなえました。幅広い都市を巡るすばらしい旅だったそうですが、もっと違う風にすれば良かったと後悔することが6つあり、その大半がお金に関することだったそうです。,2026-01-02
6e09bc3869b72d8833e5897eb22d29c2,Business_Insider,グーグル「Pixel Watch 4」レビュー：Geminiをジェスチャーで使えるAIスマートウォッチ,https://www.businessinsider.jp/article/2601-google-pixel-watch-4-review/,"Fri, 02 Jan 2026 08:00:00 GMT",グーグルのスマートウォッチ「Pixel Watch 4」のレビューをお届けします。4世代目となる本機は、心電図機能が追加され、「Gemini」のクイック起動やUIの刷新でソフトウェア面も大きく進化しました。,2026-01-02
7c478b3e3366dadf5bffd417962a21d0,Business_Insider,37枚の写真で見る、世界で最も風変りでユニークなマクドナルドの店舗,https://www.businessinsider.jp/article/2601-most-unusual-mcdonalds-restaurants-in-the-world/,"Fri, 02 Jan 2026 06:00:00 GMT",マクドナルドと言っても、その店舗の形は実はいろいろです。ニュージーランドのマクドナルドは退役した飛行機の中にあります。,2026-01-02
3f7db7a566a9506d72e853fe97a3623d,Business_Insider,6600万年前、恐竜を絶滅させた小惑星の衝突直後に起きたことがわかった,https://www.businessinsider.jp/article/2612-timeline-consequences-of-dinosaur-killing-asteroid/,"Thu, 01 Jan 2026 23:30:00 GMT",巨大な小惑星が6600万年前に地球に落ち、当時の地球上の生物の75%が絶滅しました。科学者の分析によると、数百メートルの高さの津波や山火事が発生し、大量の硫黄が放出されたことが明らかになったと言います。【アーカイブ記事】,2026-01-02
795357e864e20a2f6430d5117b74df65,Business_Insider,億万長者は移住する国を再考している…重視するのは医療費,https://www.businessinsider.jp/article/2601-how-soaring-healthcare-costs-are-changing-where-millionaires-move/,"Thu, 01 Jan 2026 23:00:00 GMT",ヘンリー・アンド・パートナーズは、世界的に民間医療費が急騰し、より安価なヨーロッパの国々が魅力を持つようになるにつれ、富裕層が計画を変更していると述べています。,2026-01-02
f9707bd8b57f82216a75fee1e31b2cca,Business_Insider,800年続く宇治の茶屋が、店舗を増やさない理由。売り上げよりも大事にしている姿勢,https://www.businessinsider.jp/article/2601-tsuen-tea-kyoto-uji/,"Thu, 01 Jan 2026 22:10:00 GMT",,2026-01-02
a392d36c5df764613f8ce33ded8fdb3e,Business_Insider,コンサルからすし職人へ…これからはブルーワーカーの時代なのか。AI時代、ホワイトカラー職の将来「不安」6割,https://www.businessinsider.jp/article/2601-is-the-era-of-blue-collar-work-arriving/,"Thu, 01 Jan 2026 22:00:00 GMT",オフィスワーカーが建設や運輸、飲食など、いわゆるブルーカラーと呼ばれる現場職種にキャリアチェンジする動きが見え始めています。人材企業は「AIの台頭」を理由の一つに挙げます。,2026-01-02
7291c1677bf7da2d3c443eacae669063,Business_Insider,「日本の古着」が世界で勝てるこれだけの理由。ギャルソンからヒューマンメイドまで、社長が語る“危機感”と“勝算”,https://www.businessinsider.jp/article/2601-geo-ceo-interview/,"Thu, 01 Jan 2026 22:00:00 GMT","ゲオホールディングスはセカンドストリート、ゲオなどを傘下に持つセカンダリー（二次流通）マーケットの企業グループだ。2026年10月からはグループの名称をセカンドリテイリングに変える。
2年間の取材を経て『セカストの奇跡、逆襲のゲオ』を上梓したノンフィクション作家の野地秩嘉氏が、遠藤結蔵社長に同社の今とこの先の展開を聞く。",2026-01-02
1c70a97602d80c25c1afdbf944a6ba31,Business_Insider,VCが予測する2026年のヘルスケア業界。テクノロジーを活用したサービスが復活し、今までとは違うAIスタートアップが注目される,https://www.businessinsider.jp/article/62072ec1-8231-498c-9571-7fbeae20c4d6/,"Thu, 01 Jan 2026 21:50:00 GMT",医療分野でベンチャーキャピタルは2026年に違う種類のAIスタートアップを支援すると見られています。 投資家たちは、どのような技術に注目し、2026年の企業買収は増えるのでしょうか。,2026-01-02
7768a803ab5956a49e2e0e2da3cd82a5,Business_Insider,【社内メールを入手】デルの営業幹部、週5日・1日8時間のオフィス勤務を改めて指示…終業時巡回で社員の早退が明らかに,https://www.businessinsider.jp/article/2512-dell-rto-policy-sales-team-eight-hours-a-day/,"Thu, 01 Jan 2026 21:40:00 GMT",デルの営業担当幹部が主要3拠点のチームに対し、週5日、1日8時間の出社を再び命じました。,2026-01-02
84a2b6e20d180a5685526cf7a547d1da,Business_Insider,【特集予告】ポストスタートアップは、地方企業？いま中小企業がアツい理由,https://www.businessinsider.jp/article/2601-the-happiness-theory-of-small-and-medium-sized-enterprises/,"Thu, 01 Jan 2026 21:30:00 GMT",地方の中小企業に、静かな変化が起きています。中小企業庁は売り上げ100億円規模への成長を目指す中小企業に対する補助金交付を開始。金融機関も中小企業をターゲットとしたサービスを増やしています。,2026-01-02
5eb2fa4358bcc2fd374d245322c09471,Business_Insider,AIボットだけのSNSを作ってみたら…彼らはすぐに派閥を形成し、極端な意見を増幅させ、少数のエリート層が支配するようになった,https://www.businessinsider.jp/article/researchers-ai-bots-social-media-network-experiment-toxic-a/,"Thu, 01 Jan 2026 21:00:00 GMT",研究者たちは、二極化のループを打破するために6つの介入策も試してみたそうですが、いずれも問題を解決することはできませんでした。,2026-01-02
34e6ed512237ed49661f575bc13c4615,Business_Insider,大学生が見た「ChatGPTに丸投げ」就活の末路。コピペES、セリフ丸暗記で「思考停止」…AI就活の落とし穴,https://www.businessinsider.jp/article/shukatsu-ai-thinking-stop-a/,"Thu, 01 Jan 2026 21:00:00 GMT",就活の現場では、AIによる模範解答の暗記やコピペESで思考停止に陥り、面接で失敗する学生がいるようです。今回は、便利ツールの落とし穴にはまった就活生のリアルな声を紹介します。,2026-01-02
639deccb7dd410d7bcaff730741321e7,Business_Insider,資産を築いて、守り続けるための“富の5原則”。ビリオネアの法律家、ジョン・モーガン氏が語る,https://www.businessinsider.jp/article/2601-john-morgan-worth-billion-says-luck-paranoia-helped-get-rich/,"Thu, 01 Jan 2026 08:30:00 GMT",ビリオネアのジョン・モーガン氏の成功は、インポスター症候群を受け入れること、運、そして職業的自立によるものだそうです。彼は、権限委譲、負債の回避、機会が訪れたときにそれをつかむことの重要性を強調しています。,2026-01-02
39e2355f7943ccbcc58ca0777070dc9a,Business_Insider,ダン・アイブスは強気の姿勢を崩していない…ウォール街屈指の強気派による、2026年のテクノロジーとAIに関する5つの予測,https://www.businessinsider.jp/article/2601-ai-outlook-2026-tech-stocks-telsa-robotaxis-google-apple-nebius/,"Thu, 01 Jan 2026 06:00:00 GMT",ウェドブッシュのダン・アイブズが2026年のテクノロジーとAIに関する予測を発表しました。,2026-01-02
51a3acc6dbbebe757e56d038d94506e4,Business_Insider,アルファロメオもジープも“同じ血液”で生じた転落…。個性を失った巨人ステランティスは、再び文化の紡ぎ手になれるか,https://www.businessinsider.jp/article/stellantis-a/,"Thu, 01 Jan 2026 04:00:00 GMT",2021年に誕生し、フィアットやアルファロメオ、ジープなどの自動車ブランドを擁するステランティス。世界シェア約9％、従業員は40万人、14のブランドを傘下に収める巨大企業ですが、栄光をつかんだ2024年から急激に業績が悪化しています。,2026-01-02
cc6e94482ee56c628973a8aa063bccc8,ITmedia_AI_Plus,「導入後の評価軸がない」生成AI導入決裁者が答えた、手探りで進める生成AI活用の実態,https://kn.itmedia.co.jp/kn/articles/2601/02/news011.html,"Fri, 02 Jan 2026 07:00:00 +0900",Ragateは情報システム部とDX推進室の意思決定関与者505人を対象とした調査結果を公表した。生成AI導入に関する懸念点や今後の予算動向を解析し、意思決定者が取るべき対応を述べた。,2026-01-02
ee265936f25510ea10d10b0bfae9a962,ITmedia_AI_Plus,OpenAI公式チートシートが注目　プロンプト作成は「構造化エンジニアリング」に,https://atmarkit.itmedia.co.jp/ait/articles/2601/01/news012.html,"Thu, 01 Jan 2026 08:00:00 +0900",2025年に公開された記事の中から、AIの話題で特に注目を集めた10本をランキング形式で紹介します。何が読者の関心を引いたのでしょうか。,2026-01-02
5b123b1e8b1b222850a1b0b5021dbc53,ITmedia_AI_Plus,AIが仕事をする時代、人間に「論理的思考トレーニング」は必要か？,https://www.itmedia.co.jp/business/articles/2601/01/news004.html,"Thu, 01 Jan 2026 08:00:00 +0900",生成AIが発展した形として、ゴールを設定すれば自律的に仕事を行う「AIエージェント」が注目されている。このような変革期において、個人のキャリア開発として一体何をすればいいのだろうか。,2026-01-02
c99028f049e4f7c005c0769f659251ff,ITmedia_AI_Plus,AIブームを「銀の弾丸」に変えらえるか　2026年、企業ITが直面する課題,https://www.itmedia.co.jp/enterprise/articles/2601/01/news014.html,"Thu, 01 Jan 2026 00:00:00 +0900",AI活用の推進やセキュリティの課題など、2025年のIT業界は話題に事欠かない1年だった。アイ・ティ・アールが発表した「国内IT投資動向調査報告書2026」を基に今後を読み解く。,2026-01-02
9bc99e1c7376c79a5227fbd7607f55a6,ITmedia_AI_Plus,知らんのか、メモリがなくなると……漫画「1年間、生成AIに翻弄されるWebメディア編集部」【最終話】,https://www.itmedia.co.jp/aiplus/articles/2512/31/news010.html,"Wed, 31 Dec 2025 16:00:00 +0900",2025年は生成AI関連の話題で盛りだくさん。AI関連のニュースを追いかけるITmedia AI＋編集部も大忙しでした。本連載ではそんな激動の1年間と、止まらないニュースに翻弄され続けた編集部の様子を4コマ漫画化します。,2026-01-02
ca3e21f64d062170c3576eda94456164,ITmedia_AI_Plus,「AIに奪われない仕事」を選ぶ若者たち　配管工・電気工事士に新たな脚光,https://www.itmedia.co.jp/business/articles/2512/31/news009.html,"Wed, 31 Dec 2025 08:30:00 +0900",労働市場では今、AIが業務内容を急速に変化させ、時には人間に取って代わろうとしている。ホワイトカラー労働者の仕事は肉体労働に比べ、AIや自動化に伴う打撃を受けやすいと考えられている。,2026-01-02
7e8226b2422ac514e7be76b683711cf5,ITmedia_AI_Plus,Meta、急成長の「Manus AI」を買収　自律型AIエージェント機能を統合へ,https://www.itmedia.co.jp/news/articles/2512/30/news034.html,"Tue, 30 Dec 2025 11:38:00 +0900",Metaは、中国発でシンガポール拠点の汎用AIエージェント開発企業Manus AIを買収すると発表した。Manusは自律型タスク遂行に強みを持ち、8カ月で売上高1億ドルを達成した急成長スタートアップだ。Metaはこの技術を「Meta AI」などの自社プロダクトに統合し、シャオ・ホンCEOらと共に、数十億人のユーザーに向けたサービスの拡充を加速させるとしている。,2026-01-02
f34f1dde2b1aa968c294821b0adb55ea,ITmedia_AI_Plus,バブル崩壊の足音がしたり、“インターネットが壊れた”り　漫画「1年間、生成AIに翻弄されるWebメディア編集部」【残り1話】,https://www.itmedia.co.jp/aiplus/articles/2512/30/news015.html,"Tue, 30 Dec 2025 08:45:00 +0900",2025年は生成AI関連の話題で盛りだくさん。AI関連のニュースを追いかけるITmedia AI＋編集部も大忙しでした。本連載ではそんな激動の1年間と、止まらないニュースに翻弄され続けた編集部の様子を4コマ漫画化します。,2026-01-02
9bfb3c253c23df8f81f66e4b2854031e,ITmedia_AI_Plus,ソフトバンクG、DigitalBridgeを40億ドルで買収　人工超知能（ASI）ビジョン加速へ,https://www.itmedia.co.jp/news/articles/2512/30/news032.html,"Tue, 30 Dec 2025 07:38:00 +0900",ソフトバンクグループは、米資産運用会社DigitalBridge Groupを約40億ドルで買収することで最終合意した。DigitalBridgeはデータセンターや光ファイバー等のデジタルインフラ投資を手掛ける。これにより、SBGは次世代AIや人工超知能（ASI）の実現に不可欠な計算リソースと基盤インフラの供給能力を強化する。,2026-01-02
0e543b2c24b3c02da925812ebd02121b,ITmedia_AI_Plus,Tachyon生成AIが最先端7モデルを搭載、LLM出力の比較で業務選択肢広げる,https://kn.itmedia.co.jp/kn/articles/2512/30/news018.html,"Tue, 30 Dec 2025 07:00:00 +0900",エムシーディースリーは法人用「Tachyon生成AI」に世界水準の7種LLMを追加搭載した。専門推論から高速処理まで用途別に活用可能な環境を整備しており、利用者は特性の異なるLLMの結果を見比べ、業務に適した回答を選択可できる。,2026-01-02
406a5aebfaade26ef8be7337150ce3dc,ITmedia_AI_Plus,NPUだけでOpenAIのLLM「gpt-oss」が動く！　速度や消費電力を計測してみた,https://www.itmedia.co.jp/aiplus/articles/2512/29/news040.html,"Mon, 29 Dec 2025 12:00:00 +0900",NPUを搭載していてもLLMの実行についてはあまり良い話がなかったAI PCだが、AMDのNPUではOpenAIの「gpt-oss」を実行できるようになった。NPUで実行した場合の文章生成速度や消費電力などを計測してみた。,2026-01-02
8d957b2352a9d805c9caba6b63c7bb79,ITmedia_AI_Plus,動画生成AIが物議に……漫画「1年間、生成AIに翻弄されるWebメディア編集部」【残り2話】,https://www.itmedia.co.jp/aiplus/articles/2512/29/news019.html,"Mon, 29 Dec 2025 09:00:00 +0900",2025年は生成AI関連の話題で盛りだくさん。AI関連のニュースを追いかけるITmedia AI＋編集部も大忙しでした。本連載ではそんな激動の1年間と、止まらないニュースに翻弄され続けた編集部の様子を4コマ漫画化します。,2026-01-02
03eea2f1c1c60f08132558b910cc626c,ITmedia_AI_Plus,生成AI活用のKPI、何にした？　調査で分かったAIで得する企業／損する企業の特徴,https://www.itmedia.co.jp/enterprise/articles/2512/26/news072.html,"Mon, 29 Dec 2025 08:00:00 +0900",生成AI活用企業の多くが設定するKPIとは。それを達成する企業／達成できない企業は何が違うのだろうか。,2026-01-02
982c640b6ba69ddd9e71097f08907f25,ITmedia_AI_Plus,IT部門は“AI前提世界”で何を担うのか？　ITRアナリストが読む「2026年の注目テーマ」【後編】,https://www.itmedia.co.jp/enterprise/articles/2512/29/news015.html,"Mon, 29 Dec 2025 08:00:00 +0900",2026年に問われるのはもはやAIをどう活用するかではなく、AIを前提とした世界で企業が自身をどのように設計し直すのかだと筆者は言います。企業を設計し直すとはどういう意味なのか、また、AIエージェントが運用に進出する中で、IT部門の役割はどう変わるのでしょうか。,2026-01-02
fc21b50e54e8619239ead534982b1931,ITmedia_AI_Plus,OpenAI、最先端AIのリスクに備える新責任者を募集　年俸約8000万円も「ストレスフルな仕事」とCEO,https://www.itmedia.co.jp/news/articles/2512/28/news037.html,"Sun, 28 Dec 2025 17:31:00 +0900",OpenAIは、新役職「Head of Preparedness」（準備責任者）の募集を開始した。フロンティアモデルがもたらすサイバー攻撃や生物学的リスク、メンタルヘルスへの影響などの深刻なリスクを追跡・評価し、製品リリース判断に直結させる役割を担う。年収は約8000万円で、高度な技術力と専門知識が求められる。,2026-01-02
8186dda58322e65ef1803101fb882304,ITmedia_AI_Plus,「バイブコーディング」は崩壊する？　CursorのCEOが“AI丸投げ開発”に警告,https://www.itmedia.co.jp/aiplus/articles/2512/27/news041.html,"Sat, 27 Dec 2025 08:04:00 +0900",AIコーディングツールを手掛けるCursorのトゥルエルCEOは、AIに丸投げする「バイブコーディング」への過度な依存に警鐘を鳴らした。コードの中身を確認しない開発は規模拡大に伴い破綻するリスクがあると指摘。AIの支援を活用しつつも、人間が詳細を把握・制御する重要性を強調した。,2026-01-02
d418e098fa8c053097dd0d50b730506a,ITmedia_AI_Plus,楽天、7000億パラメータの日本語LLM「Rakuten AI 3.0」を発表　各種サービスに展開予定,https://www.itmedia.co.jp/enterprise/articles/2512/27/news025.html,"Sat, 27 Dec 2025 08:00:00 +0900",楽天が日本語特化LLM「Rakuten AI 3.0」を発表した。MoE採用で性能と計算効率を両立し、日本語版MT-Benchで高得点を記録している。GENIAC支援のもと自社サービスへ導入する他、来春にはオープンウェイトモデルとしての公開を予定している。,2026-01-02
bd8a5182733ca35dc52c45d5b541333b,ITmedia_AI_Plus,企業の生成AI活用に起きた“3つの変化”　ヒット記事で振り返る2025年のトレンド,https://www.itmedia.co.jp/enterprise/articles/2512/27/news020.html,"Sat, 27 Dec 2025 08:00:00 +0900",2025年の生成AIトレンドを凝縮した年間ランキングを公開。企業が生成AIの「本格導入」へと進む中、読者が注目した技術や活用事例とは。激動の1年を振り返り、2026年の展望を考察する。,2026-01-02
87d72d078551b7c09e8efd96002e3332,ITmedia_AI_Plus,波紋呼ぶ“生成AI×知的財産の保護”の新ルール案へのパブコメ募集スタート　1月26日まで,https://www.itmedia.co.jp/aiplus/articles/2512/26/news116.html,"Fri, 26 Dec 2025 18:10:00 +0900",内閣府が、生成AIと知的財産権の保護に関する規制案のパブリックコメントの募集を始めた。,2026-01-02
8db4974c1e697d17585820342eb9bb64,ITmedia_AI_Plus,JR東海、自動運転のティアフォーに出資　「リニアとの連携」見込む,https://www.itmedia.co.jp/aiplus/articles/2512/26/news113.html,"Fri, 26 Dec 2025 17:29:00 +0900",JR東海は、自動運転技術を開発するティアフォーに出資したと発表した。,2026-01-02
83f6b19479ca97656fa4c047bb576f32,Hatena_IT,AIエージェント時代、正直しんどい話,https://zenn.dev/ryo369/articles/d02561ddaacc62,,AIエージェント時代、正直しんどい話 2025年12月31日 年末やし、今年AIと格闘してきた感想を正直に書いておこうと思う。 今日、Qiitaで「Agent OS」っていうClaude Codeの拡張ツールの記事を読んだ。仕様駆動開発をAIエージェントで回せますよ、サブエージェントに仕事振れますよ、みたいな話。 一見ええやんって思うや...,2026-01-02
992ec263a22f1df7ee64d1dab7024ce3,Hatena_IT,2026 年に押さえておきたい AI トレンド 38 選 - izanami,https://izanami.dev/post/3f1f4ef3-2246-4b7a-b911-26b1b8980899,,SLM のメリットは ローカルで動くからプライバシーが守れる API コストがかからん レスポンスが速い オフラインでも使える 「LLM じゃないと精度が出んやろ」って思うかもしれんけど、特定のタスクに特化させれば SLM でも十分な性能が出る。ファインチューニングと組み合わせると、コスパ最強の AI システムが作れるで ...,2026-01-02
ede3a03c6e38b41e77452f9f04d2b66c,Hatena_IT,Geminiの「Gem」機能のTips集(1/3)：基本編｜榎本大貴 / LITALICO研究所所長,https://note.com/enomotod/n/na943723d9b20,,"この記事はLITALICO Advent Calendar 2025として書こうと思っていたのですが、まんまと遅延してしまい、さすがに2025年中には出さないといけないと思ってなんとか書き上げたものです。 書いていくうちに10,000文字を超えてしまい、さすがに１記事にするのは微妙かと思って分割しました。 ▼LITALICO Advent Calendar 2025...",2026-01-02
12786c109725ebaa364f4178b3822ffb,Hatena_IT,Geminiの「Gem」機能のTips集(2/3)：応用編（知識機能、ハルシネーション抑制、自己点検、引用マーカー排除）｜榎本大貴 / LITALICO研究所所長,https://note.com/enomotod/n/n478915d143dd,,Geminiの「Gem」機能のTips集(2/3)：応用編（知識機能、ハルシネーション抑制、自己点検、引用マーカー排除） この記事は、前回の記事で紹介した「基本編」の続きです。基本編では、Gemのプロンプトを書く際の基本的な構造や、強調・リストなどの基本的なTipsを紹介しました。 今回は、僕が実際に使っていて「これ便利だ...,2026-01-02
c03862322c5510d6215288e1233714e0,Hatena_IT,NotebookLM をソースとした Gemini の Gem で問題定義サポーターというツールを作った - Tbpgr Blog,https://tbpgr.hatenablog.com/entry/2026/01/02/151033,,しばらく前に Gemini のソース情報として NotebookLM を指定可能になりました。 tbpgr.hatenablog.com 今回は、その新機能を利用して NotebookLM をソースとした Gemini の Gem で問題定義サポーターというツールを作りました。 Gem は公開設定にしてあり、皆さんも利用可能にしてあります。 できること 整理したい問題...,2026-01-02
