id,source,title,link,published,summary,collected_date
73e18c66d50f2504a0ccd314779438bc,GCP_Blog,Announcing docs.cloud.google.com: The new home for Google Cloud documentation,https://cloud.google.com/blog/topics/developers-practitioners/announcing-docscloudgooglecom-the-new-home-for-google-cloud-documentation/,"Wed, 29 Oct 2025 09:11:00 +0000","We've reached a significant milestone in improving our documentation experience with the launch of a new, dedicated home for all Google Cloud technical documentation at https://docs.cloud.google.com.
...",2025-11-02
197278911a98cb40b130956f4e0d2bfe,GCP_Blog,The Blueprint: How Giles AI transforms medical research with conversational AI,https://cloud.google.com/blog/products/ai-machine-learning/the-blueprint-giles-ai-transforming-medical-research-conversational-generative-ai/,"Tue, 28 Oct 2025 19:00:00 +0000","Welcome to The Blueprint, a new feature where we highlight how Google Cloud customers are tackling unique and common challenges across industries using the latest AI and cloud technologies. We hope to...",2025-11-02
0346e37b0447acdd3b805f5edea65735,GCP_Blog,"Expanding our NVIDIA partnership: Now shipping A4X Max, Vertex AI Training, and more",https://cloud.google.com/blog/products/compute/now-shipping-a4x-max-vertex-ai-training-and-more/,"Tue, 28 Oct 2025 18:30:00 +0000","Today's AI models are moving from billions to trillions of parameters, and are capable of complex, multi-modal reasoning. This leap in sophistication demands a new class of purpose-built infrastructur...",2025-11-02
ed76affc31487947d265c743a5774b94,GCP_Blog,Unlock the AI performance you need: Introducing managed DRANET for A4X Max on GKE,https://cloud.google.com/blog/products/networking/introducing-managed-dranet-in-google-kubernetes-engine/,"Tue, 28 Oct 2025 18:30:00 +0000","As AI/ML models grow, their infrastructure demands are pushing traditional networking to its limit, creating critical performance bottlenecks. This is especially true for models running on Kubernetes ...",2025-11-02
1fc0b0d03f6d81e9b2e07d42173c495c,GCP_Blog,From Oracle transactions to AI actions: Activate your data with intelligent automation,https://cloud.google.com/blog/products/databases/integrating-oracle-with-google-cloud-for-ai-automation/,"Tue, 28 Oct 2025 16:00:00 +0000","Many enterprises have built their foundational business operations on robust transactional systems powered by Oracle Database. And with Oracle on Google Cloud, they can deploy and manage Oracle Databa...",2025-11-02
24121c8dbe4c2154554939b3224dbaf3,GCP_Blog,Enabling a safe agentic web with reCAPTCHA,https://cloud.google.com/blog/products/identity-security/enabling-a-safe-agentic-web-with-recaptcha/,"Tue, 28 Oct 2025 16:00:00 +0000","The emergence of the agentic web — an internet where autonomous AI agents can independently execute complex, multi-step tasks and transactions that previously required human interaction — promises a f...",2025-11-02
000d6894192ecbfa8deb5370894f990c,GCP_Blog,Agent Factory Recap: AI Agents for Data Engineering and Data Science,https://cloud.google.com/blog/topics/developers-practitioners/agent-factory-recap-ai-agents-for-data-engineering-and-data-science/,"Tue, 28 Oct 2025 15:17:00 +0000","Welcome to another exciting episode of The Agent Factory, the podcast that goes beyond the hype to build production-ready AI agents! In this episode, we were thrilled to host Lucia Subatin, who guided...",2025-11-02
a52b0ec114efa88715bf29c8293229f1,GCP_Blog,Keys to the Kingdom: A Defender's Guide to Privileged Account Monitoring,https://cloud.google.com/blog/topics/threat-intelligence/privileged-account-monitoring/,"Tue, 28 Oct 2025 14:00:00 +0000","Written by: Bhavesh Dhake, Will Silverstone, Matthew Hitchcock, Aaron Fletcher

The Criticality of Privileged Access in Today's Threat Landscape
Privileged access stands as the most critical pathway f...",2025-11-02
110e3e06ec294821c9da8e90a6c8c4fc,GCP_Japan,NVIDIA とのパートナーシップを拡大: A4X Max、Vertex AI Training などの提供を開始,https://cloud.google.com/blog/ja/products/compute/now-shipping-a4x-max-vertex-ai-training-and-more/,"Fri, 31 Oct 2025 03:10:00 +0000","※この投稿は米国時間 2025 年 10 月 29 日に、Google Cloud blog に投稿されたものの抄訳です。
今日の AI モデルは、数十億パラメータから数兆パラメータに進化し、複雑なマルチモーダル推論が可能になっています。この飛躍的な高度化に対応するには、次世代モデルの膨大なコンピューティング要件とメモリ要件を処理するための、専用に構築された新しいクラスのインフラストラクチャとソフ...",2025-11-02
76d86f7302f7243237e017f41bad42e7,GCP_Japan,G4 VM の一般提供開始: ビジュアル コンピューティングと AI 向けの NVIDIA GPU ポートフォリオが拡大,https://cloud.google.com/blog/ja/products/compute/g4-vms-powered-by-nvidia-rtx-6000-blackwell-gpus-are-ga/,"Fri, 31 Oct 2025 02:00:00 +0000","※この投稿は米国時間 2025 年 10 月 21 日に、Google Cloud blog に投稿されたものの抄訳です。
今日のマルチモーダル ワークロードの多くは、必要なパフォーマンスとスループットを実現するために、GPU ベースのアクセラレータ、大容量の GPU メモリ、プロフェッショナル グラフィックスを強力に組み合わせる必要があります。このたび、Google は NVIDIA の RTX...",2025-11-02
73230a194d3cfa4ae5bb70e65ce4a4a6,GCP_Japan,必要な AI パフォーマンスを実現: GKE 上の A4X Max 向けマネージド DRANET のご紹介,https://cloud.google.com/blog/ja/products/networking/introducing-managed-dranet-in-google-kubernetes-engine/,"Fri, 31 Oct 2025 02:00:00 +0000","※この投稿は米国時間 2025 年 10 月 29 日に、Google Cloud blog に投稿されたものの抄訳です。
AI/ML モデルの成長に伴い、インフラストラクチャの需要が従来のネットワーキングの限界に達し、重大なパフォーマンス ボトルネックが生じています。これは、Kubernetes と Google Kubernetes Engine（GKE）で実行されるモデルに特に当てはまります...",2025-11-02
4512df5e6ce5bb2235c76975754f0881,GCP_Japan,ランサムウェアの猛威と「守りの再構築」,https://cloud.google.com/blog/ja/products/identity-security/ransomwares-rampancy-and-rebuilding-defenses/,"Fri, 31 Oct 2025 01:00:00 +0000",昨今のサイバー脅威環境において、もはやランサムウェアは「一過性のマルウェア感染」ではありません。それは、企業の存続、ブランドの信頼、そしてビジネス継続性を直接脅かす最大のサイバーリスクとなっています。警察庁は、2025 年上半期におけるランサムウェアの国内被害報告件数は 116 件で、半期の件数としては 2022 年下半期と並び最多となっていると報告しており、防御側にとってはますます困難な状況が続...,2025-11-02
1d94435f07a37c8962f410ba3cb861c1,GCP_Japan,Vertex AI SDK でのプロンプト管理の発表,https://cloud.google.com/blog/ja/products/ai-machine-learning/manage-your-prompts-using-vertex-sdk/,"Thu, 30 Oct 2025 01:04:00 +0000","※この投稿は米国時間 2025 年 10 月 17 日に、Google Cloud blog に投稿されたものの抄訳です。
生成 AI アプリケーションの高度化が進むにつれて、開発ワークフローはより断片化されます。AI は生産性を高める力となりますが、チームによっては、プロンプトを 1 つの環境で設計し、スプレッドシートやテキスト ファイルでバージョンを管理し、それらをコードに手動で統合している場...",2025-11-02
0d3d9aeb0f2c274ce9469ccb0d5694cc,GCP_Japan,Google Gen AI .NET SDK のご紹介,https://cloud.google.com/blog/ja/topics/developers-practitioners/introducing-google-gen-ai-net-sdk/,"Thu, 30 Oct 2025 01:03:00 +0000","※この投稿は米国時間 2025 年 10 月 24 日に、Google Cloud blog に投稿されたものの抄訳です。
昨年、Google は Google AI における Gemini（Gemini Developer API 経由）と Vertex AI（Vertex AI API 経由）上の Gemini 向けの新しい統合ライブラリとして、Google Gen AI SDK を発表しまし...",2025-11-02
9b35362afe9f284f7120cf8cea9a21c6,GCP_Japan,Oracle E-Business Suite のゼロデイが広範囲にわたる恐喝キャンペーンで悪用される,https://cloud.google.com/blog/ja/topics/threat-intelligence/oracle-ebusiness-suite-zero-day-exploitation/,"Thu, 30 Oct 2025 01:02:00 +0000"," 

※この投稿は米国時間 2025 年 10 月 10 日に、Google Cloud blog に投稿されたものの抄訳です。
はじめに
2025 年 9 月 29 日より、Google Threat Intelligence Group（GTIG）と Mandiant は、CL0P 恐喝ブランドとの関連を主張する脅威アクターによる、新たな大規模恐喝キャンペーンの追跡を開始しました。脅威アクター...",2025-11-02
f9cb232dd4b3206a28c75100405ba4ba,GCP_Japan,最前線からのサイバー犯罪の観測：UNC6040に対する予防的強化の推奨事項,https://cloud.google.com/blog/ja/topics/threat-intelligence/unc6040-proactive-hardening-recommendations/,"Thu, 30 Oct 2025 01:01:00 +0000"," 

※この投稿は米国時間 2025 年 10 月 1 日に、Google Cloud blog に投稿されたものの抄訳です。
背景
Software as a Service（SaaS）プラットフォームとアプリケーションを保護するには、包括的なセキュリティ戦略が必要です。このガイドでは、UNC6040 の具体的な攻撃手法の分析に基づき、予防的な強化対策、包括的なロギング プロトコル、高度な検出機...",2025-11-02
9236b4b22f168dc529157cbbe5b5f330,GCP_Japan,Agent Factory のハイライト: エージェントの評価、実用的なツール、マルチエージェント システムの詳細,https://cloud.google.com/blog/ja/topics/developers-practitioners/agent-factory-recap-a-deep-dive-into-agent-evaluation-practical-tooling-and-multi-agent-systems/,"Thu, 30 Oct 2025 01:00:00 +0000","※この投稿は米国時間 2025 年 10 月 21 日に、Google Cloud blog に投稿されたものの抄訳です。
エージェントが実際に機能しているかどうかをどのように判断すればよいでしょうか？これは、開発において最も複雑でありながら、最も重要な問題の一つです。Agent Factory ポッドキャストの最新エピソードでは、セッション全体を通してエージェント評価を徹底解説しました。引き続き...",2025-11-02
172de2a8ae01ea096de77637fa2754bf,GCP_Japan,大規模なトレーニング向けの Vertex AI Training の新機能を発表,https://cloud.google.com/blog/ja/products/ai-machine-learning/new-capabilities-in-vertex-ai-training-for-large-scale-training/,"Wed, 29 Oct 2025 03:00:00 +0000","※この投稿は米国時間 2025 年 10 月 28 日に、Google Cloud blog に投稿されたものの抄訳です。
生成 AI モデルの構築とスケーリングには膨大なリソースが必要ですが、このプロセスは退屈になってきます。開発者が一貫した結果を確保するためには、ジョブキューの管理、クラスタのプロビジョニング、依存関係の解決が必要です。このインフラストラクチャのオーバーヘッドと、最適なトレーニ...",2025-11-02
a885c1c8f5aba385548775f35566e21b,GCP_Japan,国内 100 以上の事例に学ぶ、AI エージェント時代の生成 AI 活用術。顧客体験、生産性向上の最前線,https://cloud.google.com/blog/ja/products/ai-machine-learning/generative-ai-utilization-techniques-for-the-ai-agent-era/,"Wed, 29 Oct 2025 02:00:00 +0000",2025 年は、生成 AI の活用が新たなステージへと移行する年です。単なるチャットボットから、自律的にタスクをこなす高度な 「AI エージェント」 へと進化する中、Google Cloud は企業向け AI エージェント統合プラットフォーム 「Gemini Enterprise」 や、Agent Development Kit (ADK)、Agent2Agent (A2A) プロトコル、Agen...,2025-11-02
fc1ccef90d2ae4a25fab899b2720666c,GCP_Japan,Google の未来であるマルチアーキテクチャに向けて AI と自動化がその実現を支援,https://cloud.google.com/blog/ja/topics/systems/using-ai-and-automation-to-migrate-between-instruction-sets/,"Tue, 28 Oct 2025 02:00:00 +0000","※この投稿は米国時間 2025 年 10 月 22 日に、Google Cloud blog に投稿されたものの抄訳です。
Google 初の Arm® ベースのカスタム CPU である Google Axion プロセッサは、Google Cloud のお客様と Google のファーストパーティ サービスにパフォーマンスとエネルギー効率の両方を提供するうえで大きな一歩となります。Google ...",2025-11-02
65a0d008b1b79240cb49eee977904c78,GCP_Japan,新しい BigQuery Studio エクスペリエンス: データ分析の生産性が向上,https://cloud.google.com/blog/ja/products/data-analytics/bigquery-studio-gets-improved-console-interface/,"Tue, 28 Oct 2025 01:10:00 +0000","※この投稿は米国時間 2025 年 10 月 18 日に、Google Cloud blog に投稿されたものの抄訳です。
BigQuery Studio は、データ アナリスト、データ エンジニア、データ サイエンティストをターゲットとし、1 つの専用プラットフォーム内で包括的な分析エクスペリエンスを提供して、データを強力なインサイトに転換できるように設計されています。
そして本日、BigQue...",2025-11-02
e4110e5f9171bb7e89fc6439c22f58b0,GCP_Japan,Gemini で Vertex AI コンテキスト キャッシュを使用すると、費用を節約し、レイテンシを短縮できます,https://cloud.google.com/blog/ja/products/ai-machine-learning/vertex-ai-context-caching/,"Tue, 28 Oct 2025 01:00:00 +0000","※この投稿は米国時間 2025 年 10 月 16 日に、Google Cloud blog に投稿されたものの抄訳です。
開発者がより高度な AI アプリケーションを構築する中で、長いドキュメント、詳細なシステム指示、コードベースなどの大量のコンテキスト情報をモデルに繰り返し送信する必要がある、といった状況にしばしば直面します。こうしたデータは、モデルが適切な応答を行うために欠かせないコンテキス...",2025-11-02
fe87e322c7afba79d55bacb715ec25fa,GCP_Japan,Google Cloud でのカオス エンジニアリング: 原則、実践、開始方法,https://cloud.google.com/blog/ja/products/devops-sre/getting-started-with-chaos-engineering/,"Mon, 27 Oct 2025 01:30:00 +0000",※この投稿は米国時間 2025 年 10 月 14 日に、Google Cloud blog に投稿されたものの抄訳です。エンジニアであれば誰でも、完璧な復元力を持つシステムを夢見ます。完璧にスケーリングし、優れたユーザー エクスペリエンスを提供し、決してダウンしないシステムです。このような復元力のあるシステムを構築する鍵が、障害を回避することではなく、意図的に障害を引き起こすことだとしたらどうで...,2025-11-02
816708e736024b507a9fe7a7501d838e,GCP_Japan,BigQuery データ クリーンルームのクエリ テンプレートによる安全なデータ コラボレーション,https://cloud.google.com/blog/ja/products/data-analytics/query-templates-for-bigquery-data-clean-rooms/,"Mon, 27 Oct 2025 01:10:00 +0000","※この投稿は米国時間 2025 年 10 月 15 日に、Google Cloud blog に投稿されたものの抄訳です。
昨今のデータドリブンな環境では、安全かつ効率的にコラボレーションできることが最も重要です。BigQuery データ クリーンルームは、機密情報を損なうことなく、複数の関係者がデータを共有、結合、分析できる、堅牢で安全な環境を提供します。これを基盤にして、Google は本日、...",2025-11-02
ce66251c80fe7e6d129bdce6f1d4b272,GCP_Japan,オープンソースでエンタープライズ対応: Google Cloud 向けの IBM Spectrum Symphony コネクタ,https://cloud.google.com/blog/ja/topics/hpc/announcing-new-ibm-spectrum-symphony-hostfactory-connectors/,"Mon, 27 Oct 2025 01:00:00 +0000","※この投稿は米国時間 2025 年 10 月 15 日に、Google Cloud blog に投稿されたものの抄訳です。
Google Cloud は、お客様がハイ パフォーマンス コンピューティング（HPC）のグリッド ワークロードを Google のプラットフォームにデプロイしていただけるように取り組んでいます。このたび、オープンソースの Google Compute Engine および ...",2025-11-02
d290ca1e60a11b69ca36ac0155e734af,GCP_Japan,LLM-Evalkit のご紹介: Google Cloud でのプロンプト エンジニアリングのための実用的なフレームワーク,https://cloud.google.com/blog/ja/products/ai-machine-learning/introducing-llm-evalkit/,"Fri, 24 Oct 2025 03:00:00 +0000","※この投稿は米国時間 2025 年 10 月 14 日に、Google Cloud blog に投稿されたものの抄訳です。
大規模言語モデル（LLM）を使用したことがある方なら、チームのプロンプトがドキュメント、スプレッドシート、さまざまなクラウド コンソールに散在している状況をよくご存じでしょう。多くの場合、イテレーションは手動で非効率的なプロセスであるため、どの変更が実際にパフォーマンスを向上...",2025-11-02
65a2075d94f80bfb74981d9b628e1abc,GCP_Japan,ブロック ストレージとファイル ストレージを統合して、クラウドでの貴社のエンタープライズ アプリケーションを強化,https://cloud.google.com/blog/ja/products/storage-data-transfer/announcing-enhancements-to-google-cloud-netapp-volumes/,"Fri, 24 Oct 2025 03:00:00 +0000","※この投稿は米国時間 2025 年 10 月 15 日に、Google Cloud blog に投稿されたものの抄訳です。
エンタープライズ アプリケーションをクラウドに移行するには、高性能なブロック ワークロードからグローバルに分散されたファイル アクセスまで、あらゆるものを処理できるストレージ基盤が必要です。これらの課題を解決するため、Google Cloud NetApp Volumes に...",2025-11-02
b9f654b0459d80eb0a20db9c1b9ca9fe,GCP_Japan,Gemini Code Assist、エンタープライズ向けの AI コードレビューを GitHub に導入,https://cloud.google.com/blog/ja/products/ai-machine-learning/gemini-code-assist-in-github-for-enterprises/,"Fri, 24 Oct 2025 02:40:00 +0000","※この投稿は米国時間 2025 年 10 月 16 日に、Google Cloud blog に投稿されたものの抄訳です。
エンジニアリング チームにとって重要な DORA 指標のひとつは、「変更のリードタイム」つまり、コードの commit から本番環境へのデプロイまでの所要時間です。DORA が発表した 2025 年度「State of AI-Assisted Development レポート...",2025-11-02
f6ea5ddb69a235034102c8524a20957d,Ggen_Blog,ライオンのデータマネジメント,https://blog.g-gen.co.jp/entry/data-management-of-lion-corporation,2025-10-30T09:00:00+09:00,当記事は、ライオン株式会社様と株式会社G-genの技術情報発信コラボレーション企画『SAPと連携するデータ分析基盤の実践とTips』で執筆されたものです。 はじめに 当企画について 自己紹介 当記事について 概要 データマネジメントのプロセス アジリティ、ガバナンス、利活用促進のバランス 設計 3つのレイヤ DataLake DWH Datamart データカタログとメタデータ 実現するためのプロ...,2025-11-02
0b0cfcc19a1bb9c1bfa14d21cec05597,Ggen_Blog,Google AI Studio vs Vertex AI。違いや選び方を解説,https://blog.g-gen.co.jp/entry/google-ai-studio-vs-vertex-ai,2025-10-27T09:00:00+09:00,G-gen の杉村です。Google の生成 AI 開発ツールである Vertex AI と Google AI Studio の違いや、それぞれのユースケースについて解説します。 概要 Vertex AI と Google AI Studio 差異の一覧 選定の基本的な考え方 セキュリティと統制 Vertex AI の場合 Google AI Studio の場合 Google Cloud プロ...,2025-11-02
5c1eea2a304d43fc55e5b013387c62ab,Ggen_Blog,ADKのWeb UIによる評価とデバッグ,https://blog.g-gen.co.jp/entry/evaluation-and-debugging-with-adk,2025-10-24T09:00:00+09:00,G-gen の min です。Agent Development Kit（ADK）の Web UI による評価とデバッグの方法を解説します。 はじめに ADK とは 評価とデバッグ Event とは 必要な依存関係 デバッグ機能 概要 Events ビュー Trace ビュー 評価機能 概要 1. テストケースの作成 2. 評価の実行 3. 結果の分析 実践 実践例 1. 正常系の動作確認 2. ...,2025-11-02
ae65fb90e814649b0370a2d3cdacd56a,Ggen_Blog,Google SecOps(Google Security Operations)を徹底解説！,https://blog.g-gen.co.jp/entry/google-secops-explained,2025-10-22T09:00:00+09:00,"G-gen の武井です。当記事では、Google Cloud が提供するセキュリティ運用プラットフォームである Google SecOps を徹底解説します。 Google SecOps とは 概要 主な特徴 主な機能 エディションと料金体系 用語と機能 Security Information and Event Management（SIEM） Security Orchestration, ...",2025-11-02
fb9f039f6fc5a61a0ae9534c2cce69b1,Ggen_Blog,NotebookLM Enterprise APIでノートブック管理を自動化,https://blog.g-gen.co.jp/entry/automate-notebooklm-datasource-management,2025-10-20T09:00:00+09:00,G-gen の福井です。Google Workspace Events API と NotebookLM Enterprise API を利用して、Google ドライブ上のファイル操作をトリガーに NotebookLM のノートブック管理を自動化するアーキテクチャと、その実装例を紹介します。 はじめに 当記事の概要 NotebookLM Enterprise とは Google Workspac...,2025-11-02
147b28a451f33b8fa08857f367da55c3,Ggen_Blog,ライオンのデータ基盤構築とSAPデータ活用体制,https://blog.g-gen.co.jp/entry/lion-data-platform-and-sap-data,2025-10-16T09:00:00+09:00,当記事は、ライオン株式会社様と株式会社G-genの技術情報発信コラボレーション企画『SAPと連携するデータ分析基盤の実践とTips』で執筆されたものです。 はじめに 概要 データ基盤整備の必要性 「収益力の強靭化」から見据える未来経営とデジタル改革 データ活用環境の課題 目指す姿 構成設計 当初案 大幅な見直しへ SAPデータ活用に向けて Cortex Frameworkの導入検証について 今後の...,2025-11-02
ea9efec397b79eee40416f5ad90f82b8,Ggen_Blog,Google AgentspaceがGemini Enterpriseとして再発表。変更点を解説,https://blog.g-gen.co.jp/entry/google-agentspace-is-now-gemini-enterprise,2025-10-14T09:00:00+09:00,G-gen の杉村です。2025年10月、Google の AI アシスタントサービス Google Agentspace が Gemini Enterprise に名称変更され、追加の機能とともに再発表されました。変更後のライセンス体系等の違いについて解説します。 Gemini Enterprise とは Gemini Enterprise の発表 発表内容 変更点 ライセンス体系 Gemini...,2025-11-02
7b0fb8c39ffd642c912b2718f66a49e4,Ggen_Blog,Colab、Colab Pro+、Colab Enterpriseを比較して解説,https://blog.g-gen.co.jp/entry/comparison-for-colab-pro-and-enterprise,2025-10-10T09:00:00+09:00,G-genの杉村です。Google Colaboratory、略称 Colab は、Google が提供する Jupyter ノートブックベースの開発環境サービスです。Colab には無料版、従量課金プラン、サブスクリプションプランである Colab Pro と Pro+、そして企業等の組織向けの Colab Enterprise があります。それぞれの違いやユースケースを解説します。 Colab...,2025-11-02
9388bce7892fc72d7d3b611858c880e9,Ggen_Blog,ADKとBigQueryで作るAIエージェントの安全な設計,https://blog.g-gen.co.jp/entry/safer-design-for-adk-bigquery-agents,2025-10-08T09:00:00+09:00,G-gen の min です。Agent Development Kit（ADK）と BigQuery を組み合わせた AI エージェントにおけるリスクを管理し、安全に運用するための設計アプローチを説明します。 はじめに ADK と BigQuery AI エージェントに潜むリスク 多層防御 対策1. ツールセットによる静的制御 書き込み制御（WriteMode） 認証情報の分離（ADC） 対策2...,2025-11-02
e3c933a9a6005977964a78009d8d7df0,Ggen_Blog,GoogleスプレッドシートのAI関数を解説,https://blog.g-gen.co.jp/entry/google-sheets-ai-function-explained,2025-10-06T09:00:00+09:00,G-gen の杉村です。Google スプレッドシートで、セルに関数を入力するだけで生成 AI が利用できる AI 関数について解説します。 はじめに AI 関数とは 利用可能エディション 留意点 仕様 使用例1 : 要約 使用例2 : 感情分析 使用例3 : 翻訳 使用例4 : 文章の生成 制限 はじめに AI 関数とは Google スプレッドシートの AI 関数とは、セルに関数を入力するだけ...,2025-11-02
