id,source,title,link,published,summary,collected_date
40437abe16e2e0716424f7b8773e9509,GCP_Blog,What’s new with Google Data Cloud,https://cloud.google.com/blog/products/data-analytics/whats-new-with-google-data-cloud/,"Thu, 16 Apr 2026 16:00:00 +0000","April 13 - April 17

We announced we are reintroducing Data Studio to play a significant role in the AI era, expanding from data visualizations and reports to host BigQuery conversational agents and d...",2026-04-19
f429d1009ad44678c54220ee5d14d2b0,GCP_Blog,Defending Your Enterprise When AI Models Can Find Vulnerabilities Faster Than Ever,https://cloud.google.com/blog/topics/threat-intelligence/defending-enterprise-ai-vulnerabilities/,"Thu, 16 Apr 2026 14:00:00 +0000","Introduction 
Advances in AI model-powered exploitation have demonstrated that general-purpose AI models can excel at vulnerability discovery, even without being purpose-built for the task. Eventually...",2026-04-19
41c2ae9f697027b27f5316af459ed6ac,GCP_Blog,Building the agentic future: A spotlight on Google Cloud’s media & entertainment partner ecosystem,https://cloud.google.com/blog/products/media-entertainment/agentic-media-and-entertainment-is-here-see-how-our-ecosystem-helps-build-it/,"Thu, 16 Apr 2026 13:15:00 +0000","As we gather in Las Vegas for NAB Show 2026, the industry conversation has shifted. We are no longer asking if AI works; we’re now focused on how it scales. The era of AI experimentation is over — pro...",2026-04-19
32da498d47e0ef1507cd0db3e102ff29,GCP_Blog,Claude Opus 4.7 on Vertex AI,https://cloud.google.com/blog/products/ai-machine-learning/claude-opus-4-7-on-vertex-ai/,"Wed, 15 Apr 2026 18:30:00 +0000","Today, we’re announcing the general availability of Claude Opus 4.7 on Vertex AI. 
What’s new: Anthropic’s newest Opus model delivers advanced performance across coding, long-running agents, and profe...",2026-04-19
3a56bba7814ada812983cf2a2558cf5c,GCP_Blog,Multi-region endpoints are available for Claude on Vertex AI,https://cloud.google.com/blog/products/ai-machine-learning/multi-region-endpoints-for-claude-available-on-vertex-ai/,"Wed, 15 Apr 2026 16:00:00 +0000","Today, we’re announcing U.S. and EU multi-region endpoints for Claude on Vertex AI are available in public preview. By pooling capacity across multiple regions, these endpoints dynamically route reque...",2026-04-19
f48c77926ea215266eec784e23dfdc22,GCP_Blog,Cloud CISO Perspectives: How CISOs can pursue technical and cultural resilience (Q&A),https://cloud.google.com/blog/products/identity-security/cloud-ciso-perspectives-how-cisos-can-pursue-technical-and-cultural-resilience-q-a/,"Wed, 15 Apr 2026 16:00:00 +0000","Welcome to the first Cloud CISO Perspectives for April 2026. Today, Thiébaut Meyer and Lia Wertheimer from Google Cloud’s Office of the CISO share Thiébaut’s conversation with Matt Rowe, chief securit...",2026-04-19
5394f8dd591de0ab3b1a4a1bb21bccda,GCP_Blog,"Cool stuff Google Cloud customers built, April edition: BMW big on SLMs, MLB’s Scout Insights AI, personalized resort experiences",https://cloud.google.com/blog/topics/customers/cool-stuff-google-cloud-customers-built-monthly-round-up/,"Wed, 15 Apr 2026 16:00:00 +0000","AI and cloud technology are reshaping every corner of every industry around the world. Without our customers, who are building the future on our platform, there would be no Google Cloud. In this regul...",2026-04-19
c43ba3e05a47407e5b90d4dbf067b1be,GCP_Blog,Guide to prompting Gemini 3.1 Flash TTS (text-to-speech),https://cloud.google.com/blog/products/ai-machine-learning/gemini-3-1-flash-tts-on-google-cloud/,"Wed, 15 Apr 2026 15:00:00 +0000","Today, Gemini 3.1 Flash TTS, our latest text-to-speech model, is available on Google AI Studio and Vertex AI. It delivers precise controllability and expressivity, empowering developers and enterprise...",2026-04-19
59a2a2f59c539afe3e749c63da6d2c9e,GCP_Blog,The German Cyber Criminal Überfall: Shifts in Europe's Data Leak Landscape,https://cloud.google.com/blog/topics/threat-intelligence/europe-data-leak-landscape/,"Wed, 15 Apr 2026 14:00:00 +0000","Written by: Jamie Collier, Robin Grunewald

Germany has reclaimed its position as a primary focus for cyber extortion in Europe. While data leak site (DLS) posts rose almost 50% globally in 2025, Goog...",2026-04-19
bcb917aaff44b8014b45dc707ab8bf6c,GCP_Blog,Introducing BigQuery Graph: Unlock hidden relationships in your data,https://cloud.google.com/blog/products/data-analytics/introducing-bigquery-graph/,"Tue, 14 Apr 2026 16:00:00 +0000","Today, we're thrilled to announce that BigQuery Graph is now available in preview. With BigQuery Graph, we’ve built an easy-to-use, highly scalable graph analytics solution for data engineers, data an...",2026-04-19
8b03c70c9d242de2f25627453acdaa03,GCP_Blog,From operational to analytical: The unified Spanner Graph and BigQuery Graph solution,https://cloud.google.com/blog/products/data-analytics/the-unified-graph-solution-with-spanner-graph-and-bigquery-graph/,"Tue, 14 Apr 2026 16:00:00 +0000","Understanding the relationships within your data is crucial for uncovering hidden insights and building intelligent applications. However, managing operational (OLTP) and analytical (OLAP) graph workl...",2026-04-19
805603a33edaa320747fab983771e434,GCP_Blog,Securing the AI era across the public sector,https://cloud.google.com/blog/topics/public-sector/securing-the-ai-era-across-the-public-sector/,"Tue, 14 Apr 2026 16:00:00 +0000","The agentic era demands a new security era. Our mission is to be the world’s most trusted security partner in this new era, helping every organization accelerate their security transformation with the...",2026-04-19
ef0f02454f0efa94e8b9a192331c949c,GCP_Blog,"Scaling unstructured enterprise knowledge with BigQuery Graph, and Kineviz GraphXR",https://cloud.google.com/blog/products/data-analytics/using-bigquery-graph-with-kineviz-graphxr/,"Tue, 14 Apr 2026 16:00:00 +0000","Over 80% of enterprise data lives in unstructured form — PDFs, emails, reports, regulatory filings. Most of the time, such sources contain critical business information, yet they remain difficult to a...",2026-04-19
f6c4450b67ad49a721de09c076c9f6c5,GCP_Blog,A new standard for research: How UC Riverside is securing the path to federal grants with Google Public Sector,https://cloud.google.com/blog/topics/public-sector/a-new-standard-for-research-how-uc-riverside-is-securing-the-path-to-federal-grants-with-google-public-sector/,"Mon, 13 Apr 2026 16:00:00 +0000","At the University of California, Riverside (UCR), scientific breakthroughs depend on quickly moving from a hypothesis to a finished study. Yet for many researchers, the path to federal grants is often...",2026-04-19
744cf65589228a4e7ddb94f2f4feb590,GCP_Blog,How to find the sweet spot between cost and performance,https://cloud.google.com/blog/products/ai-machine-learning/build-a-robust-and-cost-effective-gen-ai-strategy/,"Mon, 13 Apr 2026 16:00:00 +0000","At Google Cloud, we often see customers asking themselves: ""How can we manage our generative AI costs effectively without sacrificing the performance and availability our applications demand?"" 
This i...",2026-04-19
af923f1be97dca9d941cc585179404b1,GCP_Blog,"Building Event-Driven Data Agents with BigQuery, Pub/Sub, and ADK",https://cloud.google.com/blog/topics/developers-practitioners/building-event-driven-data-agents-with-bigquery-pubsub-and-adk/,"Fri, 10 Apr 2026 21:00:00 +0000","The Need for Real-Time Autonomous Agents
Data is only as valuable as your ability to act on it. In the modern enterprise, reacting to events hours—or even minutes—after they occur is often too late. W...",2026-04-19
aadda3e8612e4e3bf6c27b76cb346d9f,GCP_Japan,Google Cloud と米国代表チームによる分析の裏側: 米国冬季オリンピック選手のための AI インフラストラクチャの設計,https://cloud.google.com/blog/ja/products/media-entertainment/architecting-ai-infrastructure-for-us-winter-olympians/,"Fri, 17 Apr 2026 03:00:00 +0000","※この投稿は米国時間 2026 年 4 月 11 日に、Google Cloud blog に投稿されたものの抄訳です。
従来の動画再生では、フリースタイル スキーやスノーボードにおける複雑な空中技の様子はわかりますが、その技がどのようにして実現されたかという物理的な説明はできません。スポーツのスピードでは、高速の動作を実用的なデータ（関節の角度、回転速度、体の縮め具合）に変換することは非常に困難...",2026-04-19
19182699a8bf71639cd18f68f3dabd40,GCP_Japan,データレイヤの有効化によるプロダクション レディな AI の実現,https://cloud.google.com/blog/ja/topics/developers-practitioners/activating-your-data-layer-for-production-ready-ai/,"Fri, 17 Apr 2026 02:00:00 +0000","※この投稿は米国時間 2026 年 4 月 3 日に、Google Cloud blog に投稿されたものの抄訳です。
生成 AI を使用したアプリケーションやシステムとそれらがもたらす新たな機会について議論する際、データはエコシステム内で代替不可能なコンポーネントとして位置づけられます。具体的には、企業が日々収集、保持、使用しているデータが該当します。このデータは、アプリケーション、分析、ナレッ...",2026-04-19
a73ec5746c0ab320f2856174e31968e7,GCP_Japan,Envoy: エージェント型 AI ネットワーキングのための将来を見据えた基盤,https://cloud.google.com/blog/ja/products/networking/the-case-for-envoy-networking-in-the-agentic-ai-era/,"Fri, 17 Apr 2026 01:30:00 +0000","※この投稿は米国時間 2026 年 4 月 4 日に、Google Cloud blog に投稿されたものの抄訳です。
昨今のエージェント型 AI 環境では、ネットワークに新たな責任が課せられています。
従来のアプリケーション スタックでは、ネットワークは主にサービス間でリクエストを移動するものでした。しかし、最近のホワイト ペーパー Cloud Infrastructure in the Age...",2026-04-19
9fa1aa4d8bfd924285dbd62ec7847ec6,GCP_Japan,Honeylove が BigQuery を活用して製品の品質とサービスの効率を向上させた方法,https://cloud.google.com/blog/ja/products/data-analytics/how-honeylove-boosts-product-quality-and-service-efficiency-with-bigquery/,"Fri, 17 Apr 2026 01:00:00 +0000","※この投稿は米国時間 2026 年 4 月 3 日に、Google Cloud blog に投稿されたものの抄訳です。
完璧なブラの制作には、数千ものデータポイントが利用されます。
Honeylove が単なる下着ブランドではない理由はそこにあります。当社は、優れたブラジャー、トップス、補正下着、ボディスーツを製造するテクノロジー企業です。顧客からのフィードバックに基づいて製品を反復的に改良する方...",2026-04-19
a9591f77a92f77e02a957e022d4f233c,GCP_Japan,新しい GKE Cloud Storage FUSE プロファイルにより、AI ストレージの構成における当て推量が不要に,https://cloud.google.com/blog/ja/products/containers-kubernetes/optimize-aiml-workloads-with-gke-cloud-storage-fuse-profiles/,"Thu, 16 Apr 2026 02:00:00 +0000","※この投稿は米国時間 2026 年 4 月 9 日に、Google Cloud blog に投稿されたものの抄訳です。
AI / ML の世界では、データはトレーニングと推論のワークロードに欠かせない要素です。Google Kubernetes Engine（GKE）ユーザーは、Cloud Storage FUSE を使用して Google Cloud Storage に保存されているデータに高い...",2026-04-19
c613054e5b7bbbaeea51624a9b3f53e6,GCP_Japan,Spanner の完全に相互運用可能なマルチモデル データベースを使用した実際の成功事例,https://cloud.google.com/blog/ja/products/databases/customers-see-real-world-success-with-multi-model-spanner/,"Thu, 16 Apr 2026 01:00:00 +0000","※この投稿は米国時間 2026 年 4 月 1 日に、Google Cloud blog に投稿されたものの抄訳です。
生成 AI の基盤を築くマルチモデル データベースの力に焦点を当てた最初の投稿では、組織がデータベースのアーキテクチャと管理に対する従来のアプローチでもたらされる課題を克服するうえで、Google Cloud Spanner がどのように役立つかを説明しました。この投稿では、4 ...",2026-04-19
32d0f3400c4de46cccbf411e1f1e42c4,GCP_Japan,Vertex AI の Lyria 3 モデルで音楽生成をアプリに組み込む,https://cloud.google.com/blog/ja/products/ai-machine-learning/lyria-3-and-lyria-3-pro-on-vertex-ai/,"Tue, 14 Apr 2026 03:00:00 +0000","※この投稿は米国時間 2026 年 4 月 8 日に、Google Cloud blog に投稿されたものの抄訳です。
最新情報: Google の音楽生成モデル ファミリーである Lyria 3 が、Vertex AI で公開プレビュー版としてご利用いただけるようになりました。Lyria 3 モデルを使用すると、テキスト プロンプトや画像から、ボーカル サポート付きの高音質かつ高忠実度のステレオ...",2026-04-19
1a5d479a392ae455366709b501f598e4,GCP_Japan,膨大な表計算作業から脱却。AI と数理最適化で実現する、需要予測の先の「発注・在庫管理の自動化」,https://cloud.google.com/blog/ja/topics/customers/cainz-breaks-free-from-the-burden-of-massive-spreadsheet-work/,"Tue, 14 Apr 2026 03:00:00 +0000",商品、サービス、店舗を通じて、より効率的で最適なサプライチェーンの実現を目指す中で、需要予測の精度向上は株式会社カインズにとっても最優先課題です。しかし、精度の高い需要予測モデルを構築し予測結果を出力することはサプライチェーン全体においては入り口に過ぎません。実際には、予測値が出た後に、SKU ごとの特性や季節性に応じた「予測結果の精査」や「発注・在庫管理のためのメンテナンス」という不可欠な実務工...,2026-04-19
637c6cfb29a5b414f7ef26268351444c,GCP_Japan,GKE Inference Gateway を使用して、同じインフラストラクチャでリアルタイム推論と非同期推論を実行する,https://cloud.google.com/blog/ja/products/containers-kubernetes/unifying-real-time-and-async-inference-with-gke-inference-gateway/,"Tue, 14 Apr 2026 01:00:00 +0000","※この投稿は米国時間 2026 年 4 月 2 日に、Google Cloud blog に投稿されたものの抄訳です。
AI ワークロードが実験的なプロトタイプから本番環境グレードのサービスに移行するのに伴い、それらをサポートするインフラストラクチャは、利用率のギャップが拡大するという課題に直面しています。昨今の企業は通常、同時実行性が高く、低レイテンシのリアルタイム リクエストに対応するシステム...",2026-04-19
a658549490c8a182fe51d3744287e028,GCP_Japan,Claude Mythos Preview: Vertex AI で限定公開プレビュー版を提供開始,https://cloud.google.com/blog/ja/products/ai-machine-learning/claude-mythos-preview-on-vertex-ai/,"Mon, 13 Apr 2026 02:00:00 +0000","※この投稿は米国時間 2026 年 4 月 8 日に、Google Cloud blog に投稿されたものの抄訳です。
Anthropic の最新かつ最も強力なモデルである Claude Mythos Preview が、Project Glasswing の一環として、Google Cloud の一部のお客様を対象に限定公開プレビュー版で利用可能になりました。
Vertex AI での Clau...",2026-04-19
10952c31223423cf923bd162dff24058,GCP_Japan,Google Cloud で利用できる Gemma 4 の概要: Google の最も高性能なオープンモデル,https://cloud.google.com/blog/ja/products/ai-machine-learning/gemma-4-available-on-google-cloud/,"Mon, 13 Apr 2026 02:00:00 +0000","※この投稿は米国時間 2026 年 4 月 3 日に、Google Cloud blog に投稿されたものの抄訳です。
今回、Google Cloud での Gemma 4 をリリースいたしました。
最新情報: これは、サイズに対して最も高性能なオープンモデル ファミリーです。Gemini 3 と同じ研究に基づいて構築され、商用利用の自由度が高い Apache 2.0 ライセンスでリリースされたこ...",2026-04-19
0efcb8b4f37d1f859670ccf2168a5a1a,GCP_Japan,"ID.me、1 億 6,000 万ユーザーに対応するスケーリングと運用リスクの軽減を同時に達成",https://cloud.google.com/blog/ja/products/databases/id-me-scales-and-fights-ai-fraud-with-alloydb/,"Thu, 09 Apr 2026 02:00:00 +0000","※この投稿は米国時間 2026 年 3 月 31 日に、Google Cloud blog に投稿されたものの抄訳です。
編集者注: ID.me は、デジタル ID のセキュリティを変革することで、ID の確立が容易であることを証明しています。さらに、同社のプラットフォームは 1 億 6,000 万人の会員に対応できるようスケールされ、1 分あたり最大 40,000 人のユーザーへの対応が可能とな...",2026-04-19
9d7ae5b7c4e7b02ec425348b762b3550,GCP_Japan,Google ADK、MCP、Cloud Run を使用して専門家向けコンテンツ用のマルチ エージェント システムを構築する - パート 1,https://cloud.google.com/blog/ja/topics/developers-practitioners/build-a-multi-agent-system-for-expert-content-with-google-adk-mcp-and-cloud-run-part-1/,"Thu, 09 Apr 2026 01:00:00 +0000","※この投稿は米国時間 2026 年 3 月 19 日に、Google Cloud blog に投稿されたものの抄訳です。
私のチームのミッションは、コードの作成から Google Cloud で安全な AI ワークロードを実行するまで、デベロッパーの取り組みを加速させることです。デベロッパーの成功を支援するため、Google はデベロッパーが最も切実に求めている質問を特定し、簡単に実装できるわかり...",2026-04-19
9b401150f375bc97cc03940ef49b7c19,GCP_Japan,Red Hat OpenShift on Google Cloud を移行およびスケールする新しい方法,https://cloud.google.com/blog/ja/topics/partners/red-hat-openshift-on-google-cloud-migration-and-scaling-updates/,"Thu, 09 Apr 2026 00:10:00 +0000","※この投稿は米国時間 2026 年 3 月 27 日に、Google Cloud blog に投稿されたものの抄訳です。
オンプレミス ワークロードを実行している組織は、クラウドに移行する際に、難しい選択によく直面します。それは、ビジネスの基盤となるアーキテクチャの整合性を損なわずに、どのようにモダナイズするかということです。Red Hat OpenShift を使用すると、強制的なプラットフォー...",2026-04-19
4d8a12d8640613fe780659fdda8e1501,GCP_Japan,【先着特典あり】Next Tokyo 登録開始！7 月 30 日、31 日 東京ビッグサイト,https://cloud.google.com/blog/ja/topics/next-tokyo/registration-for-next-tokyo-2026-is-now-open/,"Wed, 08 Apr 2026 03:00:00 +0000","革新的なアイデアを、AI とクラウドで実現しよう
旗艦イベント Google Cloud Next Tokyo を 2026 年 7 月 30 日（木）、 31 日（金）に東京ビッグサイト 南展示棟・会議棟にて開催します。
Next Tokyo 2026 は、現場を支えるエンジニアと、未来を担うビジネス リーダーが主役となる舞台です。AI と Google Cloud の最先端トレンドを凝縮し、あ...",2026-04-19
c9d7068665e107e45fe153459c7b395a,GCP_Japan,Vertex AI に Veo 3.1 Lite と Veo の新しいアップスケーリング機能を導入,https://cloud.google.com/blog/ja/products/ai-machine-learning/veo-3-1-lite-and-a-new-veo-upscaling-capability-on-vertex-ai/,"Wed, 08 Apr 2026 03:00:00 +0000","※この投稿は米国時間 2026 年 4 月 4 日に、Google Cloud blog に投稿されたものの抄訳です。
このたび、Vertex AI に、最も費用対効果の高い動画モデルである Veo 3.1 Lite を導入いたします。
また、この新しいモデルとともに、既存の動画アセットを強化するのに役立つ、Veo のスタンドアロンの新しいアップスケーリング機能も Vertex AI でリリースい...",2026-04-19
0710931bb9e60cb56a31b15ba7a27a39,GCP_Japan,FM Logistic が AlphaEvolve を使って倉庫規模の「巡回セールスマン問題」を解決,https://cloud.google.com/blog/ja/products/ai-machine-learning/how-fm-logistic-tackled-the-traveling-salesman-problem-at-warehouse-scale-with-alphaevolve/,"Wed, 08 Apr 2026 03:00:00 +0000","※この投稿は米国時間 2026 年 3 月 27 日に、Google Cloud blog に投稿されたものの抄訳です。
巡回セールスマン問題とは、「すべての地点を 1 回ずつ訪問する最短ルートは何か」という、一見すると単純な問題です。これはコンピュータ サイエンスにおける最も難しい問題の一つであり、数学者は 1 世紀近くもこの問題に取り組んでいます。また、FM Logistic のポーランドの倉...",2026-04-19
f7865f196eb9bc63f04e6a87f2fc2210,GCP_Japan,LLM 推論の効率的フロンティアに到達するための 5 つの手法,https://cloud.google.com/blog/ja/topics/developers-practitioners/five-techniques-to-reach-the-efficient-frontier-of-llm-inference/,"Wed, 08 Apr 2026 02:10:00 +0000","※この投稿は米国時間 2026 年 3 月 28 日に、Google Cloud blog に投稿されたものの抄訳です。
モデル推論に費やした費用の分だけ、レイテンシとスループットのグラフ上で良いポジションが得られます。上の図には、ハードウェアから可能な限り最大のパフォーマンスを引き出した、最適な構成の曲線が示されています。この曲線は、金融のポートフォリオ理論から借用したもので、効率的フロンティア...",2026-04-19
15d80c542542e8cf5746ed236f776f5a,GCP_Japan,Google Cloud Partner Tech Influencer Challenge 2026 実施のご案内,https://cloud.google.com/blog/ja/topics/partners/google-cloud-partner-tech-influencer-challenge-2026/,"Tue, 07 Apr 2026 03:00:00 +0000","Google Cloud ではパートナー企業の社員の皆様による技術コンテンツの投稿を応援しています。2022 年より開始した「テクニカル ブログ チャレンジ」は、2025 年から「Google Cloud Partner Tech Influencer Challenge」と名称を変更し、ブログに限らない Web 媒体も対象として実施しています。
昨年は 2,500 を超えるコンテンツを投稿頂き大...",2026-04-19
642b38e1ed5cfeafba6f8457b83b1b1c,GCP_Japan,エージェント型 AI の時代を支える Spanner のマルチモデルによる強み,https://cloud.google.com/blog/ja/products/databases/spanners-multi-model-advantage-for-agentic-ai/,"Tue, 07 Apr 2026 02:00:00 +0000","※この投稿は米国時間 2026 年 4 月 1 日に、Google Cloud blog に投稿されたものの抄訳です。
エージェント型 AI の時代を迎え、データベースの役割は根本的に変わりつつあります。データベースは、もはや単なる受け身のデータ保管場所ではありません。生成 AI の基盤モデルを支え、先回りしたアクションを促す推論エンジンの土台となる、インテリジェントで能動的なコンテキスト ハブへ...",2026-04-19
599e5781c7c89d6f9fb5cff8a2fb33e5,Ggen_Blog,BigQuery Agent Analyticsを使用してADKで実装したエージェントの対話データを記録する,https://blog.g-gen.co.jp/entry/bigquery-agent-analytics-for-adk-explained,2026-04-17T09:00:00+09:00,G-gen の佐々木です。当記事では、ADK で開発した AI エージェントに BigQuery Agent Analytics のプラグインを組み込むことで、エージェントのリクエストやレスポンス、ツール呼び出しなどのイベントを BigQuery に記録し、SQL で分析できるようにしていきます。 構成 当記事で使用するもの Agent Development Kit（ADK） Vertex AI...,2026-04-19
ae6fa00ec2766c252be5dcdf150e20cb,Ggen_Blog,Looker StudioでBigQueryにサービスアカウントで認証できない時のチェックリスト,https://blog.g-gen.co.jp/entry/trouble-shooting-with-looker-studio-and-service-account,2026-04-15T09:00:00+09:00,G-gen の min です。Looker Studio の BigQuery データソース接続において、個人の Google アカウントではなくサービスアカウントの認証情報を使用する際、権限エラーや接続エラーが発生することがあります。当記事では、サービスアカウント接続がうまくいかない場合に確認すべきポイントをチェックリスト形式で解説します。 前提となる構成 サービスエージェントに権限があるか エ...,2026-04-19
06db10ce380633078f62dc7d2ae287cc,Ggen_Blog,BigQueryのデータ分析情報（Data insights）を解説,https://blog.g-gen.co.jp/entry/bigquery-data-insights,2026-04-13T09:00:00+09:00,G-gen の min です。BigQuery でデータ分析情報を生成する機能データ分析情報（Data insights）について解説します。 データ分析情報とは 概要 2つの分析レベル 分析情報を生成するモード 事前準備 必要な API の有効化 必要な IAM ロール テーブル分析情報 提供される機能 クエリの生成 説明の生成 生成言語の制御 生成手順 生成した分析情報の保存 データセット分析...,2026-04-19
