id,source,title,link,published,summary,collected_date
ccedb633339bf77509ad481cf723731e,GCP_Blog,How Honeylove boosts product quality and service efficiency with BigQuery,https://cloud.google.com/blog/products/data-analytics/how-honeylove-boosts-product-quality-and-service-efficiency-with-bigquery/,"Thu, 02 Apr 2026 16:00:00 +0000","Building the perfect bra takes thousands of data points.
That’s why Honeylove isn’t just another intimates brand. We’re a technology company that happens to make exceptional bras, tops, shapewear, and...",2026-04-05
40437abe16e2e0716424f7b8773e9509,GCP_Blog,What’s new with Google Data Cloud,https://cloud.google.com/blog/products/data-analytics/whats-new-with-google-data-cloud/,"Thu, 02 Apr 2026 16:00:00 +0000","March 30 - April 3

Google-built ODBC Driver for BigQuery is now available in PreviewWe are excited to announce the launch of the new, Google-built ODBC driver for BigQuery. This new open-source drive...",2026-04-05
106bcfb7d223777e5d905f2f4b3e32ee,GCP_Blog,vSphere and BRICKSTORM Malware: A Defender's Guide,https://cloud.google.com/blog/topics/threat-intelligence/vsphere-brickstorm-defender-guide/,"Thu, 02 Apr 2026 14:00:00 +0000","Written by: Stuart Carrera

Introduction 
Building on recent BRICKSTORM research from Google Threat Intelligence Group (GTIG), this post explores the evolving threats facing virtualized environments. ...",2026-04-05
0977e945218d0d215afed87dba3bf319,GCP_Blog,Activating Your Data Layer for Production-Ready AI,https://cloud.google.com/blog/topics/developers-practitioners/activating-your-data-layer-for-production-ready-ai/,"Thu, 02 Apr 2026 13:18:00 +0000","When discussing applications and systems using generative AI and the new opportunities they present, one component of the ecosystem is irreplaceable - data. Specifically, the data that companies gathe...",2026-04-05
8f925e6fee7bdfa164ce4e20a973a0f8,GCP_Blog,Top Infrastructure and GKE Sessions at Cloud Next '26,https://cloud.google.com/blog/products/infrastructure/your-guide-to-infrastructure-and-gke-sessions-at-cloud-next26/,"Wed, 01 Apr 2026 17:00:00 +0000","With Cloud Next '26 rapidly approaching, we couldn't be more excited to showcase how Google Cloud empowers organizations to scale smarter, faster, and more efficiently. 
Be sure to anchor your experie...",2026-04-05
7248808a74cb66ea24695bfa0f177aa1,GCP_Blog,Run real-time and async inference on the same infrastructure with GKE Inference Gateway,https://cloud.google.com/blog/products/containers-kubernetes/unifying-real-time-and-async-inference-with-gke-inference-gateway/,"Wed, 01 Apr 2026 16:00:00 +0000","As AI workloads transition from experimental prototypes to production-grade services, the infrastructure supporting them faces a growing utilization gap. Enterprises today typically face a binary choi...",2026-04-05
f17478d501da784320d5f252e937a4fa,GCP_Blog,Spanner's multi-model advantage for the era of agentic AI,https://cloud.google.com/blog/products/databases/spanners-multi-model-advantage-for-agentic-ai/,"Tue, 31 Mar 2026 17:00:00 +0000","In the age of agentic AI, the role of databases is fundamentally changing. It’s evolving from a passive data repository into an intelligent, active context hub designed to ground generative AI foundat...",2026-04-05
85df242721aa66bcff5d70efa8b61ab5,GCP_Blog,Real-world success with Spanner’s fully interoperable multi-model database,https://cloud.google.com/blog/products/databases/customers-see-real-world-success-with-multi-model-spanner/,"Tue, 31 Mar 2026 17:00:00 +0000","In the first post on the power of multi-model databases to lay the foundations for gen AI, we highlighted how Google Cloud Spanner helps organizations overcome some  of the challenges presented by tra...",2026-04-05
0b992a5da4baedc539843fade272e24c,GCP_Blog,Uplevel your workload scaling performance with GKE active buffer,https://cloud.google.com/blog/products/containers-kubernetes/new-gke-active-buffer-minimizes-scale-out-latency/,"Tue, 31 Mar 2026 16:00:00 +0000","In dynamic cloud environments, unexpected traffic spikes or scheduled scaling events can easily strain user workloads. Whether you’re running a retail application during a flash sale or a gaming platf...",2026-04-05
397414e8ea2b7c72d7842244b59913e1,GCP_Blog,How AI-powered tools are driving the next wave of sustainable infrastructure and reporting,https://cloud.google.com/blog/topics/sustainability/ai-tools-for-sustainable-infrastructure-and-reporting/,"Tue, 31 Mar 2026 16:00:00 +0000","As generative AI continues to scale, a shift is occurring at the  intersection of sustainability and technology.  For years, reporting teams were bogged down by scattered data and labor-intensive docu...",2026-04-05
13f00ff0459a15f8e4540748fb263806,GCP_Blog,What Google Cloud announced in AI this month,https://cloud.google.com/blog/products/ai-machine-learning/what-google-cloud-announced-in-ai-this-month/,"Tue, 31 Mar 2026 16:00:00 +0000","Editor’s note: Want to keep up with the latest from Google Cloud? Check back here for a monthly recap of our latest updates, announcements, resources, events, learning opportunities, and more.
March w...",2026-04-05
0dfb049e2e5025c0d34d9d2851d85950,GCP_Blog,North Korea-Nexus Threat Actor Compromises Widely Used Axios NPM Package in Supply Chain Attack,https://cloud.google.com/blog/topics/threat-intelligence/north-korea-threat-actor-targets-axios-npm-package/,"Tue, 31 Mar 2026 14:00:00 +0000","Written by: Austin Larsen, Dima Lenz, Adrian Hernandez, Tyler McLellan, Christopher Gardner, Ashley Zaya, Michael Rudden, Mon Liclican

Introduction 
Google Threat Intelligence Group (GTIG) is trackin...",2026-04-05
2f7f645ae246660f2b439d33878de79f,GCP_Blog,Create Expert Content: Architect A Personalized Multi-Agent System with Long-Term Memory,https://cloud.google.com/blog/topics/developers-practitioners/multi-agent-architecture-and-long-term-memory-with-adk-mcp-and-cloud-run/,"Tue, 31 Mar 2026 09:31:00 +0000","In support of our mission to accelerate the developer journey on Google Cloud, we built Dev Signal—a multi-agent system designed to transform raw community signals into reliable technical guidance by ...",2026-04-05
4e1da4423e103efb536f4fa38eb3a135,GCP_Blog,"Cloud CISO Perspectives: RSAC '26: AI, security, and the workforce of the future",https://cloud.google.com/blog/products/identity-security/cloud-ciso-perspectives-rsac-26-ai-security-and-workforce-of-the-future/,"Mon, 30 Mar 2026 16:00:00 +0000","Welcome to the second Cloud CISO Perspectives for March 2026. Today, Nick Godfrey details his conversation with Francis deSouza at RSA Conference, and how it’s part of our approach to bold and respons...",2026-04-05
f0de30aa28d3a3c233482404c19671a6,GCP_Blog,How ID.me Scaled to 160M Users While Reducing Operational Risk,https://cloud.google.com/blog/products/databases/id-me-scales-and-fights-ai-fraud-with-alloydb/,"Mon, 30 Mar 2026 16:00:00 +0000","Editor’s note: ID.me is transforming digital identity security, proving that establishing your identity can be easy. What's more, their platform has scaled to support 160 million members and can suppo...",2026-04-05
8dd0d0decbabcacef6ac1eb963dd98cf,GCP_Blog,How to build production-ready AI agents with Google-managed MCP servers,https://cloud.google.com/blog/products/ai-machine-learning/how-to-build-ai-agents-with-google-managed-mcp-servers/,"Fri, 27 Mar 2026 16:00:00 +0000","As ​​developers build AI agents with more sophisticated reasoning systems, they require higher-quality fuel–in the form of enterprise data and specialized tools–to drive real business value. To get th...",2026-04-05
803fac69a6a9fca668b9637a41cb29f4,GCP_Japan,AI インフラストラクチャとしての Kubernetes: Google Cloud、llm-d、CNCF,https://cloud.google.com/blog/ja/products/containers-kubernetes/llm-d-officially-a-cncf-sandbox-project/,"Fri, 03 Apr 2026 01:00:00 +0000","※この投稿は米国時間 2026 年 3 月 25 日に、Google Cloud blog に投稿されたものの抄訳です。
Google Cloud は、大規模な基盤モデルのビルダーや AI ネイティブ企業の膨大なニーズに応えることを、当社の AI インフラストラクチャ戦略の最優先事項としています。生成 AI の利用がミッション クリティカルな本番環境へと移行する中、このようなイノベーターは、複雑な...",2026-04-05
16604a61c0f09fb49f23fafe7f44fe01,GCP_Japan,分散 AI エージェントの構築,https://cloud.google.com/blog/ja/topics/developers-practitioners/building-distributed-ai-agents/,"Thu, 02 Apr 2026 03:00:00 +0000","※この投稿は米国時間 2026 年 3 月 19 日に、Google Cloud blog に投稿されたものの抄訳です。
率直に言って、1 回だけ動作する AI エージェントを構築するのは簡単です。しかし、本番環境で確実に動作する AI エージェントを構築し、既存の React や Node.js アプリケーションと統合する場合は、まったく別の話です。
（説明は省略して、コードに直接移動したい場合...",2026-04-05
f8d9465095070649169bccc173d33db9,GCP_Japan,DRA: 動的リソース割り当てが切り開く Kubernetes デバイス管理の新時代,https://cloud.google.com/blog/ja/products/containers-kubernetes/kubernetes-device-management-with-dra-dynamic-resource-allocation/,"Thu, 02 Apr 2026 03:00:00 +0000","※この投稿は米国時間 2026 年 3 月 26 日に、Google Cloud blog に投稿されたものの抄訳です。
大規模言語モデル（LLM）の爆発的な普及により、GPU や TPU などの高性能アクセラレータの需要が高まっています。組織が AI 機能を拡大させる中で、コンピューティング リソースの不足が主要なボトルネックとして浮上することがあります。すべての GPU と TPU のサイクル...",2026-04-05
9c51f6931252f1d1cb84f60a8242a34a,GCP_Japan,Google の企業向けブラウザでセキュリティを一層強化する 5 つの方法,https://cloud.google.com/blog/ja/products/chrome-enterprise/5-ways-our-enterprise-browser-keeps-reinforcing-security/,"Thu, 02 Apr 2026 03:00:00 +0000",※この投稿は米国時間 2026 年 3 月 25 日に、Google Cloud blog に投稿されたものの抄訳です。RSA には、セキュリティ業界の多くのエキスパートが集います。常に変化するリスク環境をサポートし続けるソリューション プロバイダであれ、業界で新しいベスト プラクティスを共有するリサーチ コミュニティであれ、社内のセキュリティ強化のために知識の拡大に励むセキュリティ担当者であれ、...,2026-04-05
c4a480cb7b8c3b1e3eabd516ce8d52d1,GCP_Japan,読み取りのスケーラビリティを合理化する Cloud SQL の自動スケーリングを備えた読み取りプール,https://cloud.google.com/blog/ja/products/databases/cloudsql-read-pools-support-autoscaling/,"Wed, 01 Apr 2026 02:10:00 +0000","※この投稿は米国時間 2026 年 3 月 19 日に、Google Cloud blog に投稿されたものの抄訳です。
データベースから頻繁に読み取りを行うアプリケーションの一般的なパターンは、読み取り負荷の高いワークロードをリードレプリカにオフロードすることです。これにより、アプリケーションをスケールしても、プライマリ データベース インスタンスでの重要な書き込みオペレーションに影響が及ぶこと...",2026-04-05
dbe284f30bb4fe08f64857cfb5a28aa7,GCP_Japan,セキュアなブラウジングをユーザー同士でサポート: 新しい Chrome Enterprise コミュニティに参加しましょう,https://cloud.google.com/blog/ja/products/chrome-enterprise/secure-browsing-powered-by-peers-join-the-new-chrome-enterprise-community/,"Wed, 01 Apr 2026 02:00:00 +0000",※この投稿は米国時間 2026 年 3 月 14 日に、Google Cloud blog に投稿されたものの抄訳です。Chrome Enterprise カスタマー コミュニティの新しいオンライン プラットフォームが誕生しました。グローバルでオープンなプラットフォームとして、すべての企業のお客様にご利用いただけます。このコミュニティは、オペレーティング システムやデバイスの種類を問わず、組織全体...,2026-04-05
ab1f2b603f2b4b902a0e0b07284ce0e1,GCP_Japan,「生成 AI」から「エージェント型 AI」へ — 自律する AI が変える企業経営,https://cloud.google.com/blog/ja/products/ai-machine-learning/how-autonomous-ai-is-transforming-corporate-management/,"Tue, 31 Mar 2026 02:00:00 +0000",エージェント型 AI（Agentic AI）に投資した企業は、平均 3.5 倍の ROI を達成し、プロジェクト成功率は 81% に達しています。 成功の鍵は、AI スキルへの人材投資、高品質なデータ基盤、そしてフルスタック プラットフォームの選択にありました。今、企業がとるべきアプローチは明確です。エージェント型 AI を軸に据え、データ基盤を整備し、人材のスキルを高め、信頼できるプラットフォー...,2026-04-05
fca7a585e078a533e6d474cc007a00d5,GCP_Japan,Alrik: Google Maps Platform で建設ロジスティクスに透明性をもたらす,https://cloud.google.com/blog/ja/products/maps-platform/alrik-bringing-transparency-to-construction-logistics-with-google-maps-platform/,"Tue, 31 Mar 2026 01:15:00 +0000","編集者注: 今回の記事は、Alrik の創業者 / CPO の Axel Enblad 氏と CTO の Jan Tägtström 氏によるものです。Google Maps Platform を活用して、正確で信頼性の高いデータで建設業界に輸送インテリジェンスをもたらしている Alrik の取り組みについて紹介します。

建設業界におけるロジスティクス管理は、無数の要素が絡み合う複雑な業務です。...",2026-04-05
03d48cf61707f59054db08fb9910daf1,GCP_Japan,次世代のジオコーディング: 詳細かつ局地的な情報で「ラストメーター」を制する,https://cloud.google.com/blog/ja/products/maps-platform/the-next-generation-of-geocoding-master-the-last-meter-with-rich-hyperlocal-destination-details/,"Tue, 31 Mar 2026 01:10:00 +0000","荷物を配送する仕事を想像してみてください。効率的なルートを通り、到着予定時刻も正確、ナビには「到着しました」と表示されています。しかし、問題が 1 つありました。あなたは事務所の正面玄関前に立っていますが、荷物の届け先は「タワー 4 の B 号室」となっており、実際にはそこから 2 ブロック離れた場所だったのです。
長年にわたって、住所は単純な位置情報、つまり、地図上の点として扱われてきました。ユ...",2026-04-05
5ef2b3a222a9c3936bd92fa8273250ae,GCP_Japan,AI 時代におけるダークウェブ インテリジェンスの進化,https://cloud.google.com/blog/ja/products/identity-security/bringing-dark-web-intelligence-into-the-ai-era/,"Mon, 30 Mar 2026 02:20:00 +0000","※この投稿は米国時間 2026 年 3 月 24 日に、Google Cloud blog に投稿されたものの抄訳です。
脅威インテリジェンス チームは膨大なデータを持っているのが常ですが、一方で大量の誤検出に悩まされており、それによって真に重要な脅威が隠されてしまうという状況に陥りがちです。アラートを減らすだけでは、重大な脅威を見逃すリスクがあるため、よりスマートなソリューションが必要となります...",2026-04-05
2394392037e9f0565d9023e19c862f02,GCP_Japan,Ironwood TPU を使用したトレーニングに関するデベロッパー ガイド,https://cloud.google.com/blog/ja/products/compute/training-large-models-on-ironwood-tpus/,"Mon, 30 Mar 2026 02:10:00 +0000","※この投稿は米国時間 2026 年 3 月 24 日に、Google Cloud blog に投稿されたものの抄訳です。
数兆単位のパラメータを扱う AI モデルへの移行により、演算リソースの需要が急激に高まり、従来のインフラストラクチャの限界が試されています。第 7 世代の Ironwood TPU は、Google がカスタム設計した AI インフラストラクチャです。チップ間相互接続（ICI）...",2026-04-05
211be10e193e99cb476c20c7e8cfdf8c,GCP_Japan,JA 共済連: 年間数百件におよぶ問い合わせの回答支援 AI エージェントを Gemini Enterprise を用いてスピーディに構築,https://cloud.google.com/blog/ja/topics/customers/ja-kyosairen-rapidly-develops-ai-agent-using-gemini-enterprise/,"Mon, 30 Mar 2026 02:00:00 +0000",将来的な人員減を見据え、全国共済農業協同組合連合会（以下、JA共済連）は、富士通株式会社（以下、富士通）とのパートナーシップのもと、Google Cloud の AI エージェント プラットフォーム Gemini Enterprise を活用した業務効率化プロジェクトを始動させました。その第一歩となったのが、各県域における地域貢献活動にかかる積立金の支出可否判断の支援です。ここでは取り組みの詳細を...,2026-04-05
28ef3688028c52de35d08cba0c73c121,GCP_Japan,Memorystore for Valkey 9.0 の一般提供を開始: 次世代のキャッシュ保存,https://cloud.google.com/blog/ja/products/databases/memorystore-for-valkey-9-0-is-now-ga/,"Thu, 26 Mar 2026 03:30:00 +0000","※この投稿は米国時間 2026 年 3 月 19 日に、Google Cloud blog に投稿されたものの抄訳です。
高スループット、低レイテンシのアプリケーション構築を目指すバックエンド デベロッパーやアーキテクトの間で、Valkey の利用が進んでいます。Valkey は、オープンソースで高性能な Key-Value データストアであり、キャッシュ保存やメッセージ キューなどのさまざまなワ...",2026-04-05
15347c9596b5193c3dadc2367f43ea0e,GCP_Japan,映像制作は映像「創作」へ ── 日本テレビが挑む AI 共創の最前線,https://cloud.google.com/blog/ja/products/ai-machine-learning/ntvs-pioneering-efforts-in-ai-co-creation/,"Thu, 26 Mar 2026 03:10:00 +0000",Google Cloud 主催「Agentic AI Summit '26 Spring」内で開催された第 5 回生成 AI 事例アワード。6 社のファイナリストによるピッチコンテストで見事最優秀賞に輝いたのは、日本テレビ放送網が開発した AI 共創プラットフォーム「AI Co-Creator」でした。ドラマ「TOKYO 巫女忍者」で証明した AI × 実写の可能性発表者は日本テレビ放送網の古谷康...,2026-04-05
9111a18620c7147f5b761ffc47f2820b,GCP_Japan,サイバーエージェント: 広告クリエイティブ制作を効率化する「AI SCREAM」において、 Google Cloud の画像生成 AI モデルが活躍,https://cloud.google.com/blog/ja/topics/customers/ai-scream-google-cloud-ai/,"Thu, 26 Mar 2026 03:00:00 +0000",株式会社サイバーエージェント（以下、サイバーエージェント）は、同社が誇る豊富なクリエイティブ制作のノウハウに生成 AI 技術を組み合わせた「AI クリエイティブ BPO（Business Process Outsourcing）」事業（※1）を展開しています。その中でもとりわけ注目されているのが、クリエイティブ生成 AI プラットフォーム「AI SCREAM（アイスクリーム）」（※2）です。今回は...,2026-04-05
7db8ff99e887026d2ea4ea48de2079e0,GCP_Japan,Coruna: iOS を狙った強力なエクスプロイト キットの謎に満ちた軌跡,https://cloud.google.com/blog/ja/topics/threat-intelligence/coruna-powerful-ios-exploit-kit/,"Thu, 26 Mar 2026 01:01:00 +0000","※この投稿は米国時間 2026 年 3 月 4 日に、Google Cloud blog に投稿されたものの抄訳です。
はじめに
Google Threat Intelligence Group（GTIG）は、iOS バージョン 13.0（2019 年 9 月リリース）からバージョン 17.2.1（2023 年 12 月リリース）を搭載した Apple iPhone モデルを標的とする、強力なエク...",2026-04-05
de75c694be35994bc3a2fcb125ae8fd5,GCP_Japan,脆弱性の状況: 2025 年のゼロデイを振り返る,https://cloud.google.com/blog/ja/topics/threat-intelligence/2025-zero-day-review/,"Thu, 26 Mar 2026 01:00:00 +0000","※この投稿は米国時間 2026 年 3 月 6 日に、Google Cloud blog に投稿されたものの抄訳です。
執筆者: Casey Charrier、James Sadowski、Zander Work、Clement Lecigne、Benoît Sevens、Fred Plan

エグゼクティブ サマリー
2025 年に実際に悪用され、Google Threat Intelligen...",2026-04-05
0c0bafbd7349ddbe570749cbf919eaf8,GCP_Japan,マルチクラスタ GKE Inference Gateway のご紹介: 世界中で AI ワークロードをスケール,https://cloud.google.com/blog/ja/products/containers-kubernetes/multi-cluster-gke-inference-gateway-helps-scale-ai-workloads/,"Wed, 25 Mar 2026 03:00:00 +0000","※この投稿は米国時間 2026 年 3 月 18 日に、Google Cloud blog に投稿されたものの抄訳です。
AI の世界は急速に変化しており、モデルのサービングを大規模かつ確実に行う必要性も高まっています。このたび、マルチクラスタ GKE Inference Gateway のプレビュー版がリリースされましたのでお知らせいたします。これにより、複数の Google Kubernete...",2026-04-05
1ecd1ae9d7fafcc8be3505e6d65432c6,GCP_Japan,Anatom-AI：自然言語で 3D 人体解剖アトラスを操作する、医師チームの挑戦,https://cloud.google.com/blog/ja/products/ai-machine-learning/a-team-of-doctors-using-natural-language-to-navigate-a-3d-human-anatomy-atlas/,"Wed, 25 Mar 2026 02:00:00 +0000","Zenn 主催、Google Cloud 協賛で開催した「第 4 回 Agentic AI Hackathon with Google Cloud 」では、全 880 エントリー・200 超のプロジェクトが集まりました。その中で最優秀賞に輝いたのが、現役医師 4 名のチームが開発した Anatom-AI です。
医療現場から生まれた課題意識医学生の 71% が解剖学に苦手意識を持つと言われています...",2026-04-05
172d1b75a391446fa465da0b749ebce5,GCP_Japan,Gemini for Government: GenAI.mil で非機密業務向けのカスタム AI エージェントを構築,https://cloud.google.com/blog/ja/topics/public-sector/gemini-for-government-build-custom-ai-agents-for-unclassified-work-on-genaimil/,"Tue, 24 Mar 2026 14:00:00 +0000",※この投稿は米国時間 2026 年 3 月 11 日に、Google Cloud blog に投稿されたものの抄訳です。2025 年 12 月、Google Public Sector は、GenAI.mil にエンタープライズ AI ツールを提供する最初のテクノロジー プロバイダとなり、Gemini for Government を通じて非機密業務に従事する 300 万人以上の民間人と軍関係者を...,2026-04-05
77a8bcddfe2d82e22a551f9ebcab7f58,Ggen_Blog,2026年3月のイチオシGoogle Cloud・Google Workspaceアップデート,https://blog.g-gen.co.jp/entry/update-in-this-month-2026-03,2026-04-01T09:00:00+09:00,G-gen の杉村です。2026年3月に発表された、Google Cloud や Google Workspace のイチオシアップデートをまとめてご紹介します。記載は全て、記事公開当時のものですのでご留意ください。 はじめに Google Cloud のアップデート Gemini 3.1 Flash-Lite が Preview 公開 IAM で Service account principa...,2026-04-05
18f642039f84a4a7106b2d200a9d7e51,Ggen_Blog,Vertex AI Agent Engineを徹底解説,https://blog.g-gen.co.jp/entry/vertex-ai-agent-engine-explained,2026-03-30T09:00:00+09:00,G-gen の佐々木です。当記事では、Google Cloud が提供する、フルマネージドの AI エージェントプラットフォームである Vertex AI Agent Engine について解説します。 はじめに Vertex AI Agent Builder とは Vertex AI Agent Engine とは 他のエージェント実行基盤との比較 Agent Engine の基本 エージェント...,2026-04-05
605310f165743bd5336ba7504312c7a3,Ggen_Blog,Artifact Registryのクリーンアップポリシーと保持ポリシーで特定イメージの削除を防止する,https://blog.g-gen.co.jp/entry/artifact-registry-cleanup-policy-with-conditional-keep,2026-03-27T09:00:00+09:00,G-gen の佐々木です。当記事では、Artifact Registry で不要になったイメージを自動削除するクリーンアップポリシーについて、特定のイメージが削除されないように条件付きの保持ポリシーを組み合わせて使う方法を解説します。 クリーンアップポリシーとは 機能の概要 保持ポリシーを使用するケース 保持ポリシーで設定可能な条件 当記事のユースケース 設定方法 保持対象イメージへのタグの付与 ...,2026-04-05
fcbdc2c4a27058723d914c47507217a0,Ggen_Blog,DropboxからGoogleドライブへのデータ移行を検証してみた,https://blog.g-gen.co.jp/entry/migration-from-dropbox-to-google-drive,2026-03-25T09:00:00+09:00,G-gen の三浦です。当記事では、Google が提供する標準機能を使って、Dropbox から Google ドライブへのデータを移行した検証の結果を紹介します。 概要 Dropbox からのデータ移行とは 前提条件 制約 検証概要 検証環境 検証の流れ 設定手順 [Dropbox] 移行元のチームフォルダ Path の確認（チームフォルダを移行する場合のみ） [Google Workspac...,2026-04-05
